{
 "1717 S STREET NW": {
  "ownerInfo": {
   "updated": "2020-06-28T17:29:38.644Z",
   "ownerData": [
    {
     "OWNERNAME": "H W GREGORY",
     "PREMISEADD": "1717 S ST NW",
     "UNITNUMBER": "",
     "SSL": "0152    0075",
     "USECODE": "024",
     "HSTDCODE": "",
     "CLASSTYPE": "001",
     "TAXRATE": "0.0085",
     "SALEPRICE": "",
     "SALEDATE": "11/12/1999",
     "INSTNO": "",
     "ACCEPTCODE": "",
     "DEEDDATE": "11/12/1999",
     "OWNNAME2": "",
     "CPMS_ADDRESS": "1717 S ST NW",
     "CAREOFNAME": "",
     "ADDRESS1": "1728 S ST NW",
     "ADDRESS2": "",
     "CITYSTZIP": "WASHINGTON                 DC 20009-6145",
     "SALEDATE_NET": "1999/11/12",
     "DEEDDATE_NET": "1999/11/12"
    }
   ]
  },
  "addressDetails": {
   "updated": "2020-06-28T18:08:09.408Z",
   "addressData": [
    {
     "ADDRESS_ID": "241525",
     "MARID": "241525",
     "STATUS": "ACTIVE",
     "FULLADDRESS": "1717 S STREET NW",
     "ADDRNUM": "1717",
     "ADDRNUMSUFFIX": "",
     "STNAME": "S",
     "STREET_TYPE": "STREET",
     "QUADRANT": "NW",
     "CITY": "WASHINGTON",
     "STATE": "DC",
     "XCOORD": "396533.97",
     "YCOORD": "138497",
     "SSL": "0152    0075",
     "ANC": "ANC 2B",
     "PSA": "Police Service Area 301",
     "WARD": "Ward 2",
     "NBHD_ACTION": " ",
     "CLUSTER_": "Cluster 6",
     "POLDIST": "Police District - Third District",
     "ROC": "Police Sector 3D3",
     "CENSUS_TRACT": "004201",
     "VOTE_PRCNCT": "Precinct 141",
     "SMD": "SMD 2B01",
     "ZIPCODE": "20009",
     "NATIONALGRID": "18S UJ 23135 09248",
     "ROADWAYSEGID": "2129",
     "FOCUS_IMPROVEMENT_AREA": "NA",
     "HAS_ALIAS": "N",
     "HAS_CONDO_UNIT": "N",
     "HAS_RES_UNIT": "Y",
     "HAS_SSL": "Y",
     "LATITUDE": "38.91433207",
     "LONGITUDE": "-77.03996509",
     "STREETVIEWURL": "http://maps.google.com/maps?z=16&layer=c&cbll=38.91433207,-77.03996509&cbp=11,9.4979422557084,,0,2.09",
     "RES_TYPE": "RESIDENTIAL",
     "WARD_2002": "Ward 2",
     "WARD_2012": "Ward 2",
     "ANC_2002": "ANC 2B",
     "ANC_2012": "ANC 2B",
     "SMD_2002": "SMD 2B01",
     "SMD_2012": "SMD 2B01",
     "IMAGEURL": "http://citizenatlas.dc.gov/mobilevideo",
     "IMAGEDIR": "20040816",
     "IMAGENAME": "QG073108.jpg",
     "ConfidenceLevel": "100",
     "Zoning": "RA-2"
    }
   ]
  },
  "licenseDetails": {
   "updated": "2020-06-28T18:34:43.660Z",
   "licenseData": [
    {
     "ADDRESS": "1717  S ST NW",
     "UNIT": "",
     "SSL": "0152    0075",
     "CUST_NUM": "39800365",
     "DECRIPTION": "Housing: Residential",
     "ENDORSEMENT_DESC": "Apartment",
     "LAST_NAME": "HERBERT",
     "FIRST_NAME": "EDWARD",
     "CORP_NAME": "",
     "TRADE_NAME": "",
     "BEGIN_RENEWAL": "Nov  1 2019 12:00AM",
     "END_RENEWAL": "Oct 31 2021 12:00AM",
     "STATUS": "Active",
     "BEGIN_RENEWAL_NET": "2019/11/01",
     "END_RENEWAL_NET": "2021/10/31"
    }
   ]
  },
  "permitDetails": {
   "updated": "2020-06-28T18:45:20.669Z",
   "permitData": [
    {
     "FULL_ADDRESS": "1717 S ST NW, WASHINGTON, DC 20009-6117",
     "B1_UNIT_START": "",
     "SSL": "",
     "B1_ALT_ID": "P130451",
     "TYPE": "Supplemental/Plumbing and Gas",
     "G6_STAT_DD": "Oct 28 2006 10:17AM",
     "B1_APPL_STATUS": "Permit Issued",
     "B1_APPL_STATUS_DATE": "          ",
     "DESC_OF_WORK": "",
     "SORT_DATE": null,
     "G6_STAT_DD_NET": "2006/10/28",
     "B1_APPL_STATUS_DATE_NET": "",
     "JOB_CLASS_CODE": "N/A",
     "JOB_SIZE": "N/A",
     "JOB_CLASSIFICATION": "N/A",
     "JOB_REVIEW_TIME": "N/A",
     "OWNER_NAME": "GREGORY",
     "OWNER_FULL_NAME": "GREGORY",
     "APPLICANT_NAME": "",
     "TRADE_NAME": "",
     "PERMIT_STATUS": [
      {
       "REVIEW_STATUS": "",
       "DISCIPLINE": "",
       "REVIEW_STATUS_DATE": ""
      }
     ]
    }
   ]
  },
  "inspectionDetails": {
   "updated": "2020-06-28T18:45:20.907Z",
   "inspectionData": []
  },
  "occupancyDetails": {
   "updated": "2020-06-28T18:45:21.210Z",
   "occupancyData": [
    {
     "FULL_ADDRESS": "1717 S ST NW, WASHINGTON, DC 20009-6117",
     "B1_UNIT_START": "",
     "SSL": "",
     "B1_ALT_ID": "HO87269",
     "TYPE": "Home Occupation",
     "G6_STAT_DD": "11/18/2004",
     "B1_APPL_STATUS": "Completed",
     "B1_APPL_STATUS_DATE": "          ",
     "DESC_OF_WORK": "",
     "G6_STAT_DD_NET": "2004/11/18",
     "B1_APPL_STATUS_DATE_NET": "",
     "OWNER_FULL_NAME": "GREGORY",
     "APPLICANT": ""
    }
   ]
  },
  "charDetails": {
   "updated": "2020-06-28T19:53:02.922Z",
   "charData": [
    {
     "PREMISEADD": "1717 S ST NW",
     "SSL": "0152    0075",
     "BLDG_NUM": "1",
     "COMPLX_NUM": "",
     "UNITNUMBER": "",
     "NUM_UNITS": "0",
     "AYB": "1905",
     "STRUCT_CL_": "",
     "STYLE_D": "3 Story",
     "STRUCT_D": "Row ",
     "GBA": "5859",
     "EXTWALL_D": "Common Brick",
     "WALL_HGT": "",
     "ROOF_D": "Meta",
     "BATHRM": "4",
     "HF_BATHRM": "0",
     "HEAT_D": "Hot ",
     "AC": "N",
     "INTWALL_D": "Hardwood",
     "ROOMS": "10",
     "BEDRM": "4",
     "KITCHENS": "4",
     "FIREPLACES": "3",
     "YR_RMDL": "1941",
     "EYB": "1957",
     "STORIES": "3",
     "OWNERNAME": "H W GREGORY",
     "OWNNAME2": "",
     "CAREOFNAME": ""
    }
   ]
  },
  "taxData": {
   "ssl": "0152    0075",
   "address": "1717 S ST NW",
   "owner": "H W GREGORY",
   "neighborhood": "OLD CITY II",
   "sub_neighborhood": "D",
   "use_code": "24",
   "sale_price": "$.00",
   "recordation_date": "11/12/1999",
   "2016_Assessment": "$1,505,940.00"
  }
 },
 "1720 SWANN STREET NW": {
  "ownerInfo": {
   "updated": "2020-06-28T17:29:39.757Z",
   "ownerData": [
    {
     "OWNERNAME": "ANNE CARSON",
     "PREMISEADD": "1720 SWANN ST NW",
     "UNITNUMBER": "",
     "SSL": "0152    0090",
     "USECODE": "024",
     "HSTDCODE": "5",
     "CLASSTYPE": "001",
     "TAXRATE": "0.0085",
     "SALEPRICE": "",
     "SALEDATE": "",
     "INSTNO": "",
     "ACCEPTCODE": "",
     "DEEDDATE": "",
     "OWNNAME2": "",
     "CPMS_ADDRESS": "1720 SWANN ST NW",
     "CAREOFNAME": "CHATEL MGMT",
     "ADDRESS1": "3210 N ST NW",
     "ADDRESS2": "",
     "CITYSTZIP": "WASHINGTON                 DC 20007-2893",
     "SALEDATE_NET": "",
     "DEEDDATE_NET": ""
    }
   ]
  },
  "addressDetails": {
   "updated": "2020-06-28T18:11:00.355Z",
   "addressData": [
    {
     "ADDRESS_ID": "241534",
     "MARID": "241534",
     "STATUS": "ACTIVE",
     "FULLADDRESS": "1720 SWANN STREET NW",
     "ADDRNUM": "1720",
     "ADDRNUMSUFFIX": "",
     "STNAME": "SWANN",
     "STREET_TYPE": "STREET",
     "QUADRANT": "NW",
     "CITY": "WASHINGTON",
     "STATE": "DC",
     "XCOORD": "396522.01",
     "YCOORD": "138534.79",
     "SSL": "0152    0090",
     "ANC": "ANC 2B",
     "PSA": "Police Service Area 301",
     "WARD": "Ward 2",
     "NBHD_ACTION": " ",
     "CLUSTER_": "Cluster 6",
     "POLDIST": "Police District - Third District",
     "ROC": "Police Sector 3D3",
     "CENSUS_TRACT": "004201",
     "VOTE_PRCNCT": "Precinct 141",
     "SMD": "SMD 2B01",
     "ZIPCODE": "20009",
     "NATIONALGRID": "18S UJ 23124 09286",
     "ROADWAYSEGID": "19232",
     "FOCUS_IMPROVEMENT_AREA": "NA",
     "HAS_ALIAS": "N",
     "HAS_CONDO_UNIT": "N",
     "HAS_RES_UNIT": "Y",
     "HAS_SSL": "Y",
     "LATITUDE": "38.91467245",
     "LONGITUDE": "-77.04010319",
     "STREETVIEWURL": "http://maps.google.com/maps?z=16&layer=c&cbll=38.91467245,-77.04010319&cbp=11,171.507477961118,,0,2.09",
     "RES_TYPE": "RESIDENTIAL",
     "WARD_2002": "Ward 2",
     "WARD_2012": "Ward 2",
     "ANC_2002": "ANC 2B",
     "ANC_2012": "ANC 2B",
     "SMD_2002": "SMD 2B01",
     "SMD_2012": "SMD 2B01",
     "IMAGEURL": "http://citizenatlas.dc.gov/mobilevideo",
     "IMAGEDIR": "20040816",
     "IMAGENAME": "QG065409.jpg",
     "ConfidenceLevel": "100",
     "Zoning": "RA-2"
    }
   ]
  },
  "licenseDetails": {
   "updated": "2020-06-28T18:34:46.523Z",
   "licenseData": [
    {
     "ADDRESS": "1720  SWANN ST NW",
     "UNIT": "",
     "SSL": "0152    0090",
     "CUST_NUM": "500115000491",
     "DECRIPTION": "Housing: Residential",
     "ENDORSEMENT_DESC": "Apartment",
     "LAST_NAME": "CARSON",
     "FIRST_NAME": "ANNE",
     "CORP_NAME": "",
     "TRADE_NAME": "",
     "BEGIN_RENEWAL": "Sep  1 2019 12:00AM",
     "END_RENEWAL": "Aug 31 2021 12:00AM",
     "STATUS": "Active",
     "BEGIN_RENEWAL_NET": "2019/09/01",
     "END_RENEWAL_NET": "2021/08/31"
    }
   ]
  },
  "permitDetails": {
   "updated": "2020-06-28T18:45:25.164Z",
   "permitData": [
    {
     "FULL_ADDRESS": "1720 SWANN ST NW, Washington, DC 20009",
     "B1_UNIT_START": "",
     "SSL": "0152    0090",
     "B1_ALT_ID": "B1202597",
     "TYPE": "Construction/Alteration and Repair",
     "G6_STAT_DD": "Jan 12 2012 12:00AM",
     "B1_APPL_STATUS": "Permit Issued",
     "B1_APPL_STATUS_DATE": "01/12/2012",
     "DESC_OF_WORK": "repairing the front steps",
     "SORT_DATE": null,
     "G6_STAT_DD_NET": "2012/01/12",
     "B1_APPL_STATUS_DATE_NET": "2012/01/12",
     "JOB_CLASS_CODE": "WT",
     "JOB_SIZE": "N/A",
     "JOB_CLASSIFICATION": "N/A",
     "JOB_REVIEW_TIME": "N/A",
     "OWNER_NAME": "ANNE CARSON",
     "OWNER_FULL_NAME": "ANNE CARSON",
     "APPLICANT_NAME": "ANNE  CARSON; PAPA-KWESI  COLEMAN",
     "TRADE_NAME": "",
     "PERMIT_STATUS": [
      {
       "REVIEW_STATUS": "Application Accepted",
       "DISCIPLINE": "Plan Review Coordinator",
       "REVIEW_STATUS_DATE": "12/06/2011"
      },
      {
       "REVIEW_STATUS": "DDOE Review Approved",
       "DISCIPLINE": "DDOE Review",
       "REVIEW_STATUS_DATE": "12/13/2011"
      },
      {
       "REVIEW_STATUS": "DDOT Review Approved",
       "DISCIPLINE": "DDOT Review",
       "REVIEW_STATUS_DATE": "01/12/2012"
      },
      {
       "REVIEW_STATUS": "HPRB Review Approved",
       "DISCIPLINE": "HPRB Review",
       "REVIEW_STATUS_DATE": "12/14/2011"
      },
      {
       "REVIEW_STATUS": "Permit Issued",
       "DISCIPLINE": "Issue Permit",
       "REVIEW_STATUS_DATE": "01/12/2012"
      },
      {
       "REVIEW_STATUS": "Structural Review Approved",
       "DISCIPLINE": "Structural Review",
       "REVIEW_STATUS_DATE": "12/15/2011"
      }
     ]
    },
    {
     "FULL_ADDRESS": "1720 SWANN ST NW, Washington, DC 20009",
     "B1_UNIT_START": "",
     "SSL": "0152    0090",
     "B1_ALT_ID": "B1308083",
     "TYPE": "Construction/Alteration and Repair",
     "G6_STAT_DD": "Jun 21 2013 12:00AM",
     "B1_APPL_STATUS": "Permit Issued",
     "B1_APPL_STATUS_DATE": "06/21/2013",
     "DESC_OF_WORK": "Replace existing aluminum replacement windows with wood sash double-hung windows.",
     "SORT_DATE": null,
     "G6_STAT_DD_NET": "2013/06/21",
     "B1_APPL_STATUS_DATE_NET": "2013/06/21",
     "JOB_CLASS_CODE": "WT",
     "JOB_SIZE": "N/A",
     "JOB_CLASSIFICATION": "N/A",
     "JOB_REVIEW_TIME": "N/A",
     "OWNER_NAME": "ANNE CARSON",
     "OWNER_FULL_NAME": "ANNE CARSON",
     "APPLICANT_NAME": "STEVE LANN  STROBA INC.",
     "TRADE_NAME": "",
     "PERMIT_STATUS": [
      {
       "REVIEW_STATUS": "Application Accepted",
       "DISCIPLINE": "Plan Review Coordinator",
       "REVIEW_STATUS_DATE": "06/21/2013"
      },
      {
       "REVIEW_STATUS": "HPRB Review Approved",
       "DISCIPLINE": "HPRB Review",
       "REVIEW_STATUS_DATE": "06/21/2013"
      },
      {
       "REVIEW_STATUS": "Permit Issued",
       "DISCIPLINE": "Issue Permit",
       "REVIEW_STATUS_DATE": "06/21/2013"
      },
      {
       "REVIEW_STATUS": "Structural Review Approved",
       "DISCIPLINE": "Structural Review",
       "REVIEW_STATUS_DATE": "06/21/2013"
      }
     ]
    },
    {
     "FULL_ADDRESS": "1720 SWANN ST NW, Washington, DC 20009",
     "B1_UNIT_START": "",
     "SSL": "0152    0090",
     "B1_ALT_ID": "B1509119",
     "TYPE": "Construction/Alteration and Repair",
     "G6_STAT_DD": "Jun 19 2015 12:00AM",
     "B1_APPL_STATUS": "Permit Issued",
     "B1_APPL_STATUS_DATE": "06/19/2015",
     "DESC_OF_WORK": "Basement window sash replacement, removing existing fixed windows, installing wood double-hung sash kits.",
     "SORT_DATE": null,
     "G6_STAT_DD_NET": "2015/06/19",
     "B1_APPL_STATUS_DATE_NET": "2015/06/19",
     "JOB_CLASS_CODE": "WT",
     "JOB_SIZE": "N/A",
     "JOB_CLASSIFICATION": "N/A",
     "JOB_REVIEW_TIME": "N/A",
     "OWNER_NAME": "Anne  Carson",
     "OWNER_FULL_NAME": "Anne  Carson",
     "APPLICANT_NAME": "STEVEN LANN  STROBA INC",
     "TRADE_NAME": "",
     "PERMIT_STATUS": [
      {
       "REVIEW_STATUS": "Application Accepted",
       "DISCIPLINE": "Plan Review Coordinator",
       "REVIEW_STATUS_DATE": "06/19/2015"
      },
      {
       "REVIEW_STATUS": "HPRB Review Approved",
       "DISCIPLINE": "HPRB Review",
       "REVIEW_STATUS_DATE": "06/19/2015"
      },
      {
       "REVIEW_STATUS": "Permit Issued",
       "DISCIPLINE": "Issue Permit",
       "REVIEW_STATUS_DATE": "06/19/2015"
      },
      {
       "REVIEW_STATUS": "Structural Review Approved",
       "DISCIPLINE": "Structural Review",
       "REVIEW_STATUS_DATE": "06/19/2015"
      }
     ]
    },
    {
     "FULL_ADDRESS": "1720 SWANN ST NW, WASHINGTON, DC 20009-5500",
     "B1_UNIT_START": "",
     "SSL": "",
     "B1_ALT_ID": "P106571",
     "TYPE": "Supplemental/Plumbing and Gas",
     "G6_STAT_DD": "Oct 26 2005 12:44PM",
     "B1_APPL_STATUS": "Permit Issued",
     "B1_APPL_STATUS_DATE": "          ",
     "DESC_OF_WORK": "",
     "SORT_DATE": null,
     "G6_STAT_DD_NET": "2005/10/26",
     "B1_APPL_STATUS_DATE_NET": "",
     "JOB_CLASS_CODE": "N/A",
     "JOB_SIZE": "N/A",
     "JOB_CLASSIFICATION": "N/A",
     "JOB_REVIEW_TIME": "N/A",
     "OWNER_NAME": "CARSON",
     "OWNER_FULL_NAME": "CARSON",
     "APPLICANT_NAME": "",
     "TRADE_NAME": "",
     "PERMIT_STATUS": [
      {
       "REVIEW_STATUS": "",
       "DISCIPLINE": "",
       "REVIEW_STATUS_DATE": ""
      }
     ]
    },
    {
     "FULL_ADDRESS": "1720 SWANN ST NW, WASHINGTON, DC 20009-5500",
     "B1_UNIT_START": "",
     "SSL": "",
     "B1_ALT_ID": "P107381",
     "TYPE": "Supplemental/Plumbing and Gas",
     "G6_STAT_DD": "Nov  7 2005 12:24PM",
     "B1_APPL_STATUS": "Permit Issued",
     "B1_APPL_STATUS_DATE": "          ",
     "DESC_OF_WORK": "",
     "SORT_DATE": null,
     "G6_STAT_DD_NET": "2005/11/07",
     "B1_APPL_STATUS_DATE_NET": "",
     "JOB_CLASS_CODE": "N/A",
     "JOB_SIZE": "N/A",
     "JOB_CLASSIFICATION": "N/A",
     "JOB_REVIEW_TIME": "N/A",
     "OWNER_NAME": "CARSON",
     "OWNER_FULL_NAME": "CARSON",
     "APPLICANT_NAME": "",
     "TRADE_NAME": "",
     "PERMIT_STATUS": [
      {
       "REVIEW_STATUS": "",
       "DISCIPLINE": "",
       "REVIEW_STATUS_DATE": ""
      }
     ]
    },
    {
     "FULL_ADDRESS": "1720 SWANN ST NW, WASHINGTON, DC 20009-5500",
     "B1_UNIT_START": "",
     "SSL": "",
     "B1_ALT_ID": "P143484",
     "TYPE": "Supplemental/Plumbing and Gas",
     "G6_STAT_DD": "May 23 2007  7:05AM",
     "B1_APPL_STATUS": "Permit Issued",
     "B1_APPL_STATUS_DATE": "          ",
     "DESC_OF_WORK": "",
     "SORT_DATE": null,
     "G6_STAT_DD_NET": "2007/05/23",
     "B1_APPL_STATUS_DATE_NET": "",
     "JOB_CLASS_CODE": "N/A",
     "JOB_SIZE": "N/A",
     "JOB_CLASSIFICATION": "N/A",
     "JOB_REVIEW_TIME": "N/A",
     "OWNER_NAME": "CARSON",
     "OWNER_FULL_NAME": "CARSON",
     "APPLICANT_NAME": "",
     "TRADE_NAME": "",
     "PERMIT_STATUS": [
      {
       "REVIEW_STATUS": "",
       "DISCIPLINE": "",
       "REVIEW_STATUS_DATE": ""
      }
     ]
    }
   ]
  },
  "inspectionDetails": {
   "updated": "2020-06-28T18:45:25.427Z",
   "inspectionData": [
    {
     "ADDRESS": "1720 SWANN ST NW, WASHINGTON, DC 20009",
     "UNIT": "",
     "SSL": "0152    0090",
     "ID": "CO1500869",
     "G6_ACT_DES": "Building Final",
     "G6_STATUS": "Approved",
     "G6_STATUS_DD": "3/10/2015 12:00:00 AM",
     "DESC_OF_WORK": "APARTMENT BUILDING -- 3 UNITS.",
     "G6_STATUS_DD_NET": "2015/03/10",
     "OWNER_FULL_NAME": "ANNE CARSON",
     "APPLICANT": ""
    },
    {
     "ADDRESS": "1720 SWANN ST NW, WASHINGTON, DC 20009",
     "UNIT": "",
     "SSL": "0152    0090",
     "ID": "CO1500869",
     "G6_ACT_DES": "Zoning Use",
     "G6_STATUS": "Approved",
     "G6_STATUS_DD": "1/15/2015 12:00:00 AM",
     "DESC_OF_WORK": "APARTMENT BUILDING -- 3 UNITS.",
     "G6_STATUS_DD_NET": "2015/01/15",
     "OWNER_FULL_NAME": "ANNE CARSON",
     "APPLICANT": ""
    },
    {
     "ADDRESS": "1720 SWANN ST NW, WASHINGTON, DC 20009",
     "UNIT": "",
     "SSL": "0152    0090",
     "ID": "CO1500869",
     "G6_ACT_DES": "Zoning Use",
     "G6_STATUS": "Rescheduled",
     "G6_STATUS_DD": "1/12/2015 12:00:00 AM",
     "DESC_OF_WORK": "APARTMENT BUILDING -- 3 UNITS.",
     "G6_STATUS_DD_NET": "2015/01/12",
     "OWNER_FULL_NAME": "ANNE CARSON",
     "APPLICANT": ""
    },
    {
     "ADDRESS": "1720 SWANN ST NW, WASHINGTON, DC 20009",
     "UNIT": "",
     "SSL": "0152    0090",
     "ID": "CO1500869",
     "G6_ACT_DES": "Zoning Use",
     "G6_STATUS": "Disapproved",
     "G6_STATUS_DD": "1/8/2015 12:00:00 AM",
     "DESC_OF_WORK": "APARTMENT BUILDING -- 3 UNITS.",
     "G6_STATUS_DD_NET": "2015/01/08",
     "OWNER_FULL_NAME": "ANNE CARSON",
     "APPLICANT": ""
    },
    {
     "ADDRESS": "1720 SWANN ST NW, WASHINGTON, DC 20009",
     "UNIT": "",
     "SSL": "0152    0090",
     "ID": "CO1500869",
     "G6_ACT_DES": "Zoning Use",
     "G6_STATUS": "Rescheduled",
     "G6_STATUS_DD": "12/30/2014 12:00:00 AM",
     "DESC_OF_WORK": "APARTMENT BUILDING -- 3 UNITS.",
     "G6_STATUS_DD_NET": "2014/12/30",
     "OWNER_FULL_NAME": "ANNE CARSON",
     "APPLICANT": ""
    },
    {
     "ADDRESS": "1720 SWANN ST NW, WASHINGTON, DC 20009",
     "UNIT": "",
     "SSL": "0152    0090",
     "ID": "CIC1101760",
     "G6_ACT_DES": "Initial Inspection",
     "G6_STATUS": "Stop Work Order",
     "G6_STATUS_DD": "7/22/2011 12:00:00 AM",
     "DESC_OF_WORK": "",
     "G6_STATUS_DD_NET": "2011/07/22",
     "OWNER_FULL_NAME": "ANNE CARSON",
     "APPLICANT": ""
    },
    {
     "ADDRESS": "1720 SWANN ST NW, WASHINGTON, DC -",
     "UNIT": "",
     "SSL": "0152    0090",
     "ID": "ECC119041",
     "G6_ACT_DES": "Other (see remarks) Plumbing",
     "G6_STATUS": "Cause",
     "G6_STATUS_DD": "11/7/2005 12:00:00 AM",
     "DESC_OF_WORK": "",
     "G6_STATUS_DD_NET": "2005/11/07",
     "OWNER_FULL_NAME": "",
     "APPLICANT": "GEORGE  TALBERT; GEORGE  TALBERT"
    },
    {
     "ADDRESS": "1720 SWANN ST NW, WASHINGTON, DC -",
     "UNIT": "",
     "SSL": "0152    0090",
     "ID": "ECC48632",
     "G6_ACT_DES": "Final Construction",
     "G6_STATUS": "No Cause",
     "G6_STATUS_DD": "12/9/2003 12:00:00 AM",
     "DESC_OF_WORK": "",
     "G6_STATUS_DD_NET": "2003/12/09",
     "OWNER_FULL_NAME": "",
     "APPLICANT": "BRAD  SULC; BRAD  SULC"
    },
    {
     "ADDRESS": "1720 SWANN ST NW, WASHINGTON, DC -",
     "UNIT": "",
     "SSL": "0152    0090",
     "ID": "ECC47796",
     "G6_ACT_DES": "Final Electrical",
     "G6_STATUS": "No Cause",
     "G6_STATUS_DD": "12/1/2003 12:00:00 AM",
     "DESC_OF_WORK": "",
     "G6_STATUS_DD_NET": "2003/12/01",
     "OWNER_FULL_NAME": "",
     "APPLICANT": "JERRY  COUCH; JERRY  COUCH"
    },
    {
     "ADDRESS": "1720 SWANN ST NW, WASHINGTON, DC -",
     "UNIT": "",
     "SSL": "0152    0090",
     "ID": "ECC39944",
     "G6_ACT_DES": "Footings Construction",
     "G6_STATUS": "No Cause",
     "G6_STATUS_DD": "9/16/2003 12:00:00 AM",
     "DESC_OF_WORK": "",
     "G6_STATUS_DD_NET": "2003/09/16",
     "OWNER_FULL_NAME": "",
     "APPLICANT": "BRAD  SULC; BRAD  SULC"
    },
    {
     "ADDRESS": "1720 SWANN ST NW, WASHINGTON, DC -",
     "UNIT": "",
     "SSL": "0152    0090",
     "ID": "ECC35908",
     "G6_ACT_DES": "Close-in (concealment)-Ceilings Construction",
     "G6_STATUS": "No Cause",
     "G6_STATUS_DD": "8/8/2003 12:00:00 AM",
     "DESC_OF_WORK": "",
     "G6_STATUS_DD_NET": "2003/08/08",
     "OWNER_FULL_NAME": "",
     "APPLICANT": "BRAD  SULC; BRAD  SULC"
    },
    {
     "ADDRESS": "1720 SWANN ST NW, WASHINGTON, DC -",
     "UNIT": "",
     "SSL": "0152    0090",
     "ID": "ECC24265",
     "G6_ACT_DES": "Close-In Construction",
     "G6_STATUS": "No Cause",
     "G6_STATUS_DD": "4/23/2003 12:00:00 AM",
     "DESC_OF_WORK": "",
     "G6_STATUS_DD_NET": "2003/04/23",
     "OWNER_FULL_NAME": "",
     "APPLICANT": "BRAD  SULC; BRAD  SULC"
    },
    {
     "ADDRESS": "1720 SWANN ST NW, WASHINGTON, DC -",
     "UNIT": "",
     "SSL": "0152    0090",
     "ID": "ECC21586",
     "G6_ACT_DES": "Framing Construction",
     "G6_STATUS": "Cause",
     "G6_STATUS_DD": "4/1/2003 12:00:00 AM",
     "DESC_OF_WORK": "",
     "G6_STATUS_DD_NET": "2003/04/01",
     "OWNER_FULL_NAME": "",
     "APPLICANT": "BRAD  SULC; BRAD  SULC"
    },
    {
     "ADDRESS": "1720 SWANN ST NW, WASHINGTON, DC -",
     "UNIT": "",
     "SSL": "0152    0090",
     "ID": "ECC22460",
     "G6_ACT_DES": "Re-inspection Construction",
     "G6_STATUS": "No Cause",
     "G6_STATUS_DD": "3/7/2003 12:00:00 AM",
     "DESC_OF_WORK": "",
     "G6_STATUS_DD_NET": "2003/03/07",
     "OWNER_FULL_NAME": "",
     "APPLICANT": "BRAD  SULC; BRAD  SULC"
    },
    {
     "ADDRESS": "1720 SWANN ST NW, WASHINGTON, DC -",
     "UNIT": "",
     "SSL": "0152    0090",
     "ID": "ECC29391",
     "G6_ACT_DES": "Close-in (concealment)-Ceilings Construction",
     "G6_STATUS": "No Cause",
     "G6_STATUS_DD": "1/1/2002 12:00:00 AM",
     "DESC_OF_WORK": "",
     "G6_STATUS_DD_NET": "2002/01/01",
     "OWNER_FULL_NAME": "",
     "APPLICANT": "BRAD  SULC; BRAD  SULC"
    }
   ]
  },
  "occupancyDetails": {
   "updated": "2020-06-28T18:45:25.608Z",
   "occupancyData": [
    {
     "FULL_ADDRESS": "1720 SWANN ST NW, WASHINGTON, DC 20009",
     "B1_UNIT_START": "",
     "SSL": "0152    0090",
     "B1_ALT_ID": "CO1500869",
     "TYPE": "Certificate of Occupancy",
     "G6_STAT_DD": "03/10/2015",
     "B1_APPL_STATUS": "Completed",
     "B1_APPL_STATUS_DATE": "03/10/2015",
     "DESC_OF_WORK": "Load ChangeAPARTMENT BUILDING -- 3 UNITS.",
     "G6_STAT_DD_NET": "2015/03/10",
     "B1_APPL_STATUS_DATE_NET": "2015/03/10",
     "OWNER_FULL_NAME": "ANNE CARSON",
     "APPLICANT": ""
    }
   ]
  },
  "charDetails": {
   "updated": "2020-06-28T19:53:04.032Z",
   "charData": [
    {
     "PREMISEADD": "1720 SWANN ST NW",
     "SSL": "0152    0090",
     "BLDG_NUM": "1",
     "COMPLX_NUM": "",
     "UNITNUMBER": "",
     "NUM_UNITS": "0",
     "AYB": "1908",
     "STRUCT_CL_": "",
     "STYLE_D": "3 Story",
     "STRUCT_D": "Row ",
     "GBA": "4791",
     "EXTWALL_D": "Common Brick",
     "WALL_HGT": "",
     "ROOF_D": "Buil",
     "BATHRM": "4",
     "HF_BATHRM": "1",
     "HEAT_D": "Warm",
     "AC": "Y",
     "INTWALL_D": "Hardwood",
     "ROOMS": "12",
     "BEDRM": "4",
     "KITCHENS": "3",
     "FIREPLACES": "2",
     "YR_RMDL": "2004",
     "EYB": "1957",
     "STORIES": "3",
     "OWNERNAME": "ANNE CARSON",
     "OWNNAME2": "",
     "CAREOFNAME": "CHATEL MGMT"
    }
   ]
  },
  "taxData": {
   "ssl": "0152    0090",
   "address": "1720 SWANN ST NW",
   "owner": "ANNE CARSON JOHN SCHOENFELD",
   "neighborhood": "OLD CITY II",
   "sub_neighborhood": "D",
   "use_code": "24",
   "sale_price": "$.00",
   "recordation_date": "N/A",
   "2016_Assessment": "$1,590,130.00"
  }
 },
 "1736 T STREET NW": {
  "ownerInfo": {
   "updated": "2020-06-28T17:29:43.666Z",
   "ownerData": [
    {
     "OWNERNAME": "MENDY S BRANNON",
     "PREMISEADD": "1736 T ST NW",
     "UNITNUMBER": "",
     "SSL": "0152    0852",
     "USECODE": "023",
     "HSTDCODE": "",
     "CLASSTYPE": "001",
     "TAXRATE": "0.0085",
     "SALEPRICE": "",
     "SALEDATE": "12/22/1999",
     "INSTNO": "",
     "ACCEPTCODE": "",
     "DEEDDATE": "12/22/1999",
     "OWNNAME2": "",
     "CPMS_ADDRESS": "1736 T ST NW",
     "CAREOFNAME": "WATASSA MANAGEMENT",
     "ADDRESS1": "PO BOX 53242",
     "ADDRESS2": "",
     "CITYSTZIP": "WASHINGTON                 DC 20009-9242",
     "SALEDATE_NET": "1999/12/22",
     "DEEDDATE_NET": "1999/12/22"
    }
   ]
  },
  "addressDetails": {
   "updated": "2020-06-28T18:11:07.434Z",
   "addressData": [
    {
     "ADDRESS_ID": "241582",
     "MARID": "241582",
     "STATUS": "ACTIVE",
     "FULLADDRESS": "1736 T STREET NW",
     "ADDRNUM": "1736",
     "ADDRNUMSUFFIX": "",
     "STNAME": "T",
     "STREET_TYPE": "STREET",
     "QUADRANT": "NW",
     "CITY": "WASHINGTON",
     "STATE": "DC",
     "XCOORD": "396549.15",
     "YCOORD": "138610.69",
     "SSL": "0152    0852",
     "ANC": "ANC 2B",
     "PSA": "Police Service Area 301",
     "WARD": "Ward 2",
     "NBHD_ACTION": " ",
     "CLUSTER_": "Cluster 6",
     "POLDIST": "Police District - Third District",
     "ROC": "Police Sector 3D3",
     "CENSUS_TRACT": "004201",
     "VOTE_PRCNCT": "Precinct 141",
     "SMD": "SMD 2B08",
     "ZIPCODE": "20009",
     "NATIONALGRID": "18S UJ 23153 09362",
     "ROADWAYSEGID": "18401",
     "FOCUS_IMPROVEMENT_AREA": "NA",
     "HAS_ALIAS": "N",
     "HAS_CONDO_UNIT": "N",
     "HAS_RES_UNIT": "Y",
     "HAS_SSL": "Y",
     "LATITUDE": "38.91535629",
     "LONGITUDE": "-77.03979063",
     "STREETVIEWURL": "http://maps.google.com/maps?z=16&layer=c&cbll=38.91535629,-77.03979063&cbp=11,179.924234532934,,0,2.09",
     "RES_TYPE": "RESIDENTIAL",
     "WARD_2002": "Ward 2",
     "WARD_2012": "Ward 2",
     "ANC_2002": "ANC 2B",
     "ANC_2012": "ANC 2B",
     "SMD_2002": "SMD 2B08",
     "SMD_2012": "SMD 2B08",
     "IMAGEURL": "http://citizenatlas.dc.gov/mobilevideo",
     "IMAGEDIR": "20040816",
     "IMAGENAME": "QG074029.jpg",
     "ConfidenceLevel": "100",
     "Zoning": "RA-2"
    }
   ]
  },
  "licenseDetails": {
   "updated": "2020-06-28T18:34:56.801Z",
   "licenseData": [
    {
     "ADDRESS": "1736  T ST NW",
     "UNIT": "",
     "SSL": "0152    0852",
     "CUST_NUM": "11755",
     "DECRIPTION": "Housing: Residential",
     "ENDORSEMENT_DESC": "Apartment",
     "LAST_NAME": "",
     "FIRST_NAME": "",
     "CORP_NAME": "RUTH L DIXON",
     "TRADE_NAME": "",
     "BEGIN_RENEWAL": "Nov  1 1999 12:00AM",
     "END_RENEWAL": "Oct 31 2001 12:00AM",
     "STATUS": "Cancelled",
     "BEGIN_RENEWAL_NET": "1999/11/01",
     "END_RENEWAL_NET": "2001/10/31"
    },
    {
     "ADDRESS": "1736  T ST NW",
     "UNIT": "",
     "SSL": "0152    0852",
     "CUST_NUM": "39938000",
     "DECRIPTION": "Housing: Residential",
     "ENDORSEMENT_DESC": "Apartment",
     "LAST_NAME": " BRANNON",
     "FIRST_NAME": "MENDY",
     "CORP_NAME": "",
     "TRADE_NAME": "",
     "BEGIN_RENEWAL": "Nov  1 2009 12:00AM",
     "END_RENEWAL": "Oct 31 2011 12:00AM",
     "STATUS": "Expired",
     "BEGIN_RENEWAL_NET": "2009/11/01",
     "END_RENEWAL_NET": "2011/10/31"
    },
    {
     "ADDRESS": "1736  T ST NW",
     "UNIT": "",
     "SSL": "0152    0852",
     "CUST_NUM": "500112000625",
     "DECRIPTION": "Housing: Residential",
     "ENDORSEMENT_DESC": "Apartment",
     "LAST_NAME": "BRANNON",
     "FIRST_NAME": "MENDY",
     "CORP_NAME": "",
     "TRADE_NAME": "",
     "BEGIN_RENEWAL": "Sep  1 2018 12:00AM",
     "END_RENEWAL": "Aug 31 2020 12:00AM",
     "STATUS": "Ready to Renew",
     "BEGIN_RENEWAL_NET": "2018/09/01",
     "END_RENEWAL_NET": "2020/08/31"
    }
   ]
  },
  "permitDetails": {
   "updated": "2020-06-28T18:51:23.597Z",
   "permitData": []
  },
  "inspectionDetails": {
   "updated": "2020-06-28T18:51:23.815Z",
   "inspectionData": []
  },
  "occupancyDetails": {
   "updated": "2020-06-28T18:51:24.122Z",
   "occupancyData": []
  },
  "charDetails": {
   "updated": "2020-06-28T19:53:08.427Z",
   "charData": [
    {
     "PREMISEADD": "1736 T ST NW",
     "SSL": "0152    0852",
     "BLDG_NUM": "1",
     "COMPLX_NUM": "",
     "UNITNUMBER": "",
     "NUM_UNITS": "0",
     "AYB": "1913",
     "STRUCT_CL_": "",
     "STYLE_D": "3 Story",
     "STRUCT_D": "Mult",
     "GBA": "5136",
     "EXTWALL_D": "Common Brick",
     "WALL_HGT": "",
     "ROOF_D": "Meta",
     "BATHRM": "4",
     "HF_BATHRM": "0",
     "HEAT_D": "Hot ",
     "AC": "N",
     "INTWALL_D": "Hardwood",
     "ROOMS": "14",
     "BEDRM": "7",
     "KITCHENS": "4",
     "FIREPLACES": "0",
     "YR_RMDL": "",
     "EYB": "1945",
     "STORIES": "3",
     "OWNERNAME": "MENDY S BRANNON",
     "OWNNAME2": "",
     "CAREOFNAME": "WATASSA MANAGEMENT"
    }
   ]
  },
  "taxData": {
   "ssl": "0152    0852",
   "address": "1736 T ST NW",
   "owner": "MENDY S BRANNON WATASSA MANAGEMENT",
   "neighborhood": "OLD CITY II",
   "sub_neighborhood": "D",
   "use_code": "23",
   "sale_price": "$.00",
   "recordation_date": "12/22/1999",
   "2016_Assessment": "$1,208,470.00"
  }
 },
 "1739 S STREET NW": {
  "ownerInfo": {
   "updated": "2020-06-28T17:29:44.434Z",
   "ownerData": [
    {
     "OWNERNAME": "WAYNE J GLEASON",
     "PREMISEADD": "1739 S ST NW",
     "UNITNUMBER": "",
     "SSL": "0152    0027",
     "USECODE": "024",
     "HSTDCODE": "1",
     "CLASSTYPE": "001",
     "TAXRATE": "0.0085",
     "SALEPRICE": "$675,000.00",
     "SALEDATE": "03/05/1999",
     "INSTNO": "",
     "ACCEPTCODE": "",
     "DEEDDATE": "03/05/1999",
     "OWNNAME2": "MARK A AGUIRRE",
     "CPMS_ADDRESS": "1739 S ST NW",
     "CAREOFNAME": "",
     "ADDRESS1": "1739 S ST NW",
     "ADDRESS2": "",
     "CITYSTZIP": "WASHINGTON                 DC 20009-6117",
     "SALEDATE_NET": "1999/03/05",
     "DEEDDATE_NET": "1999/03/05"
    }
   ]
  },
  "addressDetails": {
   "updated": "2020-06-28T18:11:08.468Z",
   "addressData": [
    {
     "ADDRESS_ID": "241503",
     "MARID": "241503",
     "STATUS": "ACTIVE",
     "FULLADDRESS": "1739 S STREET NW",
     "ADDRNUM": "1739",
     "ADDRNUMSUFFIX": "",
     "STNAME": "S",
     "STREET_TYPE": "STREET",
     "QUADRANT": "NW",
     "CITY": "WASHINGTON",
     "STATE": "DC",
     "XCOORD": "396463.73",
     "YCOORD": "138492.97",
     "SSL": "0152    0027",
     "ANC": "ANC 2B",
     "PSA": "Police Service Area 301",
     "WARD": "Ward 2",
     "NBHD_ACTION": " ",
     "CLUSTER_": "Cluster 6",
     "POLDIST": "Police District - Third District",
     "ROC": "Police Sector 3D3",
     "CENSUS_TRACT": "004201",
     "VOTE_PRCNCT": "Precinct 141",
     "SMD": "SMD 2B01",
     "ZIPCODE": "20009",
     "NATIONALGRID": "18S UJ 23065 09246",
     "ROADWAYSEGID": "19816",
     "FOCUS_IMPROVEMENT_AREA": "NA",
     "HAS_ALIAS": "N",
     "HAS_CONDO_UNIT": "N",
     "HAS_RES_UNIT": "Y",
     "HAS_SSL": "Y",
     "LATITUDE": "38.91429549",
     "LONGITUDE": "-77.04077498",
     "STREETVIEWURL": "http://maps.google.com/maps?z=16&layer=c&cbll=38.91429549,-77.04077498&cbp=11,351.553595142234,,0,2.09",
     "RES_TYPE": "RESIDENTIAL",
     "WARD_2002": "Ward 2",
     "WARD_2012": "Ward 2",
     "ANC_2002": "ANC 2B",
     "ANC_2012": "ANC 2B",
     "SMD_2002": "SMD 2B01",
     "SMD_2012": "SMD 2B01",
     "IMAGEURL": "http://citizenatlas.dc.gov/mobilevideo",
     "IMAGEDIR": "20040816",
     "IMAGENAME": "QG072454.jpg",
     "ConfidenceLevel": "100",
     "Zoning": "RA-2"
    }
   ]
  },
  "licenseDetails": {
   "updated": "2020-06-28T18:34:59.356Z",
   "licenseData": [
    {
     "ADDRESS": "1739  S ST NW",
     "UNIT": "BSMT",
     "SSL": "0152    0027",
     "CUST_NUM": "500613000211",
     "DECRIPTION": "Housing: Residential",
     "ENDORSEMENT_DESC": "Two Family Rental",
     "LAST_NAME": "MARK AGUIRRIE",
     "FIRST_NAME": "WAYNE GLEASON",
     "CORP_NAME": "",
     "TRADE_NAME": "",
     "BEGIN_RENEWAL": "Apr  1 2013 12:00AM",
     "END_RENEWAL": "Mar 31 2015 12:00AM",
     "STATUS": "Cancelled",
     "BEGIN_RENEWAL_NET": "2013/04/01",
     "END_RENEWAL_NET": "2015/03/31"
    },
    {
     "ADDRESS": "1739  S ST NW",
     "UNIT": "BSMT",
     "SSL": "0152    0027",
     "CUST_NUM": "500616000115",
     "DECRIPTION": "Housing: Residential",
     "ENDORSEMENT_DESC": "Two Family Rental",
     "LAST_NAME": "GLEASON",
     "FIRST_NAME": "WAYNE",
     "CORP_NAME": "",
     "TRADE_NAME": "",
     "BEGIN_RENEWAL": "Feb  1 2020 12:00AM",
     "END_RENEWAL": "Jan 31 2022 12:00AM",
     "STATUS": "Active",
     "BEGIN_RENEWAL_NET": "2020/02/01",
     "END_RENEWAL_NET": "2022/01/31"
    }
   ]
  },
  "permitDetails": {
   "updated": "2020-06-28T18:51:27.368Z",
   "permitData": [
    {
     "FULL_ADDRESS": "1739 S ST NW, WASHINGTON, DC",
     "B1_UNIT_START": "",
     "SSL": "",
     "B1_ALT_ID": "B103722",
     "TYPE": "Construction/Addition Alteration Repair",
     "G6_STAT_DD": "Feb 14 2007 12:18PM",
     "B1_APPL_STATUS": "Permit Issued",
     "B1_APPL_STATUS_DATE": "02/14/2007",
     "DESC_OF_WORK": "REPLACEMENT OF 2 BASEMENT WINDOWS AT REAR OF HOUSE APROXIMATELY 15\" X 30\"",
     "SORT_DATE": null,
     "G6_STAT_DD_NET": "2007/02/14",
     "B1_APPL_STATUS_DATE_NET": "2007/02/14",
     "JOB_CLASS_CODE": "WT",
     "JOB_SIZE": "N/A",
     "JOB_CLASSIFICATION": "N/A",
     "JOB_REVIEW_TIME": "N/A",
     "OWNER_NAME": "WAYNE GLEASON / MARK AGUIRRE",
     "OWNER_FULL_NAME": "WAYNE GLEASON / MARK AGUIRRE",
     "APPLICANT_NAME": "WAYNE  GLEASON",
     "TRADE_NAME": "",
     "PERMIT_STATUS": [
      {
       "REVIEW_STATUS": "APP",
       "DISCIPLINE": "Historic",
       "REVIEW_STATUS_DATE": "02/14/2007"
      },
      {
       "REVIEW_STATUS": "APP",
       "DISCIPLINE": "Struc",
       "REVIEW_STATUS_DATE": "02/14/2007"
      },
      {
       "REVIEW_STATUS": "APP",
       "DISCIPLINE": "Zoning",
       "REVIEW_STATUS_DATE": "02/14/2007"
      },
      {
       "REVIEW_STATUS": "Application Accepted",
       "DISCIPLINE": "Plan Review Coordinator",
       "REVIEW_STATUS_DATE": "07/12/2008"
      },
      {
       "REVIEW_STATUS": "HPRB Review Approved",
       "DISCIPLINE": "HPRB Review",
       "REVIEW_STATUS_DATE": "07/12/2008"
      },
      {
       "REVIEW_STATUS": "In-Process",
       "DISCIPLINE": "BZA Review",
       "REVIEW_STATUS_DATE": ""
      },
      {
       "REVIEW_STATUS": "In-Process",
       "DISCIPLINE": "CFA Review",
       "REVIEW_STATUS_DATE": ""
      },
      {
       "REVIEW_STATUS": "In-Process",
       "DISCIPLINE": "Chinatown Review",
       "REVIEW_STATUS_DATE": ""
      },
      {
       "REVIEW_STATUS": "In-Process",
       "DISCIPLINE": "DDOE Review",
       "REVIEW_STATUS_DATE": ""
      },
      {
       "REVIEW_STATUS": "In-Process",
       "DISCIPLINE": "DDOT Review (Public Space)",
       "REVIEW_STATUS_DATE": ""
      },
      {
       "REVIEW_STATUS": "In-Process",
       "DISCIPLINE": "DOH Review",
       "REVIEW_STATUS_DATE": ""
      },
      {
       "REVIEW_STATUS": "In-Process",
       "DISCIPLINE": "EISF Review",
       "REVIEW_STATUS_DATE": ""
      },
      {
       "REVIEW_STATUS": "In-Process",
       "DISCIPLINE": "Electrical Review",
       "REVIEW_STATUS_DATE": ""
      },
      {
       "REVIEW_STATUS": "In-Process",
       "DISCIPLINE": "Elevator Review",
       "REVIEW_STATUS_DATE": ""
      },
      {
       "REVIEW_STATUS": "In-Process",
       "DISCIPLINE": "File Room",
       "REVIEW_STATUS_DATE": ""
      },
      {
       "REVIEW_STATUS": "In-Process",
       "DISCIPLINE": "Fire Review",
       "REVIEW_STATUS_DATE": ""
      },
      {
       "REVIEW_STATUS": "In-Process",
       "DISCIPLINE": "Management Review",
       "REVIEW_STATUS_DATE": ""
      },
      {
       "REVIEW_STATUS": "In-Process",
       "DISCIPLINE": "Mechanical and Plumbing Review",
       "REVIEW_STATUS_DATE": ""
      },
      {
       "REVIEW_STATUS": "In-Process",
       "DISCIPLINE": "NCPC Review",
       "REVIEW_STATUS_DATE": ""
      },
      {
       "REVIEW_STATUS": "In-Process",
       "DISCIPLINE": "WASA Review",
       "REVIEW_STATUS_DATE": ""
      },
      {
       "REVIEW_STATUS": "In-Process",
       "DISCIPLINE": "White House Review",
       "REVIEW_STATUS_DATE": ""
      },
      {
       "REVIEW_STATUS": "In-Process",
       "DISCIPLINE": "WMATA Review",
       "REVIEW_STATUS_DATE": ""
      },
      {
       "REVIEW_STATUS": "In-Process",
       "DISCIPLINE": "Zoning Overlay/PUD Review",
       "REVIEW_STATUS_DATE": ""
      },
      {
       "REVIEW_STATUS": "N/A",
       "DISCIPLINE": "Historic",
       "REVIEW_STATUS_DATE": "02/14/2007"
      },
      {
       "REVIEW_STATUS": "PEN",
       "DISCIPLINE": "Historic",
       "REVIEW_STATUS_DATE": "02/14/2007"
      },
      {
       "REVIEW_STATUS": "PEN",
       "DISCIPLINE": "Struc",
       "REVIEW_STATUS_DATE": "02/14/2007"
      },
      {
       "REVIEW_STATUS": "PEN",
       "DISCIPLINE": "Zoning",
       "REVIEW_STATUS_DATE": "02/14/2007"
      },
      {
       "REVIEW_STATUS": "Permit Issued",
       "DISCIPLINE": "Issue Permit",
       "REVIEW_STATUS_DATE": "07/12/2008"
      },
      {
       "REVIEW_STATUS": "Structural Review Approved",
       "DISCIPLINE": "Structural Review",
       "REVIEW_STATUS_DATE": "07/12/2008"
      },
      {
       "REVIEW_STATUS": "Zoning Review Approved",
       "DISCIPLINE": "Zoning Review",
       "REVIEW_STATUS_DATE": "07/12/2008"
      }
     ]
    },
    {
     "FULL_ADDRESS": "1739 S ST NW, WASHINGTON, DC",
     "B1_UNIT_START": "",
     "SSL": "",
     "B1_ALT_ID": "RW101415",
     "TYPE": "Construction/Retaining Wall",
     "G6_STAT_DD": "Nov 30 2006 10:20AM",
     "B1_APPL_STATUS": "Permit Issued",
     "B1_APPL_STATUS_DATE": "11/30/2006",
     "DESC_OF_WORK": "Replacement of 80square feet of driveway with brick. Repair / replace existing retaining wall, cracked concrete pad. All work in kind.",
     "SORT_DATE": null,
     "G6_STAT_DD_NET": "2006/11/30",
     "B1_APPL_STATUS_DATE_NET": "2006/11/30",
     "JOB_CLASS_CODE": "WT",
     "JOB_SIZE": "N/A",
     "JOB_CLASSIFICATION": "N/A",
     "JOB_REVIEW_TIME": "N/A",
     "OWNER_NAME": "WAYNE J GLEASON",
     "OWNER_FULL_NAME": "WAYNE J GLEASON",
     "APPLICANT_NAME": "WAYNE J  GLEASON",
     "TRADE_NAME": "",
     "PERMIT_STATUS": [
      {
       "REVIEW_STATUS": "APP",
       "DISCIPLINE": "Historic",
       "REVIEW_STATUS_DATE": "11/30/2006"
      },
      {
       "REVIEW_STATUS": "APP",
       "DISCIPLINE": "Struc",
       "REVIEW_STATUS_DATE": "11/30/2006"
      },
      {
       "REVIEW_STATUS": "APP",
       "DISCIPLINE": "Zoning",
       "REVIEW_STATUS_DATE": "11/30/2006"
      },
      {
       "REVIEW_STATUS": "Application Accepted",
       "DISCIPLINE": "Plan Review Coordinator",
       "REVIEW_STATUS_DATE": "07/12/2008"
      },
      {
       "REVIEW_STATUS": "HPRB Review Approved",
       "DISCIPLINE": "HPRB Review",
       "REVIEW_STATUS_DATE": "07/12/2008"
      },
      {
       "REVIEW_STATUS": "In-Process",
       "DISCIPLINE": "BZA Review",
       "REVIEW_STATUS_DATE": ""
      },
      {
       "REVIEW_STATUS": "In-Process",
       "DISCIPLINE": "CFA Review",
       "REVIEW_STATUS_DATE": ""
      },
      {
       "REVIEW_STATUS": "In-Process",
       "DISCIPLINE": "Chinatown Review",
       "REVIEW_STATUS_DATE": ""
      },
      {
       "REVIEW_STATUS": "In-Process",
       "DISCIPLINE": "DDOE Review",
       "REVIEW_STATUS_DATE": ""
      },
      {
       "REVIEW_STATUS": "In-Process",
       "DISCIPLINE": "DDOT Review (Public Space)",
       "REVIEW_STATUS_DATE": ""
      },
      {
       "REVIEW_STATUS": "In-Process",
       "DISCIPLINE": "DOH Review",
       "REVIEW_STATUS_DATE": ""
      },
      {
       "REVIEW_STATUS": "In-Process",
       "DISCIPLINE": "EISF Review",
       "REVIEW_STATUS_DATE": ""
      },
      {
       "REVIEW_STATUS": "In-Process",
       "DISCIPLINE": "Electrical Review",
       "REVIEW_STATUS_DATE": ""
      },
      {
       "REVIEW_STATUS": "In-Process",
       "DISCIPLINE": "Elevator Review",
       "REVIEW_STATUS_DATE": ""
      },
      {
       "REVIEW_STATUS": "In-Process",
       "DISCIPLINE": "File Room",
       "REVIEW_STATUS_DATE": ""
      },
      {
       "REVIEW_STATUS": "In-Process",
       "DISCIPLINE": "Fire Review",
       "REVIEW_STATUS_DATE": ""
      },
      {
       "REVIEW_STATUS": "In-Process",
       "DISCIPLINE": "Management Review",
       "REVIEW_STATUS_DATE": ""
      },
      {
       "REVIEW_STATUS": "In-Process",
       "DISCIPLINE": "Mechanical and Plumbing Review",
       "REVIEW_STATUS_DATE": ""
      },
      {
       "REVIEW_STATUS": "In-Process",
       "DISCIPLINE": "NCPC Review",
       "REVIEW_STATUS_DATE": ""
      },
      {
       "REVIEW_STATUS": "In-Process",
       "DISCIPLINE": "WASA Review",
       "REVIEW_STATUS_DATE": ""
      },
      {
       "REVIEW_STATUS": "In-Process",
       "DISCIPLINE": "White House Review",
       "REVIEW_STATUS_DATE": ""
      },
      {
       "REVIEW_STATUS": "In-Process",
       "DISCIPLINE": "WMATA Review",
       "REVIEW_STATUS_DATE": ""
      },
      {
       "REVIEW_STATUS": "In-Process",
       "DISCIPLINE": "Zoning Overlay/PUD Review",
       "REVIEW_STATUS_DATE": ""
      },
      {
       "REVIEW_STATUS": "PEN",
       "DISCIPLINE": "Historic",
       "REVIEW_STATUS_DATE": "11/30/2006"
      },
      {
       "REVIEW_STATUS": "PEN",
       "DISCIPLINE": "Struc",
       "REVIEW_STATUS_DATE": "11/30/2006"
      },
      {
       "REVIEW_STATUS": "PEN",
       "DISCIPLINE": "Zoning",
       "REVIEW_STATUS_DATE": "11/30/2006"
      },
      {
       "REVIEW_STATUS": "Permit Issued",
       "DISCIPLINE": "Issue Permit",
       "REVIEW_STATUS_DATE": "07/12/2008"
      },
      {
       "REVIEW_STATUS": "Structural Review Approved",
       "DISCIPLINE": "Structural Review",
       "REVIEW_STATUS_DATE": "07/12/2008"
      },
      {
       "REVIEW_STATUS": "Zoning Review Approved",
       "DISCIPLINE": "Zoning Review",
       "REVIEW_STATUS_DATE": "07/12/2008"
      }
     ]
    }
   ]
  },
  "inspectionDetails": {
   "updated": "2020-06-28T18:51:27.626Z",
   "inspectionData": [
    {
     "ADDRESS": "1739 S ST NW, WASHINGTON, DC 20009",
     "UNIT": "",
     "SSL": "0152    0027",
     "ID": "CO1301587",
     "G6_ACT_DES": "Zoning Use",
     "G6_STATUS": "Approved",
     "G6_STATUS_DD": "4/9/2013 12:00:00 AM",
     "DESC_OF_WORK": "TWO FAMILY FLAT.",
     "G6_STATUS_DD_NET": "2013/04/09",
     "OWNER_FULL_NAME": "WAYNE J. GLEASON & MARK  A. AGUIRRE",
     "APPLICANT": ""
    },
    {
     "ADDRESS": "1739 S ST NW, WASHINGTON, DC 20009",
     "UNIT": "",
     "SSL": "0152    0027",
     "ID": "CO1301587",
     "G6_ACT_DES": "Zoning Use",
     "G6_STATUS": "Rescheduled",
     "G6_STATUS_DD": "4/4/2013 12:00:00 AM",
     "DESC_OF_WORK": "TWO FAMILY FLAT.",
     "G6_STATUS_DD_NET": "2013/04/04",
     "OWNER_FULL_NAME": "WAYNE J. GLEASON & MARK  A. AGUIRRE",
     "APPLICANT": ""
    }
   ]
  },
  "occupancyDetails": {
   "updated": "2020-06-28T18:51:27.790Z",
   "occupancyData": [
    {
     "FULL_ADDRESS": "1739 S ST NW, WASHINGTON, DC 20009",
     "B1_UNIT_START": "",
     "SSL": "0152    0027",
     "B1_ALT_ID": "CO1301587",
     "TYPE": "Certificate of Occupancy",
     "G6_STAT_DD": "04/10/2013",
     "B1_APPL_STATUS": "Completed",
     "B1_APPL_STATUS_DATE": "04/10/2013",
     "DESC_OF_WORK": "Ownership ChangeTWO FAMILY FLAT.",
     "G6_STAT_DD_NET": "2013/04/10",
     "B1_APPL_STATUS_DATE_NET": "2013/04/10",
     "OWNER_FULL_NAME": "WAYNE J. GLEASON & MARK  A. AGUIRRE",
     "APPLICANT": ""
    }
   ]
  },
  "charDetails": {
   "updated": "2020-06-28T19:53:09.208Z",
   "charData": [
    {
     "PREMISEADD": "1739 S ST NW",
     "SSL": "0152    0027",
     "BLDG_NUM": "1",
     "COMPLX_NUM": "",
     "UNITNUMBER": "",
     "NUM_UNITS": "0",
     "AYB": "1890",
     "STRUCT_CL_": "",
     "STYLE_D": "3 Story",
     "STRUCT_D": "Row ",
     "GBA": "4767",
     "EXTWALL_D": "Brick/Stone",
     "WALL_HGT": "",
     "ROOF_D": "Meta",
     "BATHRM": "3",
     "HF_BATHRM": "1",
     "HEAT_D": "Hot ",
     "AC": "Y",
     "INTWALL_D": "Hardwood",
     "ROOMS": "9",
     "BEDRM": "4",
     "KITCHENS": "2",
     "FIREPLACES": "6",
     "YR_RMDL": "2003",
     "EYB": "1985",
     "STORIES": "3",
     "OWNERNAME": "WAYNE J GLEASON",
     "OWNNAME2": "MARK A AGUIRRE",
     "CAREOFNAME": ""
    }
   ]
  },
  "taxData": {
   "ssl": "0152    0027",
   "address": "1739 S ST NW",
   "owner": "WAYNE J GLEASON",
   "neighborhood": "OLD CITY II",
   "sub_neighborhood": "D",
   "use_code": "24",
   "sale_price": "$675,000.00",
   "recordation_date": "03/05/1999",
   "2016_Assessment": "$1,629,600.00"
  }
 },
 "1750 SWANN STREET NW": {
  "ownerInfo": {
   "updated": "2020-06-28T17:29:49.721Z",
   "ownerData": [
    {
     "OWNERNAME": "DANIEL E KOHN",
     "PREMISEADD": "1750 SWANN ST NW",
     "UNITNUMBER": "",
     "SSL": "0152    0132",
     "USECODE": "024",
     "HSTDCODE": "",
     "CLASSTYPE": "001",
     "TAXRATE": "0.0085",
     "SALEPRICE": "",
     "SALEDATE": "",
     "INSTNO": "",
     "ACCEPTCODE": "",
     "DEEDDATE": "",
     "OWNNAME2": "",
     "CPMS_ADDRESS": "1750 SWANN ST NW",
     "CAREOFNAME": "",
     "ADDRESS1": "617 COLORADO AVE",
     "ADDRESS2": "",
     "CITYSTZIP": "BALTIMORE                  MD 21210-2102",
     "SALEDATE_NET": "",
     "DEEDDATE_NET": ""
    }
   ]
  },
  "addressDetails": {
   "updated": "2020-06-28T18:11:16.273Z",
   "addressData": [
    {
     "ADDRESS_ID": "241545",
     "MARID": "241545",
     "STATUS": "ACTIVE",
     "FULLADDRESS": "1750 SWANN STREET NW",
     "ADDRNUM": "1750",
     "ADDRNUMSUFFIX": "",
     "STNAME": "SWANN",
     "STREET_TYPE": "STREET",
     "QUADRANT": "NW",
     "CITY": "WASHINGTON",
     "STATE": "DC",
     "XCOORD": "396453.09",
     "YCOORD": "138536.04",
     "SSL": "0152    0132",
     "ANC": "ANC 2B",
     "PSA": "Police Service Area 301",
     "WARD": "Ward 2",
     "NBHD_ACTION": " ",
     "CLUSTER_": "Cluster 6",
     "POLDIST": "Police District - Third District",
     "ROC": "Police Sector 3D3",
     "CENSUS_TRACT": "004201",
     "VOTE_PRCNCT": "Precinct 141",
     "SMD": "SMD 2B01",
     "ZIPCODE": "20009",
     "NATIONALGRID": "18S UJ 23055 09289",
     "ROADWAYSEGID": "19232",
     "FOCUS_IMPROVEMENT_AREA": "NA",
     "HAS_ALIAS": "N",
     "HAS_CONDO_UNIT": "N",
     "HAS_RES_UNIT": "N",
     "HAS_SSL": "Y",
     "LATITUDE": "38.91468343",
     "LONGITUDE": "-77.04089788",
     "STREETVIEWURL": "http://maps.google.com/maps?z=16&layer=c&cbll=38.91468343,-77.04089788&cbp=11,162.091288002335,,0,2.09",
     "RES_TYPE": "RESIDENTIAL",
     "WARD_2002": "Ward 2",
     "WARD_2012": "Ward 2",
     "ANC_2002": "ANC 2B",
     "ANC_2012": "ANC 2B",
     "SMD_2002": "SMD 2B01",
     "SMD_2012": "SMD 2B01",
     "IMAGEURL": "http://citizenatlas.dc.gov/mobilevideo",
     "IMAGEDIR": "20040816",
     "IMAGENAME": "QG065947.jpg",
     "ConfidenceLevel": "100",
     "Zoning": "RA-2"
    }
   ]
  },
  "licenseDetails": {
   "updated": "2020-06-28T18:35:09.189Z",
   "licenseData": [
    {
     "ADDRESS": "1750  SWANN ST NW",
     "UNIT": " ",
     "SSL": "0152    0132",
     "CUST_NUM": "500613000043",
     "DECRIPTION": "Housing: Residential",
     "ENDORSEMENT_DESC": "Two Family Rental",
     "LAST_NAME": "KOHN",
     "FIRST_NAME": "DANIEL ",
     "CORP_NAME": "",
     "TRADE_NAME": "",
     "BEGIN_RENEWAL": "Jan  1 2020 12:00AM",
     "END_RENEWAL": "Dec 31 2021 12:00AM",
     "STATUS": "Active",
     "BEGIN_RENEWAL_NET": "2020/01/01",
     "END_RENEWAL_NET": "2021/12/31"
    },
    {
     "ADDRESS": "1750  SWANN ST NW",
     "UNIT": " ",
     "SSL": "0152    0132",
     "CUST_NUM": "69002330",
     "DECRIPTION": "Housing: Residential",
     "ENDORSEMENT_DESC": "Two Family Rental",
     "LAST_NAME": "KOHN",
     "FIRST_NAME": "DANIEL",
     "CORP_NAME": "",
     "TRADE_NAME": "",
     "BEGIN_RENEWAL": "Apr  1 2009 12:00AM",
     "END_RENEWAL": "Mar 31 2011 12:00AM",
     "STATUS": "Denied",
     "BEGIN_RENEWAL_NET": "2009/04/01",
     "END_RENEWAL_NET": "2011/03/31"
    }
   ]
  },
  "permitDetails": {
   "updated": "2020-06-28T18:51:45.590Z",
   "permitData": [
    {
     "FULL_ADDRESS": "1750 SWANN ST NW, WASHINGTON, DC 20009",
     "B1_UNIT_START": "",
     "SSL": "0152    0132",
     "B1_ALT_ID": "B0908163",
     "TYPE": "Construction/Alteration and Repair",
     "G6_STAT_DD": "Aug  7 2009 12:00AM",
     "B1_APPL_STATUS": "Completed",
     "B1_APPL_STATUS_DATE": "03/10/2010",
     "DESC_OF_WORK": "Interior renovation, addition of three baths, updating baths, updating kitchen.",
     "SORT_DATE": null,
     "G6_STAT_DD_NET": "2009/08/07",
     "B1_APPL_STATUS_DATE_NET": "2010/03/10",
     "JOB_CLASS_CODE": "WT",
     "JOB_SIZE": "N/A",
     "JOB_CLASSIFICATION": "N/A",
     "JOB_REVIEW_TIME": "N/A",
     "OWNER_NAME": "DANIEL E Kohn",
     "OWNER_FULL_NAME": "DANIEL E Kohn",
     "APPLICANT_NAME": "",
     "TRADE_NAME": "",
     "PERMIT_STATUS": [
      {
       "REVIEW_STATUS": "Application Accepted",
       "DISCIPLINE": "Plan Review Coordinator",
       "REVIEW_STATUS_DATE": "08/07/2009"
      },
      {
       "REVIEW_STATUS": "Electrical Review Approved",
       "DISCIPLINE": "Electrical Review",
       "REVIEW_STATUS_DATE": "08/07/2009"
      },
      {
       "REVIEW_STATUS": "HPRB Review Approved",
       "DISCIPLINE": "HPRB Review",
       "REVIEW_STATUS_DATE": "08/07/2009"
      },
      {
       "REVIEW_STATUS": "Inspection Approved",
       "DISCIPLINE": "Inspection",
       "REVIEW_STATUS_DATE": "03/10/2010"
      },
      {
       "REVIEW_STATUS": "Mechanical Review Approved",
       "DISCIPLINE": "Mechanical and Plumbing Review",
       "REVIEW_STATUS_DATE": "08/07/2009"
      },
      {
       "REVIEW_STATUS": "Permit Issued",
       "DISCIPLINE": "Issue Permit",
       "REVIEW_STATUS_DATE": "08/07/2009"
      },
      {
       "REVIEW_STATUS": "Structural Review Approved",
       "DISCIPLINE": "Structural Review",
       "REVIEW_STATUS_DATE": "08/07/2009"
      }
     ]
    },
    {
     "FULL_ADDRESS": "1750 SWANN ST NW, WASHINGTON, DC 20009",
     "B1_UNIT_START": "",
     "SSL": "0152    0132",
     "B1_ALT_ID": "B0909372",
     "TYPE": "Construction/Addition Alteration Repair",
     "G6_STAT_DD": "Jan 26 2010 12:00AM",
     "B1_APPL_STATUS": "Completed",
     "B1_APPL_STATUS_DATE": "03/24/2010",
     "DESC_OF_WORK": "ADDITION OF SMALL DECK ON REAR SECOND FLOOR ROOF, SIMILAR TO OTHER DECKS INSTAALLED BY NEIGHBORS ON ADJACENT HOUSES.",
     "SORT_DATE": null,
     "G6_STAT_DD_NET": "2010/01/26",
     "B1_APPL_STATUS_DATE_NET": "2010/03/24",
     "JOB_CLASS_CODE": "WT",
     "JOB_SIZE": "N/A",
     "JOB_CLASSIFICATION": "N/A",
     "JOB_REVIEW_TIME": "N/A",
     "OWNER_NAME": "DANIEL E KOHN",
     "OWNER_FULL_NAME": "DANIEL E KOHN",
     "APPLICANT_NAME": "MARTHA  LOGAN",
     "TRADE_NAME": "",
     "PERMIT_STATUS": [
      {
       "REVIEW_STATUS": "Application Accepted",
       "DISCIPLINE": "Plan Review Coordinator",
       "REVIEW_STATUS_DATE": "09/21/2009"
      },
      {
       "REVIEW_STATUS": "HPRB Review Approved",
       "DISCIPLINE": "HPRB Review",
       "REVIEW_STATUS_DATE": "11/17/2009"
      },
      {
       "REVIEW_STATUS": "Inspection Approved",
       "DISCIPLINE": "Inspection",
       "REVIEW_STATUS_DATE": "03/24/2010"
      },
      {
       "REVIEW_STATUS": "Permit Issued",
       "DISCIPLINE": "Issue Permit",
       "REVIEW_STATUS_DATE": "01/26/2010"
      },
      {
       "REVIEW_STATUS": "Structural Review Approved",
       "DISCIPLINE": "Structural Review",
       "REVIEW_STATUS_DATE": "01/26/2010"
      },
      {
       "REVIEW_STATUS": "Zoning Review Approved",
       "DISCIPLINE": "Zoning Review",
       "REVIEW_STATUS_DATE": "01/26/2010"
      }
     ]
    },
    {
     "FULL_ADDRESS": "1750 SWANN ST NW, WASHINGTON, DC 20009",
     "B1_UNIT_START": "",
     "SSL": "0152    0132",
     "B1_ALT_ID": "E0907400",
     "TYPE": "Supplemental/Electrical",
     "G6_STAT_DD": "Sep 10 2009 12:00AM",
     "B1_APPL_STATUS": "Permit Issued",
     "B1_APPL_STATUS_DATE": "09/10/2009",
     "DESC_OF_WORK": "",
     "SORT_DATE": null,
     "G6_STAT_DD_NET": "2009/09/10",
     "B1_APPL_STATUS_DATE_NET": "2009/09/10",
     "JOB_CLASS_CODE": "N/A",
     "JOB_SIZE": "N/A",
     "JOB_CLASSIFICATION": "N/A",
     "JOB_REVIEW_TIME": "N/A",
     "OWNER_NAME": "DANIEL E KOHN",
     "OWNER_FULL_NAME": "DANIEL E KOHN",
     "APPLICANT_NAME": "JAMES W CONNOR",
     "TRADE_NAME": "",
     "PERMIT_STATUS": [
      {
       "REVIEW_STATUS": "",
       "DISCIPLINE": "",
       "REVIEW_STATUS_DATE": ""
      }
     ]
    },
    {
     "FULL_ADDRESS": "1750 SWANN ST NW, WASHINGTON, DC 20009",
     "B1_UNIT_START": "",
     "SSL": "0152    0132",
     "B1_ALT_ID": "M0901871",
     "TYPE": "Supplemental/Mechanical",
     "G6_STAT_DD": "Sep 30 2009 12:00AM",
     "B1_APPL_STATUS": "Permit Issued",
     "B1_APPL_STATUS_DATE": "09/30/2009",
     "DESC_OF_WORK": "",
     "SORT_DATE": null,
     "G6_STAT_DD_NET": "2009/09/30",
     "B1_APPL_STATUS_DATE_NET": "2009/09/30",
     "JOB_CLASS_CODE": "N/A",
     "JOB_SIZE": "N/A",
     "JOB_CLASSIFICATION": "N/A",
     "JOB_REVIEW_TIME": "N/A",
     "OWNER_NAME": "DANIEL E KOHN",
     "OWNER_FULL_NAME": "DANIEL E KOHN",
     "APPLICANT_NAME": "WILLIAM F. ROWAN",
     "TRADE_NAME": "",
     "PERMIT_STATUS": [
      {
       "REVIEW_STATUS": "",
       "DISCIPLINE": "",
       "REVIEW_STATUS_DATE": ""
      }
     ]
    },
    {
     "FULL_ADDRESS": "1750 SWANN ST NW, WASHINGTON, DC 20009",
     "B1_UNIT_START": "",
     "SSL": "0152    0132",
     "B1_ALT_ID": "P0905691",
     "TYPE": "Supplemental/Plumbing and Gas",
     "G6_STAT_DD": "Sep 24 2009 12:00AM",
     "B1_APPL_STATUS": "Completed",
     "B1_APPL_STATUS_DATE": "03/01/2010",
     "DESC_OF_WORK": "",
     "SORT_DATE": null,
     "G6_STAT_DD_NET": "2009/09/24",
     "B1_APPL_STATUS_DATE_NET": "2010/03/01",
     "JOB_CLASS_CODE": "N/A",
     "JOB_SIZE": "N/A",
     "JOB_CLASSIFICATION": "N/A",
     "JOB_REVIEW_TIME": "N/A",
     "OWNER_NAME": "DANIEL E KOHN",
     "OWNER_FULL_NAME": "DANIEL E KOHN",
     "APPLICANT_NAME": "JOSEPH S FABIAN",
     "TRADE_NAME": "",
     "PERMIT_STATUS": [
      {
       "REVIEW_STATUS": "",
       "DISCIPLINE": "",
       "REVIEW_STATUS_DATE": ""
      }
     ]
    },
    {
     "FULL_ADDRESS": "1750 SWANN ST NW, WASHINGTON, DC 20009",
     "B1_UNIT_START": "",
     "SSL": "0152    0132",
     "B1_ALT_ID": "P1401960",
     "TYPE": "Supplemental/Plumbing and Gas",
     "G6_STAT_DD": "Dec 19 2013 12:00AM",
     "B1_APPL_STATUS": "Completed",
     "B1_APPL_STATUS_DATE": "01/14/2014",
     "DESC_OF_WORK": "",
     "SORT_DATE": null,
     "G6_STAT_DD_NET": "2013/12/19",
     "B1_APPL_STATUS_DATE_NET": "2014/01/14",
     "JOB_CLASS_CODE": "N/A",
     "JOB_SIZE": "N/A",
     "JOB_CLASSIFICATION": "N/A",
     "JOB_REVIEW_TIME": "N/A",
     "OWNER_NAME": "DANIEL E KOHN",
     "OWNER_FULL_NAME": "DANIEL E KOHN",
     "APPLICANT_NAME": "DAVID F. BROWN",
     "TRADE_NAME": "",
     "PERMIT_STATUS": [
      {
       "REVIEW_STATUS": "",
       "DISCIPLINE": "",
       "REVIEW_STATUS_DATE": ""
      }
     ]
    }
   ]
  },
  "inspectionDetails": {
   "updated": "2020-06-28T18:51:45.847Z",
   "inspectionData": [
    {
     "ADDRESS": "1750 SWANN ST NW, WASHINGTON, DC 20009",
     "UNIT": "",
     "SSL": "0152    0132",
     "ID": "P1401960",
     "G6_ACT_DES": "Plumbing Final",
     "G6_STATUS": "Approved",
     "G6_STATUS_DD": "1/14/2014 12:00:00 AM",
     "DESC_OF_WORK": "",
     "G6_STATUS_DD_NET": "2014/01/14",
     "OWNER_FULL_NAME": "DANIEL E KOHN",
     "APPLICANT": "DAVID F. BROWN"
    },
    {
     "ADDRESS": "1750 SWANN ST NW, WASHINGTON, DC 20009",
     "UNIT": "",
     "SSL": "0152    0132",
     "ID": "B0909372",
     "G6_ACT_DES": "Building Final",
     "G6_STATUS": "Approved",
     "G6_STATUS_DD": "3/24/2010 12:00:00 AM",
     "DESC_OF_WORK": "ADDITION OF SMALL DECK ON REAR SECOND FLOOR ROOF, SIMILAR TO OTHER DECKS INSTAALLED BY NEIGHBORS ON ADJACENT HOUSES.",
     "G6_STATUS_DD_NET": "2010/03/24",
     "OWNER_FULL_NAME": "DANIEL E KOHN",
     "APPLICANT": "MARTHA  LOGAN"
    },
    {
     "ADDRESS": "1750 SWANN ST NW, WASHINGTON, DC 20009",
     "UNIT": "",
     "SSL": "0152    0132",
     "ID": "B0909372",
     "G6_ACT_DES": "Building Final",
     "G6_STATUS": "Disapproved",
     "G6_STATUS_DD": "3/17/2010 12:00:00 AM",
     "DESC_OF_WORK": "ADDITION OF SMALL DECK ON REAR SECOND FLOOR ROOF, SIMILAR TO OTHER DECKS INSTAALLED BY NEIGHBORS ON ADJACENT HOUSES.",
     "G6_STATUS_DD_NET": "2010/03/17",
     "OWNER_FULL_NAME": "DANIEL E KOHN",
     "APPLICANT": "MARTHA  LOGAN"
    },
    {
     "ADDRESS": "1750 SWANN ST NW, WASHINGTON, DC 20009",
     "UNIT": "",
     "SSL": "0152    0132",
     "ID": "B0908163",
     "G6_ACT_DES": "Building Final",
     "G6_STATUS": "Approved",
     "G6_STATUS_DD": "3/10/2010 12:00:00 AM",
     "DESC_OF_WORK": "Interior renovation, addition of three baths, updating baths, updating kitchen.",
     "G6_STATUS_DD_NET": "2010/03/10",
     "OWNER_FULL_NAME": "DANIEL E Kohn",
     "APPLICANT": ""
    },
    {
     "ADDRESS": "1750 SWANN ST NW, WASHINGTON, DC 20009",
     "UNIT": "",
     "SSL": "0152    0132",
     "ID": "P0905691",
     "G6_ACT_DES": "Plumbing Final",
     "G6_STATUS": "Approved",
     "G6_STATUS_DD": "3/1/2010 12:00:00 AM",
     "DESC_OF_WORK": "",
     "G6_STATUS_DD_NET": "2010/03/01",
     "OWNER_FULL_NAME": "DANIEL E KOHN",
     "APPLICANT": "JOSEPH S FABIAN"
    },
    {
     "ADDRESS": "1750 SWANN ST NW, WASHINGTON, DC 20009",
     "UNIT": "",
     "SSL": "0152    0132",
     "ID": "B0908163",
     "G6_ACT_DES": "Building Framing",
     "G6_STATUS": "Approved",
     "G6_STATUS_DD": "10/29/2009 12:00:00 AM",
     "DESC_OF_WORK": "Interior renovation, addition of three baths, updating baths, updating kitchen.",
     "G6_STATUS_DD_NET": "2009/10/29",
     "OWNER_FULL_NAME": "DANIEL E Kohn",
     "APPLICANT": ""
    },
    {
     "ADDRESS": "1750 SWANN ST NW, WASHINGTON, DC 20009",
     "UNIT": "",
     "SSL": "0152    0132",
     "ID": "P0905691",
     "G6_ACT_DES": "Plumbing Close-In",
     "G6_STATUS": "Approved",
     "G6_STATUS_DD": "10/20/2009 12:00:00 AM",
     "DESC_OF_WORK": "",
     "G6_STATUS_DD_NET": "2009/10/20",
     "OWNER_FULL_NAME": "DANIEL E KOHN",
     "APPLICANT": "JOSEPH S FABIAN"
    }
   ]
  },
  "occupancyDetails": {
   "updated": "2020-06-28T18:51:46.020Z",
   "occupancyData": []
  },
  "charDetails": {
   "updated": "2020-06-28T19:53:13.301Z",
   "charData": [
    {
     "PREMISEADD": "1750 SWANN ST NW",
     "SSL": "0152    0132",
     "BLDG_NUM": "1",
     "COMPLX_NUM": "",
     "UNITNUMBER": "",
     "NUM_UNITS": "0",
     "AYB": "1898",
     "STRUCT_CL_": "",
     "STYLE_D": "3 Story",
     "STRUCT_D": "Row ",
     "GBA": "4328",
     "EXTWALL_D": "Brick/Stone",
     "WALL_HGT": "",
     "ROOF_D": "Buil",
     "BATHRM": "2",
     "HF_BATHRM": "0",
     "HEAT_D": "Hot ",
     "AC": "N",
     "INTWALL_D": "Hardwood",
     "ROOMS": "11",
     "BEDRM": "5",
     "KITCHENS": "2",
     "FIREPLACES": "1",
     "YR_RMDL": "2010",
     "EYB": "1957",
     "STORIES": "3",
     "OWNERNAME": "DANIEL E KOHN",
     "OWNNAME2": "",
     "CAREOFNAME": ""
    }
   ]
  },
  "taxData": {
   "ssl": "0152    0132",
   "address": "1750 SWANN ST NW",
   "owner": "DANIEL E KOHN",
   "neighborhood": "OLD CITY II",
   "sub_neighborhood": "D",
   "use_code": "24",
   "sale_price": "$.00",
   "recordation_date": "N/A",
   "2016_Assessment": "$1,241,670.00"
  }
 },
 "1756 SWANN STREET NW": {
  "ownerInfo": {
   "updated": "2020-06-28T17:29:51.874Z",
   "ownerData": [
    {
     "OWNERNAME": "MANNING NORA M",
     "PREMISEADD": "1756 SWANN ST NW",
     "UNITNUMBER": "",
     "SSL": "0152    0129",
     "USECODE": "024",
     "HSTDCODE": "1",
     "CLASSTYPE": "001",
     "TAXRATE": "0.0085",
     "SALEPRICE": "",
     "SALEDATE": "",
     "INSTNO": "",
     "ACCEPTCODE": "",
     "DEEDDATE": "",
     "OWNNAME2": "",
     "CPMS_ADDRESS": "1756 SWANN ST NW",
     "CAREOFNAME": "",
     "ADDRESS1": "1756 SWANN ST NW",
     "ADDRESS2": "",
     "CITYSTZIP": "WASHINGTON                 DC 20009-5535",
     "SALEDATE_NET": "",
     "DEEDDATE_NET": ""
    }
   ]
  },
  "addressDetails": {
   "updated": "2020-06-28T18:11:19.629Z",
   "addressData": [
    {
     "ADDRESS_ID": "241542",
     "MARID": "241542",
     "STATUS": "ACTIVE",
     "FULLADDRESS": "1756 SWANN STREET NW",
     "ADDRNUM": "1756",
     "ADDRNUMSUFFIX": "",
     "STNAME": "SWANN",
     "STREET_TYPE": "STREET",
     "QUADRANT": "NW",
     "CITY": "WASHINGTON",
     "STATE": "DC",
     "XCOORD": "396435.46",
     "YCOORD": "138536.08",
     "SSL": "0152    0129",
     "ANC": "ANC 2B",
     "PSA": "Police Service Area 301",
     "WARD": "Ward 2",
     "NBHD_ACTION": " ",
     "CLUSTER_": "Cluster 6",
     "POLDIST": "Police District - Third District",
     "ROC": "Police Sector 3D3",
     "CENSUS_TRACT": "004201",
     "VOTE_PRCNCT": "Precinct 141",
     "SMD": "SMD 2B01",
     "ZIPCODE": "20009",
     "NATIONALGRID": "18S UJ 23037 09289",
     "ROADWAYSEGID": "19232",
     "FOCUS_IMPROVEMENT_AREA": "NA",
     "HAS_ALIAS": "N",
     "HAS_CONDO_UNIT": "N",
     "HAS_RES_UNIT": "Y",
     "HAS_SSL": "Y",
     "LATITUDE": "38.91468372",
     "LONGITUDE": "-77.04110117",
     "STREETVIEWURL": "http://maps.google.com/maps?z=16&layer=c&cbll=38.91468372,-77.04110117&cbp=11,185.410183069505,,0,2.09",
     "RES_TYPE": "RESIDENTIAL",
     "WARD_2002": "Ward 2",
     "WARD_2012": "Ward 2",
     "ANC_2002": "ANC 2B",
     "ANC_2012": "ANC 2B",
     "SMD_2002": "SMD 2B01",
     "SMD_2012": "SMD 2B01",
     "IMAGEURL": "http://citizenatlas.dc.gov/mobilevideo",
     "IMAGEDIR": "20040816",
     "IMAGENAME": "QG070230.jpg",
     "ConfidenceLevel": "100",
     "Zoning": "RA-2"
    }
   ]
  },
  "licenseDetails": {
   "updated": "2020-06-28T18:35:14.277Z",
   "licenseData": [
    {
     "ADDRESS": "1756  SWANN ST NW",
     "UNIT": "",
     "SSL": "0152    0129",
     "CUST_NUM": "39803203",
     "DECRIPTION": "Housing: Residential",
     "ENDORSEMENT_DESC": "Apartment",
     "LAST_NAME": "MANNING",
     "FIRST_NAME": "NORA",
     "CORP_NAME": "",
     "TRADE_NAME": "",
     "BEGIN_RENEWAL": "Nov  1 2003 12:00AM",
     "END_RENEWAL": "Oct 31 2005 12:00AM",
     "STATUS": "Expired",
     "BEGIN_RENEWAL_NET": "2003/11/01",
     "END_RENEWAL_NET": "2005/10/31"
    },
    {
     "ADDRESS": "1756  SWANN ST NW",
     "UNIT": "",
     "SSL": "0152    0129",
     "CUST_NUM": "66007529",
     "DECRIPTION": "Housing: Residential",
     "ENDORSEMENT_DESC": "Apartment",
     "LAST_NAME": "MANNING",
     "FIRST_NAME": "NORA",
     "CORP_NAME": "",
     "TRADE_NAME": "",
     "BEGIN_RENEWAL": "Dec  1 2018 12:00AM",
     "END_RENEWAL": "Nov 30 2020 12:00AM",
     "STATUS": "Active",
     "BEGIN_RENEWAL_NET": "2018/12/01",
     "END_RENEWAL_NET": "2020/11/30"
    }
   ]
  },
  "permitDetails": {
   "updated": "2020-06-28T18:51:57.701Z",
   "permitData": [
    {
     "FULL_ADDRESS": "1756 SWANN ST NW, WASHINGTON, DC 20009",
     "B1_UNIT_START": "",
     "SSL": "0152    0129",
     "B1_ALT_ID": "P1001934",
     "TYPE": "Supplemental/Plumbing and Gas",
     "G6_STAT_DD": "Jan 14 2010 12:00AM",
     "B1_APPL_STATUS": "Permit Issued",
     "B1_APPL_STATUS_DATE": "01/14/2010",
     "DESC_OF_WORK": "",
     "SORT_DATE": null,
     "G6_STAT_DD_NET": "2010/01/14",
     "B1_APPL_STATUS_DATE_NET": "2010/01/14",
     "JOB_CLASS_CODE": "N/A",
     "JOB_SIZE": "N/A",
     "JOB_CLASSIFICATION": "N/A",
     "JOB_REVIEW_TIME": "N/A",
     "OWNER_NAME": "MANNING NORA M",
     "OWNER_FULL_NAME": "MANNING NORA M",
     "APPLICANT_NAME": "WA  CHAU",
     "TRADE_NAME": "",
     "PERMIT_STATUS": [
      {
       "REVIEW_STATUS": "",
       "DISCIPLINE": "",
       "REVIEW_STATUS_DATE": ""
      }
     ]
    }
   ]
  },
  "inspectionDetails": {
   "updated": "2020-06-28T18:51:57.914Z",
   "inspectionData": []
  },
  "occupancyDetails": {
   "updated": "2020-06-28T18:51:58.082Z",
   "occupancyData": []
  },
  "charDetails": {
   "updated": "2020-06-28T19:53:15.465Z",
   "charData": [
    {
     "PREMISEADD": "1756 SWANN ST NW",
     "SSL": "0152    0129",
     "BLDG_NUM": "1",
     "COMPLX_NUM": "",
     "UNITNUMBER": "",
     "NUM_UNITS": "0",
     "AYB": "1910",
     "STRUCT_CL_": "",
     "STYLE_D": "3 Story",
     "STRUCT_D": "Row ",
     "GBA": "4226",
     "EXTWALL_D": "Common Brick",
     "WALL_HGT": "",
     "ROOF_D": "Buil",
     "BATHRM": "3",
     "HF_BATHRM": "0",
     "HEAT_D": "Warm",
     "AC": "Y",
     "INTWALL_D": "Hardwood",
     "ROOMS": "8",
     "BEDRM": "3",
     "KITCHENS": "3",
     "FIREPLACES": "1",
     "YR_RMDL": "1987",
     "EYB": "1957",
     "STORIES": "3",
     "OWNERNAME": "MANNING NORA M",
     "OWNNAME2": "",
     "CAREOFNAME": ""
    }
   ]
  },
  "taxData": {
   "ssl": "0152    0129",
   "address": "1756 SWANN ST NW",
   "owner": "MANNING NORA M",
   "neighborhood": "OLD CITY II",
   "sub_neighborhood": "D",
   "use_code": "24",
   "sale_price": "$.00",
   "recordation_date": "N/A",
   "2016_Assessment": "$1,192,320.00"
  }
 },
 "1757 SWANN STREET NW": {
  "ownerInfo": {
   "updated": "2020-06-28T17:29:52.340Z",
   "ownerData": [
    {
     "OWNERNAME": "JUAN RECARI",
     "PREMISEADD": "1757 SWANN ST NW",
     "UNITNUMBER": "",
     "SSL": "0152    0858",
     "USECODE": "024",
     "HSTDCODE": "",
     "CLASSTYPE": "001",
     "TAXRATE": "0.0085",
     "SALEPRICE": "$335,000.00",
     "SALEDATE": "05/27/1999",
     "INSTNO": "",
     "ACCEPTCODE": "",
     "DEEDDATE": "05/27/1999",
     "OWNNAME2": "",
     "CPMS_ADDRESS": "1757 SWANN ST NW",
     "CAREOFNAME": "",
     "ADDRESS1": "2727 29TH ST NW APT 507",
     "ADDRESS2": "",
     "CITYSTZIP": "WASHINGTON                 DC 20008-5545",
     "SALEDATE_NET": "1999/05/27",
     "DEEDDATE_NET": "1999/05/27"
    }
   ]
  },
  "addressDetails": {
   "updated": "2020-06-28T18:11:20.210Z",
   "addressData": [
    {
     "ADDRESS_ID": "241587",
     "MARID": "241587",
     "STATUS": "ACTIVE",
     "FULLADDRESS": "1757 SWANN STREET NW",
     "ADDRNUM": "1757",
     "ADDRNUMSUFFIX": "",
     "STNAME": "SWANN",
     "STREET_TYPE": "STREET",
     "QUADRANT": "NW",
     "CITY": "WASHINGTON",
     "STATE": "DC",
     "XCOORD": "396459.05",
     "YCOORD": "138568.96",
     "SSL": "0152    0858",
     "ANC": "ANC 2B",
     "PSA": "Police Service Area 301",
     "WARD": "Ward 2",
     "NBHD_ACTION": " ",
     "CLUSTER_": "Cluster 6",
     "POLDIST": "Police District - Third District",
     "ROC": "Police Sector 3D3",
     "CENSUS_TRACT": "004201",
     "VOTE_PRCNCT": "Precinct 141",
     "SMD": "SMD 2B08",
     "ZIPCODE": "20009",
     "NATIONALGRID": "18S UJ 23062 09322",
     "ROADWAYSEGID": "19232",
     "FOCUS_IMPROVEMENT_AREA": "NA",
     "HAS_ALIAS": "N",
     "HAS_CONDO_UNIT": "N",
     "HAS_RES_UNIT": "Y",
     "HAS_SSL": "Y",
     "LATITUDE": "38.91498001",
     "LONGITUDE": "-77.04082933",
     "STREETVIEWURL": "http://maps.google.com/maps?z=16&layer=c&cbll=38.91498001,-77.04082933&cbp=11,1.11279421914857,,0,2.09",
     "RES_TYPE": "RESIDENTIAL",
     "WARD_2002": "Ward 2",
     "WARD_2012": "Ward 2",
     "ANC_2002": "ANC 2B",
     "ANC_2012": "ANC 2B",
     "SMD_2002": "SMD 2B08",
     "SMD_2012": "SMD 2B08",
     "IMAGEURL": "http://citizenatlas.dc.gov/mobilevideo",
     "IMAGEDIR": "20040816",
     "IMAGENAME": "QG091721.jpg",
     "ConfidenceLevel": "100",
     "Zoning": "RA-2"
    }
   ]
  },
  "licenseDetails": {
   "updated": "2020-06-28T18:35:15.547Z",
   "licenseData": [
    {
     "ADDRESS": "1757  SWANN ST NW",
     "UNIT": "",
     "SSL": "0152    0858",
     "CUST_NUM": "40000439",
     "DECRIPTION": "Housing: Residential",
     "ENDORSEMENT_DESC": "Apartment",
     "LAST_NAME": "RECARI",
     "FIRST_NAME": "JUAN",
     "CORP_NAME": "",
     "TRADE_NAME": "",
     "BEGIN_RENEWAL": "Nov  1 2003 12:00AM",
     "END_RENEWAL": "Oct 31 2005 12:00AM",
     "STATUS": "Cancelled",
     "BEGIN_RENEWAL_NET": "2003/11/01",
     "END_RENEWAL_NET": "2005/10/31"
    },
    {
     "ADDRESS": "1757  SWANN ST NW",
     "UNIT": "",
     "SSL": "0152    0858",
     "CUST_NUM": "53006357",
     "DECRIPTION": "Housing: Residential",
     "ENDORSEMENT_DESC": "Apartment",
     "LAST_NAME": "REDCARI",
     "FIRST_NAME": "JUAN",
     "CORP_NAME": "",
     "TRADE_NAME": "",
     "BEGIN_RENEWAL": "Nov  1 2003 12:00AM",
     "END_RENEWAL": "Oct 31 2005 12:00AM",
     "STATUS": "Expired",
     "BEGIN_RENEWAL_NET": "2003/11/01",
     "END_RENEWAL_NET": "2005/10/31"
    }
   ]
  },
  "permitDetails": {
   "updated": "2020-06-28T18:52:01.602Z",
   "permitData": []
  },
  "inspectionDetails": {
   "updated": "2020-06-28T18:52:01.767Z",
   "inspectionData": [
    {
     "ADDRESS": "1757 SWANN ST NW, WASHINGTON, DC 20009",
     "UNIT": "",
     "SSL": "0152    0858",
     "ID": "CIC1601391",
     "G6_ACT_DES": "Initial Inspection",
     "G6_STATUS": "Rescheduled",
     "G6_STATUS_DD": "5/12/2016 12:00:00 AM",
     "DESC_OF_WORK": "",
     "G6_STATUS_DD_NET": "2016/05/12",
     "OWNER_FULL_NAME": "JUAN RECARI",
     "APPLICANT": ""
    }
   ]
  },
  "occupancyDetails": {
   "updated": "2020-06-28T18:52:01.943Z",
   "occupancyData": []
  },
  "charDetails": {
   "updated": "2020-06-28T19:53:16.070Z",
   "charData": [
    {
     "PREMISEADD": "1757 SWANN ST NW",
     "SSL": "0152    0858",
     "BLDG_NUM": "1",
     "COMPLX_NUM": "",
     "UNITNUMBER": "",
     "NUM_UNITS": "0",
     "AYB": "1960",
     "STRUCT_CL_": "",
     "STYLE_D": "3 Story",
     "STRUCT_D": "Row ",
     "GBA": "4098",
     "EXTWALL_D": "Common Brick",
     "WALL_HGT": "",
     "ROOF_D": "Buil",
     "BATHRM": "3",
     "HF_BATHRM": "0",
     "HEAT_D": "Hot ",
     "AC": "N",
     "INTWALL_D": "Hardwood",
     "ROOMS": "7",
     "BEDRM": "4",
     "KITCHENS": "3",
     "FIREPLACES": "0",
     "YR_RMDL": "",
     "EYB": "1963",
     "STORIES": "3",
     "OWNERNAME": "JUAN RECARI",
     "OWNNAME2": "",
     "CAREOFNAME": ""
    }
   ]
  },
  "taxData": {
   "ssl": "0152    0858",
   "address": "1757 SWANN ST NW",
   "owner": "JUAN RECARI",
   "neighborhood": "OLD CITY II",
   "sub_neighborhood": "D",
   "use_code": "24",
   "sale_price": "$335,000.00",
   "recordation_date": "05/27/1999",
   "2016_Assessment": "$1,009,630.00"
  }
 },
 "1767 SWANN STREET NW": {
  "ownerInfo": {
   "updated": "2020-06-28T17:29:53.920Z",
   "ownerData": [
    {
     "OWNERNAME": "LOGAN MARTHA",
     "PREMISEADD": "1767 SWANN ST NW",
     "UNITNUMBER": "",
     "SSL": "0152    0860",
     "USECODE": "023",
     "HSTDCODE": "5",
     "CLASSTYPE": "001",
     "TAXRATE": "0.0085",
     "SALEPRICE": "",
     "SALEDATE": "",
     "INSTNO": "",
     "ACCEPTCODE": "",
     "DEEDDATE": "",
     "OWNNAME2": "",
     "CPMS_ADDRESS": "1767 SWANN ST NW",
     "CAREOFNAME": "",
     "ADDRESS1": "1767 SWANN ST NW",
     "ADDRESS2": "",
     "CITYSTZIP": "WASHINGTON                 DC 20009-5536",
     "SALEDATE_NET": "",
     "DEEDDATE_NET": ""
    }
   ]
  },
  "addressDetails": {
   "updated": "2020-06-28T18:11:23.105Z",
   "addressData": [
    {
     "ADDRESS_ID": "241588",
     "MARID": "241588",
     "STATUS": "ACTIVE",
     "FULLADDRESS": "1767 SWANN STREET NW",
     "ADDRNUM": "1767",
     "ADDRNUMSUFFIX": "",
     "STNAME": "SWANN",
     "STREET_TYPE": "STREET",
     "QUADRANT": "NW",
     "CITY": "WASHINGTON",
     "STATE": "DC",
     "XCOORD": "396445.65",
     "YCOORD": "138572.31",
     "SSL": "0152    0860",
     "ANC": "ANC 2B",
     "PSA": "Police Service Area 301",
     "WARD": "Ward 2",
     "NBHD_ACTION": " ",
     "CLUSTER_": "Cluster 6",
     "POLDIST": "Police District - Third District",
     "ROC": "Police Sector 3D3",
     "CENSUS_TRACT": "004201",
     "VOTE_PRCNCT": "Precinct 141",
     "SMD": "SMD 2B08",
     "ZIPCODE": "20009",
     "NATIONALGRID": "18S UJ 23048 09323",
     "ROADWAYSEGID": "19232",
     "FOCUS_IMPROVEMENT_AREA": "NA",
     "HAS_ALIAS": "N",
     "HAS_CONDO_UNIT": "N",
     "HAS_RES_UNIT": "Y",
     "HAS_SSL": "Y",
     "LATITUDE": "38.91500980",
     "LONGITUDE": "-77.04098386",
     "STREETVIEWURL": "http://maps.google.com/maps?z=16&layer=c&cbll=38.91498743,-77.04098915&cbp=11,351.644677393236,,0,2.09",
     "RES_TYPE": "RESIDENTIAL",
     "WARD_2002": "Ward 2",
     "WARD_2012": "Ward 2",
     "ANC_2002": "ANC 2B",
     "ANC_2012": "ANC 2B",
     "SMD_2002": "SMD 2B08",
     "SMD_2012": "SMD 2B08",
     "IMAGEURL": "http://citizenatlas.dc.gov/mobilevideo",
     "IMAGEDIR": "20040816",
     "IMAGENAME": "QG091622.jpg",
     "ConfidenceLevel": "100",
     "Zoning": "RA-2"
    }
   ]
  },
  "licenseDetails": {
   "updated": "2020-06-28T18:35:20.013Z",
   "licenseData": [
    {
     "ADDRESS": "1767  SWANN ST NW",
     "UNIT": " ",
     "SSL": "0152    0860",
     "CUST_NUM": "65006890",
     "DECRIPTION": "Housing: Residential",
     "ENDORSEMENT_DESC": "Two Family Rental",
     "LAST_NAME": "LOGAN",
     "FIRST_NAME": "MARTHA",
     "CORP_NAME": "",
     "TRADE_NAME": "",
     "BEGIN_RENEWAL": "Dec  1 2005 12:00AM",
     "END_RENEWAL": "Nov 30 2007 12:00AM",
     "STATUS": "Cancelled",
     "BEGIN_RENEWAL_NET": "2005/12/01",
     "END_RENEWAL_NET": "2007/11/30"
    },
    {
     "ADDRESS": "1767  SWANN ST NW",
     "UNIT": "",
     "SSL": "0152    0860",
     "CUST_NUM": "66000578",
     "DECRIPTION": "Housing: Residential",
     "ENDORSEMENT_DESC": "Apartment",
     "LAST_NAME": "LOGAN ",
     "FIRST_NAME": "MARTHA ",
     "CORP_NAME": "",
     "TRADE_NAME": "",
     "BEGIN_RENEWAL": "Jan  1 2012 12:00AM",
     "END_RENEWAL": "Dec 31 2013 12:00AM",
     "STATUS": "Cancelled",
     "BEGIN_RENEWAL_NET": "2012/01/01",
     "END_RENEWAL_NET": "2013/12/31"
    }
   ]
  },
  "permitDetails": {
   "updated": "2020-06-28T18:52:11.924Z",
   "permitData": [
    {
     "FULL_ADDRESS": "1767 SWANN ST NW, WASHINGTON, DC 20009-5536",
     "B1_UNIT_START": "",
     "SSL": "",
     "B1_ALT_ID": "E69987",
     "TYPE": "Supplemental/Electrical",
     "G6_STAT_DD": "Feb  6 2004  2:32PM",
     "B1_APPL_STATUS": "Permit Issued",
     "B1_APPL_STATUS_DATE": "          ",
     "DESC_OF_WORK": "",
     "SORT_DATE": null,
     "G6_STAT_DD_NET": "2004/02/06",
     "B1_APPL_STATUS_DATE_NET": "",
     "JOB_CLASS_CODE": "N/A",
     "JOB_SIZE": "N/A",
     "JOB_CLASSIFICATION": "N/A",
     "JOB_REVIEW_TIME": "N/A",
     "OWNER_NAME": "LOGAN",
     "OWNER_FULL_NAME": "LOGAN",
     "APPLICANT_NAME": "",
     "TRADE_NAME": "",
     "PERMIT_STATUS": [
      {
       "REVIEW_STATUS": "",
       "DISCIPLINE": "",
       "REVIEW_STATUS_DATE": ""
      }
     ]
    },
    {
     "FULL_ADDRESS": "1767 SWANN ST NW, WASHINGTON, DC 20009",
     "B1_UNIT_START": "",
     "SSL": "0152    0860",
     "B1_ALT_ID": "M1501791",
     "TYPE": "Supplemental/Mechanical",
     "G6_STAT_DD": "May  4 2015 12:00AM",
     "B1_APPL_STATUS": "Permit Issued",
     "B1_APPL_STATUS_DATE": "05/04/2015",
     "DESC_OF_WORK": "",
     "SORT_DATE": null,
     "G6_STAT_DD_NET": "2015/05/04",
     "B1_APPL_STATUS_DATE_NET": "2015/05/04",
     "JOB_CLASS_CODE": "N/A",
     "JOB_SIZE": "N/A",
     "JOB_CLASSIFICATION": "N/A",
     "JOB_REVIEW_TIME": "N/A",
     "OWNER_NAME": "LOGAN MARTHA",
     "OWNER_FULL_NAME": "LOGAN MARTHA",
     "APPLICANT_NAME": "NATHAN D. BOZARTH",
     "TRADE_NAME": "",
     "PERMIT_STATUS": [
      {
       "REVIEW_STATUS": "",
       "DISCIPLINE": "",
       "REVIEW_STATUS_DATE": ""
      }
     ]
    },
    {
     "FULL_ADDRESS": "1767 SWANN ST NW, WASHINGTON, DC 20009-5536",
     "B1_UNIT_START": "",
     "SSL": "",
     "B1_ALT_ID": "P71353",
     "TYPE": "Supplemental/Plumbing and Gas",
     "G6_STAT_DD": "Mar  1 2004  9:39AM",
     "B1_APPL_STATUS": "Permit Issued",
     "B1_APPL_STATUS_DATE": "          ",
     "DESC_OF_WORK": "",
     "SORT_DATE": null,
     "G6_STAT_DD_NET": "2004/03/01",
     "B1_APPL_STATUS_DATE_NET": "",
     "JOB_CLASS_CODE": "N/A",
     "JOB_SIZE": "N/A",
     "JOB_CLASSIFICATION": "N/A",
     "JOB_REVIEW_TIME": "N/A",
     "OWNER_NAME": "LOGAN",
     "OWNER_FULL_NAME": "LOGAN",
     "APPLICANT_NAME": "",
     "TRADE_NAME": "",
     "PERMIT_STATUS": [
      {
       "REVIEW_STATUS": "",
       "DISCIPLINE": "",
       "REVIEW_STATUS_DATE": ""
      }
     ]
    }
   ]
  },
  "inspectionDetails": {
   "updated": "2020-06-28T18:52:12.148Z",
   "inspectionData": [
    {
     "ADDRESS": "1767 SWANN ST NW, WASHINGTON, DC 20009",
     "UNIT": "",
     "SSL": "0152    0860",
     "ID": "M1501791",
     "G6_ACT_DES": "Mechanical Final",
     "G6_STATUS": "Disapproved",
     "G6_STATUS_DD": "7/15/2015 12:00:00 AM",
     "DESC_OF_WORK": "",
     "G6_STATUS_DD_NET": "2015/07/15",
     "OWNER_FULL_NAME": "LOGAN MARTHA",
     "APPLICANT": "NATHAN D. BOZARTH"
    },
    {
     "ADDRESS": "1767 SWANN ST NW, WASHINGTON, DC 20009",
     "UNIT": "",
     "SSL": "0152    0860",
     "ID": "M1501791",
     "G6_ACT_DES": "Mechanical Final",
     "G6_STATUS": "Rescheduled",
     "G6_STATUS_DD": "7/8/2015 12:00:00 AM",
     "DESC_OF_WORK": "",
     "G6_STATUS_DD_NET": "2015/07/08",
     "OWNER_FULL_NAME": "LOGAN MARTHA",
     "APPLICANT": "NATHAN D. BOZARTH"
    },
    {
     "ADDRESS": "1767 SWANN ST NW, WASHINGTON, DC -",
     "UNIT": "",
     "SSL": "0152    0860",
     "ID": "ECC67741",
     "G6_ACT_DES": "Final Construction",
     "G6_STATUS": "No Cause",
     "G6_STATUS_DD": "6/22/2004 12:00:00 AM",
     "DESC_OF_WORK": "",
     "G6_STATUS_DD_NET": "2004/06/22",
     "OWNER_FULL_NAME": "Martha  Logan",
     "APPLICANT": ""
    },
    {
     "ADDRESS": "1767 SWANN ST NW, WASHINGTON, DC -",
     "UNIT": "",
     "SSL": "0152    0860",
     "ID": "ECC61013",
     "G6_ACT_DES": "Other (see remarks) Zoning",
     "G6_STATUS": "No Cause",
     "G6_STATUS_DD": "5/3/2004 12:00:00 AM",
     "DESC_OF_WORK": "",
     "G6_STATUS_DD_NET": "2004/05/03",
     "OWNER_FULL_NAME": "",
     "APPLICANT": "N/A  N/A; N/A  N/A"
    },
    {
     "ADDRESS": "1767 SWANN ST NW, WASHINGTON, DC -",
     "UNIT": "",
     "SSL": "0152    0860",
     "ID": "ECC59588",
     "G6_ACT_DES": "Close-In Electrical",
     "G6_STATUS": "No Cause",
     "G6_STATUS_DD": "4/1/2004 12:00:00 AM",
     "DESC_OF_WORK": "",
     "G6_STATUS_DD_NET": "2004/04/01",
     "OWNER_FULL_NAME": "",
     "APPLICANT": "JERRY  COUCH; JERRY  COUCH"
    },
    {
     "ADDRESS": "1767 SWANN ST NW, WASHINGTON, DC -",
     "UNIT": "",
     "SSL": "0152    0860",
     "ID": "ECC59808",
     "G6_ACT_DES": "Close-in (concealment)-Walls Construction",
     "G6_STATUS": "No Cause",
     "G6_STATUS_DD": "3/31/2004 12:00:00 AM",
     "DESC_OF_WORK": "",
     "G6_STATUS_DD_NET": "2004/03/31",
     "OWNER_FULL_NAME": "MARTHA  LOGAN",
     "APPLICANT": ""
    },
    {
     "ADDRESS": "1767 SWANN ST NW, WASHINGTON, DC -",
     "UNIT": "",
     "SSL": "0152    0860",
     "ID": "ECC58310",
     "G6_ACT_DES": "Close-in (concealment)-Walls Plumbing",
     "G6_STATUS": "No Cause",
     "G6_STATUS_DD": "3/18/2004 12:00:00 AM",
     "DESC_OF_WORK": "",
     "G6_STATUS_DD_NET": "2004/03/18",
     "OWNER_FULL_NAME": "",
     "APPLICANT": "TONI  WILSON; TONI  WILSON"
    },
    {
     "ADDRESS": "1767 SWANN ST NW, WASHINGTON, DC -",
     "UNIT": "",
     "SSL": "0152    0860",
     "ID": "ECC58211",
     "G6_ACT_DES": "Close-in (concealment)-Walls Construction",
     "G6_STATUS": "No Cause",
     "G6_STATUS_DD": "3/15/2004 12:00:00 AM",
     "DESC_OF_WORK": "",
     "G6_STATUS_DD_NET": "2004/03/15",
     "OWNER_FULL_NAME": "MARTHA  LOGAN",
     "APPLICANT": ""
    },
    {
     "ADDRESS": "1767 SWANN ST NW, WASHINGTON, DC -",
     "UNIT": "",
     "SSL": "0152    0860",
     "ID": "ECC58746",
     "G6_ACT_DES": "Close-In Construction",
     "G6_STATUS": "Cause",
     "G6_STATUS_DD": "3/15/2004 12:00:00 AM",
     "DESC_OF_WORK": "",
     "G6_STATUS_DD_NET": "2004/03/15",
     "OWNER_FULL_NAME": "Martha  Logn",
     "APPLICANT": ""
    },
    {
     "ADDRESS": "1767 SWANN ST NW, WASHINGTON, DC -",
     "UNIT": "",
     "SSL": "0152    0860",
     "ID": "ECC56485",
     "G6_ACT_DES": "Close-In Electrical",
     "G6_STATUS": "Cause",
     "G6_STATUS_DD": "3/1/2004 12:00:00 AM",
     "DESC_OF_WORK": "",
     "G6_STATUS_DD_NET": "2004/03/01",
     "OWNER_FULL_NAME": "",
     "APPLICANT": "MARTHA  LOGAN; MARTHA  LOGAN"
    },
    {
     "ADDRESS": "1767 SWANN ST NW, WASHINGTON, DC -",
     "UNIT": "",
     "SSL": "0152    0860",
     "ID": "ECC47060",
     "G6_ACT_DES": "Close-in (concealment)-Walls Construction",
     "G6_STATUS": "Cause",
     "G6_STATUS_DD": "12/2/2003 12:00:00 AM",
     "DESC_OF_WORK": "",
     "G6_STATUS_DD_NET": "2003/12/02",
     "OWNER_FULL_NAME": "Martha  Logan",
     "APPLICANT": ""
    },
    {
     "ADDRESS": "1767 SWANN ST NW, WASHINGTON, DC -",
     "UNIT": "",
     "SSL": "0152    0860",
     "ID": "ECC45145",
     "G6_ACT_DES": "Other (see remarks) Electrical",
     "G6_STATUS": "No Cause",
     "G6_STATUS_DD": "11/6/2003 12:00:00 AM",
     "DESC_OF_WORK": "",
     "G6_STATUS_DD_NET": "2003/11/06",
     "OWNER_FULL_NAME": "",
     "APPLICANT": "MARTHA  LOGAN; MARTHA  LOGAN"
    },
    {
     "ADDRESS": "1767 SWANN ST NW, WASHINGTON, DC -",
     "UNIT": "",
     "SSL": "0152    0860",
     "ID": "ECC39306",
     "G6_ACT_DES": "POD Plumbing",
     "G6_STATUS": "No Cause",
     "G6_STATUS_DD": "9/9/2003 12:00:00 AM",
     "DESC_OF_WORK": "",
     "G6_STATUS_DD_NET": "2003/09/09",
     "OWNER_FULL_NAME": "Martha  Logan",
     "APPLICANT": ""
    },
    {
     "ADDRESS": "1767 SWANN ST NW, WASHINGTON, DC -",
     "UNIT": "",
     "SSL": "0152    0860",
     "ID": "ECC39308",
     "G6_ACT_DES": "POD Fire Protection",
     "G6_STATUS": "No Cause",
     "G6_STATUS_DD": "9/9/2003 12:00:00 AM",
     "DESC_OF_WORK": "",
     "G6_STATUS_DD_NET": "2003/09/09",
     "OWNER_FULL_NAME": "Martha  Logan",
     "APPLICANT": ""
    },
    {
     "ADDRESS": "1767 SWANN ST NW, WASHINGTON, DC -",
     "UNIT": "",
     "SSL": "0152    0860",
     "ID": "ECC39307",
     "G6_ACT_DES": "POD Electrical",
     "G6_STATUS": "Cause",
     "G6_STATUS_DD": "9/8/2003 12:00:00 AM",
     "DESC_OF_WORK": "",
     "G6_STATUS_DD_NET": "2003/09/08",
     "OWNER_FULL_NAME": "Martha  Logan",
     "APPLICANT": ""
    },
    {
     "ADDRESS": "1767 SWANN ST NW, WASHINGTON, DC -",
     "UNIT": "",
     "SSL": "0152    0860",
     "ID": "ECC39304",
     "G6_ACT_DES": "POD Construction",
     "G6_STATUS": "Cancelled",
     "G6_STATUS_DD": "9/4/2003 12:00:00 AM",
     "DESC_OF_WORK": "",
     "G6_STATUS_DD_NET": "2003/09/04",
     "OWNER_FULL_NAME": "Martha  Logan",
     "APPLICANT": ""
    },
    {
     "ADDRESS": "1767 SWANN ST NW, WASHINGTON, DC -",
     "UNIT": "",
     "SSL": "0152    0860",
     "ID": "ECC31345",
     "G6_ACT_DES": "Complaint Construction",
     "G6_STATUS": "Cause",
     "G6_STATUS_DD": "7/10/2003 12:00:00 AM",
     "DESC_OF_WORK": "",
     "G6_STATUS_DD_NET": "2003/07/10",
     "OWNER_FULL_NAME": "",
     "APPLICANT": "DEBRAE  ANONYMOUS; DEBRAE  ANONYMOUS"
    },
    {
     "ADDRESS": "1767 SWANN ST NW, WASHINGTON, DC -",
     "UNIT": "",
     "SSL": "0152    0860",
     "ID": "ECC29718",
     "G6_ACT_DES": "Zoning compliant form Zoning",
     "G6_STATUS": "No Cause",
     "G6_STATUS_DD": "6/17/2003 12:00:00 AM",
     "DESC_OF_WORK": "",
     "G6_STATUS_DD_NET": "2003/06/17",
     "OWNER_FULL_NAME": "",
     "APPLICANT": "ANONYMOUS  ANONYMOUS; ANONYMOUS  ANONYMOUS"
    },
    {
     "ADDRESS": "1767 SWANN ST NW, WASHINGTON, DC -",
     "UNIT": "",
     "SSL": "0152    0860",
     "ID": "ECC27625",
     "G6_ACT_DES": "Complaint Zoning",
     "G6_STATUS": "Cause",
     "G6_STATUS_DD": "5/22/2003 12:00:00 AM",
     "DESC_OF_WORK": "",
     "G6_STATUS_DD_NET": "2003/05/22",
     "OWNER_FULL_NAME": "",
     "APPLICANT": "ANONYMOUS  ANONYMOUS; ANONYMOUS  ANONYMOUS"
    },
    {
     "ADDRESS": "1767 SWANN ST NW, WASHINGTON, DC -",
     "UNIT": "",
     "SSL": "0152    0860",
     "ID": "ECC27304",
     "G6_ACT_DES": "Certificate of Occupancy Application Zoning",
     "G6_STATUS": "No Cause",
     "G6_STATUS_DD": "5/20/2003 12:00:00 AM",
     "DESC_OF_WORK": "",
     "G6_STATUS_DD_NET": "2003/05/20",
     "OWNER_FULL_NAME": "",
     "APPLICANT": "N/A  N/A; N/A  N/A"
    },
    {
     "ADDRESS": "1767 SWANN ST NW, WASHINGTON, DC -",
     "UNIT": "",
     "SSL": "0152    0860",
     "ID": "ECC26696",
     "G6_ACT_DES": "Other (see remarks) Plumbing",
     "G6_STATUS": "Cause",
     "G6_STATUS_DD": "5/16/2003 12:00:00 AM",
     "DESC_OF_WORK": "",
     "G6_STATUS_DD_NET": "2003/05/16",
     "OWNER_FULL_NAME": "",
     "APPLICANT": "DEBRA  CAMPOS; DEBRA  CAMPOS"
    },
    {
     "ADDRESS": "1767 SWANN ST NW, WASHINGTON, DC -",
     "UNIT": "",
     "SSL": "0152    0860",
     "ID": "ECC26563",
     "G6_ACT_DES": "Complaint Plumbing",
     "G6_STATUS": "Cause",
     "G6_STATUS_DD": "5/13/2003 12:00:00 AM",
     "DESC_OF_WORK": "",
     "G6_STATUS_DD_NET": "2003/05/13",
     "OWNER_FULL_NAME": "MARTHA  LOGAN",
     "APPLICANT": ""
    },
    {
     "ADDRESS": "1767 SWANN ST NW, WASHINGTON, DC -",
     "UNIT": "",
     "SSL": "0152    0860",
     "ID": "ECC23166",
     "G6_ACT_DES": "Final Electrical",
     "G6_STATUS": "No Cause",
     "G6_STATUS_DD": "4/16/2003 12:00:00 AM",
     "DESC_OF_WORK": "",
     "G6_STATUS_DD_NET": "2003/04/16",
     "OWNER_FULL_NAME": "",
     "APPLICANT": "JIM  CONNER; JIM  CONNER"
    },
    {
     "ADDRESS": "1767 SWANN ST NW, WASHINGTON, DC -",
     "UNIT": "",
     "SSL": "0152    0860",
     "ID": "ECC20184",
     "G6_ACT_DES": "POD Electrical",
     "G6_STATUS": "Cause",
     "G6_STATUS_DD": "3/20/2003 12:00:00 AM",
     "DESC_OF_WORK": "",
     "G6_STATUS_DD_NET": "2003/03/20",
     "OWNER_FULL_NAME": "Martha  Logon",
     "APPLICANT": ""
    },
    {
     "ADDRESS": "1767 SWANN ST NW, WASHINGTON, DC -",
     "UNIT": "",
     "SSL": "0152    0860",
     "ID": "ECC20286",
     "G6_ACT_DES": "POD (Pre-Occupancy Data) Construction",
     "G6_STATUS": "Cause",
     "G6_STATUS_DD": "3/20/2003 12:00:00 AM",
     "DESC_OF_WORK": "",
     "G6_STATUS_DD_NET": "2003/03/20",
     "OWNER_FULL_NAME": "",
     "APPLICANT": "MARY  LOGAN; MARY  LOGAN"
    },
    {
     "ADDRESS": "1767 SWANN ST NW, WASHINGTON, DC -",
     "UNIT": "",
     "SSL": "0152    0860",
     "ID": "ECC20182",
     "G6_ACT_DES": "Complaint Plumbing",
     "G6_STATUS": "Cause",
     "G6_STATUS_DD": "3/17/2003 12:00:00 AM",
     "DESC_OF_WORK": "",
     "G6_STATUS_DD_NET": "2003/03/17",
     "OWNER_FULL_NAME": "",
     "APPLICANT": "DEBRA  COMPOS; DEBRA  COMPOS"
    },
    {
     "ADDRESS": "1767 SWANN ST NW, WASHINGTON, DC -",
     "UNIT": "",
     "SSL": "0152    0860",
     "ID": "ECC19382",
     "G6_ACT_DES": "POD Plumbing",
     "G6_STATUS": "No Cause",
     "G6_STATUS_DD": "3/13/2003 12:00:00 AM",
     "DESC_OF_WORK": "",
     "G6_STATUS_DD_NET": "2003/03/13",
     "OWNER_FULL_NAME": "",
     "APPLICANT": "MARTHA  LOGAN; MARTHA  LOGAN"
    },
    {
     "ADDRESS": "1767 SWANN ST NW, WASHINGTON, DC -",
     "UNIT": "",
     "SSL": "0152    0860",
     "ID": "ECC18579",
     "G6_ACT_DES": "Complaint Electrical",
     "G6_STATUS": "Cause",
     "G6_STATUS_DD": "2/28/2003 12:00:00 AM",
     "DESC_OF_WORK": "",
     "G6_STATUS_DD_NET": "2003/02/28",
     "OWNER_FULL_NAME": "",
     "APPLICANT": "DEBORA  CAMPOS; DEBORA  CAMPOS"
    },
    {
     "ADDRESS": "1767 SWANN ST NW, WASHINGTON, DC -",
     "UNIT": "",
     "SSL": "0152    0860",
     "ID": "ECC16464",
     "G6_ACT_DES": "Complaint Electrical",
     "G6_STATUS": "No Cause",
     "G6_STATUS_DD": "2/4/2003 12:00:00 AM",
     "DESC_OF_WORK": "",
     "G6_STATUS_DD_NET": "2003/02/04",
     "OWNER_FULL_NAME": "",
     "APPLICANT": "ANONYMOUS  ANONYMOUS; ANONYMOUS  ANONYMOUS"
    },
    {
     "ADDRESS": "1767 SWANN ST NW, WASHINGTON, DC -",
     "UNIT": "",
     "SSL": "0152    0860",
     "ID": "ECC16469",
     "G6_ACT_DES": "Complaint Construction",
     "G6_STATUS": "No Cause",
     "G6_STATUS_DD": "1/31/2003 12:00:00 AM",
     "DESC_OF_WORK": "",
     "G6_STATUS_DD_NET": "2003/01/31",
     "OWNER_FULL_NAME": "",
     "APPLICANT": "DEBRA  CAMPOS; DEBRA  CAMPOS"
    },
    {
     "ADDRESS": "1767 SWANN ST NW, WASHINGTON, DC -",
     "UNIT": "",
     "SSL": "0152    0860",
     "ID": "ECC16470",
     "G6_ACT_DES": "Complaint Construction",
     "G6_STATUS": "No Cause",
     "G6_STATUS_DD": "1/31/2003 12:00:00 AM",
     "DESC_OF_WORK": "",
     "G6_STATUS_DD_NET": "2003/01/31",
     "OWNER_FULL_NAME": "",
     "APPLICANT": "DEBRA  CAMPOS; DEBRA  CAMPOS"
    },
    {
     "ADDRESS": "1767 SWANN ST NW, WASHINGTON, DC -",
     "UNIT": "",
     "SSL": "0152    0860",
     "ID": "ECC16089",
     "G6_ACT_DES": "Complaint Construction",
     "G6_STATUS": "No Cause",
     "G6_STATUS_DD": "1/29/2003 12:00:00 AM",
     "DESC_OF_WORK": "",
     "G6_STATUS_DD_NET": "2003/01/29",
     "OWNER_FULL_NAME": "",
     "APPLICANT": "DEBORAH  CAMPOS; DEBORAH  CAMPOS"
    },
    {
     "ADDRESS": "1767 SWANN ST NW, WASHINGTON, DC -",
     "UNIT": "",
     "SSL": "0152    0860",
     "ID": "ECC15241",
     "G6_ACT_DES": "Complaint Construction",
     "G6_STATUS": "No Cause",
     "G6_STATUS_DD": "1/17/2003 12:00:00 AM",
     "DESC_OF_WORK": "",
     "G6_STATUS_DD_NET": "2003/01/17",
     "OWNER_FULL_NAME": "",
     "APPLICANT": "MARTHA  LOGAN; MARTHA  LOGAN"
    },
    {
     "ADDRESS": "1767 SWANN ST NW, WASHINGTON, DC -",
     "UNIT": "",
     "SSL": "0152    0860",
     "ID": "ECC14936",
     "G6_ACT_DES": "Complaint Construction",
     "G6_STATUS": "Cause",
     "G6_STATUS_DD": "1/15/2003 12:00:00 AM",
     "DESC_OF_WORK": "",
     "G6_STATUS_DD_NET": "2003/01/15",
     "OWNER_FULL_NAME": "",
     "APPLICANT": "DEBRA  CAMPOS; DEBRA  CAMPOS"
    }
   ]
  },
  "occupancyDetails": {
   "updated": "2020-06-28T18:52:12.474Z",
   "occupancyData": [
    {
     "FULL_ADDRESS": "1767 SWANN ST NW, WASHINGTON, DC 20009-5536",
     "B1_UNIT_START": "",
     "SSL": "",
     "B1_ALT_ID": "CO78394",
     "TYPE": "Certificate of Occupancy",
     "G6_STAT_DD": "06/23/2004",
     "B1_APPL_STATUS": "Completed",
     "B1_APPL_STATUS_DATE": "          ",
     "DESC_OF_WORK": "",
     "G6_STAT_DD_NET": "2004/06/23",
     "B1_APPL_STATUS_DATE_NET": "",
     "OWNER_FULL_NAME": "LOGAN",
     "APPLICANT": ""
    }
   ]
  },
  "charDetails": {
   "updated": "2020-06-28T19:53:17.684Z",
   "charData": [
    {
     "PREMISEADD": "1767 SWANN ST NW",
     "SSL": "0152    0860",
     "BLDG_NUM": "1",
     "COMPLX_NUM": "",
     "UNITNUMBER": "",
     "NUM_UNITS": "0",
     "AYB": "1920",
     "STRUCT_CL_": "",
     "STYLE_D": "2 Story",
     "STRUCT_D": "Mult",
     "GBA": "2892",
     "EXTWALL_D": "Common Brick",
     "WALL_HGT": "",
     "ROOF_D": "Buil",
     "BATHRM": "3",
     "HF_BATHRM": "0",
     "HEAT_D": "Warm",
     "AC": "Y",
     "INTWALL_D": "Hardwood",
     "ROOMS": "10",
     "BEDRM": "4",
     "KITCHENS": "3",
     "FIREPLACES": "1",
     "YR_RMDL": "2004",
     "EYB": "1961",
     "STORIES": "2",
     "OWNERNAME": "LOGAN MARTHA",
     "OWNNAME2": "",
     "CAREOFNAME": ""
    }
   ]
  },
  "taxData": {
   "ssl": "0152    0860",
   "address": "1767 SWANN ST NW",
   "owner": "LOGAN MARTHA",
   "neighborhood": "OLD CITY II",
   "sub_neighborhood": "D",
   "use_code": "23",
   "sale_price": "$.00",
   "recordation_date": "N/A",
   "2016_Assessment": "$1,168,590.00"
  }
 },
 "1806 NEW HAMPSHIRE AVENUE NW": {
  "ownerInfo": {
   "updated": "2020-06-28T17:29:56.704Z",
   "ownerData": [
    {
     "OWNERNAME": "NATIONAL ASSOC NEGRO BUSINESS",
     "PREMISEADD": "1806 NEW HAMPSHIRE AVE NW",
     "UNITNUMBER": "",
     "SSL": "0152    0176",
     "USECODE": "042",
     "HSTDCODE": "",
     "CLASSTYPE": "",
     "TAXRATE": "0",
     "SALEPRICE": "",
     "SALEDATE": "",
     "INSTNO": "",
     "ACCEPTCODE": "",
     "DEEDDATE": "",
     "OWNNAME2": "",
     "CPMS_ADDRESS": "1806 NEW HAMPSHIRE AVE NW",
     "CAREOFNAME": "",
     "ADDRESS1": "1806 NEW HAMPSHIRE AVE NW",
     "ADDRESS2": "",
     "CITYSTZIP": "WASHINGTON                 DC 20009-3206",
     "SALEDATE_NET": "",
     "DEEDDATE_NET": ""
    }
   ]
  },
  "addressDetails": {
   "updated": "2020-06-28T18:11:27.104Z",
   "addressData": [
    {
     "ADDRESS_ID": "241552",
     "MARID": "241552",
     "STATUS": "ACTIVE",
     "FULLADDRESS": "1806 NEW HAMPSHIRE AVENUE NW",
     "ADDRNUM": "1806",
     "ADDRNUMSUFFIX": "",
     "STNAME": "NEW HAMPSHIRE",
     "STREET_TYPE": "AVENUE",
     "QUADRANT": "NW",
     "CITY": "WASHINGTON",
     "STATE": "DC",
     "XCOORD": "396590.22",
     "YCOORD": "138509",
     "SSL": "0152    0176",
     "ANC": "ANC 2B",
     "PSA": "Police Service Area 301",
     "WARD": "Ward 2",
     "NBHD_ACTION": " ",
     "CLUSTER_": "Cluster 6",
     "POLDIST": "Police District - Third District",
     "ROC": "Police Sector 3D3",
     "CENSUS_TRACT": "004201",
     "VOTE_PRCNCT": "Precinct 141",
     "SMD": "SMD 2B01",
     "ZIPCODE": "20009",
     "NATIONALGRID": "18S UJ 23192 09259",
     "ROADWAYSEGID": "12005",
     "FOCUS_IMPROVEMENT_AREA": "NA",
     "HAS_ALIAS": "N",
     "HAS_CONDO_UNIT": "N",
     "HAS_RES_UNIT": "N",
     "HAS_SSL": "Y",
     "LATITUDE": "38.91444039",
     "LONGITUDE": "-77.03931656",
     "STREETVIEWURL": "http://maps.google.com/maps?z=16&layer=c&cbll=38.91444039,-77.03931656&cbp=11,313.193325173771,,0,2.09",
     "RES_TYPE": "NON RESIDENTIAL",
     "WARD_2002": "Ward 2",
     "WARD_2012": "Ward 2",
     "ANC_2002": "ANC 2B",
     "ANC_2012": "ANC 2B",
     "SMD_2002": "SMD 2B01",
     "SMD_2012": "SMD 2B01",
     "IMAGEURL": "http://citizenatlas.dc.gov/mobilevideo",
     "IMAGEDIR": "20040803",
     "IMAGENAME": "Q3080740.jpg",
     "ConfidenceLevel": "100",
     "Zoning": "RA-2"
    }
   ]
  },
  "licenseDetails": {
   "updated": "2020-06-28T18:35:26.872Z",
   "licenseData": [
    {
     "ADDRESS": "1806  NEW HAMPSHIRE AVE NW",
     "UNIT": "",
     "SSL": "0152    0176",
     "CUST_NUM": "65000827",
     "DECRIPTION": "General Business",
     "ENDORSEMENT_DESC": "Charitable Solicitation",
     "LAST_NAME": "",
     "FIRST_NAME": "",
     "CORP_NAME": "NATIONAL ASSOCIATION OF NEGRO BUSINESS AND PROFESSIONAL",
     "TRADE_NAME": "",
     "BEGIN_RENEWAL": "Feb  1 2019 12:00AM",
     "END_RENEWAL": "Jan 31 2021 12:00AM",
     "STATUS": "Active",
     "BEGIN_RENEWAL_NET": "2019/02/01",
     "END_RENEWAL_NET": "2021/01/31"
    }
   ]
  },
  "permitDetails": {
   "updated": "2020-06-28T18:52:24.435Z",
   "permitData": [
    {
     "FULL_ADDRESS": "1806 NEW HAMPSHIRE AVE NW, WASHINGTON, DC 20009",
     "B1_UNIT_START": "",
     "SSL": "0152    0176",
     "B1_ALT_ID": "E1800724",
     "TYPE": "Supplemental/Electrical",
     "G6_STAT_DD": "Oct 23 2017 12:00AM",
     "B1_APPL_STATUS": "Permit Issued",
     "B1_APPL_STATUS_DATE": "10/23/2017",
     "DESC_OF_WORK": "",
     "SORT_DATE": null,
     "G6_STAT_DD_NET": "2017/10/23",
     "B1_APPL_STATUS_DATE_NET": "2017/10/23",
     "JOB_CLASS_CODE": "N/A",
     "JOB_SIZE": "N/A",
     "JOB_CLASSIFICATION": "N/A",
     "JOB_REVIEW_TIME": "N/A",
     "OWNER_NAME": "NATIONAL ASSOC NEGRO BUSINESS",
     "OWNER_FULL_NAME": "NATIONAL ASSOC NEGRO BUSINESS",
     "APPLICANT_NAME": "CARL J. SMITH",
     "TRADE_NAME": "",
     "PERMIT_STATUS": [
      {
       "REVIEW_STATUS": "",
       "DISCIPLINE": "",
       "REVIEW_STATUS_DATE": ""
      }
     ]
    },
    {
     "FULL_ADDRESS": "1806 NEW HAMPSHIRE AVE NW, WASHINGTON, DC 20009",
     "B1_UNIT_START": "",
     "SSL": "0152    0176",
     "B1_ALT_ID": "E68039232",
     "TYPE": "Supplemental/Electrical",
     "G6_STAT_DD": "Jul 27 2016  1:02AM",
     "B1_APPL_STATUS": "Permit Issued",
     "B1_APPL_STATUS_DATE": "07/27/2016",
     "DESC_OF_WORK": "This supplemental permit was issued online. Use the Online Permit View application on DCRA Intranet to view the details and print a copy of the permit. Alternatively, you can copy and paste the following URL into an internet browser.\nhttps://ospi.dcra.dc.gov/ospi/PrintPermit.aspx?param=zI8IgGJEIld%2",
     "SORT_DATE": null,
     "G6_STAT_DD_NET": "2016/07/27",
     "B1_APPL_STATUS_DATE_NET": "2016/07/27",
     "JOB_CLASS_CODE": "N/A",
     "JOB_SIZE": "N/A",
     "JOB_CLASSIFICATION": "N/A",
     "JOB_REVIEW_TIME": "N/A",
     "OWNER_NAME": "NA  NA",
     "OWNER_FULL_NAME": "NA  NA",
     "APPLICANT_NAME": "MATTHEW  LAUSCH; NA  NA; CARL  SMITH",
     "TRADE_NAME": "",
     "PERMIT_STATUS": [
      {
       "REVIEW_STATUS": "",
       "DISCIPLINE": "",
       "REVIEW_STATUS_DATE": ""
      }
     ]
    }
   ]
  },
  "inspectionDetails": {
   "updated": "2020-06-28T18:52:24.742Z",
   "inspectionData": []
  },
  "occupancyDetails": {
   "updated": "2020-06-28T18:52:24.910Z",
   "occupancyData": [
    {
     "FULL_ADDRESS": "1806 NEW HAMPSHIRE AVE NW, WASHINGTON, DC 20009",
     "B1_UNIT_START": "",
     "SSL": "0152    0176",
     "B1_ALT_ID": "CO0902632",
     "TYPE": "Certificate of Occupancy",
     "G6_STAT_DD": "",
     "B1_APPL_STATUS": "Application Accepted",
     "B1_APPL_STATUS_DATE": "06/26/2009",
     "DESC_OF_WORK": "Use Changenational headquarters",
     "G6_STAT_DD_NET": "",
     "B1_APPL_STATUS_DATE_NET": "2009/06/26",
     "OWNER_FULL_NAME": "NATIONAL ASSOC NEGRO BUSINESS",
     "APPLICANT": ""
    }
   ]
  },
  "charDetails": {
   "updated": "2020-06-28T19:53:20.617Z",
   "charData": [
    {
     "PREMISEADD": "1806 NEW HAMPSHIRE AVE NW",
     "SSL": "0152    0176",
     "BLDG_NUM": "1",
     "COMPLX_NUM": "",
     "UNITNUMBER": "",
     "NUM_UNITS": "",
     "AYB": "1910",
     "STRUCT_CL_": "Brick/Concr",
     "STYLE_D": "",
     "STRUCT_D": "",
     "GBA": "4587",
     "EXTWALL_D": "Brick",
     "WALL_HGT": "9.00",
     "ROOF_D": "",
     "BATHRM": "",
     "HF_BATHRM": "",
     "HEAT_D": "",
     "AC": "",
     "INTWALL_D": "",
     "ROOMS": "",
     "BEDRM": "",
     "KITCHENS": "",
     "FIREPLACES": "",
     "YR_RMDL": "1982",
     "EYB": "1992",
     "STORIES": "",
     "OWNERNAME": "NATIONAL ASSOC NEGRO BUSINESS",
     "OWNNAME2": "",
     "CAREOFNAME": ""
    }
   ]
  },
  "taxData": {
   "ssl": "0152    0176",
   "address": "1806 NEW HAMPSHIRE AVE NW",
   "owner": "NATIONAL ASSOC NEGRO BUSINESS",
   "neighborhood": "OLD CITY II",
   "sub_neighborhood": "D",
   "use_code": "51",
   "sale_price": "$.00",
   "recordation_date": "N/A",
   "2016_Assessment": "$1,255,790.00"
  }
 },
 "1811 18TH STREET NW": {
  "ownerInfo": {
   "updated": "2020-06-28T17:29:57.175Z",
   "ownerData": [
    {
     "OWNERNAME": "SCHWARTZ ROBERT & BRAVERMAN BURT",
     "PREMISEADD": "1809 - 1811 18TH ST NW",
     "UNITNUMBER": "",
     "SSL": "0152    0194",
     "USECODE": "049",
     "HSTDCODE": "",
     "CLASSTYPE": "",
     "TAXRATE": "0",
     "SALEPRICE": "",
     "SALEDATE": "",
     "INSTNO": "",
     "ACCEPTCODE": "",
     "DEEDDATE": "",
     "OWNNAME2": "",
     "CPMS_ADDRESS": "1809-1811 18TH ST NW",
     "CAREOFNAME": "LONGFORD MGMT",
     "ADDRESS1": "PO BOX 4538",
     "ADDRESS2": "",
     "CITYSTZIP": "WASHINGTON                 DC 20017-0538",
     "SALEDATE_NET": "",
     "DEEDDATE_NET": ""
    }
   ]
  },
  "addressDetails": {
   "updated": "2020-06-28T18:11:27.671Z",
   "addressData": [
    {
     "ADDRESS_ID": "308114",
     "MARID": "308114",
     "STATUS": "ACTIVE",
     "FULLADDRESS": "1811 18TH STREET NW",
     "ADDRNUM": "1811",
     "ADDRNUMSUFFIX": "",
     "STNAME": "18TH",
     "STREET_TYPE": "STREET",
     "QUADRANT": "NW",
     "CITY": "WASHINGTON",
     "STATE": "DC",
     "XCOORD": "396406.52",
     "YCOORD": "138523.58",
     "SSL": "0152    0194",
     "ANC": "ANC 2B",
     "PSA": "Police Service Area 301",
     "WARD": "Ward 2",
     "NBHD_ACTION": " ",
     "CLUSTER_": "Cluster 6",
     "POLDIST": "Police District - Third District",
     "ROC": "Police Sector 3D3",
     "CENSUS_TRACT": "004201",
     "VOTE_PRCNCT": "Precinct 141",
     "SMD": "SMD 2B01",
     "ZIPCODE": "20009",
     "NATIONALGRID": "18S UJ 23008 09278",
     "ROADWAYSEGID": "15958",
     "FOCUS_IMPROVEMENT_AREA": "NA",
     "HAS_ALIAS": "N",
     "HAS_CONDO_UNIT": "N",
     "HAS_RES_UNIT": "Y",
     "HAS_SSL": "Y",
     "LATITUDE": "38.914571",
     "LONGITUDE": "-77.04143480",
     "STREETVIEWURL": "",
     "RES_TYPE": "RESIDENTIAL",
     "WARD_2002": "Ward 2",
     "WARD_2012": "Ward 2",
     "ANC_2002": "ANC 2B",
     "ANC_2012": "ANC 2B",
     "SMD_2002": "SMD 2B01",
     "SMD_2012": "SMD 2B01",
     "IMAGEURL": "http://citizenatlas.dc.gov/mobilevideo",
     "IMAGEDIR": "NO_IMAGE",
     "IMAGENAME": "No_Image_Available.JPG",
     "ConfidenceLevel": "100",
     "Zoning": "MU-4"
    }
   ]
  },
  "licenseDetails": {
   "updated": "2020-06-28T18:35:28.379Z",
   "licenseData": [
    {
     "ADDRESS": "1811  18TH ST NW",
     "UNIT": "",
     "SSL": "0152    0194",
     "CUST_NUM": "50001420",
     "DECRIPTION": "Housing: Residential",
     "ENDORSEMENT_DESC": "Apartment",
     "LAST_NAME": "SCHWARTZ",
     "FIRST_NAME": "ROBERT",
     "CORP_NAME": "",
     "TRADE_NAME": "",
     "BEGIN_RENEWAL": "Nov  1 2017 12:00AM",
     "END_RENEWAL": "Oct 31 2019 12:00AM",
     "STATUS": "Cancelled",
     "BEGIN_RENEWAL_NET": "2017/11/01",
     "END_RENEWAL_NET": "2019/10/31"
    },
    {
     "ADDRESS": "1811  18TH ST NW",
     "UNIT": "",
     "SSL": "0152    0194",
     "CUST_NUM": "500120000096",
     "DECRIPTION": "Housing: Residential",
     "ENDORSEMENT_DESC": "Apartment",
     "LAST_NAME": "SCHWARTZ",
     "FIRST_NAME": "ROBERT",
     "CORP_NAME": "",
     "TRADE_NAME": "",
     "BEGIN_RENEWAL": "Nov  1 2019 12:00AM",
     "END_RENEWAL": "Oct 31 2021 12:00AM",
     "STATUS": "Active",
     "BEGIN_RENEWAL_NET": "2019/11/01",
     "END_RENEWAL_NET": "2021/10/31"
    },
    {
     "ADDRESS": "1811  18TH ST NW",
     "UNIT": "",
     "SSL": "0152    0194",
     "CUST_NUM": "920214000014",
     "DECRIPTION": "Public Health Public Accomm",
     "ENDORSEMENT_DESC": "Beauty Shop",
     "LAST_NAME": "",
     "FIRST_NAME": "",
     "CORP_NAME": "B&C HAIR STYLE LLC.",
     "TRADE_NAME": "",
     "BEGIN_RENEWAL": "May  1 2020 12:00AM",
     "END_RENEWAL": "Apr 30 2022 12:00AM",
     "STATUS": "Active",
     "BEGIN_RENEWAL_NET": "2020/05/01",
     "END_RENEWAL_NET": "2022/04/30"
    },
    {
     "ADDRESS": "1811  18TH ST NW",
     "UNIT": "12",
     "SSL": "0152    0194",
     "CUST_NUM": "400318000049",
     "DECRIPTION": "General Business",
     "ENDORSEMENT_DESC": "General Business Licenses",
     "LAST_NAME": "KAB SON",
     "FIRST_NAME": "SOON MEE &",
     "CORP_NAME": "",
     "TRADE_NAME": "WORLD CLEANER",
     "BEGIN_RENEWAL": "Oct  1 2017 12:00AM",
     "END_RENEWAL": "Sep 30 2019 12:00AM",
     "STATUS": "Expired",
     "BEGIN_RENEWAL_NET": "2017/10/01",
     "END_RENEWAL_NET": "2019/09/30"
    },
    {
     "ADDRESS": "1811  18TH ST NW",
     "UNIT": "B",
     "SSL": "0152    0194",
     "CUST_NUM": "66003641",
     "DECRIPTION": "Public Health Public Accomm",
     "ENDORSEMENT_DESC": "Beauty Shop",
     "LAST_NAME": "",
     "FIRST_NAME": "",
     "CORP_NAME": "SALON LOULE, INC ",
     "TRADE_NAME": "",
     "BEGIN_RENEWAL": "Jun  1 2006 12:00AM",
     "END_RENEWAL": "May 31 2008 12:00AM",
     "STATUS": "Expired",
     "BEGIN_RENEWAL_NET": "2006/06/01",
     "END_RENEWAL_NET": "2008/05/31"
    },
    {
     "ADDRESS": "1811  18TH ST NW",
     "UNIT": "SUITE 22",
     "SSL": "0152    0194",
     "CUST_NUM": "39706925",
     "DECRIPTION": "Public Health Food Establish",
     "ENDORSEMENT_DESC": "Delicatessen",
     "LAST_NAME": "",
     "FIRST_NAME": "",
     "CORP_NAME": "JULIETTES MACROB",
     "TRADE_NAME": "",
     "BEGIN_RENEWAL": "",
     "END_RENEWAL": "",
     "STATUS": "Cancelled",
     "BEGIN_RENEWAL_NET": "",
     "END_RENEWAL_NET": ""
    }
   ]
  },
  "permitDetails": {
   "updated": "2020-06-28T18:52:27.317Z",
   "permitData": [
    {
     "FULL_ADDRESS": "1811 18TH ST NW, WASHINGTON, DC",
     "B1_UNIT_START": "",
     "SSL": "",
     "B1_ALT_ID": "B87040",
     "TYPE": "Construction/Alteration and Repair",
     "G6_STAT_DD": "Feb 14 2006 10:48AM",
     "B1_APPL_STATUS": "Permit Issued",
     "B1_APPL_STATUS_DATE": "02/14/2006",
     "DESC_OF_WORK": "USE CHANGE / CONVERT EXISTING USE FROM OFFICE SPACE RETAIL TO HAIR AND NAIL SALON AS PER PLAN ON 1ST FL..  INTERIOR WORK ONLY..",
     "SORT_DATE": null,
     "G6_STAT_DD_NET": "2006/02/14",
     "B1_APPL_STATUS_DATE_NET": "2006/02/14",
     "JOB_CLASS_CODE": "E",
     "JOB_SIZE": "N/A",
     "JOB_CLASSIFICATION": "N/A",
     "JOB_REVIEW_TIME": "N/A",
     "OWNER_NAME": "ROBERT SWARTZ",
     "OWNER_FULL_NAME": "ROBERT SWARTZ",
     "APPLICANT_NAME": "ROSINDA  GUEIREIRO",
     "TRADE_NAME": "",
     "PERMIT_STATUS": [
      {
       "REVIEW_STATUS": "APP",
       "DISCIPLINE": "Elec",
       "REVIEW_STATUS_DATE": "02/14/2006"
      },
      {
       "REVIEW_STATUS": "APP",
       "DISCIPLINE": "Fire",
       "REVIEW_STATUS_DATE": "02/09/2006"
      },
      {
       "REVIEW_STATUS": "APP",
       "DISCIPLINE": "Historic",
       "REVIEW_STATUS_DATE": "02/14/2006"
      },
      {
       "REVIEW_STATUS": "APP",
       "DISCIPLINE": "Mech",
       "REVIEW_STATUS_DATE": "02/09/2006"
      },
      {
       "REVIEW_STATUS": "APP",
       "DISCIPLINE": "Struc",
       "REVIEW_STATUS_DATE": "02/14/2006"
      },
      {
       "REVIEW_STATUS": "APP",
       "DISCIPLINE": "Zoning",
       "REVIEW_STATUS_DATE": "01/20/2006"
      },
      {
       "REVIEW_STATUS": "APP",
       "DISCIPLINE": "Zoning",
       "REVIEW_STATUS_DATE": "02/09/2006"
      },
      {
       "REVIEW_STATUS": "Application Accepted",
       "DISCIPLINE": "Plan Review Coordinator",
       "REVIEW_STATUS_DATE": "07/12/2008"
      },
      {
       "REVIEW_STATUS": "Comments Submitted to the Applicant for Correction",
       "DISCIPLINE": "Elec Review Pending",
       "REVIEW_STATUS_DATE": "12/08/2005"
      },
      {
       "REVIEW_STATUS": "Comments Submitted to the Applicant for Correction",
       "DISCIPLINE": "Fire Review Pending",
       "REVIEW_STATUS_DATE": "12/02/2005"
      },
      {
       "REVIEW_STATUS": "Comments Submitted to the Applicant for Correction",
       "DISCIPLINE": "Mech Review Pending",
       "REVIEW_STATUS_DATE": "12/08/2005"
      },
      {
       "REVIEW_STATUS": "Comments Submitted to the Applicant for Correction",
       "DISCIPLINE": "Mech Review Pending",
       "REVIEW_STATUS_DATE": "12/14/2005"
      },
      {
       "REVIEW_STATUS": "Comments Submitted to the Applicant for Correction",
       "DISCIPLINE": "Struc Review Pending",
       "REVIEW_STATUS_DATE": "01/20/2006"
      },
      {
       "REVIEW_STATUS": "Electrical Review Approved",
       "DISCIPLINE": "Electrical Review",
       "REVIEW_STATUS_DATE": "07/12/2008"
      },
      {
       "REVIEW_STATUS": "Fire Review Approved",
       "DISCIPLINE": "Fire Review",
       "REVIEW_STATUS_DATE": "07/12/2008"
      },
      {
       "REVIEW_STATUS": "HPRB Review Approved",
       "DISCIPLINE": "HPRB Review",
       "REVIEW_STATUS_DATE": "07/12/2008"
      },
      {
       "REVIEW_STATUS": "In-Process",
       "DISCIPLINE": "BZA Review",
       "REVIEW_STATUS_DATE": ""
      },
      {
       "REVIEW_STATUS": "In-Process",
       "DISCIPLINE": "CFA Review",
       "REVIEW_STATUS_DATE": ""
      },
      {
       "REVIEW_STATUS": "In-Process",
       "DISCIPLINE": "Chinatown Review",
       "REVIEW_STATUS_DATE": ""
      },
      {
       "REVIEW_STATUS": "In-Process",
       "DISCIPLINE": "DDOE Review",
       "REVIEW_STATUS_DATE": ""
      },
      {
       "REVIEW_STATUS": "In-Process",
       "DISCIPLINE": "DDOT Review (Public Space)",
       "REVIEW_STATUS_DATE": ""
      },
      {
       "REVIEW_STATUS": "In-Process",
       "DISCIPLINE": "DOH Review",
       "REVIEW_STATUS_DATE": ""
      },
      {
       "REVIEW_STATUS": "In-Process",
       "DISCIPLINE": "EISF Review",
       "REVIEW_STATUS_DATE": ""
      },
      {
       "REVIEW_STATUS": "In-Process",
       "DISCIPLINE": "Elevator Review",
       "REVIEW_STATUS_DATE": ""
      },
      {
       "REVIEW_STATUS": "In-Process",
       "DISCIPLINE": "File Room",
       "REVIEW_STATUS_DATE": ""
      },
      {
       "REVIEW_STATUS": "In-Process",
       "DISCIPLINE": "Management Review",
       "REVIEW_STATUS_DATE": ""
      },
      {
       "REVIEW_STATUS": "In-Process",
       "DISCIPLINE": "NCPC Review",
       "REVIEW_STATUS_DATE": ""
      },
      {
       "REVIEW_STATUS": "In-Process",
       "DISCIPLINE": "WASA Review",
       "REVIEW_STATUS_DATE": ""
      },
      {
       "REVIEW_STATUS": "In-Process",
       "DISCIPLINE": "White House Review",
       "REVIEW_STATUS_DATE": ""
      },
      {
       "REVIEW_STATUS": "In-Process",
       "DISCIPLINE": "WMATA Review",
       "REVIEW_STATUS_DATE": ""
      },
      {
       "REVIEW_STATUS": "In-Process",
       "DISCIPLINE": "Zoning Overlay/PUD Review",
       "REVIEW_STATUS_DATE": ""
      },
      {
       "REVIEW_STATUS": "Mechanical Review Approved",
       "DISCIPLINE": "Mechanical and Plumbing Review",
       "REVIEW_STATUS_DATE": "07/12/2008"
      },
      {
       "REVIEW_STATUS": "PEN",
       "DISCIPLINE": "Elec",
       "REVIEW_STATUS_DATE": "11/29/2005"
      },
      {
       "REVIEW_STATUS": "PEN",
       "DISCIPLINE": "Fire",
       "REVIEW_STATUS_DATE": "11/29/2005"
      },
      {
       "REVIEW_STATUS": "PEN",
       "DISCIPLINE": "Historic",
       "REVIEW_STATUS_DATE": "11/29/2005"
      },
      {
       "REVIEW_STATUS": "PEN",
       "DISCIPLINE": "Mech",
       "REVIEW_STATUS_DATE": "11/29/2005"
      },
      {
       "REVIEW_STATUS": "PEN",
       "DISCIPLINE": "Struc",
       "REVIEW_STATUS_DATE": "11/29/2005"
      },
      {
       "REVIEW_STATUS": "PEN",
       "DISCIPLINE": "Zoning",
       "REVIEW_STATUS_DATE": "11/29/2005"
      },
      {
       "REVIEW_STATUS": "Permit Issued",
       "DISCIPLINE": "Issue Permit",
       "REVIEW_STATUS_DATE": "07/12/2008"
      },
      {
       "REVIEW_STATUS": "Structural Review Approved",
       "DISCIPLINE": "Structural Review",
       "REVIEW_STATUS_DATE": "07/12/2008"
      },
      {
       "REVIEW_STATUS": "Zoning Review Approved",
       "DISCIPLINE": "Zoning Review",
       "REVIEW_STATUS_DATE": "07/12/2008"
      }
     ]
    },
    {
     "FULL_ADDRESS": "1811 18TH ST NW, WASHINGTON, DC 20002-",
     "B1_UNIT_START": "",
     "SSL": "",
     "B1_ALT_ID": "E115572",
     "TYPE": "Supplemental/Electrical",
     "G6_STAT_DD": "Mar 16 2006  1:50PM",
     "B1_APPL_STATUS": "Permit Issued",
     "B1_APPL_STATUS_DATE": "          ",
     "DESC_OF_WORK": "",
     "SORT_DATE": null,
     "G6_STAT_DD_NET": "2006/03/16",
     "B1_APPL_STATUS_DATE_NET": "",
     "JOB_CLASS_CODE": "N/A",
     "JOB_SIZE": "N/A",
     "JOB_CLASSIFICATION": "N/A",
     "JOB_REVIEW_TIME": "N/A",
     "OWNER_NAME": "ROBERT SWARTZ",
     "OWNER_FULL_NAME": "ROBERT SWARTZ",
     "APPLICANT_NAME": "",
     "TRADE_NAME": "",
     "PERMIT_STATUS": [
      {
       "REVIEW_STATUS": "",
       "DISCIPLINE": "",
       "REVIEW_STATUS_DATE": ""
      }
     ]
    },
    {
     "FULL_ADDRESS": "1811 18TH ST NW, WASHINGTON, DC 20002-",
     "B1_UNIT_START": "",
     "SSL": "",
     "B1_ALT_ID": "P117878",
     "TYPE": "Supplemental/Plumbing and Gas",
     "G6_STAT_DD": "Apr 14 2006  3:24PM",
     "B1_APPL_STATUS": "Permit Issued",
     "B1_APPL_STATUS_DATE": "          ",
     "DESC_OF_WORK": "",
     "SORT_DATE": null,
     "G6_STAT_DD_NET": "2006/04/14",
     "B1_APPL_STATUS_DATE_NET": "",
     "JOB_CLASS_CODE": "N/A",
     "JOB_SIZE": "N/A",
     "JOB_CLASSIFICATION": "N/A",
     "JOB_REVIEW_TIME": "N/A",
     "OWNER_NAME": "ROBERT SWARTZ",
     "OWNER_FULL_NAME": "ROBERT SWARTZ",
     "APPLICANT_NAME": "",
     "TRADE_NAME": "",
     "PERMIT_STATUS": [
      {
       "REVIEW_STATUS": "",
       "DISCIPLINE": "",
       "REVIEW_STATUS_DATE": ""
      }
     ]
    }
   ]
  },
  "inspectionDetails": {
   "updated": "2020-06-28T18:52:27.550Z",
   "inspectionData": [
    {
     "ADDRESS": "1811 18TH ST NW, WASHINGTON, DC 20009",
     "UNIT": "",
     "SSL": "0152    0194",
     "ID": "CO1103049",
     "G6_ACT_DES": "Zoning Use",
     "G6_STATUS": "Approved",
     "G6_STATUS_DD": "9/7/2011 12:00:00 AM",
     "DESC_OF_WORK": "DRY CLEANER, PICK-UP STORE",
     "G6_STATUS_DD_NET": "2011/09/07",
     "OWNER_FULL_NAME": "SCHWARTZ ROBERT & BRAVERMAN BURT",
     "APPLICANT": "3838 INTERNATIONAL CORPORATION"
    },
    {
     "ADDRESS": "1811 18TH ST NW -",
     "UNIT": "",
     "SSL": "",
     "ID": "ECC138986",
     "G6_ACT_DES": "Final Fire Protection",
     "G6_STATUS": "Cause",
     "G6_STATUS_DD": "5/3/2006 12:00:00 AM",
     "DESC_OF_WORK": "",
     "G6_STATUS_DD_NET": "2006/05/03",
     "OWNER_FULL_NAME": "",
     "APPLICANT": "ROSIDA  GUERREIOR; ROSIDA  GUERREIOR"
    },
    {
     "ADDRESS": "1811 18TH ST NW -",
     "UNIT": "",
     "SSL": "",
     "ID": "ECC138454",
     "G6_ACT_DES": "Final Construction",
     "G6_STATUS": "No Cause",
     "G6_STATUS_DD": "5/1/2006 12:00:00 AM",
     "DESC_OF_WORK": "",
     "G6_STATUS_DD_NET": "2006/05/01",
     "OWNER_FULL_NAME": "",
     "APPLICANT": "ROSINDA  GUERRIOU; ROSINDA  GUERRIOU"
    },
    {
     "ADDRESS": "1811 18TH ST NW -",
     "UNIT": "",
     "SSL": "",
     "ID": "ECC136981",
     "G6_ACT_DES": "Other (see remarks) Plumbing",
     "G6_STATUS": "No Cause",
     "G6_STATUS_DD": "4/25/2006 12:00:00 AM",
     "DESC_OF_WORK": "",
     "G6_STATUS_DD_NET": "2006/04/25",
     "OWNER_FULL_NAME": "",
     "APPLICANT": "PERCY  JACKSON; PERCY  JACKSON"
    },
    {
     "ADDRESS": "1811 18TH ST NW -",
     "UNIT": "",
     "SSL": "",
     "ID": "ECC132814",
     "G6_ACT_DES": "Close-In Electrical",
     "G6_STATUS": "No Cause",
     "G6_STATUS_DD": "3/23/2006 12:00:00 AM",
     "DESC_OF_WORK": "",
     "G6_STATUS_DD_NET": "2006/03/23",
     "OWNER_FULL_NAME": "",
     "APPLICANT": "TONY  CAMPBELL; TONY  CAMPBELL"
    },
    {
     "ADDRESS": "1811 18TH ST NW -",
     "UNIT": "",
     "SSL": "",
     "ID": "ECC95792",
     "G6_ACT_DES": "Other (see remarks) Boiler",
     "G6_STATUS": "No Cause",
     "G6_STATUS_DD": "3/4/2005 12:00:00 AM",
     "DESC_OF_WORK": "",
     "G6_STATUS_DD_NET": "2005/03/04",
     "OWNER_FULL_NAME": "",
     "APPLICANT": "N/A  N/A; N/A  N/A"
    }
   ]
  },
  "occupancyDetails": {
   "updated": "2020-06-28T18:52:27.795Z",
   "occupancyData": [
    {
     "FULL_ADDRESS": "1811 18TH ST NW, WASHINGTON, DC 20009",
     "B1_UNIT_START": "",
     "SSL": "0152    0194",
     "B1_ALT_ID": "CO1103049",
     "TYPE": "Certificate of Occupancy",
     "G6_STAT_DD": "09/08/2011",
     "B1_APPL_STATUS": "Completed",
     "B1_APPL_STATUS_DATE": "09/08/2011",
     "DESC_OF_WORK": "Ownership ChangeDRY CLEANER, PICK-UP STORE",
     "G6_STAT_DD_NET": "2011/09/08",
     "B1_APPL_STATUS_DATE_NET": "2011/09/08",
     "OWNER_FULL_NAME": "SCHWARTZ ROBERT & BRAVERMAN BURT",
     "APPLICANT": "3838 INTERNATIONAL CORPORATION"
    },
    {
     "FULL_ADDRESS": "1811 18TH ST NW, WASHINGTON, DC 20002-",
     "B1_UNIT_START": "",
     "SSL": "",
     "B1_ALT_ID": "CO119042",
     "TYPE": "Certificate of Occupancy",
     "G6_STAT_DD": "05/03/2006",
     "B1_APPL_STATUS": "Completed",
     "B1_APPL_STATUS_DATE": "          ",
     "DESC_OF_WORK": "",
     "G6_STAT_DD_NET": "2006/05/03",
     "B1_APPL_STATUS_DATE_NET": "",
     "OWNER_FULL_NAME": "ROBERT SWARTZ",
     "APPLICANT": ""
    },
    {
     "FULL_ADDRESS": "1811 18TH ST NW, WASHINGTON, DC 20009",
     "B1_UNIT_START": "",
     "SSL": "0152    0194",
     "B1_ALT_ID": "CO1400755",
     "TYPE": "Certificate of Occupancy",
     "G6_STAT_DD": "12/19/2013",
     "B1_APPL_STATUS": "Completed",
     "B1_APPL_STATUS_DATE": "12/19/2013",
     "DESC_OF_WORK": "Ownership ChangeBEAUTY SALON (UNISEX)",
     "G6_STAT_DD_NET": "2013/12/19",
     "B1_APPL_STATUS_DATE_NET": "2013/12/19",
     "OWNER_FULL_NAME": "SCHWARTZ ROBERT & BRAVERMAN BURT",
     "APPLICANT": ""
    },
    {
     "FULL_ADDRESS": "1811 18TH ST NW, WASHINGTON, DC 20009",
     "B1_UNIT_START": "",
     "SSL": "0152    0194",
     "B1_ALT_ID": "CO1401478",
     "TYPE": "Certificate of Occupancy",
     "G6_STAT_DD": "03/19/2014",
     "B1_APPL_STATUS": "Completed",
     "B1_APPL_STATUS_DATE": "03/19/2014",
     "DESC_OF_WORK": "RevisedHAIR SALON",
     "G6_STAT_DD_NET": "2014/03/19",
     "B1_APPL_STATUS_DATE_NET": "2014/03/19",
     "OWNER_FULL_NAME": "SCHWARTZ ROBERT & BRAVERMAN BURT",
     "APPLICANT": ""
    },
    {
     "FULL_ADDRESS": "1811 18TH ST NW, WASHINGTON, DC 20009",
     "B1_UNIT_START": "",
     "SSL": "0152    0194",
     "B1_ALT_ID": "CO1703846",
     "TYPE": "Certificate of Occupancy",
     "G6_STAT_DD": "10/06/2017",
     "B1_APPL_STATUS": "Completed",
     "B1_APPL_STATUS_DATE": "10/06/2017",
     "DESC_OF_WORK": "Ownership ChangeDRY CLEANER, PICK-UP STORE",
     "G6_STAT_DD_NET": "2017/10/06",
     "B1_APPL_STATUS_DATE_NET": "2017/10/06",
     "OWNER_FULL_NAME": "SCHWARTZ ROBERT & BRAVERMAN BURT",
     "APPLICANT": ""
    }
   ]
  },
  "charDetails": {
   "updated": "2020-06-28T19:53:21.084Z",
   "charData": [
    {
     "PREMISEADD": "1809 - 1811 18TH ST NW",
     "SSL": "0152    0194",
     "BLDG_NUM": "1",
     "COMPLX_NUM": "",
     "UNITNUMBER": "",
     "NUM_UNITS": "",
     "AYB": "1950",
     "STRUCT_CL_": "Brick/Concr",
     "STYLE_D": "",
     "STRUCT_D": "",
     "GBA": "5113",
     "EXTWALL_D": "Brick",
     "WALL_HGT": "10.00",
     "ROOF_D": "",
     "BATHRM": "",
     "HF_BATHRM": "",
     "HEAT_D": "",
     "AC": "",
     "INTWALL_D": "",
     "ROOMS": "",
     "BEDRM": "",
     "KITCHENS": "",
     "FIREPLACES": "",
     "YR_RMDL": "1986",
     "EYB": "1980",
     "STORIES": "",
     "OWNERNAME": "SCHWARTZ ROBERT & BRAVERMAN BURT",
     "OWNNAME2": "",
     "CAREOFNAME": "LONGFORD MGMT"
    }
   ]
  },
  "taxData": {
   "ssl": "0152    0194",
   "address": "1809 - 1811 18TH ST NW",
   "owner": "SCHWARTZ ROBERT & BRAVERMAN BURT ROCK CREEK GROUP",
   "neighborhood": "OLD CITY II",
   "sub_neighborhood": "D",
   "use_code": "49",
   "sale_price": "$.00",
   "recordation_date": "N/A",
   "2016_Assessment": "$1,439,090.00"
  }
 },
 "1821 18TH STREET NW": {
  "ownerInfo": {
   "updated": "2020-06-28T17:29:58.010Z",
   "ownerData": [
    {
     "OWNERNAME": "SALWA M CHAMMA",
     "PREMISEADD": "1821 18TH ST NW",
     "UNITNUMBER": "",
     "SSL": "0152    0116",
     "USECODE": "042",
     "HSTDCODE": "",
     "CLASSTYPE": "",
     "TAXRATE": "0",
     "SALEPRICE": "",
     "SALEDATE": "01/30/1998",
     "INSTNO": "",
     "ACCEPTCODE": "",
     "DEEDDATE": "01/30/1998",
     "OWNNAME2": "",
     "CPMS_ADDRESS": "1821 18TH ST NW",
     "CAREOFNAME": "",
     "ADDRESS1": "6548 35TH RD N",
     "ADDRESS2": "",
     "CITYSTZIP": "ARLINGTON                  VA 22213-1314",
     "SALEDATE_NET": "1998/01/30",
     "DEEDDATE_NET": "1998/01/30"
    }
   ]
  },
  "addressDetails": {
   "updated": "2020-06-28T18:11:29.134Z",
   "addressData": [
    {
     "ADDRESS_ID": "241538",
     "MARID": "241538",
     "STATUS": "ACTIVE",
     "FULLADDRESS": "1821 18TH STREET NW",
     "ADDRNUM": "1821",
     "ADDRNUMSUFFIX": "",
     "STNAME": "18TH",
     "STREET_TYPE": "STREET",
     "QUADRANT": "NW",
     "CITY": "WASHINGTON",
     "STATE": "DC",
     "XCOORD": "396405.94",
     "YCOORD": "138565.59",
     "SSL": "0152    0116",
     "ANC": "ANC 2B",
     "PSA": "Police Service Area 301",
     "WARD": "Ward 2",
     "NBHD_ACTION": " ",
     "CLUSTER_": "Cluster 6",
     "POLDIST": "Police District - Third District",
     "ROC": "Police Sector 3D3",
     "CENSUS_TRACT": "004201",
     "VOTE_PRCNCT": "Precinct 141",
     "SMD": "SMD 2B08",
     "ZIPCODE": "20009",
     "NATIONALGRID": "18S UJ 23009 09320",
     "ROADWAYSEGID": "5349",
     "FOCUS_IMPROVEMENT_AREA": "NA",
     "HAS_ALIAS": "N",
     "HAS_CONDO_UNIT": "N",
     "HAS_RES_UNIT": "N",
     "HAS_SSL": "Y",
     "LATITUDE": "38.91494944",
     "LONGITUDE": "-77.04144170",
     "STREETVIEWURL": "http://maps.google.com/maps?z=16&layer=c&cbll=38.91494944,-77.0414417&cbp=11,14.1121845938802,,0,2.09",
     "RES_TYPE": "NON RESIDENTIAL",
     "WARD_2002": "Ward 2",
     "WARD_2012": "Ward 2",
     "ANC_2002": "ANC 2B",
     "ANC_2012": "ANC 2B",
     "SMD_2002": "SMD 2B08",
     "SMD_2012": "SMD 2B08",
     "IMAGEURL": "http://citizenatlas.dc.gov/mobilevideo",
     "IMAGEDIR": "20040816",
     "IMAGENAME": "QG091252.jpg",
     "ConfidenceLevel": "100",
     "Zoning": "MU-4"
    }
   ]
  },
  "licenseDetails": {
   "updated": "2020-06-28T18:35:30.980Z",
   "licenseData": [
    {
     "ADDRESS": "1821  18TH ST NW",
     "UNIT": " ",
     "SSL": "0152    0116",
     "CUST_NUM": "400320800978",
     "DECRIPTION": "General Business",
     "ENDORSEMENT_DESC": "General Business Licenses",
     "LAST_NAME": "",
     "FIRST_NAME": "",
     "CORP_NAME": "Embers",
     "TRADE_NAME": "Embers LLC",
     "BEGIN_RENEWAL": "Nov  1 2019 12:00AM",
     "END_RENEWAL": "Oct 31 2021 12:00AM",
     "STATUS": "Active",
     "BEGIN_RENEWAL_NET": "2019/11/01",
     "END_RENEWAL_NET": "2021/10/31"
    },
    {
     "ADDRESS": "1821  18TH ST NW",
     "UNIT": "#1",
     "SSL": "0152    0116",
     "CUST_NUM": "39800060",
     "DECRIPTION": "General Service and Repair",
     "ENDORSEMENT_DESC": "Home Improvement Salesman",
     "LAST_NAME": "GLASS",
     "FIRST_NAME": "THOMAS",
     "CORP_NAME": "",
     "TRADE_NAME": "",
     "BEGIN_RENEWAL": "",
     "END_RENEWAL": "",
     "STATUS": "Expired",
     "BEGIN_RENEWAL_NET": "",
     "END_RENEWAL_NET": ""
    }
   ]
  },
  "permitDetails": {
   "updated": "2020-06-28T18:52:37.031Z",
   "permitData": [
    {
     "FULL_ADDRESS": "1821 18TH ST NW Basement, Washington, DC 20009",
     "B1_UNIT_START": "Basement",
     "SSL": "0152    0116",
     "B1_ALT_ID": "B1500988",
     "TYPE": "Construction/Alteration and Repair",
     "G6_STAT_DD": "Oct 28 2014 12:00AM",
     "B1_APPL_STATUS": "Completed",
     "B1_APPL_STATUS_DATE": "11/17/2014",
     "DESC_OF_WORK": "replacement of existing Duct  to new\r\nReplace tile and remove mold drywalls and replace in kind in small areas",
     "SORT_DATE": null,
     "G6_STAT_DD_NET": "2014/10/28",
     "B1_APPL_STATUS_DATE_NET": "2014/11/17",
     "JOB_CLASS_CODE": "WT",
     "JOB_SIZE": "N/A",
     "JOB_CLASSIFICATION": "N/A",
     "JOB_REVIEW_TIME": "N/A",
     "OWNER_NAME": "salwa  Chamma",
     "OWNER_FULL_NAME": "salwa  Chamma",
     "APPLICANT_NAME": "CARLOS  DIAZ",
     "TRADE_NAME": "",
     "PERMIT_STATUS": [
      {
       "REVIEW_STATUS": "Application Accepted",
       "DISCIPLINE": "Plan Review Coordinator",
       "REVIEW_STATUS_DATE": "10/28/2014"
      },
      {
       "REVIEW_STATUS": "HPRB Review Approved",
       "DISCIPLINE": "HPRB Review",
       "REVIEW_STATUS_DATE": "10/28/2014"
      },
      {
       "REVIEW_STATUS": "Inspection Approved",
       "DISCIPLINE": "Inspection",
       "REVIEW_STATUS_DATE": "11/17/2014"
      },
      {
       "REVIEW_STATUS": "Mechanical Review Approved",
       "DISCIPLINE": "Mechanical Review",
       "REVIEW_STATUS_DATE": "10/28/2014"
      },
      {
       "REVIEW_STATUS": "Permit Issued",
       "DISCIPLINE": "Issue Permit",
       "REVIEW_STATUS_DATE": "10/28/2014"
      },
      {
       "REVIEW_STATUS": "Structural Review Approved",
       "DISCIPLINE": "Structural Review",
       "REVIEW_STATUS_DATE": "10/28/2014"
      }
     ]
    },
    {
     "FULL_ADDRESS": "1821 18TH ST NW, WASHINGTON, DC 20009",
     "B1_UNIT_START": "",
     "SSL": "0152    0116",
     "B1_ALT_ID": "M1500009",
     "TYPE": "Supplemental/Mechanical",
     "G6_STAT_DD": "Oct  1 2014 12:00AM",
     "B1_APPL_STATUS": "Permit Issued",
     "B1_APPL_STATUS_DATE": "10/01/2014",
     "DESC_OF_WORK": "",
     "SORT_DATE": null,
     "G6_STAT_DD_NET": "2014/10/01",
     "B1_APPL_STATUS_DATE_NET": "2014/10/01",
     "JOB_CLASS_CODE": "N/A",
     "JOB_SIZE": "N/A",
     "JOB_CLASSIFICATION": "N/A",
     "JOB_REVIEW_TIME": "N/A",
     "OWNER_NAME": "SALWA M CHAMMA",
     "OWNER_FULL_NAME": "SALWA M CHAMMA",
     "APPLICANT_NAME": "HAROLD D JOHNSON III",
     "TRADE_NAME": "",
     "PERMIT_STATUS": [
      {
       "REVIEW_STATUS": "",
       "DISCIPLINE": "",
       "REVIEW_STATUS_DATE": ""
      }
     ]
    },
    {
     "FULL_ADDRESS": "1821 18TH ST NW, WASHINGTON, DC 20009",
     "B1_UNIT_START": "",
     "SSL": "0152    0116",
     "B1_ALT_ID": "M1500168",
     "TYPE": "Supplemental/Mechanical",
     "G6_STAT_DD": "Oct 20 2014 12:00AM",
     "B1_APPL_STATUS": "Permit Issued",
     "B1_APPL_STATUS_DATE": "10/20/2014",
     "DESC_OF_WORK": "",
     "SORT_DATE": null,
     "G6_STAT_DD_NET": "2014/10/20",
     "B1_APPL_STATUS_DATE_NET": "2014/10/20",
     "JOB_CLASS_CODE": "N/A",
     "JOB_SIZE": "N/A",
     "JOB_CLASSIFICATION": "N/A",
     "JOB_REVIEW_TIME": "N/A",
     "OWNER_NAME": "SALWA M CHAMMA",
     "OWNER_FULL_NAME": "SALWA M CHAMMA",
     "APPLICANT_NAME": "NIKOLAOS K. MANOLOPOULOS",
     "TRADE_NAME": "",
     "PERMIT_STATUS": [
      {
       "REVIEW_STATUS": "",
       "DISCIPLINE": "",
       "REVIEW_STATUS_DATE": ""
      }
     ]
    },
    {
     "FULL_ADDRESS": "1821 18TH ST NW, WASHINGTON, DC 20009",
     "B1_UNIT_START": "",
     "SSL": "0152    0116",
     "B1_ALT_ID": "P1802827",
     "TYPE": "Supplemental/Plumbing and Gas",
     "G6_STAT_DD": "Jan 16 2018 12:00AM",
     "B1_APPL_STATUS": "Permit Issued",
     "B1_APPL_STATUS_DATE": "01/16/2018",
     "DESC_OF_WORK": "",
     "SORT_DATE": null,
     "G6_STAT_DD_NET": "2018/01/16",
     "B1_APPL_STATUS_DATE_NET": "2018/01/16",
     "JOB_CLASS_CODE": "N/A",
     "JOB_SIZE": "N/A",
     "JOB_CLASSIFICATION": "N/A",
     "JOB_REVIEW_TIME": "N/A",
     "OWNER_NAME": "SALWA M CHAMMA",
     "OWNER_FULL_NAME": "SALWA M CHAMMA",
     "APPLICANT_NAME": "DOMINIC D. MAGNOLIA",
     "TRADE_NAME": "",
     "PERMIT_STATUS": [
      {
       "REVIEW_STATUS": "",
       "DISCIPLINE": "",
       "REVIEW_STATUS_DATE": ""
      }
     ]
    },
    {
     "FULL_ADDRESS": "1821 18TH ST NW, WASHINGTON, DC 20009",
     "B1_UNIT_START": "",
     "SSL": "0152    0116",
     "B1_ALT_ID": "SR14SO05934",
     "TYPE": "Surveyors/Customer Request",
     "G6_STAT_DD": "Jan  1 1900 12:00AM",
     "B1_APPL_STATUS": "Request Complete",
     "B1_APPL_STATUS_DATE": "06/26/2014",
     "DESC_OF_WORK": "",
     "SORT_DATE": null,
     "G6_STAT_DD_NET": "",
     "B1_APPL_STATUS_DATE_NET": "2014/06/26",
     "JOB_CLASS_CODE": "N/A",
     "JOB_SIZE": "N/A",
     "JOB_CLASSIFICATION": "N/A",
     "JOB_REVIEW_TIME": "N/A",
     "OWNER_NAME": "",
     "OWNER_FULL_NAME": "",
     "APPLICANT_NAME": "WILL  COUCH",
     "TRADE_NAME": "",
     "PERMIT_STATUS": [
      {
       "REVIEW_STATUS": "",
       "DISCIPLINE": "",
       "REVIEW_STATUS_DATE": ""
      }
     ]
    },
    {
     "FULL_ADDRESS": "1821 18TH ST NW, WASHINGTON, DC 20009",
     "B1_UNIT_START": "",
     "SSL": "0152    0116",
     "B1_ALT_ID": "SR14SO06378",
     "TYPE": "Surveyors/Customer Request",
     "G6_STAT_DD": "Jan  1 1900 12:00AM",
     "B1_APPL_STATUS": "Request Complete",
     "B1_APPL_STATUS_DATE": "07/17/2014",
     "DESC_OF_WORK": "",
     "SORT_DATE": null,
     "G6_STAT_DD_NET": "",
     "B1_APPL_STATUS_DATE_NET": "2014/07/17",
     "JOB_CLASS_CODE": "N/A",
     "JOB_SIZE": "N/A",
     "JOB_CLASSIFICATION": "N/A",
     "JOB_REVIEW_TIME": "N/A",
     "OWNER_NAME": "",
     "OWNER_FULL_NAME": "",
     "APPLICANT_NAME": "ALLISON  FITZSIMMONS",
     "TRADE_NAME": "",
     "PERMIT_STATUS": [
      {
       "REVIEW_STATUS": "",
       "DISCIPLINE": "",
       "REVIEW_STATUS_DATE": ""
      }
     ]
    }
   ]
  },
  "inspectionDetails": {
   "updated": "2020-06-28T18:52:37.253Z",
   "inspectionData": [
    {
     "ADDRESS": "1821 18TH ST NW Basement, Washington, DC 20009",
     "UNIT": "Basement",
     "SSL": "0152    0116",
     "ID": "B1500988",
     "G6_ACT_DES": "Building Final",
     "G6_STATUS": "Approved",
     "G6_STATUS_DD": "11/17/2014 12:00:00 AM",
     "DESC_OF_WORK": "replacement of existing Duct  to new\r\nReplace tile and remove mold drywalls and replace in kind in small areas",
     "G6_STATUS_DD_NET": "2014/11/17",
     "OWNER_FULL_NAME": "salwa  Chamma",
     "APPLICANT": "CARLOS  DIAZ"
    },
    {
     "ADDRESS": "1821 18TH ST NW Basement, Washington, DC 20009",
     "UNIT": "Basement",
     "SSL": "0152    0116",
     "ID": "B1500988",
     "G6_ACT_DES": "Building Close-In",
     "G6_STATUS": "Approved",
     "G6_STATUS_DD": "11/3/2014 12:00:00 AM",
     "DESC_OF_WORK": "replacement of existing Duct  to new\r\nReplace tile and remove mold drywalls and replace in kind in small areas",
     "G6_STATUS_DD_NET": "2014/11/03",
     "OWNER_FULL_NAME": "salwa  Chamma",
     "APPLICANT": "CARLOS  DIAZ"
    },
    {
     "ADDRESS": "1821 18TH ST NW Basement, Washington, DC 20009",
     "UNIT": "Basement",
     "SSL": "0152    0116",
     "ID": "B1500988",
     "G6_ACT_DES": "Building Close-In",
     "G6_STATUS": "Rescheduled",
     "G6_STATUS_DD": "10/28/2014 12:00:00 AM",
     "DESC_OF_WORK": "replacement of existing Duct  to new\r\nReplace tile and remove mold drywalls and replace in kind in small areas",
     "G6_STATUS_DD_NET": "2014/10/28",
     "OWNER_FULL_NAME": "salwa  Chamma",
     "APPLICANT": "CARLOS  DIAZ"
    },
    {
     "ADDRESS": "1821 18TH ST NW, WASHINGTON, DC 20009",
     "UNIT": "",
     "SSL": "0152    0116",
     "ID": "CIC1500099",
     "G6_ACT_DES": "Initial Inspection",
     "G6_STATUS": "No Cause",
     "G6_STATUS_DD": "10/22/2014 12:00:00 AM",
     "DESC_OF_WORK": "",
     "G6_STATUS_DD_NET": "2014/10/22",
     "OWNER_FULL_NAME": "SALWA M CHAMMA",
     "APPLICANT": ""
    },
    {
     "ADDRESS": "1821 18TH ST NW, WASHINGTON, DC 20009",
     "UNIT": "",
     "SSL": "0152    0116",
     "ID": "CIC1500099",
     "G6_ACT_DES": "Initial Inspection",
     "G6_STATUS": "Rescheduled",
     "G6_STATUS_DD": "10/21/2014 12:00:00 AM",
     "DESC_OF_WORK": "",
     "G6_STATUS_DD_NET": "2014/10/21",
     "OWNER_FULL_NAME": "SALWA M CHAMMA",
     "APPLICANT": ""
    },
    {
     "ADDRESS": "1821 18TH ST NW, WASHINGTON, DC 20009",
     "UNIT": "",
     "SSL": "0152    0116",
     "ID": "CIC1500099",
     "G6_ACT_DES": "Initial Inspection",
     "G6_STATUS": "Rescheduled",
     "G6_STATUS_DD": "10/20/2014 12:00:00 AM",
     "DESC_OF_WORK": "",
     "G6_STATUS_DD_NET": "2014/10/20",
     "OWNER_FULL_NAME": "SALWA M CHAMMA",
     "APPLICANT": ""
    }
   ]
  },
  "occupancyDetails": {
   "updated": "2020-06-28T18:52:37.543Z",
   "occupancyData": [
    {
     "FULL_ADDRESS": "1821 18TH ST NW, WASHINGTON, DC 20009",
     "B1_UNIT_START": "",
     "SSL": "0152    0116",
     "B1_ALT_ID": "CO2001451",
     "TYPE": "Certificate of Occupancy",
     "G6_STAT_DD": "02/27/2020",
     "B1_APPL_STATUS": "Completed",
     "B1_APPL_STATUS_DATE": "02/27/2020",
     "DESC_OF_WORK": "Ownership ChangeOFFICE",
     "G6_STAT_DD_NET": "2020/02/27",
     "B1_APPL_STATUS_DATE_NET": "2020/02/27",
     "OWNER_FULL_NAME": "ESTATE OF SALWA CHAMMA, RONA KENNEDY - TRUSTEE",
     "APPLICANT": ""
    },
    {
     "FULL_ADDRESS": "1821 18TH ST NW, WASHINGTON, DC 20009-5526",
     "B1_UNIT_START": "",
     "SSL": "",
     "B1_ALT_ID": "CO77573",
     "TYPE": "Certificate of Occupancy",
     "G6_STAT_DD": "06/09/2004",
     "B1_APPL_STATUS": "Completed",
     "B1_APPL_STATUS_DATE": "          ",
     "DESC_OF_WORK": "",
     "G6_STAT_DD_NET": "2004/06/09",
     "B1_APPL_STATUS_DATE_NET": "",
     "OWNER_FULL_NAME": "1821 18TH ST ASSOC",
     "APPLICANT": ""
    }
   ]
  },
  "charDetails": {
   "updated": "2020-06-28T19:53:21.972Z",
   "charData": [
    {
     "PREMISEADD": "1821 18TH ST NW",
     "SSL": "0152    0116",
     "BLDG_NUM": "1",
     "COMPLX_NUM": "",
     "UNITNUMBER": "",
     "NUM_UNITS": "",
     "AYB": "1890",
     "STRUCT_CL_": "Brick/Concr",
     "STYLE_D": "",
     "STRUCT_D": "",
     "GBA": "2688",
     "EXTWALL_D": "Brick",
     "WALL_HGT": "9.00",
     "ROOF_D": "",
     "BATHRM": "",
     "HF_BATHRM": "",
     "HEAT_D": "",
     "AC": "",
     "INTWALL_D": "",
     "ROOMS": "",
     "BEDRM": "",
     "KITCHENS": "",
     "FIREPLACES": "",
     "YR_RMDL": "",
     "EYB": "1995",
     "STORIES": "",
     "OWNERNAME": "SALWA M CHAMMA",
     "OWNNAME2": "",
     "CAREOFNAME": ""
    }
   ]
  },
  "taxData": {
   "ssl": "0152    0116",
   "address": "1821 18TH ST NW",
   "owner": "SALWA M CHAMMA",
   "neighborhood": "OLD CITY II",
   "sub_neighborhood": "D",
   "use_code": "51",
   "sale_price": "$.00",
   "recordation_date": "01/30/1998",
   "2016_Assessment": "$963,180.00"
  }
 },
 "1508 17TH STREET NW": {
  "ownerInfo": {
   "updated": "2020-06-28T17:30:00.260Z",
   "ownerData": [
    {
     "OWNERNAME": "RAPHIEL S HAMPTON",
     "PREMISEADD": "1508 17TH ST NW",
     "UNITNUMBER": "",
     "SSL": "0156    0168",
     "USECODE": "024",
     "HSTDCODE": "",
     "CLASSTYPE": "001",
     "TAXRATE": "0.0085",
     "SALEPRICE": "",
     "SALEDATE": "08/17/1992",
     "INSTNO": "",
     "ACCEPTCODE": "",
     "DEEDDATE": "08/17/1992",
     "OWNNAME2": "",
     "CPMS_ADDRESS": "1508 17TH ST NW",
     "CAREOFNAME": "",
     "ADDRESS1": "1508 17TH ST NW",
     "ADDRESS2": "",
     "CITYSTZIP": "WASHINGTON                 DC 20036-6252",
     "SALEDATE_NET": "1992/08/17",
     "DEEDDATE_NET": "1992/08/17"
    }
   ]
  },
  "addressDetails": {
   "updated": "2020-06-28T18:11:32.328Z",
   "addressData": [
    {
     "ADDRESS_ID": "225602",
     "MARID": "225602",
     "STATUS": "ACTIVE",
     "FULLADDRESS": "1508 17TH STREET NW",
     "ADDRNUM": "1508",
     "ADDRNUMSUFFIX": "",
     "STNAME": "17TH",
     "STREET_TYPE": "STREET",
     "QUADRANT": "NW",
     "CITY": "WASHINGTON",
     "STATE": "DC",
     "XCOORD": "396639.41",
     "YCOORD": "138016.31",
     "SSL": "0156    0168",
     "ANC": "ANC 2B",
     "PSA": "Police Service Area 208",
     "WARD": "Ward 2",
     "NBHD_ACTION": " ",
     "CLUSTER_": "Cluster 6",
     "POLDIST": "Police District - Second District",
     "ROC": "Police Sector 2D3",
     "CENSUS_TRACT": "005301",
     "VOTE_PRCNCT": "Precinct 15",
     "SMD": "SMD 2B07",
     "ZIPCODE": "20036",
     "NATIONALGRID": "18S UJ 23230 08765",
     "ROADWAYSEGID": "5688",
     "FOCUS_IMPROVEMENT_AREA": "NA",
     "HAS_ALIAS": "N",
     "HAS_CONDO_UNIT": "N",
     "HAS_RES_UNIT": "Y",
     "HAS_SSL": "Y",
     "LATITUDE": "38.91000226",
     "LONGITUDE": "-77.03874696",
     "STREETVIEWURL": "http://maps.google.com/maps?z=16&layer=c&cbll=38.91000226,-77.03874696&cbp=11,283.775795055726,,0,2.09",
     "RES_TYPE": "RESIDENTIAL",
     "WARD_2002": "Ward 2",
     "WARD_2012": "Ward 2",
     "ANC_2002": "ANC 2B",
     "ANC_2012": "ANC 2B",
     "SMD_2002": "SMD 2B07",
     "SMD_2012": "SMD 2B07",
     "IMAGEURL": "http://citizenatlas.dc.gov/mobilevideo",
     "IMAGEDIR": "20040815",
     "IMAGENAME": "QF103255.jpg",
     "ConfidenceLevel": "100",
     "Zoning": "RA-8"
    }
   ]
  },
  "licenseDetails": {
   "updated": "2020-06-28T18:35:38.240Z",
   "licenseData": [
    {
     "ADDRESS": "1400 -1799 17TH ST NW",
     "UNIT": "1799",
     "SSL": "NA",
     "CUST_NUM": "201211000891",
     "DECRIPTION": "Entertainment",
     "ENDORSEMENT_DESC": "Special Events",
     "LAST_NAME": "",
     "FIRST_NAME": "",
     "CORP_NAME": "URBAN NEIGHBORHOOD ALLIANCE",
     "TRADE_NAME": "17TH STREET FESTIVAL",
     "BEGIN_RENEWAL": "",
     "END_RENEWAL": "Sep 25 2011 12:00AM",
     "STATUS": "Expired",
     "BEGIN_RENEWAL_NET": "",
     "END_RENEWAL_NET": "2011/09/25"
    },
    {
     "ADDRESS": "1400 -1799 17TH ST NW",
     "UNIT": "1799",
     "SSL": "NA",
     "CUST_NUM": "201212000094",
     "DECRIPTION": "Entertainment",
     "ENDORSEMENT_DESC": "Special Events",
     "LAST_NAME": "",
     "FIRST_NAME": "",
     "CORP_NAME": "URBAN NEIGHBORHOOD ALLIANCE",
     "TRADE_NAME": "17TH STREET FESTIVAL",
     "BEGIN_RENEWAL": "",
     "END_RENEWAL": "Sep 23 2012 12:00AM",
     "STATUS": "Expired",
     "BEGIN_RENEWAL_NET": "",
     "END_RENEWAL_NET": "2012/09/23"
    },
    {
     "ADDRESS": "1508  17TH ST NW",
     "UNIT": "",
     "SSL": "",
     "CUST_NUM": "420316000432",
     "DECRIPTION": "General Service and Repair",
     "ENDORSEMENT_DESC": "Home Improvement Salesman",
     "LAST_NAME": "HAMPTON",
     "FIRST_NAME": "RAPHIEL",
     "CORP_NAME": "SUNSHINE CONSTRUCTION, LLC.",
     "TRADE_NAME": "",
     "BEGIN_RENEWAL": "Aug  1 2016 12:00AM",
     "END_RENEWAL": "Jul 31 2018 12:00AM",
     "STATUS": "Expired",
     "BEGIN_RENEWAL_NET": "2016/08/01",
     "END_RENEWAL_NET": "2018/07/31"
    },
    {
     "ADDRESS": "1508  17TH ST NW",
     "UNIT": "",
     "SSL": "0156    0168",
     "CUST_NUM": "39809045",
     "DECRIPTION": "Housing: Residential",
     "ENDORSEMENT_DESC": "Apartment",
     "LAST_NAME": "HAMPTON",
     "FIRST_NAME": "RAPHIEL",
     "CORP_NAME": "",
     "TRADE_NAME": "",
     "BEGIN_RENEWAL": "Nov  1 2013 12:00AM",
     "END_RENEWAL": "Oct 31 2015 12:00AM",
     "STATUS": "Expired",
     "BEGIN_RENEWAL_NET": "2013/11/01",
     "END_RENEWAL_NET": "2015/10/31"
    },
    {
     "ADDRESS": "1508  17TH ST NW",
     "UNIT": "",
     "SSL": "0156    0168",
     "CUST_NUM": "400319000570",
     "DECRIPTION": "General Business",
     "ENDORSEMENT_DESC": "General Business Licenses",
     "LAST_NAME": "HAMPTON",
     "FIRST_NAME": "RAPHIEL",
     "CORP_NAME": "SUNSHINE REALTY LLC",
     "TRADE_NAME": "",
     "BEGIN_RENEWAL": "Dec  1 2018 12:00AM",
     "END_RENEWAL": "Nov 30 2020 12:00AM",
     "STATUS": "Active",
     "BEGIN_RENEWAL_NET": "2018/12/01",
     "END_RENEWAL_NET": "2020/11/30"
    },
    {
     "ADDRESS": "1508  17TH ST NW",
     "UNIT": "",
     "SSL": "0156    0168",
     "CUST_NUM": "420315000212",
     "DECRIPTION": "General Service and Repair",
     "ENDORSEMENT_DESC": "Home Improvement Salesman",
     "LAST_NAME": "HAMPTON",
     "FIRST_NAME": "RAPHIEL",
     "CORP_NAME": "Sunshine Realty, L.L.C",
     "TRADE_NAME": "Sunshine Construction",
     "BEGIN_RENEWAL": "Mar  1 2015 12:00AM",
     "END_RENEWAL": "Feb 28 2017 12:00AM",
     "STATUS": "Expired",
     "BEGIN_RENEWAL_NET": "2015/03/01",
     "END_RENEWAL_NET": "2017/02/28"
    },
    {
     "ADDRESS": "1508  17TH ST NW",
     "UNIT": "",
     "SSL": "0156    0168",
     "CUST_NUM": "500119000066",
     "DECRIPTION": "Housing: Residential",
     "ENDORSEMENT_DESC": "Apartment",
     "LAST_NAME": "HAMPTON",
     "FIRST_NAME": "RAPHIEL S.",
     "CORP_NAME": "",
     "TRADE_NAME": "",
     "BEGIN_RENEWAL": "Nov  1 2018 12:00AM",
     "END_RENEWAL": "Oct 31 2020 12:00AM",
     "STATUS": "Active",
     "BEGIN_RENEWAL_NET": "2018/11/01",
     "END_RENEWAL_NET": "2020/10/31"
    },
    {
     "ADDRESS": "1508  17TH ST NW",
     "UNIT": "1",
     "SSL": "0156    0168",
     "CUST_NUM": "410516000575",
     "DECRIPTION": "General Service and Repair",
     "ENDORSEMENT_DESC": "Gen Contr-Construction Mngr",
     "LAST_NAME": "",
     "FIRST_NAME": "",
     "CORP_NAME": "Sunshine Construction LLC.",
     "TRADE_NAME": "",
     "BEGIN_RENEWAL": "Jun  1 2016 12:00AM",
     "END_RENEWAL": "May 31 2018 12:00AM",
     "STATUS": "Expired",
     "BEGIN_RENEWAL_NET": "2016/06/01",
     "END_RENEWAL_NET": "2018/05/31"
    }
   ]
  },
  "permitDetails": {
   "updated": "2020-06-28T18:52:58.241Z",
   "permitData": [
    {
     "FULL_ADDRESS": "1508 17TH ST NW, WASHINGTON, DC 20036",
     "B1_UNIT_START": "",
     "SSL": "0156    0168",
     "B1_ALT_ID": "B1111284",
     "TYPE": "Construction/Alteration and Repair",
     "G6_STAT_DD": "Jan  1 1900 12:00AM",
     "B1_APPL_STATUS": "Application Canceled",
     "B1_APPL_STATUS_DATE": "11/03/2015",
     "DESC_OF_WORK": "REPOINTING FACADE AND SIDE WALL \r\nSCAFFOLDING WILL BE SET UP  IN ALLEY  AND FRONT.",
     "SORT_DATE": null,
     "G6_STAT_DD_NET": "",
     "B1_APPL_STATUS_DATE_NET": "2015/11/03",
     "JOB_CLASS_CODE": "WT",
     "JOB_SIZE": "N/A",
     "JOB_CLASSIFICATION": "N/A",
     "JOB_REVIEW_TIME": "N/A",
     "OWNER_NAME": "RAPHIEL S HAMPTON",
     "OWNER_FULL_NAME": "RAPHIEL S HAMPTON",
     "APPLICANT_NAME": "LENORA  ZACCUR",
     "TRADE_NAME": "",
     "PERMIT_STATUS": [
      {
       "REVIEW_STATUS": "Application Accepted",
       "DISCIPLINE": "Plan Review Coordinator",
       "REVIEW_STATUS_DATE": "09/13/2011"
      },
      {
       "REVIEW_STATUS": "Application Canceled",
       "DISCIPLINE": "File Room",
       "REVIEW_STATUS_DATE": "11/03/2015"
      },
      {
       "REVIEW_STATUS": "DDOT Review Approved",
       "DISCIPLINE": "DDOT Review",
       "REVIEW_STATUS_DATE": "10/12/2011"
      },
      {
       "REVIEW_STATUS": "HPRB Review Approved",
       "DISCIPLINE": "HPRB Review",
       "REVIEW_STATUS_DATE": "09/13/2011"
      },
      {
       "REVIEW_STATUS": "In-Process",
       "DISCIPLINE": "Structural Review",
       "REVIEW_STATUS_DATE": ""
      }
     ]
    },
    {
     "FULL_ADDRESS": "1508 17TH ST NW, WASHINGTON, DC 20036-6252",
     "B1_UNIT_START": "",
     "SSL": "",
     "B1_ALT_ID": "P148421",
     "TYPE": "Supplemental/Plumbing and Gas",
     "G6_STAT_DD": "Aug  6 2007  7:27AM",
     "B1_APPL_STATUS": "Permit Issued",
     "B1_APPL_STATUS_DATE": "          ",
     "DESC_OF_WORK": "",
     "SORT_DATE": null,
     "G6_STAT_DD_NET": "2007/08/06",
     "B1_APPL_STATUS_DATE_NET": "",
     "JOB_CLASS_CODE": "N/A",
     "JOB_SIZE": "N/A",
     "JOB_CLASSIFICATION": "N/A",
     "JOB_REVIEW_TIME": "N/A",
     "OWNER_NAME": "HAMPTON",
     "OWNER_FULL_NAME": "HAMPTON",
     "APPLICANT_NAME": "",
     "TRADE_NAME": "",
     "PERMIT_STATUS": [
      {
       "REVIEW_STATUS": "",
       "DISCIPLINE": "",
       "REVIEW_STATUS_DATE": ""
      }
     ]
    },
    {
     "FULL_ADDRESS": "1508 17TH ST NW, WASHINGTON, DC 20036",
     "B1_UNIT_START": "",
     "SSL": "0156    0168",
     "B1_ALT_ID": "RW1100158",
     "TYPE": "Construction/Retaining Wall",
     "G6_STAT_DD": "Jan  1 1900 12:00AM",
     "B1_APPL_STATUS": "Application Canceled",
     "B1_APPL_STATUS_DATE": "06/17/2015",
     "DESC_OF_WORK": "MASONY WORK OUTSIDE BUILDING IS CRACKED AFTER EARTHQUACK LEAKING INSIDE THE APPARTMENT",
     "SORT_DATE": null,
     "G6_STAT_DD_NET": "",
     "B1_APPL_STATUS_DATE_NET": "2015/06/17",
     "JOB_CLASS_CODE": "WT",
     "JOB_SIZE": "N/A",
     "JOB_CLASSIFICATION": "N/A",
     "JOB_REVIEW_TIME": "N/A",
     "OWNER_NAME": "RAPHIEL S HAMPTON",
     "OWNER_FULL_NAME": "RAPHIEL S HAMPTON",
     "APPLICANT_NAME": "",
     "TRADE_NAME": "",
     "PERMIT_STATUS": [
      {
       "REVIEW_STATUS": "Application Accepted",
       "DISCIPLINE": "Plan Review Coordinator",
       "REVIEW_STATUS_DATE": "09/13/2011"
      },
      {
       "REVIEW_STATUS": "Application Canceled",
       "DISCIPLINE": "File Room",
       "REVIEW_STATUS_DATE": "06/17/2015"
      },
      {
       "REVIEW_STATUS": "In-Process",
       "DISCIPLINE": "HPRB Review",
       "REVIEW_STATUS_DATE": ""
      },
      {
       "REVIEW_STATUS": "In-Process",
       "DISCIPLINE": "Structural Review",
       "REVIEW_STATUS_DATE": ""
      }
     ]
    },
    {
     "FULL_ADDRESS": "1508 17th ST NW 20036",
     "B1_UNIT_START": "",
     "SSL": "",
     "B1_ALT_ID": "SR17SO04689",
     "TYPE": "Surveyors/Customer Request",
     "G6_STAT_DD": "Jan  1 1900 12:00AM",
     "B1_APPL_STATUS": "Request Complete",
     "B1_APPL_STATUS_DATE": "05/09/2017",
     "DESC_OF_WORK": "        ===> Count: 2,  Process: Regular,  Delivery: Email",
     "SORT_DATE": null,
     "G6_STAT_DD_NET": "",
     "B1_APPL_STATUS_DATE_NET": "2017/05/09",
     "JOB_CLASS_CODE": "N/A",
     "JOB_SIZE": "N/A",
     "JOB_CLASSIFICATION": "N/A",
     "JOB_REVIEW_TIME": "N/A",
     "OWNER_NAME": "",
     "OWNER_FULL_NAME": "",
     "APPLICANT_NAME": "MAX  ROSNER",
     "TRADE_NAME": "",
     "PERMIT_STATUS": [
      {
       "REVIEW_STATUS": "",
       "DISCIPLINE": "",
       "REVIEW_STATUS_DATE": ""
      }
     ]
    }
   ]
  },
  "inspectionDetails": {
   "updated": "2020-06-28T18:52:58.443Z",
   "inspectionData": [
    {
     "ADDRESS": "1508 17TH ST NW, WASHINGTON, DC 20036",
     "UNIT": "",
     "SSL": "0156    0168",
     "ID": "CIC1101941",
     "G6_ACT_DES": "Initial Inspection",
     "G6_STATUS": "No Cause",
     "G6_STATUS_DD": "8/16/2011 12:00:00 AM",
     "DESC_OF_WORK": "",
     "G6_STATUS_DD_NET": "2011/08/16",
     "OWNER_FULL_NAME": "RAPHIEL S HAMPTON",
     "APPLICANT": ""
    }
   ]
  },
  "occupancyDetails": {
   "updated": "2020-06-28T18:52:58.667Z",
   "occupancyData": [
    {
     "FULL_ADDRESS": "1508 17TH ST NW apt #1, Washington , DC 20036",
     "B1_UNIT_START": "apt #1",
     "SSL": "0156    0168",
     "B1_ALT_ID": "EHOP1690771",
     "TYPE": "Home Occupation/Expedited",
     "G6_STAT_DD": "06/25/2016",
     "B1_APPL_STATUS": "Permit Issued",
     "B1_APPL_STATUS_DATE": "06/25/2016",
     "DESC_OF_WORK": "Home office of a business person",
     "G6_STAT_DD_NET": "2016/06/25",
     "B1_APPL_STATUS_DATE_NET": "2016/06/25",
     "OWNER_FULL_NAME": "",
     "APPLICANT": "NA NA NA"
    },
    {
     "FULL_ADDRESS": "1508 17TH ST NW, WASHINGTON, DC 20036",
     "B1_UNIT_START": "",
     "SSL": "0156    0168",
     "B1_ALT_ID": "HO1600293",
     "TYPE": "Home Occupation",
     "G6_STAT_DD": "",
     "B1_APPL_STATUS": "",
     "B1_APPL_STATUS_DATE": "06/24/2016",
     "DESC_OF_WORK": "",
     "G6_STAT_DD_NET": "",
     "B1_APPL_STATUS_DATE_NET": "2016/06/24",
     "OWNER_FULL_NAME": "RAPHIEL S HAMPTON",
     "APPLICANT": "RAPHIEL S HAMPTON"
    },
    {
     "FULL_ADDRESS": "1508 17TH ST NW, WASHINGTON, DC 20036",
     "B1_UNIT_START": "",
     "SSL": "0156    0168",
     "B1_ALT_ID": "HO1900154",
     "TYPE": "Home Occupation",
     "G6_STAT_DD": "",
     "B1_APPL_STATUS": "Permit Approved",
     "B1_APPL_STATUS_DATE": "12/04/2018",
     "DESC_OF_WORK": "HOME OFFICE (PROPERTY MANAGEMENT AND DEVELOPMENT)",
     "G6_STAT_DD_NET": "",
     "B1_APPL_STATUS_DATE_NET": "2018/12/04",
     "OWNER_FULL_NAME": "RAPHIEL S HAMPTON",
     "APPLICANT": "RAPHIEL  HAMPTON"
    }
   ]
  },
  "charDetails": {
   "updated": "2020-06-28T19:53:24.134Z",
   "charData": [
    {
     "PREMISEADD": "1508 17TH ST NW",
     "SSL": "0156    0168",
     "BLDG_NUM": "1",
     "COMPLX_NUM": "",
     "UNITNUMBER": "",
     "NUM_UNITS": "0",
     "AYB": "1890",
     "STRUCT_CL_": "",
     "STYLE_D": "3 Story",
     "STRUCT_D": "Row ",
     "GBA": "3983",
     "EXTWALL_D": "Common Brick",
     "WALL_HGT": "",
     "ROOF_D": "Buil",
     "BATHRM": "4",
     "HF_BATHRM": "0",
     "HEAT_D": "Hot ",
     "AC": "N",
     "INTWALL_D": "Hardwood",
     "ROOMS": "11",
     "BEDRM": "5",
     "KITCHENS": "4",
     "FIREPLACES": "0",
     "YR_RMDL": "2012",
     "EYB": "1957",
     "STORIES": "3",
     "OWNERNAME": "RAPHIEL S HAMPTON",
     "OWNNAME2": "",
     "CAREOFNAME": ""
    }
   ]
  },
  "taxData": {
   "ssl": "0156    0168",
   "address": "1508 17TH ST NW",
   "owner": "RAPHIEL S HAMPTON",
   "neighborhood": "OLD CITY II",
   "sub_neighborhood": "D",
   "use_code": "24",
   "sale_price": "$.00",
   "recordation_date": "08/17/1992",
   "2016_Assessment": "$1,051,090.00"
  }
 },
 "1536 17TH STREET NW": {
  "ownerInfo": {
   "updated": "2020-06-28T17:30:02.125Z",
   "ownerData": [
    {
     "OWNERNAME": "MICHAEL V FASANO",
     "PREMISEADD": "1536 17TH ST NW",
     "UNITNUMBER": "",
     "SSL": "0156    0267",
     "USECODE": "024",
     "HSTDCODE": "",
     "CLASSTYPE": "001",
     "TAXRATE": "0.0085",
     "SALEPRICE": "",
     "SALEDATE": "",
     "INSTNO": "",
     "ACCEPTCODE": "",
     "DEEDDATE": "",
     "OWNNAME2": "",
     "CPMS_ADDRESS": "1536 17TH ST NW",
     "CAREOFNAME": "",
     "ADDRESS1": "1026 16TH ST NW STE 101",
     "ADDRESS2": "",
     "CITYSTZIP": "WASHINGTON                 DC 20036-5711",
     "SALEDATE_NET": "",
     "DEEDDATE_NET": ""
    }
   ]
  },
  "addressDetails": {
   "updated": "2020-06-28T18:11:33.762Z",
   "addressData": [
    {
     "ADDRESS_ID": "225768",
     "MARID": "225768",
     "STATUS": "ACTIVE",
     "FULLADDRESS": "1536 17TH STREET NW",
     "ADDRNUM": "1536",
     "ADDRNUMSUFFIX": "",
     "STNAME": "17TH",
     "STREET_TYPE": "STREET",
     "QUADRANT": "NW",
     "CITY": "WASHINGTON",
     "STATE": "DC",
     "XCOORD": "396639.60",
     "YCOORD": "138106.66",
     "SSL": "0156    0267",
     "ANC": "ANC 2B",
     "PSA": "Police Service Area 208",
     "WARD": "Ward 2",
     "NBHD_ACTION": " ",
     "CLUSTER_": "Cluster 6",
     "POLDIST": "Police District - Second District",
     "ROC": "Police Sector 2D3",
     "CENSUS_TRACT": "005301",
     "VOTE_PRCNCT": "Precinct 15",
     "SMD": "SMD 2B07",
     "ZIPCODE": "20036",
     "NATIONALGRID": "18S UJ 23232 08856",
     "ROADWAYSEGID": "16440",
     "FOCUS_IMPROVEMENT_AREA": "NA",
     "HAS_ALIAS": "N",
     "HAS_CONDO_UNIT": "N",
     "HAS_RES_UNIT": "N",
     "HAS_SSL": "Y",
     "LATITUDE": "38.91081617",
     "LONGITUDE": "-77.03874522",
     "STREETVIEWURL": "http://maps.google.com/maps?z=16&layer=c&cbll=38.91081617,-77.03874522&cbp=11,268.877571988668,,0,2.09",
     "RES_TYPE": "RESIDENTIAL",
     "WARD_2002": "Ward 2",
     "WARD_2012": "Ward 2",
     "ANC_2002": "ANC 2B",
     "ANC_2012": "ANC 2B",
     "SMD_2002": "SMD 2B07",
     "SMD_2012": "SMD 2B07",
     "IMAGEURL": "http://citizenatlas.dc.gov/mobilevideo",
     "IMAGEDIR": "20040815",
     "IMAGENAME": "QF103757.jpg",
     "ConfidenceLevel": "100",
     "Zoning": "RA-8"
    }
   ]
  },
  "licenseDetails": {
   "updated": "2020-06-28T18:35:41.596Z",
   "licenseData": [
    {
     "ADDRESS": "1400 -1799 17TH ST NW",
     "UNIT": "1799",
     "SSL": "NA",
     "CUST_NUM": "201211000891",
     "DECRIPTION": "Entertainment",
     "ENDORSEMENT_DESC": "Special Events",
     "LAST_NAME": "",
     "FIRST_NAME": "",
     "CORP_NAME": "URBAN NEIGHBORHOOD ALLIANCE",
     "TRADE_NAME": "17TH STREET FESTIVAL",
     "BEGIN_RENEWAL": "",
     "END_RENEWAL": "Sep 25 2011 12:00AM",
     "STATUS": "Expired",
     "BEGIN_RENEWAL_NET": "",
     "END_RENEWAL_NET": "2011/09/25"
    },
    {
     "ADDRESS": "1400 -1799 17TH ST NW",
     "UNIT": "1799",
     "SSL": "NA",
     "CUST_NUM": "201212000094",
     "DECRIPTION": "Entertainment",
     "ENDORSEMENT_DESC": "Special Events",
     "LAST_NAME": "",
     "FIRST_NAME": "",
     "CORP_NAME": "URBAN NEIGHBORHOOD ALLIANCE",
     "TRADE_NAME": "17TH STREET FESTIVAL",
     "BEGIN_RENEWAL": "",
     "END_RENEWAL": "Sep 23 2012 12:00AM",
     "STATUS": "Expired",
     "BEGIN_RENEWAL_NET": "",
     "END_RENEWAL_NET": "2012/09/23"
    },
    {
     "ADDRESS": "1526  17TH ST NW",
     "UNIT": "",
     "SSL": "0156    0034",
     "CUST_NUM": "39700885",
     "DECRIPTION": "Housing: Residential",
     "ENDORSEMENT_DESC": "Apartment",
     "LAST_NAME": "",
     "FIRST_NAME": "",
     "CORP_NAME": "PIER WITH NO END",
     "TRADE_NAME": "",
     "BEGIN_RENEWAL": "Nov  1 1999 12:00AM",
     "END_RENEWAL": "Oct 31 2001 12:00AM",
     "STATUS": "Expired",
     "BEGIN_RENEWAL_NET": "1999/11/01",
     "END_RENEWAL_NET": "2001/10/31"
    },
    {
     "ADDRESS": "1526  17TH ST NW",
     "UNIT": "",
     "SSL": "0156    0034",
     "CUST_NUM": "500514003391",
     "DECRIPTION": "Housing: Residential",
     "ENDORSEMENT_DESC": "One Family Rental",
     "LAST_NAME": "HUGHES",
     "FIRST_NAME": "ANNA",
     "CORP_NAME": "",
     "TRADE_NAME": "",
     "BEGIN_RENEWAL": "Sep  1 2014 12:00AM",
     "END_RENEWAL": "Aug 31 2016 12:00AM",
     "STATUS": "Expired",
     "BEGIN_RENEWAL_NET": "2014/09/01",
     "END_RENEWAL_NET": "2016/08/31"
    },
    {
     "ADDRESS": "1526  17TH ST NW",
     "UNIT": " ",
     "SSL": "0156    0034",
     "CUST_NUM": "500519800160",
     "DECRIPTION": "Housing: Residential",
     "ENDORSEMENT_DESC": "One Family Rental",
     "LAST_NAME": "Bittner",
     "FIRST_NAME": "Patrick",
     "CORP_NAME": "Patrick Bittner",
     "TRADE_NAME": "",
     "BEGIN_RENEWAL": "Oct  1 2018 12:00AM",
     "END_RENEWAL": "Sep 30 2020 12:00AM",
     "STATUS": "Active",
     "BEGIN_RENEWAL_NET": "2018/10/01",
     "END_RENEWAL_NET": "2020/09/30"
    },
    {
     "ADDRESS": "1526  17TH ST NW",
     "UNIT": "#218",
     "SSL": "0156    0034",
     "CUST_NUM": "400316901605",
     "DECRIPTION": "General Business",
     "ENDORSEMENT_DESC": "General Business Licenses",
     "LAST_NAME": "",
     "FIRST_NAME": "",
     "CORP_NAME": "Elizabeth Curwen",
     "TRADE_NAME": "",
     "BEGIN_RENEWAL": "Feb  1 2016 12:00AM",
     "END_RENEWAL": "Jan 31 2018 12:00AM",
     "STATUS": "Expired",
     "BEGIN_RENEWAL_NET": "2016/02/01",
     "END_RENEWAL_NET": "2018/01/31"
    },
    {
     "ADDRESS": "1526  17TH ST NW",
     "UNIT": "#302",
     "SSL": "0156    0034",
     "CUST_NUM": "40001018",
     "DECRIPTION": "Housing: Residential",
     "ENDORSEMENT_DESC": "Cooperative Association",
     "LAST_NAME": "",
     "FIRST_NAME": "",
     "CORP_NAME": "CAVANAUGH COURT OWNERS INC",
     "TRADE_NAME": "",
     "BEGIN_RENEWAL": "Jun  1 2014 12:00AM",
     "END_RENEWAL": "May 31 2016 12:00AM",
     "STATUS": "Expired",
     "BEGIN_RENEWAL_NET": "2014/06/01",
     "END_RENEWAL_NET": "2016/05/31"
    },
    {
     "ADDRESS": "1526  17TH ST NW",
     "UNIT": "#302",
     "SSL": "0156    0034",
     "CUST_NUM": "500418000003",
     "DECRIPTION": "Housing: Residential",
     "ENDORSEMENT_DESC": "Cooperative Association",
     "LAST_NAME": "",
     "FIRST_NAME": "",
     "CORP_NAME": "CAVANAUGH COURT OWNERS INC",
     "TRADE_NAME": "",
     "BEGIN_RENEWAL": "Jan  1 2020 12:00AM",
     "END_RENEWAL": "Dec 31 2021 12:00AM",
     "STATUS": "Active",
     "BEGIN_RENEWAL_NET": "2020/01/01",
     "END_RENEWAL_NET": "2021/12/31"
    },
    {
     "ADDRESS": "1526  17TH ST NW",
     "UNIT": "117",
     "SSL": "0156    0034",
     "CUST_NUM": "500519002068",
     "DECRIPTION": "Housing: Residential",
     "ENDORSEMENT_DESC": "One Family Rental",
     "LAST_NAME": "MACARUSO",
     "FIRST_NAME": "DAVID",
     "CORP_NAME": "",
     "TRADE_NAME": "",
     "BEGIN_RENEWAL": "Apr  1 2019 12:00AM",
     "END_RENEWAL": "Mar 31 2021 12:00AM",
     "STATUS": "Active",
     "BEGIN_RENEWAL_NET": "2019/04/01",
     "END_RENEWAL_NET": "2021/03/31"
    },
    {
     "ADDRESS": "1526  17TH ST NW",
     "UNIT": "201",
     "SSL": "0156    0034",
     "CUST_NUM": "500516900189",
     "DECRIPTION": "Housing: Residential",
     "ENDORSEMENT_DESC": "One Family Rental",
     "LAST_NAME": "CARILLO",
     "FIRST_NAME": "JORGE",
     "CORP_NAME": "",
     "TRADE_NAME": "",
     "BEGIN_RENEWAL": "Oct  1 2019 12:00AM",
     "END_RENEWAL": "Sep 30 2021 12:00AM",
     "STATUS": "Active",
     "BEGIN_RENEWAL_NET": "2019/10/01",
     "END_RENEWAL_NET": "2021/09/30"
    },
    {
     "ADDRESS": "1526  17TH ST NW",
     "UNIT": "315",
     "SSL": "0156    0034",
     "CUST_NUM": "500512003325",
     "DECRIPTION": "Housing: Residential",
     "ENDORSEMENT_DESC": "One Family Rental",
     "LAST_NAME": "JO",
     "FIRST_NAME": "CATHERINE",
     "CORP_NAME": "",
     "TRADE_NAME": "",
     "BEGIN_RENEWAL": "Nov  1 2011 12:00AM",
     "END_RENEWAL": "Oct 31 2013 12:00AM",
     "STATUS": "Cancelled",
     "BEGIN_RENEWAL_NET": "2011/11/01",
     "END_RENEWAL_NET": "2013/10/31"
    },
    {
     "ADDRESS": "1526  17TH ST NW",
     "UNIT": "SUITE 302",
     "SSL": "0156    0034",
     "CUST_NUM": "22022",
     "DECRIPTION": "Housing: Residential",
     "ENDORSEMENT_DESC": "Cooperative Association",
     "LAST_NAME": "",
     "FIRST_NAME": "",
     "CORP_NAME": "CAVANAUGH COURT INC",
     "TRADE_NAME": "",
     "BEGIN_RENEWAL": "Jun  1 2001 12:00AM",
     "END_RENEWAL": "May 31 2003 12:00AM",
     "STATUS": "Cancelled",
     "BEGIN_RENEWAL_NET": "2001/06/01",
     "END_RENEWAL_NET": "2003/05/31"
    },
    {
     "ADDRESS": "1536  17TH ST NW",
     "UNIT": "",
     "SSL": "0156    0267",
     "CUST_NUM": "500612000240",
     "DECRIPTION": "Housing: Residential",
     "ENDORSEMENT_DESC": "Two Family Rental",
     "LAST_NAME": "FASANO",
     "FIRST_NAME": "MICHAEL",
     "CORP_NAME": "",
     "TRADE_NAME": "",
     "BEGIN_RENEWAL": "Jul  1 2020 12:00AM",
     "END_RENEWAL": "Jun 30 2022 12:00AM",
     "STATUS": "Ready to Batch Print",
     "BEGIN_RENEWAL_NET": "2020/07/01",
     "END_RENEWAL_NET": "2022/06/30"
    }
   ]
  },
  "permitDetails": {
   "updated": "2020-06-28T18:53:13.896Z",
   "permitData": []
  },
  "inspectionDetails": {
   "updated": "2020-06-28T18:53:14.083Z",
   "inspectionData": []
  },
  "occupancyDetails": {
   "updated": "2020-06-28T18:53:14.273Z",
   "occupancyData": [
    {
     "FULL_ADDRESS": "1526 17TH ST NW #218, Washington, DC 20036",
     "B1_UNIT_START": "#218",
     "SSL": "0156    0034",
     "B1_ALT_ID": "EHOP1690319",
     "TYPE": "Home Occupation/Expedited",
     "G6_STAT_DD": "02/04/2016",
     "B1_APPL_STATUS": "Permit Issued",
     "B1_APPL_STATUS_DATE": "02/04/2016",
     "DESC_OF_WORK": "Independent consultant, journalist, and writer",
     "G6_STAT_DD_NET": "2016/02/04",
     "B1_APPL_STATUS_DATE_NET": "2016/02/04",
     "OWNER_FULL_NAME": "",
     "APPLICANT": "NA NA NA"
    },
    {
     "FULL_ADDRESS": "1526 17TH ST NW, WASHINGTON, DC 20036-",
     "B1_UNIT_START": "",
     "SSL": "",
     "B1_ALT_ID": "HO35975",
     "TYPE": "Home Occupation",
     "G6_STAT_DD": "06/26/2002",
     "B1_APPL_STATUS": "Completed",
     "B1_APPL_STATUS_DATE": "          ",
     "DESC_OF_WORK": "",
     "G6_STAT_DD_NET": "2002/06/26",
     "B1_APPL_STATUS_DATE_NET": "",
     "OWNER_FULL_NAME": "EVANS IV, JOHN EDWARD",
     "APPLICANT": ""
    }
   ]
  },
  "charDetails": {
   "updated": "2020-06-28T19:53:25.175Z",
   "charData": [
    {
     "PREMISEADD": "1536 17TH ST NW",
     "SSL": "0156    0267",
     "BLDG_NUM": "1",
     "COMPLX_NUM": "",
     "UNITNUMBER": "",
     "NUM_UNITS": "0",
     "AYB": "1890",
     "STRUCT_CL_": "",
     "STYLE_D": "3 Story",
     "STRUCT_D": "Row ",
     "GBA": "3824",
     "EXTWALL_D": "Common Brick",
     "WALL_HGT": "",
     "ROOF_D": "Meta",
     "BATHRM": "3",
     "HF_BATHRM": "0",
     "HEAT_D": "Hot ",
     "AC": "N",
     "INTWALL_D": "Hardwood",
     "ROOMS": "8",
     "BEDRM": "2",
     "KITCHENS": "3",
     "FIREPLACES": "0",
     "YR_RMDL": "",
     "EYB": "1957",
     "STORIES": "3",
     "OWNERNAME": "MICHAEL V FASANO",
     "OWNNAME2": "",
     "CAREOFNAME": ""
    }
   ]
  },
  "taxData": {
   "ssl": "0156    0267",
   "address": "1536 17TH ST NW",
   "owner": "MICHAEL V FASANO",
   "neighborhood": "OLD CITY II",
   "sub_neighborhood": "D",
   "use_code": "24",
   "sale_price": "$.00",
   "recordation_date": "N/A",
   "2016_Assessment": "$1,045,780.00"
  }
 },
 "1538 17TH STREET NW": {
  "ownerInfo": {
   "updated": "2020-06-28T17:30:02.491Z",
   "ownerData": [
    {
     "OWNERNAME": "MICHAEL V FASANO",
     "PREMISEADD": "1538 17TH ST NW",
     "UNITNUMBER": "",
     "SSL": "0156    0266",
     "USECODE": "024",
     "HSTDCODE": "",
     "CLASSTYPE": "001",
     "TAXRATE": "0.0085",
     "SALEPRICE": "",
     "SALEDATE": "",
     "INSTNO": "",
     "ACCEPTCODE": "",
     "DEEDDATE": "",
     "OWNNAME2": "",
     "CPMS_ADDRESS": "1538 17TH ST NW",
     "CAREOFNAME": "",
     "ADDRESS1": "1026 16TH ST NW STE 101",
     "ADDRESS2": "",
     "CITYSTZIP": "WASHINGTON                 DC 20036-5711",
     "SALEDATE_NET": "",
     "DEEDDATE_NET": ""
    }
   ]
  },
  "addressDetails": {
   "updated": "2020-06-28T18:11:33.939Z",
   "addressData": [
    {
     "ADDRESS_ID": "225775",
     "MARID": "225775",
     "STATUS": "ACTIVE",
     "FULLADDRESS": "1538 17TH STREET NW",
     "ADDRNUM": "1538",
     "ADDRNUMSUFFIX": "",
     "STNAME": "17TH",
     "STREET_TYPE": "STREET",
     "QUADRANT": "NW",
     "CITY": "WASHINGTON",
     "STATE": "DC",
     "XCOORD": "396639.19",
     "YCOORD": "138112.65",
     "SSL": "0156    0266",
     "ANC": "ANC 2B",
     "PSA": "Police Service Area 208",
     "WARD": "Ward 2",
     "NBHD_ACTION": " ",
     "CLUSTER_": "Cluster 6",
     "POLDIST": "Police District - Second District",
     "ROC": "Police Sector 2D3",
     "CENSUS_TRACT": "005301",
     "VOTE_PRCNCT": "Precinct 15",
     "SMD": "SMD 2B07",
     "ZIPCODE": "20036",
     "NATIONALGRID": "18S UJ 23232 08862",
     "ROADWAYSEGID": "16440",
     "FOCUS_IMPROVEMENT_AREA": "NA",
     "HAS_ALIAS": "N",
     "HAS_CONDO_UNIT": "N",
     "HAS_RES_UNIT": "Y",
     "HAS_SSL": "Y",
     "LATITUDE": "38.91087013",
     "LONGITUDE": "-77.03874997",
     "STREETVIEWURL": "http://maps.google.com/maps?z=16&layer=c&cbll=38.91087013,-77.03874997&cbp=11,284.12702503494,,0,2.09",
     "RES_TYPE": "RESIDENTIAL",
     "WARD_2002": "Ward 2",
     "WARD_2012": "Ward 2",
     "ANC_2002": "ANC 2B",
     "ANC_2012": "ANC 2B",
     "SMD_2002": "SMD 2B07",
     "SMD_2012": "SMD 2B07",
     "IMAGEURL": "http://citizenatlas.dc.gov/mobilevideo",
     "IMAGEDIR": "20040815",
     "IMAGENAME": "QF103641.jpg",
     "ConfidenceLevel": "100",
     "Zoning": "RA-8"
    }
   ]
  },
  "licenseDetails": {
   "updated": "2020-06-28T18:35:42.252Z",
   "licenseData": [
    {
     "ADDRESS": "1400 -1799 17TH ST NW",
     "UNIT": "1799",
     "SSL": "NA",
     "CUST_NUM": "201211000891",
     "DECRIPTION": "Entertainment",
     "ENDORSEMENT_DESC": "Special Events",
     "LAST_NAME": "",
     "FIRST_NAME": "",
     "CORP_NAME": "URBAN NEIGHBORHOOD ALLIANCE",
     "TRADE_NAME": "17TH STREET FESTIVAL",
     "BEGIN_RENEWAL": "",
     "END_RENEWAL": "Sep 25 2011 12:00AM",
     "STATUS": "Expired",
     "BEGIN_RENEWAL_NET": "",
     "END_RENEWAL_NET": "2011/09/25"
    },
    {
     "ADDRESS": "1400 -1799 17TH ST NW",
     "UNIT": "1799",
     "SSL": "NA",
     "CUST_NUM": "201212000094",
     "DECRIPTION": "Entertainment",
     "ENDORSEMENT_DESC": "Special Events",
     "LAST_NAME": "",
     "FIRST_NAME": "",
     "CORP_NAME": "URBAN NEIGHBORHOOD ALLIANCE",
     "TRADE_NAME": "17TH STREET FESTIVAL",
     "BEGIN_RENEWAL": "",
     "END_RENEWAL": "Sep 23 2012 12:00AM",
     "STATUS": "Expired",
     "BEGIN_RENEWAL_NET": "",
     "END_RENEWAL_NET": "2012/09/23"
    },
    {
     "ADDRESS": "1526  17TH ST NW",
     "UNIT": "",
     "SSL": "0156    0034",
     "CUST_NUM": "39700885",
     "DECRIPTION": "Housing: Residential",
     "ENDORSEMENT_DESC": "Apartment",
     "LAST_NAME": "",
     "FIRST_NAME": "",
     "CORP_NAME": "PIER WITH NO END",
     "TRADE_NAME": "",
     "BEGIN_RENEWAL": "Nov  1 1999 12:00AM",
     "END_RENEWAL": "Oct 31 2001 12:00AM",
     "STATUS": "Expired",
     "BEGIN_RENEWAL_NET": "1999/11/01",
     "END_RENEWAL_NET": "2001/10/31"
    },
    {
     "ADDRESS": "1526  17TH ST NW",
     "UNIT": "",
     "SSL": "0156    0034",
     "CUST_NUM": "500514003391",
     "DECRIPTION": "Housing: Residential",
     "ENDORSEMENT_DESC": "One Family Rental",
     "LAST_NAME": "HUGHES",
     "FIRST_NAME": "ANNA",
     "CORP_NAME": "",
     "TRADE_NAME": "",
     "BEGIN_RENEWAL": "Sep  1 2014 12:00AM",
     "END_RENEWAL": "Aug 31 2016 12:00AM",
     "STATUS": "Expired",
     "BEGIN_RENEWAL_NET": "2014/09/01",
     "END_RENEWAL_NET": "2016/08/31"
    },
    {
     "ADDRESS": "1526  17TH ST NW",
     "UNIT": " ",
     "SSL": "0156    0034",
     "CUST_NUM": "500519800160",
     "DECRIPTION": "Housing: Residential",
     "ENDORSEMENT_DESC": "One Family Rental",
     "LAST_NAME": "Bittner",
     "FIRST_NAME": "Patrick",
     "CORP_NAME": "Patrick Bittner",
     "TRADE_NAME": "",
     "BEGIN_RENEWAL": "Oct  1 2018 12:00AM",
     "END_RENEWAL": "Sep 30 2020 12:00AM",
     "STATUS": "Active",
     "BEGIN_RENEWAL_NET": "2018/10/01",
     "END_RENEWAL_NET": "2020/09/30"
    },
    {
     "ADDRESS": "1526  17TH ST NW",
     "UNIT": "#218",
     "SSL": "0156    0034",
     "CUST_NUM": "400316901605",
     "DECRIPTION": "General Business",
     "ENDORSEMENT_DESC": "General Business Licenses",
     "LAST_NAME": "",
     "FIRST_NAME": "",
     "CORP_NAME": "Elizabeth Curwen",
     "TRADE_NAME": "",
     "BEGIN_RENEWAL": "Feb  1 2016 12:00AM",
     "END_RENEWAL": "Jan 31 2018 12:00AM",
     "STATUS": "Expired",
     "BEGIN_RENEWAL_NET": "2016/02/01",
     "END_RENEWAL_NET": "2018/01/31"
    },
    {
     "ADDRESS": "1526  17TH ST NW",
     "UNIT": "#302",
     "SSL": "0156    0034",
     "CUST_NUM": "40001018",
     "DECRIPTION": "Housing: Residential",
     "ENDORSEMENT_DESC": "Cooperative Association",
     "LAST_NAME": "",
     "FIRST_NAME": "",
     "CORP_NAME": "CAVANAUGH COURT OWNERS INC",
     "TRADE_NAME": "",
     "BEGIN_RENEWAL": "Jun  1 2014 12:00AM",
     "END_RENEWAL": "May 31 2016 12:00AM",
     "STATUS": "Expired",
     "BEGIN_RENEWAL_NET": "2014/06/01",
     "END_RENEWAL_NET": "2016/05/31"
    },
    {
     "ADDRESS": "1526  17TH ST NW",
     "UNIT": "#302",
     "SSL": "0156    0034",
     "CUST_NUM": "500418000003",
     "DECRIPTION": "Housing: Residential",
     "ENDORSEMENT_DESC": "Cooperative Association",
     "LAST_NAME": "",
     "FIRST_NAME": "",
     "CORP_NAME": "CAVANAUGH COURT OWNERS INC",
     "TRADE_NAME": "",
     "BEGIN_RENEWAL": "Jan  1 2020 12:00AM",
     "END_RENEWAL": "Dec 31 2021 12:00AM",
     "STATUS": "Active",
     "BEGIN_RENEWAL_NET": "2020/01/01",
     "END_RENEWAL_NET": "2021/12/31"
    },
    {
     "ADDRESS": "1526  17TH ST NW",
     "UNIT": "117",
     "SSL": "0156    0034",
     "CUST_NUM": "500519002068",
     "DECRIPTION": "Housing: Residential",
     "ENDORSEMENT_DESC": "One Family Rental",
     "LAST_NAME": "MACARUSO",
     "FIRST_NAME": "DAVID",
     "CORP_NAME": "",
     "TRADE_NAME": "",
     "BEGIN_RENEWAL": "Apr  1 2019 12:00AM",
     "END_RENEWAL": "Mar 31 2021 12:00AM",
     "STATUS": "Active",
     "BEGIN_RENEWAL_NET": "2019/04/01",
     "END_RENEWAL_NET": "2021/03/31"
    },
    {
     "ADDRESS": "1526  17TH ST NW",
     "UNIT": "201",
     "SSL": "0156    0034",
     "CUST_NUM": "500516900189",
     "DECRIPTION": "Housing: Residential",
     "ENDORSEMENT_DESC": "One Family Rental",
     "LAST_NAME": "CARILLO",
     "FIRST_NAME": "JORGE",
     "CORP_NAME": "",
     "TRADE_NAME": "",
     "BEGIN_RENEWAL": "Oct  1 2019 12:00AM",
     "END_RENEWAL": "Sep 30 2021 12:00AM",
     "STATUS": "Active",
     "BEGIN_RENEWAL_NET": "2019/10/01",
     "END_RENEWAL_NET": "2021/09/30"
    },
    {
     "ADDRESS": "1526  17TH ST NW",
     "UNIT": "315",
     "SSL": "0156    0034",
     "CUST_NUM": "500512003325",
     "DECRIPTION": "Housing: Residential",
     "ENDORSEMENT_DESC": "One Family Rental",
     "LAST_NAME": "JO",
     "FIRST_NAME": "CATHERINE",
     "CORP_NAME": "",
     "TRADE_NAME": "",
     "BEGIN_RENEWAL": "Nov  1 2011 12:00AM",
     "END_RENEWAL": "Oct 31 2013 12:00AM",
     "STATUS": "Cancelled",
     "BEGIN_RENEWAL_NET": "2011/11/01",
     "END_RENEWAL_NET": "2013/10/31"
    },
    {
     "ADDRESS": "1526  17TH ST NW",
     "UNIT": "SUITE 302",
     "SSL": "0156    0034",
     "CUST_NUM": "22022",
     "DECRIPTION": "Housing: Residential",
     "ENDORSEMENT_DESC": "Cooperative Association",
     "LAST_NAME": "",
     "FIRST_NAME": "",
     "CORP_NAME": "CAVANAUGH COURT INC",
     "TRADE_NAME": "",
     "BEGIN_RENEWAL": "Jun  1 2001 12:00AM",
     "END_RENEWAL": "May 31 2003 12:00AM",
     "STATUS": "Cancelled",
     "BEGIN_RENEWAL_NET": "2001/06/01",
     "END_RENEWAL_NET": "2003/05/31"
    },
    {
     "ADDRESS": "1538  17TH ST NW",
     "UNIT": "",
     "SSL": "0156    0266",
     "CUST_NUM": "500612000239",
     "DECRIPTION": "Housing: Residential",
     "ENDORSEMENT_DESC": "Two Family Rental",
     "LAST_NAME": "FASANO",
     "FIRST_NAME": "MICHAEL",
     "CORP_NAME": "",
     "TRADE_NAME": "",
     "BEGIN_RENEWAL": "Jul  1 2020 12:00AM",
     "END_RENEWAL": "Jun 30 2022 12:00AM",
     "STATUS": "Ready to Batch Print",
     "BEGIN_RENEWAL_NET": "2020/07/01",
     "END_RENEWAL_NET": "2022/06/30"
    }
   ]
  },
  "permitDetails": {
   "updated": "2020-06-28T18:53:14.767Z",
   "permitData": []
  },
  "inspectionDetails": {
   "updated": "2020-06-28T18:53:14.934Z",
   "inspectionData": []
  },
  "occupancyDetails": {
   "updated": "2020-06-28T18:53:15.107Z",
   "occupancyData": [
    {
     "FULL_ADDRESS": "1526 17TH ST NW #218, Washington, DC 20036",
     "B1_UNIT_START": "#218",
     "SSL": "0156    0034",
     "B1_ALT_ID": "EHOP1690319",
     "TYPE": "Home Occupation/Expedited",
     "G6_STAT_DD": "02/04/2016",
     "B1_APPL_STATUS": "Permit Issued",
     "B1_APPL_STATUS_DATE": "02/04/2016",
     "DESC_OF_WORK": "Independent consultant, journalist, and writer",
     "G6_STAT_DD_NET": "2016/02/04",
     "B1_APPL_STATUS_DATE_NET": "2016/02/04",
     "OWNER_FULL_NAME": "",
     "APPLICANT": "NA NA NA"
    },
    {
     "FULL_ADDRESS": "1526 17TH ST NW, WASHINGTON, DC 20036-",
     "B1_UNIT_START": "",
     "SSL": "",
     "B1_ALT_ID": "HO35975",
     "TYPE": "Home Occupation",
     "G6_STAT_DD": "06/26/2002",
     "B1_APPL_STATUS": "Completed",
     "B1_APPL_STATUS_DATE": "          ",
     "DESC_OF_WORK": "",
     "G6_STAT_DD_NET": "2002/06/26",
     "B1_APPL_STATUS_DATE_NET": "",
     "OWNER_FULL_NAME": "EVANS IV, JOHN EDWARD",
     "APPLICANT": ""
    }
   ]
  },
  "charDetails": {
   "updated": "2020-06-28T19:53:25.322Z",
   "charData": [
    {
     "PREMISEADD": "1538 17TH ST NW",
     "SSL": "0156    0266",
     "BLDG_NUM": "1",
     "COMPLX_NUM": "",
     "UNITNUMBER": "",
     "NUM_UNITS": "0",
     "AYB": "1891",
     "STRUCT_CL_": "",
     "STYLE_D": "3 Story",
     "STRUCT_D": "Row ",
     "GBA": "3780",
     "EXTWALL_D": "Common Brick",
     "WALL_HGT": "",
     "ROOF_D": "Meta",
     "BATHRM": "2",
     "HF_BATHRM": "1",
     "HEAT_D": "Hot ",
     "AC": "N",
     "INTWALL_D": "Hardwood",
     "ROOMS": "8",
     "BEDRM": "4",
     "KITCHENS": "2",
     "FIREPLACES": "4",
     "YR_RMDL": "1992",
     "EYB": "1957",
     "STORIES": "3",
     "OWNERNAME": "MICHAEL V FASANO",
     "OWNNAME2": "",
     "CAREOFNAME": ""
    }
   ]
  },
  "taxData": {
   "ssl": "0156    0266",
   "address": "1538 17TH ST NW",
   "owner": "MICHAEL V FASANO",
   "neighborhood": "OLD CITY II",
   "sub_neighborhood": "D",
   "use_code": "24",
   "sale_price": "$.00",
   "recordation_date": "N/A",
   "2016_Assessment": "$1,066,260.00"
  }
 },
 "1540 17TH STREET NW": {
  "ownerInfo": {
   "updated": "2020-06-28T17:30:02.854Z",
   "ownerData": [
    {
     "OWNERNAME": "FREY JANICE W",
     "PREMISEADD": "1540 17TH ST NW",
     "UNITNUMBER": "",
     "SSL": "0156    0265",
     "USECODE": "024",
     "HSTDCODE": "",
     "CLASSTYPE": "001",
     "TAXRATE": "0.0085",
     "SALEPRICE": "",
     "SALEDATE": "",
     "INSTNO": "",
     "ACCEPTCODE": "",
     "DEEDDATE": "",
     "OWNNAME2": "",
     "CPMS_ADDRESS": "1540 17TH ST NW",
     "CAREOFNAME": "",
     "ADDRESS1": "3223 RESERVOIR RD NW",
     "ADDRESS2": "",
     "CITYSTZIP": "WASHINGTON                 DC 20007-2943",
     "SALEDATE_NET": "",
     "DEEDDATE_NET": ""
    }
   ]
  },
  "addressDetails": {
   "updated": "2020-06-28T18:11:34.120Z",
   "addressData": [
    {
     "ADDRESS_ID": "225779",
     "MARID": "225779",
     "STATUS": "ACTIVE",
     "FULLADDRESS": "1540 17TH STREET NW",
     "ADDRNUM": "1540",
     "ADDRNUMSUFFIX": "",
     "STNAME": "17TH",
     "STREET_TYPE": "STREET",
     "QUADRANT": "NW",
     "CITY": "WASHINGTON",
     "STATE": "DC",
     "XCOORD": "396639.22",
     "YCOORD": "138118.42",
     "SSL": "0156    0265",
     "ANC": "ANC 2B",
     "PSA": "Police Service Area 208",
     "WARD": "Ward 2",
     "NBHD_ACTION": " ",
     "CLUSTER_": "Cluster 6",
     "POLDIST": "Police District - Second District",
     "ROC": "Police Sector 2D3",
     "CENSUS_TRACT": "005301",
     "VOTE_PRCNCT": "Precinct 15",
     "SMD": "SMD 2B07",
     "ZIPCODE": "20036",
     "NATIONALGRID": "18S UJ 23232 08867",
     "ROADWAYSEGID": "16440",
     "FOCUS_IMPROVEMENT_AREA": "NA",
     "HAS_ALIAS": "N",
     "HAS_CONDO_UNIT": "N",
     "HAS_RES_UNIT": "Y",
     "HAS_SSL": "Y",
     "LATITUDE": "38.91092210",
     "LONGITUDE": "-77.03874965",
     "STREETVIEWURL": "http://maps.google.com/maps?z=16&layer=c&cbll=38.9109221,-77.03874965&cbp=11,189.836232964069,,0,2.09",
     "RES_TYPE": "RESIDENTIAL",
     "WARD_2002": "Ward 2",
     "WARD_2012": "Ward 2",
     "ANC_2002": "ANC 2B",
     "ANC_2012": "ANC 2B",
     "SMD_2002": "SMD 2B07",
     "SMD_2012": "SMD 2B07",
     "IMAGEURL": "http://citizenatlas.dc.gov/mobilevideo",
     "IMAGEDIR": "20040815",
     "IMAGENAME": "QF103722.jpg",
     "ConfidenceLevel": "100",
     "Zoning": "RA-8"
    }
   ]
  },
  "licenseDetails": {
   "updated": "2020-06-28T18:35:42.866Z",
   "licenseData": [
    {
     "ADDRESS": "1400 -1799 17TH ST NW",
     "UNIT": "1799",
     "SSL": "NA",
     "CUST_NUM": "201211000891",
     "DECRIPTION": "Entertainment",
     "ENDORSEMENT_DESC": "Special Events",
     "LAST_NAME": "",
     "FIRST_NAME": "",
     "CORP_NAME": "URBAN NEIGHBORHOOD ALLIANCE",
     "TRADE_NAME": "17TH STREET FESTIVAL",
     "BEGIN_RENEWAL": "",
     "END_RENEWAL": "Sep 25 2011 12:00AM",
     "STATUS": "Expired",
     "BEGIN_RENEWAL_NET": "",
     "END_RENEWAL_NET": "2011/09/25"
    },
    {
     "ADDRESS": "1400 -1799 17TH ST NW",
     "UNIT": "1799",
     "SSL": "NA",
     "CUST_NUM": "201212000094",
     "DECRIPTION": "Entertainment",
     "ENDORSEMENT_DESC": "Special Events",
     "LAST_NAME": "",
     "FIRST_NAME": "",
     "CORP_NAME": "URBAN NEIGHBORHOOD ALLIANCE",
     "TRADE_NAME": "17TH STREET FESTIVAL",
     "BEGIN_RENEWAL": "",
     "END_RENEWAL": "Sep 23 2012 12:00AM",
     "STATUS": "Expired",
     "BEGIN_RENEWAL_NET": "",
     "END_RENEWAL_NET": "2012/09/23"
    },
    {
     "ADDRESS": "1526  17TH ST NW",
     "UNIT": "",
     "SSL": "0156    0034",
     "CUST_NUM": "39700885",
     "DECRIPTION": "Housing: Residential",
     "ENDORSEMENT_DESC": "Apartment",
     "LAST_NAME": "",
     "FIRST_NAME": "",
     "CORP_NAME": "PIER WITH NO END",
     "TRADE_NAME": "",
     "BEGIN_RENEWAL": "Nov  1 1999 12:00AM",
     "END_RENEWAL": "Oct 31 2001 12:00AM",
     "STATUS": "Expired",
     "BEGIN_RENEWAL_NET": "1999/11/01",
     "END_RENEWAL_NET": "2001/10/31"
    },
    {
     "ADDRESS": "1526  17TH ST NW",
     "UNIT": "",
     "SSL": "0156    0034",
     "CUST_NUM": "500514003391",
     "DECRIPTION": "Housing: Residential",
     "ENDORSEMENT_DESC": "One Family Rental",
     "LAST_NAME": "HUGHES",
     "FIRST_NAME": "ANNA",
     "CORP_NAME": "",
     "TRADE_NAME": "",
     "BEGIN_RENEWAL": "Sep  1 2014 12:00AM",
     "END_RENEWAL": "Aug 31 2016 12:00AM",
     "STATUS": "Expired",
     "BEGIN_RENEWAL_NET": "2014/09/01",
     "END_RENEWAL_NET": "2016/08/31"
    },
    {
     "ADDRESS": "1526  17TH ST NW",
     "UNIT": " ",
     "SSL": "0156    0034",
     "CUST_NUM": "500519800160",
     "DECRIPTION": "Housing: Residential",
     "ENDORSEMENT_DESC": "One Family Rental",
     "LAST_NAME": "Bittner",
     "FIRST_NAME": "Patrick",
     "CORP_NAME": "Patrick Bittner",
     "TRADE_NAME": "",
     "BEGIN_RENEWAL": "Oct  1 2018 12:00AM",
     "END_RENEWAL": "Sep 30 2020 12:00AM",
     "STATUS": "Active",
     "BEGIN_RENEWAL_NET": "2018/10/01",
     "END_RENEWAL_NET": "2020/09/30"
    },
    {
     "ADDRESS": "1526  17TH ST NW",
     "UNIT": "#218",
     "SSL": "0156    0034",
     "CUST_NUM": "400316901605",
     "DECRIPTION": "General Business",
     "ENDORSEMENT_DESC": "General Business Licenses",
     "LAST_NAME": "",
     "FIRST_NAME": "",
     "CORP_NAME": "Elizabeth Curwen",
     "TRADE_NAME": "",
     "BEGIN_RENEWAL": "Feb  1 2016 12:00AM",
     "END_RENEWAL": "Jan 31 2018 12:00AM",
     "STATUS": "Expired",
     "BEGIN_RENEWAL_NET": "2016/02/01",
     "END_RENEWAL_NET": "2018/01/31"
    },
    {
     "ADDRESS": "1526  17TH ST NW",
     "UNIT": "#302",
     "SSL": "0156    0034",
     "CUST_NUM": "40001018",
     "DECRIPTION": "Housing: Residential",
     "ENDORSEMENT_DESC": "Cooperative Association",
     "LAST_NAME": "",
     "FIRST_NAME": "",
     "CORP_NAME": "CAVANAUGH COURT OWNERS INC",
     "TRADE_NAME": "",
     "BEGIN_RENEWAL": "Jun  1 2014 12:00AM",
     "END_RENEWAL": "May 31 2016 12:00AM",
     "STATUS": "Expired",
     "BEGIN_RENEWAL_NET": "2014/06/01",
     "END_RENEWAL_NET": "2016/05/31"
    },
    {
     "ADDRESS": "1526  17TH ST NW",
     "UNIT": "#302",
     "SSL": "0156    0034",
     "CUST_NUM": "500418000003",
     "DECRIPTION": "Housing: Residential",
     "ENDORSEMENT_DESC": "Cooperative Association",
     "LAST_NAME": "",
     "FIRST_NAME": "",
     "CORP_NAME": "CAVANAUGH COURT OWNERS INC",
     "TRADE_NAME": "",
     "BEGIN_RENEWAL": "Jan  1 2020 12:00AM",
     "END_RENEWAL": "Dec 31 2021 12:00AM",
     "STATUS": "Active",
     "BEGIN_RENEWAL_NET": "2020/01/01",
     "END_RENEWAL_NET": "2021/12/31"
    },
    {
     "ADDRESS": "1526  17TH ST NW",
     "UNIT": "117",
     "SSL": "0156    0034",
     "CUST_NUM": "500519002068",
     "DECRIPTION": "Housing: Residential",
     "ENDORSEMENT_DESC": "One Family Rental",
     "LAST_NAME": "MACARUSO",
     "FIRST_NAME": "DAVID",
     "CORP_NAME": "",
     "TRADE_NAME": "",
     "BEGIN_RENEWAL": "Apr  1 2019 12:00AM",
     "END_RENEWAL": "Mar 31 2021 12:00AM",
     "STATUS": "Active",
     "BEGIN_RENEWAL_NET": "2019/04/01",
     "END_RENEWAL_NET": "2021/03/31"
    },
    {
     "ADDRESS": "1526  17TH ST NW",
     "UNIT": "201",
     "SSL": "0156    0034",
     "CUST_NUM": "500516900189",
     "DECRIPTION": "Housing: Residential",
     "ENDORSEMENT_DESC": "One Family Rental",
     "LAST_NAME": "CARILLO",
     "FIRST_NAME": "JORGE",
     "CORP_NAME": "",
     "TRADE_NAME": "",
     "BEGIN_RENEWAL": "Oct  1 2019 12:00AM",
     "END_RENEWAL": "Sep 30 2021 12:00AM",
     "STATUS": "Active",
     "BEGIN_RENEWAL_NET": "2019/10/01",
     "END_RENEWAL_NET": "2021/09/30"
    },
    {
     "ADDRESS": "1526  17TH ST NW",
     "UNIT": "315",
     "SSL": "0156    0034",
     "CUST_NUM": "500512003325",
     "DECRIPTION": "Housing: Residential",
     "ENDORSEMENT_DESC": "One Family Rental",
     "LAST_NAME": "JO",
     "FIRST_NAME": "CATHERINE",
     "CORP_NAME": "",
     "TRADE_NAME": "",
     "BEGIN_RENEWAL": "Nov  1 2011 12:00AM",
     "END_RENEWAL": "Oct 31 2013 12:00AM",
     "STATUS": "Cancelled",
     "BEGIN_RENEWAL_NET": "2011/11/01",
     "END_RENEWAL_NET": "2013/10/31"
    },
    {
     "ADDRESS": "1526  17TH ST NW",
     "UNIT": "SUITE 302",
     "SSL": "0156    0034",
     "CUST_NUM": "22022",
     "DECRIPTION": "Housing: Residential",
     "ENDORSEMENT_DESC": "Cooperative Association",
     "LAST_NAME": "",
     "FIRST_NAME": "",
     "CORP_NAME": "CAVANAUGH COURT INC",
     "TRADE_NAME": "",
     "BEGIN_RENEWAL": "Jun  1 2001 12:00AM",
     "END_RENEWAL": "May 31 2003 12:00AM",
     "STATUS": "Cancelled",
     "BEGIN_RENEWAL_NET": "2001/06/01",
     "END_RENEWAL_NET": "2003/05/31"
    },
    {
     "ADDRESS": "1540  17TH ST NW",
     "UNIT": "",
     "SSL": "0156    0265",
     "CUST_NUM": "500112000465",
     "DECRIPTION": "Housing: Residential",
     "ENDORSEMENT_DESC": "Apartment",
     "LAST_NAME": "FREY",
     "FIRST_NAME": "JANICE",
     "CORP_NAME": "",
     "TRADE_NAME": "",
     "BEGIN_RENEWAL": "Jul  1 2018 12:00AM",
     "END_RENEWAL": "Jun 30 2020 12:00AM",
     "STATUS": "Ready to Renew",
     "BEGIN_RENEWAL_NET": "2018/07/01",
     "END_RENEWAL_NET": "2020/06/30"
    }
   ]
  },
  "permitDetails": {
   "updated": "2020-06-28T18:53:15.865Z",
   "permitData": []
  },
  "inspectionDetails": {
   "updated": "2020-06-28T18:53:16.086Z",
   "inspectionData": [
    {
     "ADDRESS": "1540 17TH ST NW, WASHINGTON, DC 20036",
     "UNIT": "",
     "SSL": "0156    0265",
     "ID": "CO1202536",
     "G6_ACT_DES": "Zoning Use",
     "G6_STATUS": "Cancelled",
     "G6_STATUS_DD": "7/19/2012 12:00:00 AM",
     "DESC_OF_WORK": "APARTMENT BUILDING 4 UNITS.",
     "G6_STATUS_DD_NET": "2012/07/19",
     "OWNER_FULL_NAME": "FREY JANICE W",
     "APPLICANT": "JANICE W. FREY"
    },
    {
     "ADDRESS": "1540 17TH ST NW, WASHINGTON, DC 20036",
     "UNIT": "",
     "SSL": "0156    0265",
     "ID": "CO1202536",
     "G6_ACT_DES": "Zoning Use",
     "G6_STATUS": "Rescheduled",
     "G6_STATUS_DD": "7/19/2012 12:00:00 AM",
     "DESC_OF_WORK": "APARTMENT BUILDING 4 UNITS.",
     "G6_STATUS_DD_NET": "2012/07/19",
     "OWNER_FULL_NAME": "FREY JANICE W",
     "APPLICANT": "JANICE W. FREY"
    },
    {
     "ADDRESS": "1540 17TH ST NW, WASHINGTON, DC 20036",
     "UNIT": "",
     "SSL": "0156    0265",
     "ID": "CO1202536",
     "G6_ACT_DES": "Zoning Use",
     "G6_STATUS": "Rescheduled",
     "G6_STATUS_DD": "7/18/2012 12:00:00 AM",
     "DESC_OF_WORK": "APARTMENT BUILDING 4 UNITS.",
     "G6_STATUS_DD_NET": "2012/07/18",
     "OWNER_FULL_NAME": "FREY JANICE W",
     "APPLICANT": "JANICE W. FREY"
    }
   ]
  },
  "occupancyDetails": {
   "updated": "2020-06-28T18:53:16.306Z",
   "occupancyData": [
    {
     "FULL_ADDRESS": "1540 17TH ST NW, WASHINGTON, DC 20036",
     "B1_UNIT_START": "",
     "SSL": "0156    0265",
     "B1_ALT_ID": "CO1202536",
     "TYPE": "Certificate of Occupancy",
     "G6_STAT_DD": "",
     "B1_APPL_STATUS": "Application Accepted",
     "B1_APPL_STATUS_DATE": "07/12/2012",
     "DESC_OF_WORK": "Ownership ChangeAPARTMENT BUILDING 4 UNITS.",
     "G6_STAT_DD_NET": "",
     "B1_APPL_STATUS_DATE_NET": "2012/07/12",
     "OWNER_FULL_NAME": "FREY JANICE W",
     "APPLICANT": "JANICE W. FREY"
    },
    {
     "FULL_ADDRESS": "1526 17TH ST NW #218, Washington, DC 20036",
     "B1_UNIT_START": "#218",
     "SSL": "0156    0034",
     "B1_ALT_ID": "EHOP1690319",
     "TYPE": "Home Occupation/Expedited",
     "G6_STAT_DD": "02/04/2016",
     "B1_APPL_STATUS": "Permit Issued",
     "B1_APPL_STATUS_DATE": "02/04/2016",
     "DESC_OF_WORK": "Independent consultant, journalist, and writer",
     "G6_STAT_DD_NET": "2016/02/04",
     "B1_APPL_STATUS_DATE_NET": "2016/02/04",
     "OWNER_FULL_NAME": "",
     "APPLICANT": "NA NA NA"
    },
    {
     "FULL_ADDRESS": "1526 17TH ST NW, WASHINGTON, DC 20036-",
     "B1_UNIT_START": "",
     "SSL": "",
     "B1_ALT_ID": "HO35975",
     "TYPE": "Home Occupation",
     "G6_STAT_DD": "06/26/2002",
     "B1_APPL_STATUS": "Completed",
     "B1_APPL_STATUS_DATE": "          ",
     "DESC_OF_WORK": "",
     "G6_STAT_DD_NET": "2002/06/26",
     "B1_APPL_STATUS_DATE_NET": "",
     "OWNER_FULL_NAME": "EVANS IV, JOHN EDWARD",
     "APPLICANT": ""
    }
   ]
  },
  "charDetails": {
   "updated": "2020-06-28T19:53:25.472Z",
   "charData": [
    {
     "PREMISEADD": "1540 17TH ST NW",
     "SSL": "0156    0265",
     "BLDG_NUM": "1",
     "COMPLX_NUM": "",
     "UNITNUMBER": "",
     "NUM_UNITS": "0",
     "AYB": "1900",
     "STRUCT_CL_": "",
     "STYLE_D": "3 Story",
     "STRUCT_D": "Row ",
     "GBA": "3821",
     "EXTWALL_D": "Brick/Stone",
     "WALL_HGT": "",
     "ROOF_D": "Buil",
     "BATHRM": "4",
     "HF_BATHRM": "0",
     "HEAT_D": "Warm",
     "AC": "Y",
     "INTWALL_D": "Hardwood",
     "ROOMS": "10",
     "BEDRM": "4",
     "KITCHENS": "3",
     "FIREPLACES": "3",
     "YR_RMDL": "",
     "EYB": "1957",
     "STORIES": "3",
     "OWNERNAME": "FREY JANICE W",
     "OWNNAME2": "",
     "CAREOFNAME": ""
    }
   ]
  },
  "taxData": {
   "ssl": "0156    0265",
   "address": "1540 17TH ST NW",
   "owner": "FREY JANICE W",
   "neighborhood": "OLD CITY II",
   "sub_neighborhood": "D",
   "use_code": "24",
   "sale_price": "$.00",
   "recordation_date": "N/A",
   "2016_Assessment": "$1,061,700.00"
  }
 },
 "1708 Q STREET NW": {
  "ownerInfo": {
   "updated": "2020-06-28T17:30:05.749Z",
   "ownerData": [
    {
     "OWNERNAME": "CHERI BELZ REVOCABLE TRUST",
     "PREMISEADD": "1708 Q ST NW",
     "UNITNUMBER": "",
     "SSL": "0156    0260",
     "USECODE": "024",
     "HSTDCODE": "",
     "CLASSTYPE": "001",
     "TAXRATE": "0.0085",
     "SALEPRICE": "",
     "SALEDATE": "",
     "INSTNO": "",
     "ACCEPTCODE": "",
     "DEEDDATE": "",
     "OWNNAME2": "",
     "CPMS_ADDRESS": "1708 Q ST NW",
     "CAREOFNAME": "",
     "ADDRESS1": "601 KALMIA AVE",
     "ADDRESS2": "",
     "CITYSTZIP": "BOULDER                    CO 80304-1735",
     "SALEDATE_NET": "",
     "DEEDDATE_NET": ""
    }
   ]
  },
  "addressDetails": {
   "updated": "2020-06-28T18:11:36.527Z",
   "addressData": [
    {
     "ADDRESS_ID": "225842",
     "MARID": "225842",
     "STATUS": "ACTIVE",
     "FULLADDRESS": "1708 Q STREET NW",
     "ADDRNUM": "1708",
     "ADDRNUMSUFFIX": "",
     "STNAME": "Q",
     "STREET_TYPE": "STREET",
     "QUADRANT": "NW",
     "CITY": "WASHINGTON",
     "STATE": "DC",
     "XCOORD": "396608.30",
     "YCOORD": "138120.72",
     "SSL": "0156    0260",
     "ANC": "ANC 2B",
     "PSA": "Police Service Area 208",
     "WARD": "Ward 2",
     "NBHD_ACTION": " ",
     "CLUSTER_": "Cluster 6",
     "POLDIST": "Police District - Second District",
     "ROC": "Police Sector 2D3",
     "CENSUS_TRACT": "005301",
     "VOTE_PRCNCT": "Precinct 15",
     "SMD": "SMD 2B07",
     "ZIPCODE": "20009",
     "NATIONALGRID": "18S UJ 23201 08870",
     "ROADWAYSEGID": "9008",
     "FOCUS_IMPROVEMENT_AREA": "NA",
     "HAS_ALIAS": "N",
     "HAS_CONDO_UNIT": "N",
     "HAS_RES_UNIT": "Y",
     "HAS_SSL": "Y",
     "LATITUDE": "38.91094270",
     "LONGITUDE": "-77.03910617",
     "STREETVIEWURL": "http://maps.google.com/maps?z=16&layer=c&cbll=38.9109427,-77.03910617&cbp=11,170.57331465699,,0,2.09",
     "RES_TYPE": "RESIDENTIAL",
     "WARD_2002": "Ward 2",
     "WARD_2012": "Ward 2",
     "ANC_2002": "ANC 2B",
     "ANC_2012": "ANC 2B",
     "SMD_2002": "SMD 2B07",
     "SMD_2012": "SMD 2B07",
     "IMAGEURL": "http://citizenatlas.dc.gov/mobilevideo",
     "IMAGEDIR": "20040804",
     "IMAGENAME": "Q4132117.jpg",
     "ConfidenceLevel": "100",
     "Zoning": "RA-8"
    }
   ]
  },
  "licenseDetails": {
   "updated": "2020-06-28T18:35:48.480Z",
   "licenseData": [
    {
     "ADDRESS": "1708  Q ST NW",
     "UNIT": "",
     "SSL": "0156    0260",
     "CUST_NUM": "39209339",
     "DECRIPTION": "Housing: Residential",
     "ENDORSEMENT_DESC": "Apartment",
     "LAST_NAME": "BELZ",
     "FIRST_NAME": "CHERI",
     "CORP_NAME": "",
     "TRADE_NAME": "",
     "BEGIN_RENEWAL": "Nov  1 2019 12:00AM",
     "END_RENEWAL": "Oct 31 2021 12:00AM",
     "STATUS": "Active",
     "BEGIN_RENEWAL_NET": "2019/11/01",
     "END_RENEWAL_NET": "2021/10/31"
    }
   ]
  },
  "permitDetails": {
   "updated": "2020-06-28T18:53:42.198Z",
   "permitData": [
    {
     "FULL_ADDRESS": "1708 Q ST NW, WASHINGTON, DC 20009",
     "B1_UNIT_START": "",
     "SSL": "0156    0260",
     "B1_ALT_ID": "E1806494",
     "TYPE": "Supplemental/Electrical",
     "G6_STAT_DD": "May  3 2018 12:00AM",
     "B1_APPL_STATUS": "Permit Issued",
     "B1_APPL_STATUS_DATE": "05/03/2018",
     "DESC_OF_WORK": "",
     "SORT_DATE": null,
     "G6_STAT_DD_NET": "2018/05/03",
     "B1_APPL_STATUS_DATE_NET": "2018/05/03",
     "JOB_CLASS_CODE": "N/A",
     "JOB_SIZE": "N/A",
     "JOB_CLASSIFICATION": "N/A",
     "JOB_REVIEW_TIME": "N/A",
     "OWNER_NAME": "CHERI BELZ REVOCABLE TRUST",
     "OWNER_FULL_NAME": "CHERI BELZ REVOCABLE TRUST",
     "APPLICANT_NAME": "JAMES D BORROR",
     "TRADE_NAME": "",
     "PERMIT_STATUS": [
      {
       "REVIEW_STATUS": "",
       "DISCIPLINE": "",
       "REVIEW_STATUS_DATE": ""
      }
     ]
    }
   ]
  },
  "inspectionDetails": {
   "updated": "2020-06-28T18:53:42.467Z",
   "inspectionData": []
  },
  "occupancyDetails": {
   "updated": "2020-06-28T18:53:42.774Z",
   "occupancyData": []
  },
  "charDetails": {
   "updated": "2020-06-28T19:53:27.022Z",
   "charData": [
    {
     "PREMISEADD": "1708 Q ST NW",
     "SSL": "0156    0260",
     "BLDG_NUM": "1",
     "COMPLX_NUM": "",
     "UNITNUMBER": "",
     "NUM_UNITS": "0",
     "AYB": "1890",
     "STRUCT_CL_": "",
     "STYLE_D": "3 Story",
     "STRUCT_D": "Row ",
     "GBA": "4635",
     "EXTWALL_D": "Stone",
     "WALL_HGT": "",
     "ROOF_D": "Buil",
     "BATHRM": "4",
     "HF_BATHRM": "0",
     "HEAT_D": "Hot ",
     "AC": "N",
     "INTWALL_D": "Hardwood",
     "ROOMS": "11",
     "BEDRM": "7",
     "KITCHENS": "2",
     "FIREPLACES": "2",
     "YR_RMDL": "1947",
     "EYB": "1964",
     "STORIES": "3",
     "OWNERNAME": "CHERI BELZ REVOCABLE TRUST",
     "OWNNAME2": "",
     "CAREOFNAME": ""
    }
   ]
  },
  "taxData": {
   "ssl": "0156    0260",
   "address": "1708 Q ST NW",
   "owner": "CHERI BELZ REVOCABLE TRUST",
   "neighborhood": "OLD CITY II",
   "sub_neighborhood": "D",
   "use_code": "24",
   "sale_price": "$.00",
   "recordation_date": "N/A",
   "2016_Assessment": "$1,327,560.00"
  }
 },
 "1709 P STREET NW": {
  "ownerInfo": {
   "updated": "2020-06-28T17:30:05.906Z",
   "ownerData": [
    {
     "OWNERNAME": "DANA L WHITMAN",
     "PREMISEADD": "1709 P ST NW",
     "UNITNUMBER": "",
     "SSL": "0156    0803",
     "USECODE": "024",
     "HSTDCODE": "",
     "CLASSTYPE": "001",
     "TAXRATE": "0.0085",
     "SALEPRICE": "",
     "SALEDATE": "02/29/2000",
     "INSTNO": "",
     "ACCEPTCODE": "",
     "DEEDDATE": "02/29/2000",
     "OWNNAME2": "DEAN J STORER",
     "CPMS_ADDRESS": "1709 P ST NW",
     "CAREOFNAME": "",
     "ADDRESS1": "1616 RIGGS PL NW",
     "ADDRESS2": "",
     "CITYSTZIP": "WASHINGTON                 DC 20009-6417",
     "SALEDATE_NET": "2000/02/29",
     "DEEDDATE_NET": "2000/02/29"
    }
   ]
  },
  "addressDetails": {
   "updated": "2020-06-28T18:11:36.696Z",
   "addressData": [
    {
     "ADDRESS_ID": "225843",
     "MARID": "225843",
     "STATUS": "ACTIVE",
     "FULLADDRESS": "1709 P STREET NW",
     "ADDRNUM": "1709",
     "ADDRNUMSUFFIX": "",
     "STNAME": "P",
     "STREET_TYPE": "STREET",
     "QUADRANT": "NW",
     "CITY": "WASHINGTON",
     "STATE": "DC",
     "XCOORD": "396605.99",
     "YCOORD": "137997.99",
     "SSL": "0156    0803",
     "ANC": "ANC 2B",
     "PSA": "Police Service Area 208",
     "WARD": "Ward 2",
     "NBHD_ACTION": " ",
     "CLUSTER_": "Cluster 6",
     "POLDIST": "Police District - Second District",
     "ROC": "Police Sector 2D3",
     "CENSUS_TRACT": "005301",
     "VOTE_PRCNCT": "Precinct 15",
     "SMD": "SMD 2B07",
     "ZIPCODE": "20036",
     "NATIONALGRID": "18S UJ 23196 08748",
     "ROADWAYSEGID": "11005",
     "FOCUS_IMPROVEMENT_AREA": "NA",
     "HAS_ALIAS": "N",
     "HAS_CONDO_UNIT": "N",
     "HAS_RES_UNIT": "Y",
     "HAS_SSL": "Y",
     "LATITUDE": "38.90983710",
     "LONGITUDE": "-77.03913220",
     "STREETVIEWURL": "http://maps.google.com/maps?z=16&layer=c&cbll=38.9098371,-77.0391322&cbp=11,9.28939716585377,,0,2.09",
     "RES_TYPE": "RESIDENTIAL",
     "WARD_2002": "Ward 2",
     "WARD_2012": "Ward 2",
     "ANC_2002": "ANC 2B",
     "ANC_2012": "ANC 2B",
     "SMD_2002": "SMD 2B07",
     "SMD_2012": "SMD 2B07",
     "IMAGEURL": "http://citizenatlas.dc.gov/mobilevideo",
     "IMAGEDIR": "20040804",
     "IMAGENAME": "Q4130606.jpg",
     "ConfidenceLevel": "100",
     "Zoning": "RA-8"
    }
   ]
  },
  "licenseDetails": {
   "updated": "2020-06-28T18:35:49.191Z",
   "licenseData": [
    {
     "ADDRESS": "1709  P ST NW",
     "UNIT": "",
     "SSL": "0156    0803",
     "CUST_NUM": "41002789",
     "DECRIPTION": "Housing: Residential",
     "ENDORSEMENT_DESC": "Apartment",
     "LAST_NAME": "WHITMAN",
     "FIRST_NAME": "DANA",
     "CORP_NAME": "",
     "TRADE_NAME": "",
     "BEGIN_RENEWAL": "Nov  1 2007 12:00AM",
     "END_RENEWAL": "Oct 31 2009 12:00AM",
     "STATUS": "Expired",
     "BEGIN_RENEWAL_NET": "2007/11/01",
     "END_RENEWAL_NET": "2009/10/31"
    },
    {
     "ADDRESS": "1709  P ST NW",
     "UNIT": "",
     "SSL": "0156    0803",
     "CUST_NUM": "69009140",
     "DECRIPTION": "Housing: Residential",
     "ENDORSEMENT_DESC": "Apartment",
     "LAST_NAME": "",
     "FIRST_NAME": "",
     "CORP_NAME": "DC GUEST APARTMENTS LLC",
     "TRADE_NAME": "",
     "BEGIN_RENEWAL": "Oct  1 2019 12:00AM",
     "END_RENEWAL": "Sep 30 2021 12:00AM",
     "STATUS": "Active",
     "BEGIN_RENEWAL_NET": "2019/10/01",
     "END_RENEWAL_NET": "2021/09/30"
    }
   ]
  },
  "permitDetails": {
   "updated": "2020-06-28T18:53:42.954Z",
   "permitData": [
    {
     "FULL_ADDRESS": "1709 P ST NW, WASHINGTON, DC 20036",
     "B1_UNIT_START": "",
     "SSL": "",
     "B1_ALT_ID": "SR19SO01302",
     "TYPE": "Surveyors/Customer Request",
     "G6_STAT_DD": "Jan  1 1900 12:00AM",
     "B1_APPL_STATUS": "Ready For Pickup",
     "B1_APPL_STATUS_DATE": "11/30/2018",
     "DESC_OF_WORK": "        ===> Count: 1,  Process: Expedite,  Delivery: Pickup",
     "SORT_DATE": null,
     "G6_STAT_DD_NET": "",
     "B1_APPL_STATUS_DATE_NET": "2018/11/30",
     "JOB_CLASS_CODE": "N/A",
     "JOB_SIZE": "N/A",
     "JOB_CLASSIFICATION": "N/A",
     "JOB_REVIEW_TIME": "N/A",
     "OWNER_NAME": "",
     "OWNER_FULL_NAME": "",
     "APPLICANT_NAME": "DANA L WHITMAN",
     "TRADE_NAME": "",
     "PERMIT_STATUS": [
      {
       "REVIEW_STATUS": "",
       "DISCIPLINE": "",
       "REVIEW_STATUS_DATE": ""
      }
     ]
    }
   ]
  },
  "inspectionDetails": {
   "updated": "2020-06-28T18:53:43.140Z",
   "inspectionData": [
    {
     "ADDRESS": "1709 P ST NW, WASHINGTON, DC -",
     "UNIT": "",
     "SSL": "0156    0803",
     "ID": "ECC174672",
     "G6_ACT_DES": "Water Service Plumbing",
     "G6_STATUS": "Cancelled",
     "G6_STATUS_DD": "2/20/2007 12:00:00 AM",
     "DESC_OF_WORK": "",
     "G6_STATUS_DD_NET": "2007/02/20",
     "OWNER_FULL_NAME": "",
     "APPLICANT": "MIKE  WHITEHEAD; MIKE  WHITEHEAD"
    }
   ]
  },
  "occupancyDetails": {
   "updated": "2020-06-28T18:53:43.326Z",
   "occupancyData": [
    {
     "FULL_ADDRESS": "1709 P ST NW, WASHINGTON, DC 20036-1324",
     "B1_UNIT_START": "",
     "SSL": "",
     "B1_ALT_ID": "CO13857",
     "TYPE": "Certificate of Occupancy",
     "G6_STAT_DD": "",
     "B1_APPL_STATUS": "Open",
     "B1_APPL_STATUS_DATE": "          ",
     "DESC_OF_WORK": "UPTOWN ARTS OVERLAY",
     "G6_STAT_DD_NET": "",
     "B1_APPL_STATUS_DATE_NET": "",
     "OWNER_FULL_NAME": "SERAFINI",
     "APPLICANT": ""
    },
    {
     "FULL_ADDRESS": "1709 P ST NW, WASHINGTON, DC 20036-1324",
     "B1_UNIT_START": "",
     "SSL": "",
     "B1_ALT_ID": "CO13872",
     "TYPE": "Certificate of Occupancy",
     "G6_STAT_DD": "06/27/2001",
     "B1_APPL_STATUS": "Completed",
     "B1_APPL_STATUS_DATE": "          ",
     "DESC_OF_WORK": "HISTORIC PRESERVATION HOLD",
     "G6_STAT_DD_NET": "2001/06/27",
     "B1_APPL_STATUS_DATE_NET": "",
     "OWNER_FULL_NAME": "VAUGHTER",
     "APPLICANT": ""
    }
   ]
  },
  "charDetails": {
   "updated": "2020-06-28T19:53:27.182Z",
   "charData": [
    {
     "PREMISEADD": "1709 P ST NW",
     "SSL": "0156    0803",
     "BLDG_NUM": "1",
     "COMPLX_NUM": "",
     "UNITNUMBER": "",
     "NUM_UNITS": "0",
     "AYB": "1890",
     "STRUCT_CL_": "",
     "STYLE_D": "3 Story",
     "STRUCT_D": "Row ",
     "GBA": "4456",
     "EXTWALL_D": "Common Brick",
     "WALL_HGT": "",
     "ROOF_D": "Meta",
     "BATHRM": "4",
     "HF_BATHRM": "0",
     "HEAT_D": "Warm",
     "AC": "Y",
     "INTWALL_D": "Hardwood",
     "ROOMS": "12",
     "BEDRM": "4",
     "KITCHENS": "4",
     "FIREPLACES": "0",
     "YR_RMDL": "2000",
     "EYB": "1966",
     "STORIES": "3",
     "OWNERNAME": "DANA L WHITMAN",
     "OWNNAME2": "DEAN J STORER",
     "CAREOFNAME": ""
    }
   ]
  },
  "taxData": {
   "ssl": "0156    0803",
   "address": "1709 P ST NW",
   "owner": "DANA L WHITMAN",
   "neighborhood": "OLD CITY II",
   "sub_neighborhood": "D",
   "use_code": "24",
   "sale_price": "$.00",
   "recordation_date": "02/29/2000",
   "2016_Assessment": "$1,497,410.00"
  }
 },
 "1712 Q STREET NW": {
  "ownerInfo": {
   "updated": "2020-06-28T17:30:06.567Z",
   "ownerData": [
    {
     "OWNERNAME": "ELEANOR M RICE",
     "PREMISEADD": "1712 Q ST NW",
     "UNITNUMBER": "",
     "SSL": "0156    0248",
     "USECODE": "024",
     "HSTDCODE": "",
     "CLASSTYPE": "001",
     "TAXRATE": "0.0085",
     "SALEPRICE": "",
     "SALEDATE": "04/06/2004",
     "INSTNO": "",
     "ACCEPTCODE": "BUYER=SELLER",
     "DEEDDATE": "04/06/2004",
     "OWNNAME2": "",
     "CPMS_ADDRESS": "1712 Q ST NW",
     "CAREOFNAME": "",
     "ADDRESS1": "9320 W PARKHILL DR",
     "ADDRESS2": "",
     "CITYSTZIP": "BETHESDA                   MD 20814-3967",
     "SALEDATE_NET": "2004/04/06",
     "DEEDDATE_NET": "2004/04/06"
    }
   ]
  },
  "addressDetails": {
   "updated": "2020-06-28T18:11:37.502Z",
   "addressData": [
    {
     "ADDRESS_ID": "225846",
     "MARID": "225846",
     "STATUS": "ACTIVE",
     "FULLADDRESS": "1712 Q STREET NW",
     "ADDRNUM": "1712",
     "ADDRNUMSUFFIX": "",
     "STNAME": "Q",
     "STREET_TYPE": "STREET",
     "QUADRANT": "NW",
     "CITY": "WASHINGTON",
     "STATE": "DC",
     "XCOORD": "396592.64",
     "YCOORD": "138120.37",
     "SSL": "0156    0248",
     "ANC": "ANC 2B",
     "PSA": "Police Service Area 208",
     "WARD": "Ward 2",
     "NBHD_ACTION": " ",
     "CLUSTER_": "Cluster 6",
     "POLDIST": "Police District - Second District",
     "ROC": "Police Sector 2D3",
     "CENSUS_TRACT": "005301",
     "VOTE_PRCNCT": "Precinct 15",
     "SMD": "SMD 2B07",
     "ZIPCODE": "20009",
     "NATIONALGRID": "18S UJ 23185 08870",
     "ROADWAYSEGID": "19819",
     "FOCUS_IMPROVEMENT_AREA": "NA",
     "HAS_ALIAS": "N",
     "HAS_CONDO_UNIT": "N",
     "HAS_RES_UNIT": "Y",
     "HAS_SSL": "Y",
     "LATITUDE": "38.91093949",
     "LONGITUDE": "-77.03928673",
     "STREETVIEWURL": "http://maps.google.com/maps?z=16&layer=c&cbll=38.91093949,-77.03928673&cbp=11,174.060027989508,,0,2.09",
     "RES_TYPE": "RESIDENTIAL",
     "WARD_2002": "Ward 2",
     "WARD_2012": "Ward 2",
     "ANC_2002": "ANC 2B",
     "ANC_2012": "ANC 2B",
     "SMD_2002": "SMD 2B07",
     "SMD_2012": "SMD 2B07",
     "IMAGEURL": "http://citizenatlas.dc.gov/mobilevideo",
     "IMAGEDIR": "20040804",
     "IMAGENAME": "Q4132238.jpg",
     "ConfidenceLevel": "100",
     "Zoning": "RA-8"
    }
   ]
  },
  "licenseDetails": {
   "updated": "2020-06-28T18:35:50.682Z",
   "licenseData": [
    {
     "ADDRESS": "1712  Q ST NW",
     "UNIT": "",
     "SSL": "0156    0248",
     "CUST_NUM": "40005327",
     "DECRIPTION": "Housing: Residential",
     "ENDORSEMENT_DESC": "Apartment",
     "LAST_NAME": "RICE",
     "FIRST_NAME": "CHARLES",
     "CORP_NAME": "",
     "TRADE_NAME": "",
     "BEGIN_RENEWAL": "Nov  1 2011 12:00AM",
     "END_RENEWAL": "Oct 31 2013 12:00AM",
     "STATUS": "Expired",
     "BEGIN_RENEWAL_NET": "2011/11/01",
     "END_RENEWAL_NET": "2013/10/31"
    },
    {
     "ADDRESS": "1712  Q ST NW",
     "UNIT": "",
     "SSL": "0156    0248",
     "CUST_NUM": "91848",
     "DECRIPTION": "Housing: Residential",
     "ENDORSEMENT_DESC": "Apartment",
     "LAST_NAME": "KIRK",
     "FIRST_NAME": "IRWIN",
     "CORP_NAME": "",
     "TRADE_NAME": "",
     "BEGIN_RENEWAL": "",
     "END_RENEWAL": "",
     "STATUS": "Cancelled",
     "BEGIN_RENEWAL_NET": "",
     "END_RENEWAL_NET": ""
    }
   ]
  },
  "permitDetails": {
   "updated": "2020-06-28T18:53:45.601Z",
   "permitData": []
  },
  "inspectionDetails": {
   "updated": "2020-06-28T18:53:45.765Z",
   "inspectionData": [
    {
     "ADDRESS": "1712 Q ST NW, WASHINGTON, DC 20009",
     "UNIT": "",
     "SSL": "0156    0248",
     "ID": "CIC0900960",
     "G6_ACT_DES": "Initial Inspection",
     "G6_STATUS": "Summary Abatement",
     "G6_STATUS_DD": "6/1/2009 12:00:00 AM",
     "DESC_OF_WORK": "",
     "G6_STATUS_DD_NET": "2009/06/01",
     "OWNER_FULL_NAME": "ELEANOR M RICE",
     "APPLICANT": ""
    }
   ]
  },
  "occupancyDetails": {
   "updated": "2020-06-28T18:53:46.010Z",
   "occupancyData": []
  },
  "charDetails": {
   "updated": "2020-06-28T19:53:27.787Z",
   "charData": [
    {
     "PREMISEADD": "1712 Q ST NW",
     "SSL": "0156    0248",
     "BLDG_NUM": "1",
     "COMPLX_NUM": "",
     "UNITNUMBER": "",
     "NUM_UNITS": "0",
     "AYB": "1890",
     "STRUCT_CL_": "",
     "STYLE_D": "3 Story",
     "STRUCT_D": "Row ",
     "GBA": "4234",
     "EXTWALL_D": "Common Brick",
     "WALL_HGT": "",
     "ROOF_D": "Meta",
     "BATHRM": "3",
     "HF_BATHRM": "0",
     "HEAT_D": "Hot ",
     "AC": "N",
     "INTWALL_D": "Hardwood",
     "ROOMS": "10",
     "BEDRM": "4",
     "KITCHENS": "4",
     "FIREPLACES": "2",
     "YR_RMDL": "1928",
     "EYB": "1957",
     "STORIES": "3",
     "OWNERNAME": "ELEANOR M RICE",
     "OWNNAME2": "",
     "CAREOFNAME": ""
    }
   ]
  },
  "taxData": {
   "ssl": "0156    0248",
   "address": "1712 Q ST NW",
   "owner": "ELEANOR M RICE",
   "neighborhood": "OLD CITY II",
   "sub_neighborhood": "D",
   "use_code": "24",
   "sale_price": "$.00",
   "recordation_date": "04/06/2004",
   "2016_Assessment": "$1,202,140.00"
  }
 },
 "1714 Q STREET NW": {
  "ownerInfo": {
   "updated": "2020-06-28T17:30:07.159Z",
   "ownerData": [
    {
     "OWNERNAME": "MESSING DAVID J",
     "PREMISEADD": "1714 Q ST NW",
     "UNITNUMBER": "",
     "SSL": "0156    0247",
     "USECODE": "024",
     "HSTDCODE": "5",
     "CLASSTYPE": "001",
     "TAXRATE": "0.0085",
     "SALEPRICE": "",
     "SALEDATE": "",
     "INSTNO": "",
     "ACCEPTCODE": "",
     "DEEDDATE": "",
     "OWNNAME2": "",
     "CPMS_ADDRESS": "1714 Q ST NW",
     "CAREOFNAME": "",
     "ADDRESS1": "1714 Q ST NW",
     "ADDRESS2": "",
     "CITYSTZIP": "WASHINGTON                 DC 20009-2473",
     "SALEDATE_NET": "",
     "DEEDDATE_NET": ""
    }
   ]
  },
  "addressDetails": {
   "updated": "2020-06-28T18:11:38.149Z",
   "addressData": [
    {
     "ADDRESS_ID": "225848",
     "MARID": "225848",
     "STATUS": "ACTIVE",
     "FULLADDRESS": "1714 Q STREET NW",
     "ADDRNUM": "1714",
     "ADDRNUMSUFFIX": "",
     "STNAME": "Q",
     "STREET_TYPE": "STREET",
     "QUADRANT": "NW",
     "CITY": "WASHINGTON",
     "STATE": "DC",
     "XCOORD": "396586.93",
     "YCOORD": "138119.96",
     "SSL": "0156    0247",
     "ANC": "ANC 2B",
     "PSA": "Police Service Area 208",
     "WARD": "Ward 2",
     "NBHD_ACTION": " ",
     "CLUSTER_": "Cluster 6",
     "POLDIST": "Police District - Second District",
     "ROC": "Police Sector 2D3",
     "CENSUS_TRACT": "005301",
     "VOTE_PRCNCT": "Precinct 15",
     "SMD": "SMD 2B07",
     "ZIPCODE": "20009",
     "NATIONALGRID": "18S UJ 23180 08870",
     "ROADWAYSEGID": "19819",
     "FOCUS_IMPROVEMENT_AREA": "NA",
     "HAS_ALIAS": "N",
     "HAS_CONDO_UNIT": "N",
     "HAS_RES_UNIT": "Y",
     "HAS_SSL": "Y",
     "LATITUDE": "38.91093578",
     "LONGITUDE": "-77.03935256",
     "STREETVIEWURL": "http://maps.google.com/maps?z=16&layer=c&cbll=38.91093578,-77.03935256&cbp=11,189.903913249402,,0,2.09",
     "RES_TYPE": "RESIDENTIAL",
     "WARD_2002": "Ward 2",
     "WARD_2012": "Ward 2",
     "ANC_2002": "ANC 2B",
     "ANC_2012": "ANC 2B",
     "SMD_2002": "SMD 2B07",
     "SMD_2012": "SMD 2B07",
     "IMAGEURL": "http://citizenatlas.dc.gov/mobilevideo",
     "IMAGEDIR": "20040804",
     "IMAGENAME": "Q4132314.jpg",
     "ConfidenceLevel": "100",
     "Zoning": "RA-8"
    }
   ]
  },
  "licenseDetails": {
   "updated": "2020-06-28T18:35:51.870Z",
   "licenseData": [
    {
     "ADDRESS": "1714  Q ST NW",
     "UNIT": "",
     "SSL": "0156    0247",
     "CUST_NUM": "50000565",
     "DECRIPTION": "Housing: Residential",
     "ENDORSEMENT_DESC": "Apartment",
     "LAST_NAME": "MESSING",
     "FIRST_NAME": "DAVID",
     "CORP_NAME": "",
     "TRADE_NAME": "",
     "BEGIN_RENEWAL": "Nov  1 2019 12:00AM",
     "END_RENEWAL": "Oct 31 2021 12:00AM",
     "STATUS": "Active",
     "BEGIN_RENEWAL_NET": "2019/11/01",
     "END_RENEWAL_NET": "2021/10/31"
    },
    {
     "ADDRESS": "1714  Q ST NW",
     "UNIT": "",
     "SSL": "0156    0247",
     "CUST_NUM": "90203",
     "DECRIPTION": "Housing: Residential",
     "ENDORSEMENT_DESC": "Apartment",
     "LAST_NAME": "MESSING",
     "FIRST_NAME": "DAVID",
     "CORP_NAME": "",
     "TRADE_NAME": "",
     "BEGIN_RENEWAL": "",
     "END_RENEWAL": "",
     "STATUS": "Cancelled",
     "BEGIN_RENEWAL_NET": "",
     "END_RENEWAL_NET": ""
    }
   ]
  },
  "permitDetails": {
   "updated": "2020-06-28T18:53:47.247Z",
   "permitData": [
    {
     "FULL_ADDRESS": "1714 Q ST NW, WASHINGTON, DC",
     "B1_UNIT_START": "",
     "SSL": "",
     "B1_ALT_ID": "MS110966",
     "TYPE": "Construction/Miscellaneous",
     "G6_STAT_DD": "Oct 16 2007 10:49AM",
     "B1_APPL_STATUS": "Permit Issued",
     "B1_APPL_STATUS_DATE": "10/16/2007",
     "DESC_OF_WORK": "construct 8 x 20 rear deck on top of 19050 addition (one story) to the back of townhouse. Addition is 20 long and 8 wide",
     "SORT_DATE": null,
     "G6_STAT_DD_NET": "2007/10/16",
     "B1_APPL_STATUS_DATE_NET": "2007/10/16",
     "JOB_CLASS_CODE": "WT",
     "JOB_SIZE": "N/A",
     "JOB_CLASSIFICATION": "N/A",
     "JOB_REVIEW_TIME": "N/A",
     "OWNER_NAME": "david messing",
     "OWNER_FULL_NAME": "david messing",
     "APPLICANT_NAME": "DAVID  MESSING",
     "TRADE_NAME": "",
     "PERMIT_STATUS": [
      {
       "REVIEW_STATUS": "APP",
       "DISCIPLINE": "Struc",
       "REVIEW_STATUS_DATE": "10/16/2007"
      },
      {
       "REVIEW_STATUS": "APP",
       "DISCIPLINE": "Zoning",
       "REVIEW_STATUS_DATE": "09/06/2007"
      },
      {
       "REVIEW_STATUS": "Application Accepted",
       "DISCIPLINE": "Plan Review Coordinator",
       "REVIEW_STATUS_DATE": "07/12/2008"
      },
      {
       "REVIEW_STATUS": "Comments Submitted to the Applicant for Correction",
       "DISCIPLINE": "Struc Review Pending",
       "REVIEW_STATUS_DATE": "09/18/2007"
      },
      {
       "REVIEW_STATUS": "Comments Submitted to the Applicant for Correction",
       "DISCIPLINE": "Zoning Review Pending",
       "REVIEW_STATUS_DATE": "09/04/2007"
      },
      {
       "REVIEW_STATUS": "Comments Submitted to the Applicant for Correction",
       "DISCIPLINE": "Zoning Review Pending",
       "REVIEW_STATUS_DATE": "09/05/2007"
      },
      {
       "REVIEW_STATUS": "In-Process",
       "DISCIPLINE": "BZA Review",
       "REVIEW_STATUS_DATE": ""
      },
      {
       "REVIEW_STATUS": "In-Process",
       "DISCIPLINE": "CFA Review",
       "REVIEW_STATUS_DATE": ""
      },
      {
       "REVIEW_STATUS": "In-Process",
       "DISCIPLINE": "Chinatown Review",
       "REVIEW_STATUS_DATE": ""
      },
      {
       "REVIEW_STATUS": "In-Process",
       "DISCIPLINE": "DDOE Review",
       "REVIEW_STATUS_DATE": ""
      },
      {
       "REVIEW_STATUS": "In-Process",
       "DISCIPLINE": "DDOT Review (Public Space)",
       "REVIEW_STATUS_DATE": ""
      },
      {
       "REVIEW_STATUS": "In-Process",
       "DISCIPLINE": "DOH Review",
       "REVIEW_STATUS_DATE": ""
      },
      {
       "REVIEW_STATUS": "In-Process",
       "DISCIPLINE": "EISF Review",
       "REVIEW_STATUS_DATE": ""
      },
      {
       "REVIEW_STATUS": "In-Process",
       "DISCIPLINE": "Electrical Review",
       "REVIEW_STATUS_DATE": ""
      },
      {
       "REVIEW_STATUS": "In-Process",
       "DISCIPLINE": "Elevator Review",
       "REVIEW_STATUS_DATE": ""
      },
      {
       "REVIEW_STATUS": "In-Process",
       "DISCIPLINE": "File Room",
       "REVIEW_STATUS_DATE": ""
      },
      {
       "REVIEW_STATUS": "In-Process",
       "DISCIPLINE": "Fire Review",
       "REVIEW_STATUS_DATE": ""
      },
      {
       "REVIEW_STATUS": "In-Process",
       "DISCIPLINE": "HPRB Review",
       "REVIEW_STATUS_DATE": ""
      },
      {
       "REVIEW_STATUS": "In-Process",
       "DISCIPLINE": "Management Review",
       "REVIEW_STATUS_DATE": ""
      },
      {
       "REVIEW_STATUS": "In-Process",
       "DISCIPLINE": "Mechanical and Plumbing Review",
       "REVIEW_STATUS_DATE": ""
      },
      {
       "REVIEW_STATUS": "In-Process",
       "DISCIPLINE": "NCPC Review",
       "REVIEW_STATUS_DATE": ""
      },
      {
       "REVIEW_STATUS": "In-Process",
       "DISCIPLINE": "WASA Review",
       "REVIEW_STATUS_DATE": ""
      },
      {
       "REVIEW_STATUS": "In-Process",
       "DISCIPLINE": "White House Review",
       "REVIEW_STATUS_DATE": ""
      },
      {
       "REVIEW_STATUS": "In-Process",
       "DISCIPLINE": "WMATA Review",
       "REVIEW_STATUS_DATE": ""
      },
      {
       "REVIEW_STATUS": "In-Process",
       "DISCIPLINE": "Zoning Overlay/PUD Review",
       "REVIEW_STATUS_DATE": ""
      },
      {
       "REVIEW_STATUS": "PEN",
       "DISCIPLINE": "Struc",
       "REVIEW_STATUS_DATE": "09/04/2007"
      },
      {
       "REVIEW_STATUS": "PEN",
       "DISCIPLINE": "Zoning",
       "REVIEW_STATUS_DATE": "09/04/2007"
      },
      {
       "REVIEW_STATUS": "Permit Issued",
       "DISCIPLINE": "Issue Permit",
       "REVIEW_STATUS_DATE": "07/12/2008"
      },
      {
       "REVIEW_STATUS": "Structural Review Approved",
       "DISCIPLINE": "Structural Review",
       "REVIEW_STATUS_DATE": "07/12/2008"
      },
      {
       "REVIEW_STATUS": "Zoning Review Approved",
       "DISCIPLINE": "Zoning Review",
       "REVIEW_STATUS_DATE": "07/12/2008"
      }
     ]
    }
   ]
  },
  "inspectionDetails": {
   "updated": "2020-06-28T18:53:47.484Z",
   "inspectionData": [
    {
     "ADDRESS": "1714 Q ST NW, WASHINGTON, DC -",
     "UNIT": "",
     "SSL": "0156    0247",
     "ID": "ECC194915",
     "G6_ACT_DES": "Illegal Construction Plumbing",
     "G6_STATUS": "Failed to Inspect",
     "G6_STATUS_DD": "12/22/2007 12:00:00 AM",
     "DESC_OF_WORK": "",
     "G6_STATUS_DD_NET": "2007/12/22",
     "OWNER_FULL_NAME": "",
     "APPLICANT": "NA  NA; NA  NA"
    }
   ]
  },
  "occupancyDetails": {
   "updated": "2020-06-28T18:53:47.689Z",
   "occupancyData": []
  },
  "charDetails": {
   "updated": "2020-06-28T19:53:28.258Z",
   "charData": [
    {
     "PREMISEADD": "1714 Q ST NW",
     "SSL": "0156    0247",
     "BLDG_NUM": "1",
     "COMPLX_NUM": "",
     "UNITNUMBER": "",
     "NUM_UNITS": "0",
     "AYB": "1890",
     "STRUCT_CL_": "",
     "STYLE_D": "3 Story",
     "STRUCT_D": "Row ",
     "GBA": "4487",
     "EXTWALL_D": "Common Brick",
     "WALL_HGT": "",
     "ROOF_D": "Buil",
     "BATHRM": "4",
     "HF_BATHRM": "0",
     "HEAT_D": "Warm",
     "AC": "Y",
     "INTWALL_D": "Hardwood",
     "ROOMS": "10",
     "BEDRM": "6",
     "KITCHENS": "4",
     "FIREPLACES": "2",
     "YR_RMDL": "2007",
     "EYB": "1957",
     "STORIES": "3",
     "OWNERNAME": "MESSING DAVID J",
     "OWNNAME2": "",
     "CAREOFNAME": ""
    }
   ]
  },
  "taxData": {
   "ssl": "0156    0247",
   "address": "1714 Q ST NW",
   "owner": "MESSING DAVID J",
   "neighborhood": "OLD CITY II",
   "sub_neighborhood": "D",
   "use_code": "24",
   "sale_price": "$.00",
   "recordation_date": "N/A",
   "2016_Assessment": "$1,288,860.00"
  }
 },
 "1720 Q STREET NW": {
  "ownerInfo": {
   "updated": "2020-06-28T17:30:08.271Z",
   "ownerData": [
    {
     "OWNERNAME": "CESAR A CACERES",
     "PREMISEADD": "1720 Q ST NW",
     "UNITNUMBER": "",
     "SSL": "0156    0244",
     "USECODE": "011",
     "HSTDCODE": "",
     "CLASSTYPE": "001",
     "TAXRATE": "0.0085",
     "SALEPRICE": "",
     "SALEDATE": "",
     "INSTNO": "",
     "ACCEPTCODE": "",
     "DEEDDATE": "",
     "OWNNAME2": "",
     "CPMS_ADDRESS": "1720 Q ST NW",
     "CAREOFNAME": "",
     "ADDRESS1": "2500 VIRGINIA AVE NW",
     "ADDRESS2": "",
     "CITYSTZIP": "WASHINGTON                 DC 20037-1901",
     "SALEDATE_NET": "",
     "DEEDDATE_NET": ""
    }
   ]
  },
  "addressDetails": {
   "updated": "2020-06-28T18:11:40.695Z",
   "addressData": [
    {
     "ADDRESS_ID": "225852",
     "MARID": "225852",
     "STATUS": "ACTIVE",
     "FULLADDRESS": "1720 Q STREET NW",
     "ADDRNUM": "1720",
     "ADDRNUMSUFFIX": "",
     "STNAME": "Q",
     "STREET_TYPE": "STREET",
     "QUADRANT": "NW",
     "CITY": "WASHINGTON",
     "STATE": "DC",
     "XCOORD": "396568.14",
     "YCOORD": "138119.96",
     "SSL": "0156    0244",
     "ANC": "ANC 2B",
     "PSA": "Police Service Area 208",
     "WARD": "Ward 2",
     "NBHD_ACTION": " ",
     "CLUSTER_": "Cluster 6",
     "POLDIST": "Police District - Second District",
     "ROC": "Police Sector 2D3",
     "CENSUS_TRACT": "005301",
     "VOTE_PRCNCT": "Precinct 15",
     "SMD": "SMD 2B07",
     "ZIPCODE": "20009",
     "NATIONALGRID": "18S UJ 23161 08871",
     "ROADWAYSEGID": "19819",
     "FOCUS_IMPROVEMENT_AREA": "NA",
     "HAS_ALIAS": "N",
     "HAS_CONDO_UNIT": "N",
     "HAS_RES_UNIT": "N",
     "HAS_SSL": "Y",
     "LATITUDE": "38.91093570",
     "LONGITUDE": "-77.03956921",
     "STREETVIEWURL": "http://maps.google.com/maps?z=16&layer=c&cbll=38.9109357,-77.03956921&cbp=11,162.000493285248,,0,2.09",
     "RES_TYPE": "RESIDENTIAL",
     "WARD_2002": "Ward 2",
     "WARD_2012": "Ward 2",
     "ANC_2002": "ANC 2B",
     "ANC_2012": "ANC 2B",
     "SMD_2002": "SMD 2B07",
     "SMD_2012": "SMD 2B07",
     "IMAGEURL": "http://citizenatlas.dc.gov/mobilevideo",
     "IMAGEDIR": "20040804",
     "IMAGENAME": "Q4132447.jpg",
     "ConfidenceLevel": "100",
     "Zoning": "RA-8"
    }
   ]
  },
  "licenseDetails": {
   "updated": "2020-06-28T18:35:54.727Z",
   "licenseData": [
    {
     "ADDRESS": "1720  Q ST NW",
     "UNIT": "714",
     "SSL": "0156    0244",
     "CUST_NUM": "64003597",
     "DECRIPTION": "Housing: Residential",
     "ENDORSEMENT_DESC": "One Family Rental",
     "LAST_NAME": "CACERES",
     "FIRST_NAME": "CESAR",
     "CORP_NAME": "",
     "TRADE_NAME": "",
     "BEGIN_RENEWAL": "Oct  1 2014 12:00AM",
     "END_RENEWAL": "Sep 30 2016 12:00AM",
     "STATUS": "Expired",
     "BEGIN_RENEWAL_NET": "2014/10/01",
     "END_RENEWAL_NET": "2016/09/30"
    }
   ]
  },
  "permitDetails": {
   "updated": "2020-06-28T18:53:52.540Z",
   "permitData": [
    {
     "FULL_ADDRESS": "1720 Q ST NW, WASHINGTON, DC 20009-2408",
     "B1_UNIT_START": "",
     "SSL": "",
     "B1_ALT_ID": "P86500",
     "TYPE": "Supplemental/Plumbing and Gas",
     "G6_STAT_DD": "Nov  4 2004  2:45PM",
     "B1_APPL_STATUS": "Permit Issued",
     "B1_APPL_STATUS_DATE": "          ",
     "DESC_OF_WORK": "",
     "SORT_DATE": null,
     "G6_STAT_DD_NET": "2004/11/04",
     "B1_APPL_STATUS_DATE_NET": "",
     "JOB_CLASS_CODE": "N/A",
     "JOB_SIZE": "N/A",
     "JOB_CLASSIFICATION": "N/A",
     "JOB_REVIEW_TIME": "N/A",
     "OWNER_NAME": "JOHNSON",
     "OWNER_FULL_NAME": "JOHNSON",
     "APPLICANT_NAME": "",
     "TRADE_NAME": "",
     "PERMIT_STATUS": [
      {
       "REVIEW_STATUS": "",
       "DISCIPLINE": "",
       "REVIEW_STATUS_DATE": ""
      }
     ]
    }
   ]
  },
  "inspectionDetails": {
   "updated": "2020-06-28T18:53:52.732Z",
   "inspectionData": []
  },
  "occupancyDetails": {
   "updated": "2020-06-28T18:53:52.912Z",
   "occupancyData": []
  },
  "charDetails": {
   "updated": "2020-06-28T19:53:29.304Z",
   "charData": [
    {
     "PREMISEADD": "1720 Q ST NW",
     "SSL": "0156    0244",
     "BLDG_NUM": "1",
     "COMPLX_NUM": "",
     "UNITNUMBER": "",
     "NUM_UNITS": "0",
     "AYB": "1890",
     "STRUCT_CL_": "",
     "STYLE_D": "3 Story",
     "STRUCT_D": "Row ",
     "GBA": "4390",
     "EXTWALL_D": "Common Brick",
     "WALL_HGT": "",
     "ROOF_D": "Buil",
     "BATHRM": "4",
     "HF_BATHRM": "1",
     "HEAT_D": "Hot ",
     "AC": "Y",
     "INTWALL_D": "Hardwood",
     "ROOMS": "10",
     "BEDRM": "5",
     "KITCHENS": "1",
     "FIREPLACES": "2",
     "YR_RMDL": "",
     "EYB": "1957",
     "STORIES": "3",
     "OWNERNAME": "CESAR A CACERES",
     "OWNNAME2": "",
     "CAREOFNAME": ""
    }
   ]
  },
  "taxData": {
   "ssl": "0156    0244",
   "address": "1720 Q ST NW",
   "owner": "CESAR A CACERES",
   "neighborhood": "OLD CITY II",
   "sub_neighborhood": "D",
   "use_code": "11",
   "sale_price": "$.00",
   "recordation_date": "N/A",
   "2016_Assessment": "$1,246,410.00"
  }
 },
 "1722 Q STREET NW": {
  "ownerInfo": {
   "updated": "2020-06-28T17:30:09.087Z",
   "ownerData": [
    {
     "OWNERNAME": "CESAR A CACERES",
     "PREMISEADD": "1722 Q ST NW",
     "UNITNUMBER": "",
     "SSL": "0156    0243",
     "USECODE": "011",
     "HSTDCODE": "",
     "CLASSTYPE": "001",
     "TAXRATE": "0.0085",
     "SALEPRICE": "",
     "SALEDATE": "",
     "INSTNO": "",
     "ACCEPTCODE": "",
     "DEEDDATE": "",
     "OWNNAME2": "",
     "CPMS_ADDRESS": "1722 Q ST NW",
     "CAREOFNAME": "",
     "ADDRESS1": "2500 VIRGINIA AVE NW",
     "ADDRESS2": "",
     "CITYSTZIP": "WASHINGTON                 DC 20037-1901",
     "SALEDATE_NET": "",
     "DEEDDATE_NET": ""
    }
   ]
  },
  "addressDetails": {
   "updated": "2020-06-28T18:11:41.090Z",
   "addressData": [
    {
     "ADDRESS_ID": "225854",
     "MARID": "225854",
     "STATUS": "ACTIVE",
     "FULLADDRESS": "1722 Q STREET NW",
     "ADDRNUM": "1722",
     "ADDRNUMSUFFIX": "",
     "STNAME": "Q",
     "STREET_TYPE": "STREET",
     "QUADRANT": "NW",
     "CITY": "WASHINGTON",
     "STATE": "DC",
     "XCOORD": "396562.21",
     "YCOORD": "138119.90",
     "SSL": "0156    0243",
     "ANC": "ANC 2B",
     "PSA": "Police Service Area 208",
     "WARD": "Ward 2",
     "NBHD_ACTION": " ",
     "CLUSTER_": "Cluster 6",
     "POLDIST": "Police District - Second District",
     "ROC": "Police Sector 2D3",
     "CENSUS_TRACT": "005301",
     "VOTE_PRCNCT": "Precinct 15",
     "SMD": "SMD 2B07",
     "ZIPCODE": "20009",
     "NATIONALGRID": "18S UJ 23155 08871",
     "ROADWAYSEGID": "19819",
     "FOCUS_IMPROVEMENT_AREA": "NA",
     "HAS_ALIAS": "N",
     "HAS_CONDO_UNIT": "N",
     "HAS_RES_UNIT": "N",
     "HAS_SSL": "Y",
     "LATITUDE": "38.91093514",
     "LONGITUDE": "-77.03963758",
     "STREETVIEWURL": "http://maps.google.com/maps?z=16&layer=c&cbll=38.91093514,-77.03963758&cbp=11,177.753600526203,,0,2.09",
     "RES_TYPE": "RESIDENTIAL",
     "WARD_2002": "Ward 2",
     "WARD_2012": "Ward 2",
     "ANC_2002": "ANC 2B",
     "ANC_2012": "ANC 2B",
     "SMD_2002": "SMD 2B07",
     "SMD_2012": "SMD 2B07",
     "IMAGEURL": "http://citizenatlas.dc.gov/mobilevideo",
     "IMAGEDIR": "20040804",
     "IMAGENAME": "Q4132504.jpg",
     "ConfidenceLevel": "100",
     "Zoning": "RA-8"
    }
   ]
  },
  "licenseDetails": {
   "updated": "2020-06-28T18:35:55.784Z",
   "licenseData": [
    {
     "ADDRESS": "1722  Q ST NW",
     "UNIT": "714",
     "SSL": "0156    0243",
     "CUST_NUM": "64003596",
     "DECRIPTION": "Housing: Residential",
     "ENDORSEMENT_DESC": "One Family Rental",
     "LAST_NAME": "CACERES",
     "FIRST_NAME": "CESAR",
     "CORP_NAME": "",
     "TRADE_NAME": "",
     "BEGIN_RENEWAL": "Oct  1 2014 12:00AM",
     "END_RENEWAL": "Sep 30 2016 12:00AM",
     "STATUS": "Expired",
     "BEGIN_RENEWAL_NET": "2014/10/01",
     "END_RENEWAL_NET": "2016/09/30"
    }
   ]
  },
  "permitDetails": {
   "updated": "2020-06-28T18:53:54.074Z",
   "permitData": []
  },
  "inspectionDetails": {
   "updated": "2020-06-28T18:53:54.244Z",
   "inspectionData": []
  },
  "occupancyDetails": {
   "updated": "2020-06-28T18:53:54.457Z",
   "occupancyData": []
  },
  "charDetails": {
   "updated": "2020-06-28T19:53:29.769Z",
   "charData": [
    {
     "PREMISEADD": "1722 Q ST NW",
     "SSL": "0156    0243",
     "BLDG_NUM": "1",
     "COMPLX_NUM": "",
     "UNITNUMBER": "",
     "NUM_UNITS": "0",
     "AYB": "1890",
     "STRUCT_CL_": "",
     "STYLE_D": "3 Story",
     "STRUCT_D": "Row ",
     "GBA": "4171",
     "EXTWALL_D": "Common Brick",
     "WALL_HGT": "",
     "ROOF_D": "Meta",
     "BATHRM": "3",
     "HF_BATHRM": "0",
     "HEAT_D": "Forc",
     "AC": "N",
     "INTWALL_D": "Hardwood",
     "ROOMS": "7",
     "BEDRM": "4",
     "KITCHENS": "1",
     "FIREPLACES": "2",
     "YR_RMDL": "",
     "EYB": "1957",
     "STORIES": "3",
     "OWNERNAME": "CESAR A CACERES",
     "OWNNAME2": "",
     "CAREOFNAME": ""
    }
   ]
  },
  "taxData": {
   "ssl": "0156    0243",
   "address": "1722 Q ST NW",
   "owner": "CESAR A CACERES",
   "neighborhood": "OLD CITY II",
   "sub_neighborhood": "D",
   "use_code": "11",
   "sale_price": "$.00",
   "recordation_date": "N/A",
   "2016_Assessment": "$1,191,500.00"
  }
 },
 "1734 Q STREET NW": {
  "ownerInfo": {
   "updated": "2020-06-28T17:30:13.843Z",
   "ownerData": [
    {
     "OWNERNAME": "JENNINGS JOHN J",
     "PREMISEADD": "1734 Q ST NW",
     "UNITNUMBER": "",
     "SSL": "0156    0237",
     "USECODE": "024",
     "HSTDCODE": "",
     "CLASSTYPE": "001",
     "TAXRATE": "0.0085",
     "SALEPRICE": "",
     "SALEDATE": "",
     "INSTNO": "",
     "ACCEPTCODE": "",
     "DEEDDATE": "",
     "OWNNAME2": "",
     "CPMS_ADDRESS": "1734 Q ST NW",
     "CAREOFNAME": "LARRY R. PILOT ESQ",
     "ADDRESS1": "1815 N HARTFORD ST",
     "ADDRESS2": "",
     "CITYSTZIP": "ARLINGTON                  VA 22201-5206",
     "SALEDATE_NET": "",
     "DEEDDATE_NET": ""
    }
   ]
  },
  "addressDetails": {
   "updated": "2020-06-28T18:11:46.254Z",
   "addressData": [
    {
     "ADDRESS_ID": "225873",
     "MARID": "225873",
     "STATUS": "ACTIVE",
     "FULLADDRESS": "1734 Q STREET NW",
     "ADDRNUM": "1734",
     "ADDRNUMSUFFIX": "",
     "STNAME": "Q",
     "STREET_TYPE": "STREET",
     "QUADRANT": "NW",
     "CITY": "WASHINGTON",
     "STATE": "DC",
     "XCOORD": "396525.54",
     "YCOORD": "138120.74",
     "SSL": "0156    0237",
     "ANC": "ANC 2B",
     "PSA": "Police Service Area 208",
     "WARD": "Ward 2",
     "NBHD_ACTION": " ",
     "CLUSTER_": "Cluster 6",
     "POLDIST": "Police District - Second District",
     "ROC": "Police Sector 2D3",
     "CENSUS_TRACT": "005301",
     "VOTE_PRCNCT": "Precinct 15",
     "SMD": "SMD 2B07",
     "ZIPCODE": "20009",
     "NATIONALGRID": "18S UJ 23118 08872",
     "ROADWAYSEGID": "19819",
     "FOCUS_IMPROVEMENT_AREA": "NA",
     "HAS_ALIAS": "N",
     "HAS_CONDO_UNIT": "N",
     "HAS_RES_UNIT": "Y",
     "HAS_SSL": "Y",
     "LATITUDE": "38.91094256",
     "LONGITUDE": "-77.04006039",
     "STREETVIEWURL": "http://maps.google.com/maps?z=16&layer=c&cbll=38.91094256,-77.04006039&cbp=11,199.120113505382,,0,2.09",
     "RES_TYPE": "RESIDENTIAL",
     "WARD_2002": "Ward 2",
     "WARD_2012": "Ward 2",
     "ANC_2002": "ANC 2B",
     "ANC_2012": "ANC 2B",
     "SMD_2002": "SMD 2B07",
     "SMD_2012": "SMD 2B07",
     "IMAGEURL": "http://citizenatlas.dc.gov/mobilevideo",
     "IMAGEDIR": "20040804",
     "IMAGENAME": "Q4132726.jpg",
     "ConfidenceLevel": "100",
     "Zoning": "RA-8"
    }
   ]
  },
  "licenseDetails": {
   "updated": "2020-06-28T18:36:06.341Z",
   "licenseData": [
    {
     "ADDRESS": "1734  Q ST NW",
     "UNIT": "",
     "SSL": "0156    0237",
     "CUST_NUM": "39802640",
     "DECRIPTION": "Housing: Residential",
     "ENDORSEMENT_DESC": "Apartment",
     "LAST_NAME": "JENNINGS",
     "FIRST_NAME": "JOHN",
     "CORP_NAME": "",
     "TRADE_NAME": "",
     "BEGIN_RENEWAL": "",
     "END_RENEWAL": "",
     "STATUS": "Expired",
     "BEGIN_RENEWAL_NET": "",
     "END_RENEWAL_NET": ""
    }
   ]
  },
  "permitDetails": {
   "updated": "2020-06-28T18:54:12.998Z",
   "permitData": [
    {
     "FULL_ADDRESS": "1734 Q ST NW, WASHINGTON, DC 20009",
     "B1_UNIT_START": "",
     "SSL": "0156    0237",
     "B1_ALT_ID": "G59568441",
     "TYPE": "Supplemental/Plumbing and Gas",
     "G6_STAT_DD": "Nov 29 2011  1:00AM",
     "B1_APPL_STATUS": "Permit Issued",
     "B1_APPL_STATUS_DATE": "11/29/2011",
     "DESC_OF_WORK": "This supplemental permit was issued online. Use the Online Permit View application on DCRA Intranet to view the details and print a copy of the permit. Alternatively, you can copy and paste the following URL into an internet browser.\nhttps://ospi.dcra.dc.gov/ospi/PrintPermit.aspx?param=zI8IgGJEIle0I",
     "SORT_DATE": null,
     "G6_STAT_DD_NET": "2011/11/29",
     "B1_APPL_STATUS_DATE_NET": "2011/11/29",
     "JOB_CLASS_CODE": "N/A",
     "JOB_SIZE": "N/A",
     "JOB_CLASSIFICATION": "N/A",
     "JOB_REVIEW_TIME": "N/A",
     "OWNER_NAME": "EVA JENKNER",
     "OWNER_FULL_NAME": "EVA JENKNER",
     "APPLICANT_NAME": "ANDREW  ARNTSON; EVA  JENKNER; ANDREW  ARNTSON",
     "TRADE_NAME": "",
     "PERMIT_STATUS": [
      {
       "REVIEW_STATUS": "",
       "DISCIPLINE": "",
       "REVIEW_STATUS_DATE": ""
      }
     ]
    }
   ]
  },
  "inspectionDetails": {
   "updated": "2020-06-28T18:54:13.200Z",
   "inspectionData": []
  },
  "occupancyDetails": {
   "updated": "2020-06-28T18:54:13.409Z",
   "occupancyData": []
  },
  "charDetails": {
   "updated": "2020-06-28T19:53:33.602Z",
   "charData": [
    {
     "PREMISEADD": "1734 Q ST NW",
     "SSL": "0156    0237",
     "BLDG_NUM": "1",
     "COMPLX_NUM": "",
     "UNITNUMBER": "",
     "NUM_UNITS": "0",
     "AYB": "1890",
     "STRUCT_CL_": "",
     "STYLE_D": "3 Story",
     "STRUCT_D": "Row ",
     "GBA": "4521",
     "EXTWALL_D": "Common Brick",
     "WALL_HGT": "",
     "ROOF_D": "Buil",
     "BATHRM": "3",
     "HF_BATHRM": "0",
     "HEAT_D": "Warm",
     "AC": "Y",
     "INTWALL_D": "Hardwood",
     "ROOMS": "12",
     "BEDRM": "4",
     "KITCHENS": "3",
     "FIREPLACES": "2",
     "YR_RMDL": "1981",
     "EYB": "1957",
     "STORIES": "3",
     "OWNERNAME": "JENNINGS JOHN J",
     "OWNNAME2": "",
     "CAREOFNAME": "LARRY R. PILOT ESQ"
    }
   ]
  },
  "taxData": {
   "ssl": "0156    0237",
   "address": "1734 Q ST NW",
   "owner": "JENNINGS JOHN J LARRY R. PILOT ESQ",
   "neighborhood": "OLD CITY II",
   "sub_neighborhood": "D",
   "use_code": "24",
   "sale_price": "$.00",
   "recordation_date": "N/A",
   "2016_Assessment": "$1,287,850.00"
  }
 },
 "1741 P STREET NW": {
  "ownerInfo": {
   "updated": "2020-06-28T17:30:16.308Z",
   "ownerData": [
    {
     "OWNERNAME": "1741 P STREET NW COOPERATIVE ASSOC INC",
     "PREMISEADD": "1741 P ST NW",
     "UNITNUMBER": "",
     "SSL": "0156    0055",
     "USECODE": "026",
     "HSTDCODE": "",
     "CLASSTYPE": "001",
     "TAXRATE": "0.0085",
     "SALEPRICE": "",
     "SALEDATE": "",
     "INSTNO": "",
     "ACCEPTCODE": "",
     "DEEDDATE": "",
     "OWNNAME2": "",
     "CPMS_ADDRESS": "1741 P ST NW",
     "CAREOFNAME": "",
     "ADDRESS1": "1741 P ST NW",
     "ADDRESS2": "",
     "CITYSTZIP": "WASHINGTON                 DC 20036-1303",
     "SALEDATE_NET": "",
     "DEEDDATE_NET": ""
    }
   ]
  },
  "addressDetails": {
   "updated": "2020-06-28T18:11:50.078Z",
   "addressData": [
    {
     "ADDRESS_ID": "225885",
     "MARID": "225885",
     "STATUS": "ACTIVE",
     "FULLADDRESS": "1741 P STREET NW",
     "ADDRNUM": "1741",
     "ADDRNUMSUFFIX": "",
     "STNAME": "P",
     "STREET_TYPE": "STREET",
     "QUADRANT": "NW",
     "CITY": "WASHINGTON",
     "STATE": "DC",
     "XCOORD": "396493.78",
     "YCOORD": "137999.94",
     "SSL": "0156    0055",
     "ANC": "ANC 2B",
     "PSA": "Police Service Area 208",
     "WARD": "Ward 2",
     "NBHD_ACTION": " ",
     "CLUSTER_": "Cluster 6",
     "POLDIST": "Police District - Second District",
     "ROC": "Police Sector 2D3",
     "CENSUS_TRACT": "005301",
     "VOTE_PRCNCT": "Precinct 15",
     "SMD": "SMD 2B07",
     "ZIPCODE": "20036",
     "NATIONALGRID": "18S UJ 23084 08752",
     "ROADWAYSEGID": "18815",
     "FOCUS_IMPROVEMENT_AREA": "NA",
     "HAS_ALIAS": "N",
     "HAS_CONDO_UNIT": "N",
     "HAS_RES_UNIT": "Y",
     "HAS_SSL": "Y",
     "LATITUDE": "38.90985423",
     "LONGITUDE": "-77.04042597",
     "STREETVIEWURL": "http://maps.google.com/maps?z=16&layer=c&cbll=38.90985423,-77.04042597&cbp=11,5.97971681476271,,0,2.09",
     "RES_TYPE": "RESIDENTIAL",
     "WARD_2002": "Ward 2",
     "WARD_2012": "Ward 2",
     "ANC_2002": "ANC 2B",
     "ANC_2012": "ANC 2B",
     "SMD_2002": "SMD 2B07",
     "SMD_2012": "SMD 2B07",
     "IMAGEURL": "http://citizenatlas.dc.gov/mobilevideo",
     "IMAGEDIR": "20040804",
     "IMAGENAME": "Q4125759.jpg",
     "ConfidenceLevel": "100",
     "Zoning": "RA-8"
    }
   ]
  },
  "licenseDetails": {
   "updated": "2020-06-28T18:36:12.449Z",
   "licenseData": [
    {
     "ADDRESS": "1741  P ST NW",
     "UNIT": "",
     "SSL": "0156    0055",
     "CUST_NUM": "500412900696",
     "DECRIPTION": "Housing: Residential",
     "ENDORSEMENT_DESC": "Cooperative Association",
     "LAST_NAME": "",
     "FIRST_NAME": "",
     "CORP_NAME": "1741 P ST., N.W. COOPERATIVE ASOCIATION INC.",
     "TRADE_NAME": "",
     "BEGIN_RENEWAL": "Jun  1 2018 12:00AM",
     "END_RENEWAL": "May 31 2020 12:00AM",
     "STATUS": "Ready to Renew",
     "BEGIN_RENEWAL_NET": "2018/06/01",
     "END_RENEWAL_NET": "2020/05/31"
    },
    {
     "ADDRESS": "1741  P ST NW",
     "UNIT": " ",
     "SSL": "0156    0055",
     "CUST_NUM": "54001929",
     "DECRIPTION": "Housing: Residential",
     "ENDORSEMENT_DESC": "Cooperative Association",
     "LAST_NAME": "",
     "FIRST_NAME": "",
     "CORP_NAME": "1741 P ST NW COOPERATIVE ASSOCIATION INC",
     "TRADE_NAME": "",
     "BEGIN_RENEWAL": "Jun  1 2010 12:00AM",
     "END_RENEWAL": "May 31 2012 12:00AM",
     "STATUS": "Expired",
     "BEGIN_RENEWAL_NET": "2010/06/01",
     "END_RENEWAL_NET": "2012/05/31"
    }
   ]
  },
  "permitDetails": {
   "updated": "2020-06-28T18:54:24.997Z",
   "permitData": [
    {
     "FULL_ADDRESS": "1741 P ST NW, WASHINGTON, DC 20036",
     "B1_UNIT_START": "",
     "SSL": "0156    0055",
     "B1_ALT_ID": "B0905577",
     "TYPE": "Construction/Alteration and Repair",
     "G6_STAT_DD": "Jan  1 1900 12:00AM",
     "B1_APPL_STATUS": "Application Canceled",
     "B1_APPL_STATUS_DATE": "09/09/2015",
     "DESC_OF_WORK": "ADD WASHER/ DRYER (ELECTRIC) IN KITCHEN, REPAIR WATER DAMAGE TO CEILINGS AND WALLS, RENOVATE OR REPLACE CROWN MOLDING AND CASINGS, AND INSTALL IN WALL CATV AND INTERNET CABLE.",
     "SORT_DATE": null,
     "G6_STAT_DD_NET": "",
     "B1_APPL_STATUS_DATE_NET": "2015/09/09",
     "JOB_CLASS_CODE": "WT",
     "JOB_SIZE": "N/A",
     "JOB_CLASSIFICATION": "N/A",
     "JOB_REVIEW_TIME": "N/A",
     "OWNER_NAME": "1741 P STREET NW COOPERATIVE ASSOC INC",
     "OWNER_FULL_NAME": "1741 P STREET NW COOPERATIVE ASSOC INC",
     "APPLICANT_NAME": "EDEN  SARFATY",
     "TRADE_NAME": "",
     "PERMIT_STATUS": [
      {
       "REVIEW_STATUS": "Application Accepted",
       "DISCIPLINE": "Plan Review Coordinator",
       "REVIEW_STATUS_DATE": "05/11/2009"
      },
      {
       "REVIEW_STATUS": "Application Canceled",
       "DISCIPLINE": "File Room",
       "REVIEW_STATUS_DATE": "09/09/2015"
      },
      {
       "REVIEW_STATUS": "Comments Submitted to the Applicant for Correction",
       "DISCIPLINE": "Electrical Review Pending",
       "REVIEW_STATUS_DATE": "08/14/2009"
      },
      {
       "REVIEW_STATUS": "In-Process",
       "DISCIPLINE": "HPRB Review",
       "REVIEW_STATUS_DATE": ""
      },
      {
       "REVIEW_STATUS": "In-Process",
       "DISCIPLINE": "Structural Review",
       "REVIEW_STATUS_DATE": ""
      }
     ]
    },
    {
     "FULL_ADDRESS": "1741 P ST NW, WASHINGTON, DC 20036",
     "B1_UNIT_START": "",
     "SSL": "0156    0055",
     "B1_ALT_ID": "M1603617",
     "TYPE": "Supplemental/Mechanical",
     "G6_STAT_DD": "Sep 27 2016 12:00AM",
     "B1_APPL_STATUS": "Completed",
     "B1_APPL_STATUS_DATE": "02/16/2017",
     "DESC_OF_WORK": "",
     "SORT_DATE": null,
     "G6_STAT_DD_NET": "2016/09/27",
     "B1_APPL_STATUS_DATE_NET": "2017/02/16",
     "JOB_CLASS_CODE": "N/A",
     "JOB_SIZE": "N/A",
     "JOB_CLASSIFICATION": "N/A",
     "JOB_REVIEW_TIME": "N/A",
     "OWNER_NAME": "1741 P STREET NW COOPERATIVE ASSOC INC",
     "OWNER_FULL_NAME": "1741 P STREET NW COOPERATIVE ASSOC INC",
     "APPLICANT_NAME": "NATHAN D. BOZARTH",
     "TRADE_NAME": "",
     "PERMIT_STATUS": [
      {
       "REVIEW_STATUS": "",
       "DISCIPLINE": "",
       "REVIEW_STATUS_DATE": ""
      }
     ]
    },
    {
     "FULL_ADDRESS": "1741 P ST NW, WASHINGTON, DC 20036",
     "B1_UNIT_START": "",
     "SSL": "0156    0055",
     "B1_ALT_ID": "P1609761",
     "TYPE": "Supplemental/Plumbing and Gas",
     "G6_STAT_DD": "Sep 27 2016 12:00AM",
     "B1_APPL_STATUS": "Permit Issued",
     "B1_APPL_STATUS_DATE": "09/27/2016",
     "DESC_OF_WORK": "",
     "SORT_DATE": null,
     "G6_STAT_DD_NET": "2016/09/27",
     "B1_APPL_STATUS_DATE_NET": "2016/09/27",
     "JOB_CLASS_CODE": "N/A",
     "JOB_SIZE": "N/A",
     "JOB_CLASSIFICATION": "N/A",
     "JOB_REVIEW_TIME": "N/A",
     "OWNER_NAME": "1741 P STREET NW COOPERATIVE ASSOC INC",
     "OWNER_FULL_NAME": "1741 P STREET NW COOPERATIVE ASSOC INC",
     "APPLICANT_NAME": "NATHAN D. BOZARTH",
     "TRADE_NAME": "",
     "PERMIT_STATUS": [
      {
       "REVIEW_STATUS": "",
       "DISCIPLINE": "",
       "REVIEW_STATUS_DATE": ""
      }
     ]
    },
    {
     "FULL_ADDRESS": "1741 P ST NW, WASHINGTON, DC 20036",
     "B1_UNIT_START": "",
     "SSL": "0156    0055",
     "B1_ALT_ID": "SR13SO02869",
     "TYPE": "Surveyors/Customer Request",
     "G6_STAT_DD": "Jan  1 1900 12:00AM",
     "B1_APPL_STATUS": "Request Complete",
     "B1_APPL_STATUS_DATE": "03/13/2013",
     "DESC_OF_WORK": "",
     "SORT_DATE": null,
     "G6_STAT_DD_NET": "",
     "B1_APPL_STATUS_DATE_NET": "2013/03/13",
     "JOB_CLASS_CODE": "N/A",
     "JOB_SIZE": "N/A",
     "JOB_CLASSIFICATION": "N/A",
     "JOB_REVIEW_TIME": "N/A",
     "OWNER_NAME": "",
     "OWNER_FULL_NAME": "",
     "APPLICANT_NAME": "EDEN  SARFATY",
     "TRADE_NAME": "",
     "PERMIT_STATUS": [
      {
       "REVIEW_STATUS": "",
       "DISCIPLINE": "",
       "REVIEW_STATUS_DATE": ""
      }
     ]
    }
   ]
  },
  "inspectionDetails": {
   "updated": "2020-06-28T18:54:25.270Z",
   "inspectionData": [
    {
     "ADDRESS": "1741 P ST NW, WASHINGTON, DC 20036",
     "UNIT": "",
     "SSL": "0156    0055",
     "ID": "M1603617",
     "G6_ACT_DES": "Mechanical Final",
     "G6_STATUS": "Approved",
     "G6_STATUS_DD": "2/16/2017 12:00:00 AM",
     "DESC_OF_WORK": "",
     "G6_STATUS_DD_NET": "2017/02/16",
     "OWNER_FULL_NAME": "1741 P STREET NW COOPERATIVE ASSOC INC",
     "APPLICANT": "NATHAN D. BOZARTH"
    },
    {
     "ADDRESS": "1741 P ST NW, WASHINGTON, DC 20036",
     "UNIT": "",
     "SSL": "0156    0055",
     "ID": "M1603617",
     "G6_ACT_DES": "Mechanical Final",
     "G6_STATUS": "Rescheduled",
     "G6_STATUS_DD": "2/15/2017 12:00:00 AM",
     "DESC_OF_WORK": "",
     "G6_STATUS_DD_NET": "2017/02/15",
     "OWNER_FULL_NAME": "1741 P STREET NW COOPERATIVE ASSOC INC",
     "APPLICANT": "NATHAN D. BOZARTH"
    },
    {
     "ADDRESS": "1741 P ST NW, WASHINGTON, DC 20036",
     "UNIT": "",
     "SSL": "0156    0055",
     "ID": "M1603617",
     "G6_ACT_DES": "Mechanical Final",
     "G6_STATUS": "Rescheduled",
     "G6_STATUS_DD": "2/3/2017 12:00:00 AM",
     "DESC_OF_WORK": "",
     "G6_STATUS_DD_NET": "2017/02/03",
     "OWNER_FULL_NAME": "1741 P STREET NW COOPERATIVE ASSOC INC",
     "APPLICANT": "NATHAN D. BOZARTH"
    }
   ]
  },
  "occupancyDetails": {
   "updated": "2020-06-28T18:54:25.439Z",
   "occupancyData": [
    {
     "FULL_ADDRESS": "1741 P ST NW, WASHINGTON, DC 20036",
     "B1_UNIT_START": "",
     "SSL": "0156    0055",
     "B1_ALT_ID": "CO0902112",
     "TYPE": "Certificate of Occupancy",
     "G6_STAT_DD": "",
     "B1_APPL_STATUS": "Application Accepted",
     "B1_APPL_STATUS_DATE": "05/11/2009",
     "DESC_OF_WORK": "Ownership ChangeAPARTMENT BUILDING (4-UNITS).",
     "G6_STAT_DD_NET": "",
     "B1_APPL_STATUS_DATE_NET": "2009/05/11",
     "OWNER_FULL_NAME": "1741 P STREET NW COOPERATIVE ASSOC INC",
     "APPLICANT": "1741 P STREET NW COOPERATIVE ASSOC, INC."
    }
   ]
  },
  "charDetails": {
   "updated": "2020-06-28T19:53:36.020Z",
   "charData": [
    {
     "PREMISEADD": "1741 P ST NW",
     "SSL": "0156    0055",
     "BLDG_NUM": "1",
     "COMPLX_NUM": "",
     "UNITNUMBER": "",
     "NUM_UNITS": "",
     "AYB": "1908",
     "STRUCT_CL_": "",
     "STYLE_D": "",
     "STRUCT_D": "",
     "GBA": "7162",
     "EXTWALL_D": "",
     "WALL_HGT": "",
     "ROOF_D": "",
     "BATHRM": "",
     "HF_BATHRM": "",
     "HEAT_D": "",
     "AC": "",
     "INTWALL_D": "",
     "ROOMS": "",
     "BEDRM": "",
     "KITCHENS": "",
     "FIREPLACES": "",
     "YR_RMDL": "1980",
     "EYB": "1864",
     "STORIES": "",
     "OWNERNAME": "1741 P STREET NW COOPERATIVE ASSOC INC",
     "OWNNAME2": "",
     "CAREOFNAME": ""
    }
   ]
  },
  "taxData": {
   "ssl": "0156    0055",
   "address": "1741 P ST NW",
   "owner": "1741 P STREET NW COOPERATIVE ASSOC INC",
   "neighborhood": "OLD CITY II",
   "sub_neighborhood": "D",
   "use_code": "26",
   "sale_price": "$.00",
   "recordation_date": "N/A",
   "2016_Assessment": "$948,650.00"
  }
 },
 "1753 CHURCH STREET NW": {
  "ownerInfo": {
   "updated": "2020-06-28T17:30:19.887Z",
   "ownerData": [
    {
     "OWNERNAME": "CHRISTOPHER P DELANEY",
     "PREMISEADD": "1753 CHURCH ST NW",
     "UNITNUMBER": "",
     "SSL": "0156    0287",
     "USECODE": "024",
     "HSTDCODE": "",
     "CLASSTYPE": "001",
     "TAXRATE": "0.0085",
     "SALEPRICE": "",
     "SALEDATE": "12/24/1998",
     "INSTNO": "",
     "ACCEPTCODE": "",
     "DEEDDATE": "12/24/1998",
     "OWNNAME2": "",
     "CPMS_ADDRESS": "1753 CHURCH ST NW",
     "CAREOFNAME": "",
     "ADDRESS1": "3145 BIRCH ST NW",
     "ADDRESS2": "",
     "CITYSTZIP": "WASHINGTON                 DC 20015-2215",
     "SALEDATE_NET": "1998/12/24",
     "DEEDDATE_NET": "1998/12/24"
    }
   ]
  },
  "addressDetails": {
   "updated": "2020-06-28T18:11:54.287Z",
   "addressData": [
    {
     "ADDRESS_ID": "225899",
     "MARID": "225899",
     "STATUS": "ACTIVE",
     "FULLADDRESS": "1753 CHURCH STREET NW",
     "ADDRNUM": "1753",
     "ADDRNUMSUFFIX": "",
     "STNAME": "CHURCH",
     "STREET_TYPE": "STREET",
     "QUADRANT": "NW",
     "CITY": "WASHINGTON",
     "STATE": "DC",
     "XCOORD": "396518.76",
     "YCOORD": "138074.45",
     "SSL": "0156    0287",
     "ANC": "ANC 2B",
     "PSA": "Police Service Area 208",
     "WARD": "Ward 2",
     "NBHD_ACTION": " ",
     "CLUSTER_": "Cluster 6",
     "POLDIST": "Police District - Second District",
     "ROC": "Police Sector 2D3",
     "CENSUS_TRACT": "005301",
     "VOTE_PRCNCT": "Precinct 15",
     "SMD": "SMD 2B07",
     "ZIPCODE": "20036",
     "NATIONALGRID": "18S UJ 23111 08826",
     "ROADWAYSEGID": "2552",
     "FOCUS_IMPROVEMENT_AREA": "NA",
     "HAS_ALIAS": "N",
     "HAS_CONDO_UNIT": "N",
     "HAS_RES_UNIT": "Y",
     "HAS_SSL": "Y",
     "LATITUDE": "38.91052554",
     "LONGITUDE": "-77.04013833",
     "STREETVIEWURL": "http://maps.google.com/maps?z=16&layer=c&cbll=38.91052554,-77.04013833&cbp=11,18.358058130889,,0,2.09",
     "RES_TYPE": "RESIDENTIAL",
     "WARD_2002": "Ward 2",
     "WARD_2012": "Ward 2",
     "ANC_2002": "ANC 2B",
     "ANC_2012": "ANC 2B",
     "SMD_2002": "SMD 2B07",
     "SMD_2012": "SMD 2B07",
     "IMAGEURL": "http://citizenatlas.dc.gov/mobilevideo",
     "IMAGEDIR": "20040805",
     "IMAGENAME": "Q5100107.jpg",
     "ConfidenceLevel": "100",
     "Zoning": "RA-8"
    }
   ]
  },
  "licenseDetails": {
   "updated": "2020-06-28T18:36:19.720Z",
   "licenseData": [
    {
     "ADDRESS": "1753  CHURCH ST NW",
     "UNIT": "",
     "SSL": "0156    0287",
     "CUST_NUM": "500616000193",
     "DECRIPTION": "Housing: Residential",
     "ENDORSEMENT_DESC": "Two Family Rental",
     "LAST_NAME": "ANNE ZORC",
     "FIRST_NAME": "CHRIS DELANEY &",
     "CORP_NAME": "",
     "TRADE_NAME": "",
     "BEGIN_RENEWAL": "May  1 2020 12:00AM",
     "END_RENEWAL": "May 31 2022 12:00AM",
     "STATUS": "Active",
     "BEGIN_RENEWAL_NET": "2020/05/01",
     "END_RENEWAL_NET": "2022/05/31"
    }
   ]
  },
  "permitDetails": {
   "updated": "2020-06-28T18:54:39.852Z",
   "permitData": []
  },
  "inspectionDetails": {
   "updated": "2020-06-28T18:54:40.035Z",
   "inspectionData": []
  },
  "occupancyDetails": {
   "updated": "2020-06-28T18:54:40.196Z",
   "occupancyData": []
  },
  "charDetails": {
   "updated": "2020-06-28T19:53:39.420Z",
   "charData": [
    {
     "PREMISEADD": "1753 CHURCH ST NW",
     "SSL": "0156    0287",
     "BLDG_NUM": "1",
     "COMPLX_NUM": "",
     "UNITNUMBER": "",
     "NUM_UNITS": "0",
     "AYB": "1890",
     "STRUCT_CL_": "",
     "STYLE_D": "3 Story",
     "STRUCT_D": "Row ",
     "GBA": "3366",
     "EXTWALL_D": "Common Brick",
     "WALL_HGT": "",
     "ROOF_D": "Buil",
     "BATHRM": "4",
     "HF_BATHRM": "0",
     "HEAT_D": "Hot ",
     "AC": "N",
     "INTWALL_D": "Hardwood",
     "ROOMS": "9",
     "BEDRM": "4",
     "KITCHENS": "3",
     "FIREPLACES": "3",
     "YR_RMDL": "",
     "EYB": "1957",
     "STORIES": "3",
     "OWNERNAME": "CHRISTOPHER P DELANEY",
     "OWNNAME2": "",
     "CAREOFNAME": ""
    }
   ]
  },
  "taxData": {
   "ssl": "0156    0287",
   "address": "1753 CHURCH ST NW",
   "owner": "CHRISTOPHER P DELANEY",
   "neighborhood": "OLD CITY II",
   "sub_neighborhood": "D",
   "use_code": "24",
   "sale_price": "$.00",
   "recordation_date": "12/24/1998",
   "2016_Assessment": "$1,127,570.00"
  }
 },
 "1755 CHURCH STREET NW": {
  "ownerInfo": {
   "updated": "2020-06-28T17:30:20.363Z",
   "ownerData": [
    {
     "OWNERNAME": "MARY E QUAYLE BAKER",
     "PREMISEADD": "1755 CHURCH ST NW",
     "UNITNUMBER": "",
     "SSL": "0156    0288",
     "USECODE": "024",
     "HSTDCODE": "",
     "CLASSTYPE": "001",
     "TAXRATE": "0.0085",
     "SALEPRICE": "",
     "SALEDATE": "",
     "INSTNO": "",
     "ACCEPTCODE": "",
     "DEEDDATE": "",
     "OWNNAME2": "",
     "CPMS_ADDRESS": "1755 CHURCH ST NW",
     "CAREOFNAME": "",
     "ADDRESS1": "PO BOX 6163",
     "ADDRESS2": "",
     "CITYSTZIP": "MC LEAN                    VA 22106-6163",
     "SALEDATE_NET": "",
     "DEEDDATE_NET": ""
    }
   ]
  },
  "addressDetails": {
   "updated": "2020-06-28T18:11:54.871Z",
   "addressData": [
    {
     "ADDRESS_ID": "225902",
     "MARID": "225902",
     "STATUS": "ACTIVE",
     "FULLADDRESS": "1755 CHURCH STREET NW",
     "ADDRNUM": "1755",
     "ADDRNUMSUFFIX": "",
     "STNAME": "CHURCH",
     "STREET_TYPE": "STREET",
     "QUADRANT": "NW",
     "CITY": "WASHINGTON",
     "STATE": "DC",
     "XCOORD": "396513.35",
     "YCOORD": "138074.34",
     "SSL": "0156    0288",
     "ANC": "ANC 2B",
     "PSA": "Police Service Area 208",
     "WARD": "Ward 2",
     "NBHD_ACTION": " ",
     "CLUSTER_": "Cluster 6",
     "POLDIST": "Police District - Second District",
     "ROC": "Police Sector 2D3",
     "CENSUS_TRACT": "005301",
     "VOTE_PRCNCT": "Precinct 15",
     "SMD": "SMD 2B07",
     "ZIPCODE": "20036",
     "NATIONALGRID": "18S UJ 23105 08826",
     "ROADWAYSEGID": "2552",
     "FOCUS_IMPROVEMENT_AREA": "NA",
     "HAS_ALIAS": "N",
     "HAS_CONDO_UNIT": "N",
     "HAS_RES_UNIT": "Y",
     "HAS_SSL": "Y",
     "LATITUDE": "38.91052453",
     "LONGITUDE": "-77.04020071",
     "STREETVIEWURL": "http://maps.google.com/maps?z=16&layer=c&cbll=38.91052453,-77.04020071&cbp=11,357.69168728194,,0,2.09",
     "RES_TYPE": "RESIDENTIAL",
     "WARD_2002": "Ward 2",
     "WARD_2012": "Ward 2",
     "ANC_2002": "ANC 2B",
     "ANC_2012": "ANC 2B",
     "SMD_2002": "SMD 2B07",
     "SMD_2012": "SMD 2B07",
     "IMAGEURL": "http://citizenatlas.dc.gov/mobilevideo",
     "IMAGEDIR": "20040805",
     "IMAGENAME": "Q5100059.jpg",
     "ConfidenceLevel": "100",
     "Zoning": "RA-8"
    }
   ]
  },
  "licenseDetails": {
   "updated": "2020-06-28T18:36:21.143Z",
   "licenseData": [
    {
     "ADDRESS": "1755  CHURCH ST NW",
     "UNIT": "",
     "SSL": "0156    0288",
     "CUST_NUM": "50000319",
     "DECRIPTION": "Housing: Residential",
     "ENDORSEMENT_DESC": "Apartment",
     "LAST_NAME": "QUAYLE BAKER",
     "FIRST_NAME": "MARY",
     "CORP_NAME": "",
     "TRADE_NAME": "",
     "BEGIN_RENEWAL": "Nov  1 2019 12:00AM",
     "END_RENEWAL": "Oct 31 2021 12:00AM",
     "STATUS": "Active",
     "BEGIN_RENEWAL_NET": "2019/11/01",
     "END_RENEWAL_NET": "2021/10/31"
    },
    {
     "ADDRESS": "1755  CHURCH ST NW",
     "UNIT": "1",
     "SSL": "0156    0288",
     "CUST_NUM": "400311005434",
     "DECRIPTION": "General Business",
     "ENDORSEMENT_DESC": "General Business Licenses",
     "LAST_NAME": "SLATER",
     "FIRST_NAME": "BETHANY",
     "CORP_NAME": "",
     "TRADE_NAME": "",
     "BEGIN_RENEWAL": "Sep  1 2013 12:00AM",
     "END_RENEWAL": "Aug 31 2015 12:00AM",
     "STATUS": "Cancelled",
     "BEGIN_RENEWAL_NET": "2013/09/01",
     "END_RENEWAL_NET": "2015/08/31"
    }
   ]
  },
  "permitDetails": {
   "updated": "2020-06-28T18:54:42.063Z",
   "permitData": []
  },
  "inspectionDetails": {
   "updated": "2020-06-28T18:54:42.240Z",
   "inspectionData": []
  },
  "occupancyDetails": {
   "updated": "2020-06-28T18:54:42.474Z",
   "occupancyData": [
    {
     "FULL_ADDRESS": "1755 CHURCH ST NW, APT# 1, WASHINGTON, DC 20036",
     "B1_UNIT_START": "1",
     "SSL": "0156    0288",
     "B1_ALT_ID": "HO1100452",
     "TYPE": "Home Occupation",
     "G6_STAT_DD": "03/24/2011",
     "B1_APPL_STATUS": "Completed",
     "B1_APPL_STATUS_DATE": "03/24/2011",
     "DESC_OF_WORK": "FINE ART MANUFACTURING OBOE REEDS AS APPROVED BY MATT LEGRANT",
     "G6_STAT_DD_NET": "2011/03/24",
     "B1_APPL_STATUS_DATE_NET": "2011/03/24",
     "OWNER_FULL_NAME": "MARY E QUAYLE BAKER",
     "APPLICANT": "BETHANY A. SLATER"
    }
   ]
  },
  "charDetails": {
   "updated": "2020-06-28T19:53:39.870Z",
   "charData": [
    {
     "PREMISEADD": "1755 CHURCH ST NW",
     "SSL": "0156    0288",
     "BLDG_NUM": "1",
     "COMPLX_NUM": "",
     "UNITNUMBER": "",
     "NUM_UNITS": "0",
     "AYB": "1890",
     "STRUCT_CL_": "",
     "STYLE_D": "3 Story",
     "STRUCT_D": "Row ",
     "GBA": "3612",
     "EXTWALL_D": "Common Brick",
     "WALL_HGT": "",
     "ROOF_D": "Meta",
     "BATHRM": "4",
     "HF_BATHRM": "0",
     "HEAT_D": "Warm",
     "AC": "Y",
     "INTWALL_D": "Hardwood",
     "ROOMS": "11",
     "BEDRM": "4",
     "KITCHENS": "3",
     "FIREPLACES": "0",
     "YR_RMDL": "1990",
     "EYB": "1957",
     "STORIES": "3",
     "OWNERNAME": "MARY E QUAYLE BAKER",
     "OWNNAME2": "",
     "CAREOFNAME": ""
    }
   ]
  },
  "taxData": {
   "ssl": "0156    0288",
   "address": "1755 CHURCH ST NW",
   "owner": "MARY E QUAYLE BAKER",
   "neighborhood": "OLD CITY II",
   "sub_neighborhood": "D",
   "use_code": "24",
   "sale_price": "$.00",
   "recordation_date": "N/A",
   "2016_Assessment": "$1,116,530.00"
  }
 },
 "1761 CHURCH STREET NW": {
  "ownerInfo": {
   "updated": "2020-06-28T17:30:21.619Z",
   "ownerData": [
    {
     "OWNERNAME": "KIMBERLY HOOVER",
     "PREMISEADD": "1761 CHURCH ST NW",
     "UNITNUMBER": "",
     "SSL": "0156    0291",
     "USECODE": "011",
     "HSTDCODE": "1",
     "CLASSTYPE": "001",
     "TAXRATE": "0.0085",
     "SALEPRICE": "",
     "SALEDATE": "07/02/1999",
     "INSTNO": "",
     "ACCEPTCODE": "",
     "DEEDDATE": "07/02/1999",
     "OWNNAME2": "",
     "CPMS_ADDRESS": "1761 CHURCH ST NW",
     "CAREOFNAME": "",
     "ADDRESS1": "1761 CHURCH ST NW",
     "ADDRESS2": "",
     "CITYSTZIP": "WASHINGTON                 DC 20036-1301",
     "SALEDATE_NET": "1999/07/02",
     "DEEDDATE_NET": "1999/07/02"
    }
   ]
  },
  "addressDetails": {
   "updated": "2020-06-28T18:11:56.801Z",
   "addressData": [
    {
     "ADDRESS_ID": "225910",
     "MARID": "225910",
     "STATUS": "ACTIVE",
     "FULLADDRESS": "1761 CHURCH STREET NW",
     "ADDRNUM": "1761",
     "ADDRNUMSUFFIX": "",
     "STNAME": "CHURCH",
     "STREET_TYPE": "STREET",
     "QUADRANT": "NW",
     "CITY": "WASHINGTON",
     "STATE": "DC",
     "XCOORD": "396496.36",
     "YCOORD": "138074.62",
     "SSL": "0156    0291",
     "ANC": "ANC 2B",
     "PSA": "Police Service Area 208",
     "WARD": "Ward 2",
     "NBHD_ACTION": " ",
     "CLUSTER_": "Cluster 6",
     "POLDIST": "Police District - Second District",
     "ROC": "Police Sector 2D3",
     "CENSUS_TRACT": "005301",
     "VOTE_PRCNCT": "Precinct 15",
     "SMD": "SMD 2B07",
     "ZIPCODE": "20036",
     "NATIONALGRID": "18S UJ 23088 08827",
     "ROADWAYSEGID": "2552",
     "FOCUS_IMPROVEMENT_AREA": "NA",
     "HAS_ALIAS": "N",
     "HAS_CONDO_UNIT": "N",
     "HAS_RES_UNIT": "N",
     "HAS_SSL": "Y",
     "LATITUDE": "38.91052698",
     "LONGITUDE": "-77.04039660",
     "STREETVIEWURL": "http://maps.google.com/maps?z=16&layer=c&cbll=38.91052698,-77.0403966&cbp=11,342.586416506528,,0,2.09",
     "RES_TYPE": "RESIDENTIAL",
     "WARD_2002": "Ward 2",
     "WARD_2012": "Ward 2",
     "ANC_2002": "ANC 2B",
     "ANC_2012": "ANC 2B",
     "SMD_2002": "SMD 2B07",
     "SMD_2012": "SMD 2B07",
     "IMAGEURL": "http://citizenatlas.dc.gov/mobilevideo",
     "IMAGEDIR": "20040805",
     "IMAGENAME": "Q5095934.jpg",
     "ConfidenceLevel": "100",
     "Zoning": "RA-8"
    }
   ]
  },
  "licenseDetails": {
   "updated": "2020-06-28T18:36:25.161Z",
   "licenseData": [
    {
     "ADDRESS": "1761  CHURCH ST NW",
     "UNIT": "",
     "SSL": "0156    0291",
     "CUST_NUM": "500515904770",
     "DECRIPTION": "Housing: Residential",
     "ENDORSEMENT_DESC": "One Family Rental",
     "LAST_NAME": "",
     "FIRST_NAME": "",
     "CORP_NAME": "Kimberly Hill Hoover ",
     "TRADE_NAME": "Attache Property Management LLC",
     "BEGIN_RENEWAL": "Sep  1 2015 12:00AM",
     "END_RENEWAL": "Aug 31 2017 12:00AM",
     "STATUS": "Expired",
     "BEGIN_RENEWAL_NET": "2015/09/01",
     "END_RENEWAL_NET": "2017/08/31"
    }
   ]
  },
  "permitDetails": {
   "updated": "2020-06-28T18:54:47.812Z",
   "permitData": [
    {
     "FULL_ADDRESS": "1761 CHURCH ST NW, WASHINGTON, DC 20036",
     "B1_UNIT_START": "",
     "SSL": "0156    0291",
     "B1_ALT_ID": "B1100192",
     "TYPE": "Construction/Alteration and Repair",
     "G6_STAT_DD": "Oct  7 2010 12:00AM",
     "B1_APPL_STATUS": "Permit Issued",
     "B1_APPL_STATUS_DATE": "10/07/2010",
     "DESC_OF_WORK": "REMOVE REAR BUMP OUT ROOF SHINGLES AND REPLACE WITH CARDNAL RED STANDING SEAM ROOF\r\nINSTALL STANDING SEAM CARDINAL RED METAL ROOF ON LOWER REAR ADDTION.",
     "SORT_DATE": null,
     "G6_STAT_DD_NET": "2010/10/07",
     "B1_APPL_STATUS_DATE_NET": "2010/10/07",
     "JOB_CLASS_CODE": "WT",
     "JOB_SIZE": "N/A",
     "JOB_CLASSIFICATION": "N/A",
     "JOB_REVIEW_TIME": "N/A",
     "OWNER_NAME": "KIMBERLY HOOVER",
     "OWNER_FULL_NAME": "KIMBERLY HOOVER",
     "APPLICANT_NAME": "JORDANA  GUZMAN",
     "TRADE_NAME": "",
     "PERMIT_STATUS": [
      {
       "REVIEW_STATUS": "Application Accepted",
       "DISCIPLINE": "Plan Review Coordinator",
       "REVIEW_STATUS_DATE": "10/07/2010"
      },
      {
       "REVIEW_STATUS": "HPRB Review Approved",
       "DISCIPLINE": "HPRB Review",
       "REVIEW_STATUS_DATE": "10/07/2010"
      },
      {
       "REVIEW_STATUS": "Permit Issued",
       "DISCIPLINE": "Issue Permit",
       "REVIEW_STATUS_DATE": "10/07/2010"
      },
      {
       "REVIEW_STATUS": "Structural Review Approved",
       "DISCIPLINE": "Structural Review",
       "REVIEW_STATUS_DATE": "10/07/2010"
      }
     ]
    },
    {
     "FULL_ADDRESS": "1761 CHURCH ST NW, Washington, DC 20036",
     "B1_UNIT_START": "",
     "SSL": "0156    0291",
     "B1_ALT_ID": "B1308784",
     "TYPE": "Construction/Alteration and Repair",
     "G6_STAT_DD": "Jul 15 2013 12:00AM",
     "B1_APPL_STATUS": "Permit Issued",
     "B1_APPL_STATUS_DATE": "07/15/2013",
     "DESC_OF_WORK": "Remove 30sf drywall. Remove wall tile. Remove kitchen cabinets. Remove built-in shelving. Install kitchen cabinets. Install tile. Install new built-ins. Patch drywall. Paint walls. Paint shelving.",
     "SORT_DATE": null,
     "G6_STAT_DD_NET": "2013/07/15",
     "B1_APPL_STATUS_DATE_NET": "2013/07/15",
     "JOB_CLASS_CODE": "WT",
     "JOB_SIZE": "N/A",
     "JOB_CLASSIFICATION": "N/A",
     "JOB_REVIEW_TIME": "N/A",
     "OWNER_NAME": "Kimberly  Hoover",
     "OWNER_FULL_NAME": "Kimberly  Hoover",
     "APPLICANT_NAME": "BOAZ YAVNAI  CAMDEN CONSTRUCTION",
     "TRADE_NAME": "",
     "PERMIT_STATUS": [
      {
       "REVIEW_STATUS": "Application Accepted",
       "DISCIPLINE": "Plan Review Coordinator",
       "REVIEW_STATUS_DATE": "07/15/2013"
      },
      {
       "REVIEW_STATUS": "HPRB Review Approved",
       "DISCIPLINE": "HPRB Review",
       "REVIEW_STATUS_DATE": "07/15/2013"
      },
      {
       "REVIEW_STATUS": "Permit Issued",
       "DISCIPLINE": "Issue Permit",
       "REVIEW_STATUS_DATE": "07/15/2013"
      },
      {
       "REVIEW_STATUS": "Structural Review Approved",
       "DISCIPLINE": "Structural Review",
       "REVIEW_STATUS_DATE": "07/15/2013"
      }
     ]
    }
   ]
  },
  "inspectionDetails": {
   "updated": "2020-06-28T18:54:48.021Z",
   "inspectionData": [
    {
     "ADDRESS": "1761 CHURCH ST NW, WASHINGTON, DC 20036",
     "UNIT": "",
     "SSL": "0156    0291",
     "ID": "CO2000395",
     "G6_ACT_DES": "Zoning Use",
     "G6_STATUS": "Disapproved",
     "G6_STATUS_DD": "11/7/2019 12:00:00 AM",
     "DESC_OF_WORK": "**ZONING INSPECTIONF FOR TWO FAMILY FLAT WITH TWO REAR PARKING SPACES***",
     "G6_STATUS_DD_NET": "2019/11/07",
     "OWNER_FULL_NAME": "KIMBERLY HOOVER",
     "APPLICANT": ""
    },
    {
     "ADDRESS": "1761 CHURCH ST NW, WASHINGTON, DC 20036",
     "UNIT": "",
     "SSL": "0156    0291",
     "ID": "CO2000395",
     "G6_ACT_DES": "Zoning Use",
     "G6_STATUS": "Rescheduled",
     "G6_STATUS_DD": "11/6/2019 12:00:00 AM",
     "DESC_OF_WORK": "**ZONING INSPECTIONF FOR TWO FAMILY FLAT WITH TWO REAR PARKING SPACES***",
     "G6_STATUS_DD_NET": "2019/11/06",
     "OWNER_FULL_NAME": "KIMBERLY HOOVER",
     "APPLICANT": ""
    },
    {
     "ADDRESS": "1761 CHURCH ST NW, WASHINGTON, DC 20036",
     "UNIT": "",
     "SSL": "0156    0291",
     "ID": "CO2000395",
     "G6_ACT_DES": "Zoning Use",
     "G6_STATUS": "Rescheduled",
     "G6_STATUS_DD": "11/5/2019 12:00:00 AM",
     "DESC_OF_WORK": "**ZONING INSPECTIONF FOR TWO FAMILY FLAT WITH TWO REAR PARKING SPACES***",
     "G6_STATUS_DD_NET": "2019/11/05",
     "OWNER_FULL_NAME": "KIMBERLY HOOVER",
     "APPLICANT": ""
    },
    {
     "ADDRESS": "1761 CHURCH ST NW, WASHINGTON, DC 20036",
     "UNIT": "",
     "SSL": "0156    0291",
     "ID": "CIC0900885",
     "G6_ACT_DES": "Initial Inspection",
     "G6_STATUS": "No Cause",
     "G6_STATUS_DD": "6/3/2009 12:00:00 AM",
     "DESC_OF_WORK": "",
     "G6_STATUS_DD_NET": "2009/06/03",
     "OWNER_FULL_NAME": "KIMBERLY HOOVER",
     "APPLICANT": ""
    },
    {
     "ADDRESS": "1761 CHURCH ST NW, WASHINGTON, DC 20036",
     "UNIT": "",
     "SSL": "0156    0291",
     "ID": "CIC0900885",
     "G6_ACT_DES": "Follow Up",
     "G6_STATUS": "No Cause",
     "G6_STATUS_DD": "5/28/2009 12:00:00 AM",
     "DESC_OF_WORK": "",
     "G6_STATUS_DD_NET": "2009/05/28",
     "OWNER_FULL_NAME": "KIMBERLY HOOVER",
     "APPLICANT": ""
    },
    {
     "ADDRESS": "1761 CHURCH ST NW, WASHINGTON, DC 20036",
     "UNIT": "",
     "SSL": "0156    0291",
     "ID": "CIC0900885",
     "G6_ACT_DES": "Initial Inspection",
     "G6_STATUS": "No Cause",
     "G6_STATUS_DD": "5/19/2009 12:00:00 AM",
     "DESC_OF_WORK": "",
     "G6_STATUS_DD_NET": "2009/05/19",
     "OWNER_FULL_NAME": "KIMBERLY HOOVER",
     "APPLICANT": ""
    }
   ]
  },
  "occupancyDetails": {
   "updated": "2020-06-28T18:54:48.168Z",
   "occupancyData": [
    {
     "FULL_ADDRESS": "1761 CHURCH ST NW, WASHINGTON, DC 20036",
     "B1_UNIT_START": "",
     "SSL": "0156    0291",
     "B1_ALT_ID": "CO2000395",
     "TYPE": "Certificate of Occupancy",
     "G6_STAT_DD": "",
     "B1_APPL_STATUS": "Application Accepted",
     "B1_APPL_STATUS_DATE": "11/05/2019",
     "DESC_OF_WORK": "Ownership Change**ZONING INSPECTIONF FOR TWO FAMILY FLAT WITH TWO REAR PARKING SPACES***",
     "G6_STAT_DD_NET": "",
     "B1_APPL_STATUS_DATE_NET": "2019/11/05",
     "OWNER_FULL_NAME": "KIMBERLY HOOVER",
     "APPLICANT": ""
    }
   ]
  },
  "charDetails": {
   "updated": "2020-06-28T19:53:41.111Z",
   "charData": [
    {
     "PREMISEADD": "1761 CHURCH ST NW",
     "SSL": "0156    0291",
     "BLDG_NUM": "1",
     "COMPLX_NUM": "",
     "UNITNUMBER": "",
     "NUM_UNITS": "0",
     "AYB": "1890",
     "STRUCT_CL_": "",
     "STYLE_D": "3 Story",
     "STRUCT_D": "Row ",
     "GBA": "2826",
     "EXTWALL_D": "Common Brick",
     "WALL_HGT": "",
     "ROOF_D": "Meta",
     "BATHRM": "2",
     "HF_BATHRM": "0",
     "HEAT_D": "Hot ",
     "AC": "N",
     "INTWALL_D": "Hardwood",
     "ROOMS": "8",
     "BEDRM": "4",
     "KITCHENS": "1",
     "FIREPLACES": "1",
     "YR_RMDL": "1999",
     "EYB": "1957",
     "STORIES": "3",
     "OWNERNAME": "KIMBERLY HOOVER",
     "OWNNAME2": "",
     "CAREOFNAME": ""
    }
   ]
  },
  "taxData": {
   "ssl": "0156    0291",
   "address": "1761 CHURCH ST NW",
   "owner": "KIMBERLY HOOVER",
   "neighborhood": "OLD CITY II",
   "sub_neighborhood": "D",
   "use_code": "11",
   "sale_price": "$.00",
   "recordation_date": "07/02/1999",
   "2016_Assessment": "$1,198,280.00"
  }
 },
 "1763 CHURCH STREET NW": {
  "ownerInfo": {
   "updated": "2020-06-28T17:30:22.117Z",
   "ownerData": [
    {
     "OWNERNAME": "CHACONAS CONTRACTING COMPANY LLC",
     "PREMISEADD": "1763 CHURCH ST NW",
     "UNITNUMBER": "",
     "SSL": "0156    0292",
     "USECODE": "024",
     "HSTDCODE": "",
     "CLASSTYPE": "001",
     "TAXRATE": "0.0085",
     "SALEPRICE": "$569,000.00",
     "SALEDATE": "06/18/2001",
     "INSTNO": "",
     "ACCEPTCODE": "MARKET",
     "DEEDDATE": "06/18/2001",
     "OWNNAME2": "",
     "CPMS_ADDRESS": "1763 CHURCH ST NW",
     "CAREOFNAME": "",
     "ADDRESS1": "3242 JONES RD",
     "ADDRESS2": "",
     "CITYSTZIP": "WOODBINE                   ND 21747",
     "SALEDATE_NET": "2001/06/18",
     "DEEDDATE_NET": "2001/06/18"
    }
   ]
  },
  "addressDetails": {
   "updated": "2020-06-28T18:11:57.359Z",
   "addressData": [
    {
     "ADDRESS_ID": "225912",
     "MARID": "225912",
     "STATUS": "ACTIVE",
     "FULLADDRESS": "1763 CHURCH STREET NW",
     "ADDRNUM": "1763",
     "ADDRNUMSUFFIX": "",
     "STNAME": "CHURCH",
     "STREET_TYPE": "STREET",
     "QUADRANT": "NW",
     "CITY": "WASHINGTON",
     "STATE": "DC",
     "XCOORD": "396491.28",
     "YCOORD": "138074.78",
     "SSL": "0156    0292",
     "ANC": "ANC 2B",
     "PSA": "Police Service Area 208",
     "WARD": "Ward 2",
     "NBHD_ACTION": " ",
     "CLUSTER_": "Cluster 6",
     "POLDIST": "Police District - Second District",
     "ROC": "Police Sector 2D3",
     "CENSUS_TRACT": "005301",
     "VOTE_PRCNCT": "Precinct 15",
     "SMD": "SMD 2B07",
     "ZIPCODE": "20036",
     "NATIONALGRID": "18S UJ 23083 08827",
     "ROADWAYSEGID": "2552",
     "FOCUS_IMPROVEMENT_AREA": "NA",
     "HAS_ALIAS": "N",
     "HAS_CONDO_UNIT": "N",
     "HAS_RES_UNIT": "N",
     "HAS_SSL": "Y",
     "LATITUDE": "38.91052840",
     "LONGITUDE": "-77.04045517",
     "STREETVIEWURL": "http://maps.google.com/maps?z=16&layer=c&cbll=38.9105284,-77.04045517&cbp=11,2.59562992928729,,0,2.09",
     "RES_TYPE": "RESIDENTIAL",
     "WARD_2002": "Ward 2",
     "WARD_2012": "Ward 2",
     "ANC_2002": "ANC 2B",
     "ANC_2012": "ANC 2B",
     "SMD_2002": "SMD 2B07",
     "SMD_2012": "SMD 2B07",
     "IMAGEURL": "http://citizenatlas.dc.gov/mobilevideo",
     "IMAGEDIR": "20040805",
     "IMAGENAME": "Q5095828.jpg",
     "ConfidenceLevel": "100",
     "Zoning": "RA-8"
    }
   ]
  },
  "licenseDetails": {
   "updated": "2020-06-28T18:36:27.042Z",
   "licenseData": [
    {
     "ADDRESS": "1763  CHURCH ST NW",
     "UNIT": "",
     "SSL": "0156    0292",
     "CUST_NUM": "500614901347",
     "DECRIPTION": "Housing: Residential",
     "ENDORSEMENT_DESC": "Two Family Rental",
     "LAST_NAME": "",
     "FIRST_NAME": "",
     "CORP_NAME": "CHACONAS CONTRACTING COMPANY LLC",
     "TRADE_NAME": "",
     "BEGIN_RENEWAL": "Jan  1 2014 12:00AM",
     "END_RENEWAL": "Dec 31 2015 12:00AM",
     "STATUS": "Expired",
     "BEGIN_RENEWAL_NET": "2014/01/01",
     "END_RENEWAL_NET": "2015/12/31"
    },
    {
     "ADDRESS": "1763  CHURCH ST NW",
     "UNIT": "",
     "SSL": "0156    0292",
     "CUST_NUM": "500618000267",
     "DECRIPTION": "Housing: Residential",
     "ENDORSEMENT_DESC": "Two Family Rental",
     "LAST_NAME": "CHACONAS",
     "FIRST_NAME": "TED",
     "CORP_NAME": "CHACONAS CONTRACTING CO. LLC",
     "TRADE_NAME": "",
     "BEGIN_RENEWAL": "Aug  1 2018 12:00AM",
     "END_RENEWAL": "Jul 31 2020 12:00AM",
     "STATUS": "Ready to Batch Print",
     "BEGIN_RENEWAL_NET": "2018/08/01",
     "END_RENEWAL_NET": "2020/07/31"
    },
    {
     "ADDRESS": "1763  CHURCH ST NW",
     "UNIT": " ",
     "SSL": "0156    0292",
     "CUST_NUM": "64003361",
     "DECRIPTION": "Housing: Residential",
     "ENDORSEMENT_DESC": "Two Family Rental",
     "LAST_NAME": "",
     "FIRST_NAME": "",
     "CORP_NAME": "CHACONAS CONTRACTING COMPANY, LLC.",
     "TRADE_NAME": "",
     "BEGIN_RENEWAL": "Oct  1 2010 12:00AM",
     "END_RENEWAL": "Sep 30 2012 12:00AM",
     "STATUS": "Expired",
     "BEGIN_RENEWAL_NET": "2010/10/01",
     "END_RENEWAL_NET": "2012/09/30"
    }
   ]
  },
  "permitDetails": {
   "updated": "2020-06-28T18:54:50.360Z",
   "permitData": []
  },
  "inspectionDetails": {
   "updated": "2020-06-28T18:54:50.509Z",
   "inspectionData": [
    {
     "ADDRESS": "1763 CHURCH ST NW, WASHINGTON, DC -",
     "UNIT": "",
     "SSL": "0156    0292",
     "ID": "ECC37396",
     "G6_ACT_DES": "Final Construction",
     "G6_STATUS": "Failed to Inspect",
     "G6_STATUS_DD": "8/25/2003 12:00:00 AM",
     "DESC_OF_WORK": "",
     "G6_STATUS_DD_NET": "2003/08/25",
     "OWNER_FULL_NAME": "",
     "APPLICANT": "TED  CHACONAS; TED  CHACONAS"
    },
    {
     "ADDRESS": "1763 CHURCH ST NW, WASHINGTON, DC -",
     "UNIT": "",
     "SSL": "0156    0292",
     "ID": "ECC27760",
     "G6_ACT_DES": "Final Electrical",
     "G6_STATUS": "No Cause",
     "G6_STATUS_DD": "5/27/2003 12:00:00 AM",
     "DESC_OF_WORK": "",
     "G6_STATUS_DD_NET": "2003/05/27",
     "OWNER_FULL_NAME": "",
     "APPLICANT": "SCOTT  MYERS; SCOTT  MYERS"
    },
    {
     "ADDRESS": "1763 CHURCH ST NW, WASHINGTON, DC -",
     "UNIT": "",
     "SSL": "0156    0292",
     "ID": "ECC22320",
     "G6_ACT_DES": "Final Electrical",
     "G6_STATUS": "Cause",
     "G6_STATUS_DD": "4/8/2003 12:00:00 AM",
     "DESC_OF_WORK": "",
     "G6_STATUS_DD_NET": "2003/04/08",
     "OWNER_FULL_NAME": "",
     "APPLICANT": "SCOTT  MYERS; SCOTT  MYERS"
    },
    {
     "ADDRESS": "1763 CHURCH ST NW, WASHINGTON, DC -",
     "UNIT": "",
     "SSL": "0156    0292",
     "ID": "ECC25485",
     "G6_ACT_DES": "Final Electrical",
     "G6_STATUS": "No Cause",
     "G6_STATUS_DD": "1/12/2003 12:00:00 AM",
     "DESC_OF_WORK": "",
     "G6_STATUS_DD_NET": "2003/01/12",
     "OWNER_FULL_NAME": "",
     "APPLICANT": "SCOTT  MYERS; SCOTT  MYERS"
    },
    {
     "ADDRESS": "1763 CHURCH ST NW, WASHINGTON, DC -",
     "UNIT": "",
     "SSL": "0156    0292",
     "ID": "ECC14480",
     "G6_ACT_DES": "Close-In Plumbing",
     "G6_STATUS": "No Cause",
     "G6_STATUS_DD": "1/10/2003 12:00:00 AM",
     "DESC_OF_WORK": "",
     "G6_STATUS_DD_NET": "2003/01/10",
     "OWNER_FULL_NAME": "",
     "APPLICANT": "BRAD  NA; BRAD  NA"
    },
    {
     "ADDRESS": "1763 CHURCH ST NW, WASHINGTON, DC -",
     "UNIT": "",
     "SSL": "0156    0292",
     "ID": "ECC11364",
     "G6_ACT_DES": "Other (see remarks) Plumbing",
     "G6_STATUS": "No Cause",
     "G6_STATUS_DD": "11/25/2002 12:00:00 AM",
     "DESC_OF_WORK": "",
     "G6_STATUS_DD_NET": "2002/11/25",
     "OWNER_FULL_NAME": "",
     "APPLICANT": "BRAD  NA; BRAD  NA"
    },
    {
     "ADDRESS": "1763 CHURCH ST NW, WASHINGTON, DC -",
     "UNIT": "",
     "SSL": "0156    0292",
     "ID": "ECC16638",
     "G6_ACT_DES": "Final Electrical",
     "G6_STATUS": "Cause",
     "G6_STATUS_DD": "2/3/2002 12:00:00 AM",
     "DESC_OF_WORK": "",
     "G6_STATUS_DD_NET": "2002/02/03",
     "OWNER_FULL_NAME": "",
     "APPLICANT": "SCOTT  MYERS; SCOTT  MYERS"
    }
   ]
  },
  "occupancyDetails": {
   "updated": "2020-06-28T18:54:50.658Z",
   "occupancyData": [
    {
     "FULL_ADDRESS": "1763 CHURCH ST NW, WASHINGTON, DC 20036-1301",
     "B1_UNIT_START": "",
     "SSL": "",
     "B1_ALT_ID": "CO61154",
     "TYPE": "Certificate of Occupancy",
     "G6_STAT_DD": "08/29/2003",
     "B1_APPL_STATUS": "Completed",
     "B1_APPL_STATUS_DATE": "          ",
     "DESC_OF_WORK": "HISTORIC PRESERVATION HOLD",
     "G6_STAT_DD_NET": "2003/08/29",
     "B1_APPL_STATUS_DATE_NET": "",
     "OWNER_FULL_NAME": "MCHUGHES",
     "APPLICANT": ""
    }
   ]
  },
  "charDetails": {
   "updated": "2020-06-28T19:53:41.570Z",
   "charData": [
    {
     "PREMISEADD": "1763 CHURCH ST NW",
     "SSL": "0156    0292",
     "BLDG_NUM": "1",
     "COMPLX_NUM": "",
     "UNITNUMBER": "",
     "NUM_UNITS": "0",
     "AYB": "1890",
     "STRUCT_CL_": "",
     "STYLE_D": "3 Story",
     "STRUCT_D": "Row ",
     "GBA": "3792",
     "EXTWALL_D": "Common Brick",
     "WALL_HGT": "",
     "ROOF_D": "Meta",
     "BATHRM": "3",
     "HF_BATHRM": "1",
     "HEAT_D": "Warm",
     "AC": "Y",
     "INTWALL_D": "Hardwood",
     "ROOMS": "9",
     "BEDRM": "6",
     "KITCHENS": "2",
     "FIREPLACES": "3",
     "YR_RMDL": "2002",
     "EYB": "1966",
     "STORIES": "3",
     "OWNERNAME": "CHACONAS CONTRACTING COMPANY LLC",
     "OWNNAME2": "",
     "CAREOFNAME": ""
    }
   ]
  },
  "taxData": {
   "ssl": "0156    0292",
   "address": "1763 CHURCH ST NW",
   "owner": "CHACONAS CONTRACTING COMPANY LLC",
   "neighborhood": "OLD CITY II",
   "sub_neighborhood": "D",
   "use_code": "24",
   "sale_price": "$569,000.00",
   "recordation_date": "06/18/2001",
   "2016_Assessment": "$1,425,110.00"
  }
 },
 "1765 P STREET NW": {
  "ownerInfo": {
   "updated": "2020-06-28T17:30:22.808Z",
   "ownerData": [
    {
     "OWNERNAME": "CARMEN DEL CASTILLO",
     "PREMISEADD": "1765 P ST NW",
     "UNITNUMBER": "",
     "SSL": "0156    0167",
     "USECODE": "024",
     "HSTDCODE": "",
     "CLASSTYPE": "001",
     "TAXRATE": "0.0085",
     "SALEPRICE": "",
     "SALEDATE": "06/02/2004",
     "INSTNO": "",
     "ACCEPTCODE": "BUYER=SELLER",
     "DEEDDATE": "06/02/2004",
     "OWNNAME2": "ERIC C DEL CASTILLO",
     "CPMS_ADDRESS": "1765 P ST NW",
     "CAREOFNAME": "",
     "ADDRESS1": "1765 P ST NW",
     "ADDRESS2": "",
     "CITYSTZIP": "WASHINGTON                 DC 20036-1308",
     "SALEDATE_NET": "2004/06/02",
     "DEEDDATE_NET": "2004/06/02"
    }
   ]
  },
  "addressDetails": {
   "updated": "2020-06-28T18:11:58.084Z",
   "addressData": [
    {
     "ADDRESS_ID": "225915",
     "MARID": "225915",
     "STATUS": "ACTIVE",
     "FULLADDRESS": "1765 P STREET NW",
     "ADDRNUM": "1765",
     "ADDRNUMSUFFIX": "",
     "STNAME": "P",
     "STREET_TYPE": "STREET",
     "QUADRANT": "NW",
     "CITY": "WASHINGTON",
     "STATE": "DC",
     "XCOORD": "396417.54",
     "YCOORD": "137999.69",
     "SSL": "0156    0167",
     "ANC": "ANC 2B",
     "PSA": "Police Service Area 208",
     "WARD": "Ward 2",
     "NBHD_ACTION": " ",
     "CLUSTER_": "Cluster 6",
     "POLDIST": "Police District - Second District",
     "ROC": "Police Sector 2D3",
     "CENSUS_TRACT": "005301",
     "VOTE_PRCNCT": "Precinct 15",
     "SMD": "SMD 2B07",
     "ZIPCODE": "20036",
     "NATIONALGRID": "18S UJ 23007 08752",
     "ROADWAYSEGID": "18815",
     "FOCUS_IMPROVEMENT_AREA": "NA",
     "HAS_ALIAS": "N",
     "HAS_CONDO_UNIT": "N",
     "HAS_RES_UNIT": "Y",
     "HAS_SSL": "Y",
     "LATITUDE": "38.90985133",
     "LONGITUDE": "-77.041305",
     "STREETVIEWURL": "http://maps.google.com/maps?z=16&layer=c&cbll=38.90983446,-77.04131144&cbp=11,13.967716072788,,0,2.09",
     "RES_TYPE": "RESIDENTIAL",
     "WARD_2002": "Ward 2",
     "WARD_2012": "Ward 2",
     "ANC_2002": "ANC 2B",
     "ANC_2012": "ANC 2B",
     "SMD_2002": "SMD 2B07",
     "SMD_2012": "SMD 2B07",
     "IMAGEURL": "http://citizenatlas.dc.gov/mobilevideo",
     "IMAGEDIR": "20040804",
     "IMAGENAME": "Q4125308.jpg",
     "ConfidenceLevel": "100",
     "Zoning": "RA-8"
    }
   ]
  },
  "licenseDetails": {
   "updated": "2020-06-28T18:36:28.928Z",
   "licenseData": [
    {
     "ADDRESS": "1765  P ST NW",
     "UNIT": "",
     "SSL": "0156    0167",
     "CUST_NUM": "39208623",
     "DECRIPTION": "Housing: Residential",
     "ENDORSEMENT_DESC": "Apartment",
     "LAST_NAME": "CASTILLO",
     "FIRST_NAME": "ERIC",
     "CORP_NAME": "",
     "TRADE_NAME": "",
     "BEGIN_RENEWAL": "Nov  1 2003 12:00AM",
     "END_RENEWAL": "Oct 31 2005 12:00AM",
     "STATUS": "Expired",
     "BEGIN_RENEWAL_NET": "2003/11/01",
     "END_RENEWAL_NET": "2005/10/31"
    },
    {
     "ADDRESS": "1765  P ST NW",
     "UNIT": "",
     "SSL": "0156    0167",
     "CUST_NUM": "66001239",
     "DECRIPTION": "Housing: Residential",
     "ENDORSEMENT_DESC": "Apartment",
     "LAST_NAME": "DEL CASTILLO",
     "FIRST_NAME": "CARMEN",
     "CORP_NAME": "",
     "TRADE_NAME": "",
     "BEGIN_RENEWAL": "Feb  1 2018 12:00AM",
     "END_RENEWAL": "Jan 31 2020 12:00AM",
     "STATUS": "Expired",
     "BEGIN_RENEWAL_NET": "2018/02/01",
     "END_RENEWAL_NET": "2020/01/31"
    }
   ]
  },
  "permitDetails": {
   "updated": "2020-06-28T18:54:53.555Z",
   "permitData": [
    {
     "FULL_ADDRESS": "1765 P ST NW, Washington, DC",
     "B1_UNIT_START": "",
     "SSL": "0156    0167",
     "B1_ALT_ID": "B0901092",
     "TYPE": "Construction/Alteration and Repair",
     "G6_STAT_DD": "Nov  7 2008 12:00AM",
     "B1_APPL_STATUS": "Permit Issued",
     "B1_APPL_STATUS_DATE": "11/07/2008",
     "DESC_OF_WORK": "Remove tree coming out of brick wall. Dig out all roots and repair damage to brick wall. Scrap off cement over section of brick wall and restore.",
     "SORT_DATE": null,
     "G6_STAT_DD_NET": "2008/11/07",
     "B1_APPL_STATUS_DATE_NET": "2008/11/07",
     "JOB_CLASS_CODE": "N/A",
     "JOB_SIZE": "N/A",
     "JOB_CLASSIFICATION": "N/A",
     "JOB_REVIEW_TIME": "N/A",
     "OWNER_NAME": "CARMEN DEL CASTILLO",
     "OWNER_FULL_NAME": "CARMEN DEL CASTILLO",
     "APPLICANT_NAME": ".",
     "TRADE_NAME": "",
     "PERMIT_STATUS": [
      {
       "REVIEW_STATUS": "Application Accepted",
       "DISCIPLINE": "Plan Review Coordinator",
       "REVIEW_STATUS_DATE": "11/07/2008"
      },
      {
       "REVIEW_STATUS": "DDOT Review Approved",
       "DISCIPLINE": "DDOT Review (Public Space)",
       "REVIEW_STATUS_DATE": "11/07/2008"
      },
      {
       "REVIEW_STATUS": "HPRB Review Approved",
       "DISCIPLINE": "HPRB Review",
       "REVIEW_STATUS_DATE": "11/07/2008"
      },
      {
       "REVIEW_STATUS": "Permit Issued",
       "DISCIPLINE": "Issue Permit",
       "REVIEW_STATUS_DATE": "11/07/2008"
      },
      {
       "REVIEW_STATUS": "Structural Review Approved",
       "DISCIPLINE": "Structural Review",
       "REVIEW_STATUS_DATE": "11/07/2008"
      }
     ]
    },
    {
     "FULL_ADDRESS": "1765 P ST NW, WASHINGTON, DC 20036",
     "B1_UNIT_START": "",
     "SSL": "0156    0167",
     "B1_ALT_ID": "B1506227",
     "TYPE": "Construction/Alteration and Repair",
     "G6_STAT_DD": "Apr  9 2015 12:00AM",
     "B1_APPL_STATUS": "Permit Issued",
     "B1_APPL_STATUS_DATE": "04/09/2015",
     "DESC_OF_WORK": "replace windows in 4th floor bedroom windows with Clad pine same size and location and type of window",
     "SORT_DATE": null,
     "G6_STAT_DD_NET": "2015/04/09",
     "B1_APPL_STATUS_DATE_NET": "2015/04/09",
     "JOB_CLASS_CODE": "WT",
     "JOB_SIZE": "N/A",
     "JOB_CLASSIFICATION": "N/A",
     "JOB_REVIEW_TIME": "N/A",
     "OWNER_NAME": "Del Cortillo",
     "OWNER_FULL_NAME": "Del Cortillo",
     "APPLICANT_NAME": "DEL CORTILLO",
     "TRADE_NAME": "",
     "PERMIT_STATUS": [
      {
       "REVIEW_STATUS": "Application Accepted",
       "DISCIPLINE": "Plan Review Coordinator",
       "REVIEW_STATUS_DATE": "04/08/2015"
      },
      {
       "REVIEW_STATUS": "HPRB Review Approved",
       "DISCIPLINE": "HPRB Review",
       "REVIEW_STATUS_DATE": "04/09/2015"
      },
      {
       "REVIEW_STATUS": "Permit Issued",
       "DISCIPLINE": "Issue Permit",
       "REVIEW_STATUS_DATE": "04/09/2015"
      },
      {
       "REVIEW_STATUS": "Structural Review Approved",
       "DISCIPLINE": "Structural Review",
       "REVIEW_STATUS_DATE": "04/09/2015"
      }
     ]
    },
    {
     "FULL_ADDRESS": "1765 P ST NW exterior, Washington, DC 20036",
     "B1_UNIT_START": "exterior",
     "SSL": "0156    0167",
     "B1_ALT_ID": "SC1500080",
     "TYPE": "Construction/Miscellaneous/Scaffolding",
     "G6_STAT_DD": "May 26 2015 12:00AM",
     "B1_APPL_STATUS": "Permit Issued",
     "B1_APPL_STATUS_DATE": "05/26/2015",
     "DESC_OF_WORK": "exterior paint work 45 feet high",
     "SORT_DATE": null,
     "G6_STAT_DD_NET": "2015/05/26",
     "B1_APPL_STATUS_DATE_NET": "2015/05/26",
     "JOB_CLASS_CODE": "N/A",
     "JOB_SIZE": "N/A",
     "JOB_CLASSIFICATION": "N/A",
     "JOB_REVIEW_TIME": "N/A",
     "OWNER_NAME": "eric  del castillo",
     "OWNER_FULL_NAME": "eric  del castillo",
     "APPLICANT_NAME": "NAA INC  CORDON",
     "TRADE_NAME": "",
     "PERMIT_STATUS": [
      {
       "REVIEW_STATUS": "Application Accepted",
       "DISCIPLINE": "Plan Review Coordinator",
       "REVIEW_STATUS_DATE": "04/24/2015"
      },
      {
       "REVIEW_STATUS": "Comments Submitted to the Applicant for Correction",
       "DISCIPLINE": "Structural Review Pending",
       "REVIEW_STATUS_DATE": "05/26/2015"
      },
      {
       "REVIEW_STATUS": "HPRB Review Approved",
       "DISCIPLINE": "HPRB Review",
       "REVIEW_STATUS_DATE": "04/24/2015"
      },
      {
       "REVIEW_STATUS": "Permit Issued",
       "DISCIPLINE": "Issue Permit",
       "REVIEW_STATUS_DATE": "05/26/2015"
      },
      {
       "REVIEW_STATUS": "Structural Review Approved",
       "DISCIPLINE": "Structural Review",
       "REVIEW_STATUS_DATE": "05/26/2015"
      }
     ]
    },
    {
     "FULL_ADDRESS": "1765 P ST NW, WASHINGTON, DC 20036",
     "B1_UNIT_START": "",
     "SSL": "",
     "B1_ALT_ID": "SR17SO05477",
     "TYPE": "Surveyors/Customer Request",
     "G6_STAT_DD": "Jan  1 1900 12:00AM",
     "B1_APPL_STATUS": "Request Complete",
     "B1_APPL_STATUS_DATE": "06/09/2017",
     "DESC_OF_WORK": "        ===> Count: 1,  Process: Expedite,  Delivery: Email",
     "SORT_DATE": null,
     "G6_STAT_DD_NET": "",
     "B1_APPL_STATUS_DATE_NET": "2017/06/09",
     "JOB_CLASS_CODE": "N/A",
     "JOB_SIZE": "N/A",
     "JOB_CLASSIFICATION": "N/A",
     "JOB_REVIEW_TIME": "N/A",
     "OWNER_NAME": "",
     "OWNER_FULL_NAME": "",
     "APPLICANT_NAME": "HATEM  HATEM",
     "TRADE_NAME": "",
     "PERMIT_STATUS": [
      {
       "REVIEW_STATUS": "",
       "DISCIPLINE": "",
       "REVIEW_STATUS_DATE": ""
      }
     ]
    }
   ]
  },
  "inspectionDetails": {
   "updated": "2020-06-28T18:54:53.773Z",
   "inspectionData": [
    {
     "ADDRESS": "1765 P ST NW, WASHINGTON, DC 20036",
     "UNIT": "",
     "SSL": "0156    0167",
     "ID": "CIC1401858",
     "G6_ACT_DES": "Follow Up",
     "G6_STATUS": "Scheduled",
     "G6_STATUS_DD": "11/24/2015 12:00:00 AM",
     "DESC_OF_WORK": "",
     "G6_STATUS_DD_NET": "2015/11/24",
     "OWNER_FULL_NAME": "ERIC C DEL CASTILLO",
     "APPLICANT": ""
    },
    {
     "ADDRESS": "1765 P ST NW, WASHINGTON, DC 20036",
     "UNIT": "",
     "SSL": "0156    0167",
     "ID": "CIC1401858",
     "G6_ACT_DES": "Follow Up",
     "G6_STATUS": "Scheduled",
     "G6_STATUS_DD": "8/13/2015 12:00:00 AM",
     "DESC_OF_WORK": "",
     "G6_STATUS_DD_NET": "2015/08/13",
     "OWNER_FULL_NAME": "ERIC C DEL CASTILLO",
     "APPLICANT": ""
    },
    {
     "ADDRESS": "1765 P ST NW, WASHINGTON, DC 20036",
     "UNIT": "",
     "SSL": "0156    0167",
     "ID": "CIC1401858",
     "G6_ACT_DES": "Follow Up",
     "G6_STATUS": "Scheduled",
     "G6_STATUS_DD": "12/2/2014 12:00:00 AM",
     "DESC_OF_WORK": "",
     "G6_STATUS_DD_NET": "2014/12/02",
     "OWNER_FULL_NAME": "ERIC C DEL CASTILLO",
     "APPLICANT": ""
    },
    {
     "ADDRESS": "1765 P ST NW, WASHINGTON, DC 20036",
     "UNIT": "",
     "SSL": "0156    0167",
     "ID": "CIC1401858",
     "G6_ACT_DES": "Follow Up",
     "G6_STATUS": "Scheduled",
     "G6_STATUS_DD": "11/13/2014 12:00:00 AM",
     "DESC_OF_WORK": "",
     "G6_STATUS_DD_NET": "2014/11/13",
     "OWNER_FULL_NAME": "ERIC C DEL CASTILLO",
     "APPLICANT": ""
    },
    {
     "ADDRESS": "1765 P ST NW, WASHINGTON, DC 20036",
     "UNIT": "",
     "SSL": "0156    0167",
     "ID": "CIC1401858",
     "G6_ACT_DES": "Initial Inspection",
     "G6_STATUS": "Scheduled",
     "G6_STATUS_DD": "8/20/2014 12:00:00 AM",
     "DESC_OF_WORK": "",
     "G6_STATUS_DD_NET": "2014/08/20",
     "OWNER_FULL_NAME": "ERIC C DEL CASTILLO",
     "APPLICANT": ""
    }
   ]
  },
  "occupancyDetails": {
   "updated": "2020-06-28T18:54:53.996Z",
   "occupancyData": [
    {
     "FULL_ADDRESS": "1765 P ST NW, WASHINGTON, DC 20036-1308",
     "B1_UNIT_START": "",
     "SSL": "",
     "B1_ALT_ID": "CO113302",
     "TYPE": "Certificate of Occupancy",
     "G6_STAT_DD": "02/11/2006",
     "B1_APPL_STATUS": "Completed",
     "B1_APPL_STATUS_DATE": "          ",
     "DESC_OF_WORK": "HISTORIC PRESERVATION HOLD",
     "G6_STAT_DD_NET": "2006/02/11",
     "B1_APPL_STATUS_DATE_NET": "",
     "OWNER_FULL_NAME": "DEL CASTILLO CASTILLO",
     "APPLICANT": ""
    }
   ]
  },
  "charDetails": {
   "updated": "2020-06-28T19:53:42.180Z",
   "charData": [
    {
     "PREMISEADD": "1765 P ST NW",
     "SSL": "0156    0167",
     "BLDG_NUM": "1",
     "COMPLX_NUM": "",
     "UNITNUMBER": "",
     "NUM_UNITS": "0",
     "AYB": "1890",
     "STRUCT_CL_": "",
     "STYLE_D": "3 Story",
     "STRUCT_D": "Row ",
     "GBA": "5654",
     "EXTWALL_D": "Common Brick",
     "WALL_HGT": "",
     "ROOF_D": "Meta",
     "BATHRM": "4",
     "HF_BATHRM": "0",
     "HEAT_D": "Hot ",
     "AC": "N",
     "INTWALL_D": "Hardwood",
     "ROOMS": "10",
     "BEDRM": "4",
     "KITCHENS": "4",
     "FIREPLACES": "0",
     "YR_RMDL": "",
     "EYB": "1957",
     "STORIES": "3",
     "OWNERNAME": "CARMEN DEL CASTILLO",
     "OWNNAME2": "ERIC C DEL CASTILLO",
     "CAREOFNAME": ""
    }
   ]
  },
  "taxData": {
   "ssl": "0156    0167",
   "address": "1765 P ST NW",
   "owner": "CARMEN DEL CASTILLO",
   "neighborhood": "OLD CITY II",
   "sub_neighborhood": "D",
   "use_code": "24",
   "sale_price": "$.00",
   "recordation_date": "06/02/2004",
   "2016_Assessment": "$1,178,860.00"
  }
 },
 "1767 CHURCH STREET NW": {
  "ownerInfo": {
   "updated": "2020-06-28T17:30:23.105Z",
   "ownerData": [
    {
     "OWNERNAME": "GEORGE R LEWIS",
     "PREMISEADD": "1767 CHURCH ST NW",
     "UNITNUMBER": "",
     "SSL": "0156    0294",
     "USECODE": "011",
     "HSTDCODE": "5",
     "CLASSTYPE": "001",
     "TAXRATE": "0.0085",
     "SALEPRICE": "",
     "SALEDATE": "",
     "INSTNO": "",
     "ACCEPTCODE": "",
     "DEEDDATE": "",
     "OWNNAME2": "WILLIAM J RYAN",
     "CPMS_ADDRESS": "1767 CHURCH ST NW",
     "CAREOFNAME": "",
     "ADDRESS1": "1767 CHURCH ST NW",
     "ADDRESS2": "",
     "CITYSTZIP": "WASHINGTON                 DC 20036-1301",
     "SALEDATE_NET": "",
     "DEEDDATE_NET": ""
    }
   ]
  },
  "addressDetails": {
   "updated": "2020-06-28T18:11:58.456Z",
   "addressData": [
    {
     "ADDRESS_ID": "225916",
     "MARID": "225916",
     "STATUS": "ACTIVE",
     "FULLADDRESS": "1767 CHURCH STREET NW",
     "ADDRNUM": "1767",
     "ADDRNUMSUFFIX": "",
     "STNAME": "CHURCH",
     "STREET_TYPE": "STREET",
     "QUADRANT": "NW",
     "CITY": "WASHINGTON",
     "STATE": "DC",
     "XCOORD": "396479.64",
     "YCOORD": "138074.84",
     "SSL": "0156    0294",
     "ANC": "ANC 2B",
     "PSA": "Police Service Area 208",
     "WARD": "Ward 2",
     "NBHD_ACTION": " ",
     "CLUSTER_": "Cluster 6",
     "POLDIST": "Police District - Second District",
     "ROC": "Police Sector 2D3",
     "CENSUS_TRACT": "005301",
     "VOTE_PRCNCT": "Precinct 15",
     "SMD": "SMD 2B07",
     "ZIPCODE": "20036",
     "NATIONALGRID": "18S UJ 23071 08827",
     "ROADWAYSEGID": "2552",
     "FOCUS_IMPROVEMENT_AREA": "NA",
     "HAS_ALIAS": "N",
     "HAS_CONDO_UNIT": "N",
     "HAS_RES_UNIT": "N",
     "HAS_SSL": "Y",
     "LATITUDE": "38.91052890",
     "LONGITUDE": "-77.04058938",
     "STREETVIEWURL": "http://maps.google.com/maps?z=16&layer=c&cbll=38.9105289,-77.04058938&cbp=11,0.535387152811515,,0,2.09",
     "RES_TYPE": "RESIDENTIAL",
     "WARD_2002": "Ward 2",
     "WARD_2012": "Ward 2",
     "ANC_2002": "ANC 2B",
     "ANC_2012": "ANC 2B",
     "SMD_2002": "SMD 2B07",
     "SMD_2012": "SMD 2B07",
     "IMAGEURL": "http://citizenatlas.dc.gov/mobilevideo",
     "IMAGEDIR": "20040805",
     "IMAGENAME": "Q5095809.jpg",
     "ConfidenceLevel": "100",
     "Zoning": "RA-8"
    }
   ]
  },
  "licenseDetails": {
   "updated": "2020-06-28T18:36:30.079Z",
   "licenseData": [
    {
     "ADDRESS": "1767  CHURCH ST NW",
     "UNIT": "",
     "SSL": "0156    0294",
     "CUST_NUM": "39800792",
     "DECRIPTION": "Housing: Residential",
     "ENDORSEMENT_DESC": "Apartment",
     "LAST_NAME": "RYAN",
     "FIRST_NAME": "WILLIAM",
     "CORP_NAME": "",
     "TRADE_NAME": "",
     "BEGIN_RENEWAL": "Nov  1 2003 12:00AM",
     "END_RENEWAL": "Oct 31 2005 12:00AM",
     "STATUS": "Expired",
     "BEGIN_RENEWAL_NET": "2003/11/01",
     "END_RENEWAL_NET": "2005/10/31"
    },
    {
     "ADDRESS": "1767  CHURCH ST NW",
     "UNIT": "",
     "SSL": "0156    0294",
     "CUST_NUM": "500518000133",
     "DECRIPTION": "Housing: Residential",
     "ENDORSEMENT_DESC": "One Family Rental",
     "LAST_NAME": "RYAN",
     "FIRST_NAME": "WILLIAM",
     "CORP_NAME": "",
     "TRADE_NAME": "",
     "BEGIN_RENEWAL": "Oct  1 2019 12:00AM",
     "END_RENEWAL": "Sep 30 2021 12:00AM",
     "STATUS": "Active",
     "BEGIN_RENEWAL_NET": "2019/10/01",
     "END_RENEWAL_NET": "2021/09/30"
    }
   ]
  },
  "permitDetails": {
   "updated": "2020-06-28T18:54:55.117Z",
   "permitData": [
    {
     "FULL_ADDRESS": "1767 CHURCH ST NW, WASHINGTON, DC 20036",
     "B1_UNIT_START": "",
     "SSL": "0156    0294",
     "B1_ALT_ID": "P1004213",
     "TYPE": "Supplemental/Plumbing and Gas",
     "G6_STAT_DD": "Jun  3 2010 12:00AM",
     "B1_APPL_STATUS": "Permit Issued",
     "B1_APPL_STATUS_DATE": "06/03/2010",
     "DESC_OF_WORK": "",
     "SORT_DATE": null,
     "G6_STAT_DD_NET": "2010/06/03",
     "B1_APPL_STATUS_DATE_NET": "2010/06/03",
     "JOB_CLASS_CODE": "N/A",
     "JOB_SIZE": "N/A",
     "JOB_CLASSIFICATION": "N/A",
     "JOB_REVIEW_TIME": "N/A",
     "OWNER_NAME": "WILLIAM J RYAN",
     "OWNER_FULL_NAME": "WILLIAM J RYAN",
     "APPLICANT_NAME": "DAVID  BROWN",
     "TRADE_NAME": "",
     "PERMIT_STATUS": [
      {
       "REVIEW_STATUS": "",
       "DISCIPLINE": "",
       "REVIEW_STATUS_DATE": ""
      }
     ]
    }
   ]
  },
  "inspectionDetails": {
   "updated": "2020-06-28T18:54:55.305Z",
   "inspectionData": [
    {
     "ADDRESS": "1767 CHURCH ST NW, WASHINGTON, DC 20036",
     "UNIT": "",
     "SSL": "0156    0294",
     "ID": "CO1703265",
     "G6_ACT_DES": "Building Final",
     "G6_STATUS": "Approved",
     "G6_STATUS_DD": "10/12/2017 12:00:00 AM",
     "DESC_OF_WORK": "THERE IS NO PRIOR CERTIFICATE OF OCCUPANCY FOR USE AS A 3 UNIT APARTMENT BUILDING. THE STRUCTURAL DIVISION SHALL DETERMINE IF A BUILDING PERMIT IS REQUIRED TO ESTABLISH THE USE AND IF NOT WHAT PROCESS WILL SUFFICE ENTERING THEIR DETERMINATION INTO ACCELLA",
     "G6_STATUS_DD_NET": "2017/10/12",
     "OWNER_FULL_NAME": "WILLIAM J RYAN AND GEORGE R. LEWIS",
     "APPLICANT": ""
    },
    {
     "ADDRESS": "1767 CHURCH ST NW, WASHINGTON, DC 20036",
     "UNIT": "",
     "SSL": "0156    0294",
     "ID": "CO1703265",
     "G6_ACT_DES": "Zoning Use",
     "G6_STATUS": "Approved",
     "G6_STATUS_DD": "10/12/2017 12:00:00 AM",
     "DESC_OF_WORK": "THERE IS NO PRIOR CERTIFICATE OF OCCUPANCY FOR USE AS A 3 UNIT APARTMENT BUILDING. THE STRUCTURAL DIVISION SHALL DETERMINE IF A BUILDING PERMIT IS REQUIRED TO ESTABLISH THE USE AND IF NOT WHAT PROCESS WILL SUFFICE ENTERING THEIR DETERMINATION INTO ACCELLA",
     "G6_STATUS_DD_NET": "2017/10/12",
     "OWNER_FULL_NAME": "WILLIAM J RYAN AND GEORGE R. LEWIS",
     "APPLICANT": ""
    },
    {
     "ADDRESS": "1767 CHURCH ST NW, WASHINGTON, DC 20036",
     "UNIT": "",
     "SSL": "0156    0294",
     "ID": "CO1703265",
     "G6_ACT_DES": "Building Final",
     "G6_STATUS": "Rescheduled",
     "G6_STATUS_DD": "10/2/2017 12:00:00 AM",
     "DESC_OF_WORK": "THERE IS NO PRIOR CERTIFICATE OF OCCUPANCY FOR USE AS A 3 UNIT APARTMENT BUILDING. THE STRUCTURAL DIVISION SHALL DETERMINE IF A BUILDING PERMIT IS REQUIRED TO ESTABLISH THE USE AND IF NOT WHAT PROCESS WILL SUFFICE ENTERING THEIR DETERMINATION INTO ACCELLA",
     "G6_STATUS_DD_NET": "2017/10/02",
     "OWNER_FULL_NAME": "WILLIAM J RYAN AND GEORGE R. LEWIS",
     "APPLICANT": ""
    },
    {
     "ADDRESS": "1767 CHURCH ST NW, WASHINGTON, DC 20036",
     "UNIT": "",
     "SSL": "0156    0294",
     "ID": "CO1703265",
     "G6_ACT_DES": "Zoning Use",
     "G6_STATUS": "Rescheduled",
     "G6_STATUS_DD": "10/2/2017 12:00:00 AM",
     "DESC_OF_WORK": "THERE IS NO PRIOR CERTIFICATE OF OCCUPANCY FOR USE AS A 3 UNIT APARTMENT BUILDING. THE STRUCTURAL DIVISION SHALL DETERMINE IF A BUILDING PERMIT IS REQUIRED TO ESTABLISH THE USE AND IF NOT WHAT PROCESS WILL SUFFICE ENTERING THEIR DETERMINATION INTO ACCELLA",
     "G6_STATUS_DD_NET": "2017/10/02",
     "OWNER_FULL_NAME": "WILLIAM J RYAN AND GEORGE R. LEWIS",
     "APPLICANT": ""
    }
   ]
  },
  "occupancyDetails": {
   "updated": "2020-06-28T18:54:55.456Z",
   "occupancyData": [
    {
     "FULL_ADDRESS": "1767 CHURCH ST NW, WASHINGTON, DC 20036",
     "B1_UNIT_START": "",
     "SSL": "0156    0294",
     "B1_ALT_ID": "CO1703265",
     "TYPE": "Certificate of Occupancy",
     "G6_STAT_DD": "",
     "B1_APPL_STATUS": "Application Accepted",
     "B1_APPL_STATUS_DATE": "08/03/2017",
     "DESC_OF_WORK": "THERE IS NO PRIOR CERTIFICATE OF OCCUPANCY FOR USE AS A 3 UNIT APARTMENT BUILDING. THE STRUCTURAL DIVISION SHALL DETERMINE IF A BUILDING PERMIT IS REQUIRED TO ESTABLISH THE USE AND IF NOT WHAT PROCESS WILL SUFFICE ENTERING THEIR DETERMINATION INTO ACCELLA",
     "G6_STAT_DD_NET": "",
     "B1_APPL_STATUS_DATE_NET": "2017/08/03",
     "OWNER_FULL_NAME": "WILLIAM J RYAN AND GEORGE R. LEWIS",
     "APPLICANT": ""
    }
   ]
  },
  "charDetails": {
   "updated": "2020-06-28T19:53:42.496Z",
   "charData": [
    {
     "PREMISEADD": "1767 CHURCH ST NW",
     "SSL": "0156    0294",
     "BLDG_NUM": "1",
     "COMPLX_NUM": "",
     "UNITNUMBER": "",
     "NUM_UNITS": "0",
     "AYB": "1893",
     "STRUCT_CL_": "",
     "STYLE_D": "3 Story",
     "STRUCT_D": "Row ",
     "GBA": "3647",
     "EXTWALL_D": "Common Brick",
     "WALL_HGT": "",
     "ROOF_D": "Meta",
     "BATHRM": "3",
     "HF_BATHRM": "0",
     "HEAT_D": "Warm",
     "AC": "Y",
     "INTWALL_D": "Hardwood",
     "ROOMS": "7",
     "BEDRM": "3",
     "KITCHENS": "3",
     "FIREPLACES": "0",
     "YR_RMDL": "1984",
     "EYB": "1957",
     "STORIES": "3",
     "OWNERNAME": "GEORGE R LEWIS",
     "OWNNAME2": "WILLIAM J RYAN",
     "CAREOFNAME": ""
    }
   ]
  },
  "taxData": {
   "ssl": "0156    0294",
   "address": "1767 CHURCH ST NW",
   "owner": "GEORGE R LEWIS",
   "neighborhood": "OLD CITY II",
   "sub_neighborhood": "D",
   "use_code": "11",
   "sale_price": "$.00",
   "recordation_date": "N/A",
   "2016_Assessment": "$1,171,860.00"
  }
 },
 "1420 17TH STREET NW": {
  "ownerInfo": {
   "updated": "2020-06-28T17:30:26.048Z",
   "ownerData": [
    {
     "OWNERNAME": "SHAWN M CASEY TRUSTEE",
     "PREMISEADD": "1420 17TH ST NW",
     "UNITNUMBER": "",
     "SSL": "0157    0092",
     "USECODE": "011",
     "HSTDCODE": "",
     "CLASSTYPE": "001",
     "TAXRATE": "0.0085",
     "SALEPRICE": "",
     "SALEDATE": "",
     "INSTNO": "",
     "ACCEPTCODE": "",
     "DEEDDATE": "",
     "OWNNAME2": "",
     "CPMS_ADDRESS": "1420 17TH ST NW",
     "CAREOFNAME": "ROBERT COHEN",
     "ADDRESS1": "PO BOX 342",
     "ADDRESS2": "",
     "CITYSTZIP": "VERONA                     PA 15147-0342",
     "SALEDATE_NET": "",
     "DEEDDATE_NET": ""
    }
   ]
  },
  "addressDetails": {
   "updated": "2020-06-28T18:12:01.717Z",
   "addressData": [
    {
     "ADDRESS_ID": "241725",
     "MARID": "241725",
     "STATUS": "ACTIVE",
     "FULLADDRESS": "1420 17TH STREET NW",
     "ADDRNUM": "1420",
     "ADDRNUMSUFFIX": "",
     "STNAME": "17TH",
     "STREET_TYPE": "STREET",
     "QUADRANT": "NW",
     "CITY": "WASHINGTON",
     "STATE": "DC",
     "XCOORD": "396641.24",
     "YCOORD": "137955.54",
     "SSL": "0157    0092",
     "ANC": "ANC 2B",
     "PSA": "Police Service Area 208",
     "WARD": "Ward 2",
     "NBHD_ACTION": " ",
     "CLUSTER_": "Cluster 6",
     "POLDIST": "Police District - Second District",
     "ROC": "Police Sector 2D3",
     "CENSUS_TRACT": "005301",
     "VOTE_PRCNCT": "Precinct 15",
     "SMD": "SMD 2B07",
     "ZIPCODE": "20036",
     "NATIONALGRID": "18S UJ 23230 08705",
     "ROADWAYSEGID": "34358",
     "FOCUS_IMPROVEMENT_AREA": "NA",
     "HAS_ALIAS": "N",
     "HAS_CONDO_UNIT": "N",
     "HAS_RES_UNIT": "Y",
     "HAS_SSL": "Y",
     "LATITUDE": "38.90945483",
     "LONGITUDE": "-77.03872557",
     "STREETVIEWURL": "http://maps.google.com/maps?z=16&layer=c&cbll=38.90945483,-77.03872557&cbp=11,271.853087691568,,0,2.09",
     "RES_TYPE": "RESIDENTIAL",
     "WARD_2002": "Ward 2",
     "WARD_2012": "Ward 2",
     "ANC_2002": "ANC 2B",
     "ANC_2012": "ANC 2B",
     "SMD_2002": "SMD 2B07",
     "SMD_2012": "SMD 2B07",
     "IMAGEURL": "http://citizenatlas.dc.gov/mobilevideo",
     "IMAGEDIR": "20040815",
     "IMAGENAME": "QF102857.jpg",
     "ConfidenceLevel": "100",
     "Zoning": "RA-10"
    }
   ]
  },
  "licenseDetails": {
   "updated": "2020-06-28T18:36:36.569Z",
   "licenseData": [
    {
     "ADDRESS": "1400 -1799 17TH ST NW",
     "UNIT": "1799",
     "SSL": "NA",
     "CUST_NUM": "201211000891",
     "DECRIPTION": "Entertainment",
     "ENDORSEMENT_DESC": "Special Events",
     "LAST_NAME": "",
     "FIRST_NAME": "",
     "CORP_NAME": "URBAN NEIGHBORHOOD ALLIANCE",
     "TRADE_NAME": "17TH STREET FESTIVAL",
     "BEGIN_RENEWAL": "",
     "END_RENEWAL": "Sep 25 2011 12:00AM",
     "STATUS": "Expired",
     "BEGIN_RENEWAL_NET": "",
     "END_RENEWAL_NET": "2011/09/25"
    },
    {
     "ADDRESS": "1400 -1799 17TH ST NW",
     "UNIT": "1799",
     "SSL": "NA",
     "CUST_NUM": "201212000094",
     "DECRIPTION": "Entertainment",
     "ENDORSEMENT_DESC": "Special Events",
     "LAST_NAME": "",
     "FIRST_NAME": "",
     "CORP_NAME": "URBAN NEIGHBORHOOD ALLIANCE",
     "TRADE_NAME": "17TH STREET FESTIVAL",
     "BEGIN_RENEWAL": "",
     "END_RENEWAL": "Sep 23 2012 12:00AM",
     "STATUS": "Expired",
     "BEGIN_RENEWAL_NET": "",
     "END_RENEWAL_NET": "2012/09/23"
    }
   ]
  },
  "permitDetails": {
   "updated": "2020-06-28T18:55:18.423Z",
   "permitData": []
  },
  "inspectionDetails": {
   "updated": "2020-06-28T18:55:18.638Z",
   "inspectionData": [
    {
     "ADDRESS": "1420 17TH ST NW, WASHINGTON, DC 20036",
     "UNIT": "",
     "SSL": "0157    0092",
     "ID": "CIC1201477",
     "G6_ACT_DES": "Initial Inspection",
     "G6_STATUS": "No Cause",
     "G6_STATUS_DD": "5/2/2012 12:00:00 AM",
     "DESC_OF_WORK": "",
     "G6_STATUS_DD_NET": "2012/05/02",
     "OWNER_FULL_NAME": "SHAWN M CASEY TRUSTEE",
     "APPLICANT": ""
    },
    {
     "ADDRESS": "1420 17TH ST NW, WASHINGTON, DC 20036",
     "UNIT": "",
     "SSL": "0157    0092",
     "ID": "CO1001029",
     "G6_ACT_DES": "Zoning Final",
     "G6_STATUS": "Approved",
     "G6_STATUS_DD": "3/18/2010 12:00:00 AM",
     "DESC_OF_WORK": "TWO FAMILY FLAT -- (2 UNITS)",
     "G6_STATUS_DD_NET": "2010/03/18",
     "OWNER_FULL_NAME": "SHAWN M CASEY TRUSTEE",
     "APPLICANT": "SHAWN M CASY TRUSTEE "
    },
    {
     "ADDRESS": "1420 17TH ST NW, WASHINGTON, DC 20036",
     "UNIT": "",
     "SSL": "0157    0092",
     "ID": "CO1001029",
     "G6_ACT_DES": "Zoning Inspection",
     "G6_STATUS": "No Show",
     "G6_STATUS_DD": "3/11/2010 12:00:00 AM",
     "DESC_OF_WORK": "TWO FAMILY FLAT -- (2 UNITS)",
     "G6_STATUS_DD_NET": "2010/03/11",
     "OWNER_FULL_NAME": "SHAWN M CASEY TRUSTEE",
     "APPLICANT": "SHAWN M CASY TRUSTEE "
    },
    {
     "ADDRESS": "1420 17TH ST NW, WASHINGTON, DC 20036",
     "UNIT": "",
     "SSL": "0157    0092",
     "ID": "CO1001029",
     "G6_ACT_DES": "Zoning Final",
     "G6_STATUS": "No Show",
     "G6_STATUS_DD": "3/3/2010 12:00:00 AM",
     "DESC_OF_WORK": "TWO FAMILY FLAT -- (2 UNITS)",
     "G6_STATUS_DD_NET": "2010/03/03",
     "OWNER_FULL_NAME": "SHAWN M CASEY TRUSTEE",
     "APPLICANT": "SHAWN M CASY TRUSTEE "
    },
    {
     "ADDRESS": "1420 17TH ST NW, WASHINGTON, DC -",
     "UNIT": "",
     "SSL": "0157    0092",
     "ID": "ECC94928",
     "G6_ACT_DES": "Complaint Construction",
     "G6_STATUS": "Cause",
     "G6_STATUS_DD": "2/25/2005 12:00:00 AM",
     "DESC_OF_WORK": "",
     "G6_STATUS_DD_NET": "2005/02/25",
     "OWNER_FULL_NAME": "",
     "APPLICANT": "VIRENDER  BHOGAL; VIRENDER  BHOGAL"
    },
    {
     "ADDRESS": "1420 17TH ST NW, WASHINGTON, DC -",
     "UNIT": "",
     "SSL": "0157    0092",
     "ID": "ECC91041",
     "G6_ACT_DES": "Complaint Construction",
     "G6_STATUS": "No Cause",
     "G6_STATUS_DD": "1/12/2005 12:00:00 AM",
     "DESC_OF_WORK": "",
     "G6_STATUS_DD_NET": "2005/01/12",
     "OWNER_FULL_NAME": "",
     "APPLICANT": "ABDULLAH  BARROW; ABDULLAH  BARROW"
    }
   ]
  },
  "occupancyDetails": {
   "updated": "2020-06-28T18:55:18.930Z",
   "occupancyData": [
    {
     "FULL_ADDRESS": "1420 17TH ST NW, WASHINGTON, DC 20036",
     "B1_UNIT_START": "",
     "SSL": "0157    0092",
     "B1_ALT_ID": "CO1001029",
     "TYPE": "Certificate of Occupancy",
     "G6_STAT_DD": "03/24/2010",
     "B1_APPL_STATUS": "Completed",
     "B1_APPL_STATUS_DATE": "03/24/2010",
     "DESC_OF_WORK": "Load ChangeTWO FAMILY FLAT -- (2 UNITS)",
     "G6_STAT_DD_NET": "2010/03/24",
     "B1_APPL_STATUS_DATE_NET": "2010/03/24",
     "OWNER_FULL_NAME": "SHAWN M CASEY TRUSTEE",
     "APPLICANT": "SHAWN M CASY TRUSTEE "
    }
   ]
  },
  "charDetails": {
   "updated": "2020-06-28T19:53:44.671Z",
   "charData": [
    {
     "PREMISEADD": "1420 17TH ST NW",
     "SSL": "0157    0092",
     "BLDG_NUM": "1",
     "COMPLX_NUM": "",
     "UNITNUMBER": "",
     "NUM_UNITS": "0",
     "AYB": "1890",
     "STRUCT_CL_": "",
     "STYLE_D": "3 Story",
     "STRUCT_D": "Row ",
     "GBA": "6441",
     "EXTWALL_D": "Common Brick",
     "WALL_HGT": "",
     "ROOF_D": "Meta",
     "BATHRM": "5",
     "HF_BATHRM": "0",
     "HEAT_D": "Hot ",
     "AC": "Y",
     "INTWALL_D": "Hardwood",
     "ROOMS": "15",
     "BEDRM": "5",
     "KITCHENS": "1",
     "FIREPLACES": "1",
     "YR_RMDL": "1992",
     "EYB": "1972",
     "STORIES": "3",
     "OWNERNAME": "SHAWN M CASEY TRUSTEE",
     "OWNNAME2": "",
     "CAREOFNAME": "ROBERT COHEN"
    }
   ]
  },
  "taxData": {
   "ssl": "0157    0092",
   "address": "1420 17TH ST NW",
   "owner": "SHAWN M CASEY TRUSTEE ROBERT COHEN",
   "neighborhood": "OLD CITY II",
   "sub_neighborhood": "D",
   "use_code": "11",
   "sale_price": "$.00",
   "recordation_date": "N/A",
   "2016_Assessment": "$1,800,540.00"
  }
 },
 "1732 P STREET NW": {
  "ownerInfo": {
   "updated": "2020-06-28T17:30:29.184Z",
   "ownerData": [
    {
     "OWNERNAME": "",
     "PREMISEADD": "1732 P ST NW",
     "UNITNUMBER": "",
     "SSL": "0157    0811",
     "USECODE": "000",
     "HSTDCODE": "",
     "CLASSTYPE": "",
     "TAXRATE": "0",
     "SALEPRICE": "",
     "SALEDATE": "",
     "INSTNO": "",
     "ACCEPTCODE": "",
     "DEEDDATE": "",
     "OWNNAME2": "",
     "CPMS_ADDRESS": "1732 P ST NW",
     "CAREOFNAME": "",
     "ADDRESS1": "",
     "ADDRESS2": "",
     "CITYSTZIP": "",
     "SALEDATE_NET": "",
     "DEEDDATE_NET": ""
    },
    {
     "OWNERNAME": "THOMAS C COSTELLO TRUSTEE",
     "PREMISEADD": "1732 P ST NW",
     "UNITNUMBER": "",
     "SSL": "0157    0117",
     "USECODE": "011",
     "HSTDCODE": "1",
     "CLASSTYPE": "001",
     "TAXRATE": "0.0085",
     "SALEPRICE": "",
     "SALEDATE": "",
     "INSTNO": "",
     "ACCEPTCODE": "",
     "DEEDDATE": "",
     "OWNNAME2": "",
     "CPMS_ADDRESS": "1732 P ST NW",
     "CAREOFNAME": "",
     "ADDRESS1": "1732 P ST NW",
     "ADDRESS2": "",
     "CITYSTZIP": "WASHINGTON                 DC 20036-1486",
     "SALEDATE_NET": "",
     "DEEDDATE_NET": ""
    },
    {
     "OWNERNAME": "",
     "PREMISEADD": "1732 P ST NW",
     "UNITNUMBER": "",
     "SSL": "0157    0116",
     "USECODE": "011",
     "HSTDCODE": "5",
     "CLASSTYPE": "001",
     "TAXRATE": "0.0085",
     "SALEPRICE": "",
     "SALEDATE": "",
     "INSTNO": "",
     "ACCEPTCODE": "",
     "DEEDDATE": "",
     "OWNNAME2": "",
     "CPMS_ADDRESS": "1732 P ST NW",
     "CAREOFNAME": "",
     "ADDRESS1": "",
     "ADDRESS2": "",
     "CITYSTZIP": "",
     "SALEDATE_NET": "",
     "DEEDDATE_NET": ""
    },
    {
     "OWNERNAME": "",
     "PREMISEADD": "1732 P ST NW",
     "UNITNUMBER": "",
     "SSL": "0157    0812",
     "USECODE": "014",
     "HSTDCODE": "",
     "CLASSTYPE": "001",
     "TAXRATE": "0.0085",
     "SALEPRICE": "",
     "SALEDATE": "",
     "INSTNO": "",
     "ACCEPTCODE": "",
     "DEEDDATE": "",
     "OWNNAME2": "",
     "CPMS_ADDRESS": "1732 P ST NW",
     "CAREOFNAME": "",
     "ADDRESS1": "",
     "ADDRESS2": "",
     "CITYSTZIP": "",
     "SALEDATE_NET": "",
     "DEEDDATE_NET": ""
    }
   ]
  },
  "addressDetails": {
   "updated": "2020-06-28T18:12:04.845Z",
   "addressData": [
    {
     "ADDRESS_ID": "241728",
     "MARID": "241728",
     "STATUS": "ACTIVE",
     "FULLADDRESS": "1732 P STREET NW",
     "ADDRNUM": "1732",
     "ADDRNUMSUFFIX": "",
     "STNAME": "P",
     "STREET_TYPE": "STREET",
     "QUADRANT": "NW",
     "CITY": "WASHINGTON",
     "STATE": "DC",
     "XCOORD": "396548.68",
     "YCOORD": "137955.38",
     "SSL": "0157    0117",
     "ANC": "ANC 2B",
     "PSA": "Police Service Area 208",
     "WARD": "Ward 2",
     "NBHD_ACTION": " ",
     "CLUSTER_": "Cluster 6",
     "POLDIST": "Police District - Second District",
     "ROC": "Police Sector 2D3",
     "CENSUS_TRACT": "005301",
     "VOTE_PRCNCT": "Precinct 15",
     "SMD": "SMD 2B07",
     "ZIPCODE": "20036",
     "NATIONALGRID": "18S UJ 23138 08706",
     "ROADWAYSEGID": "1275",
     "FOCUS_IMPROVEMENT_AREA": "NA",
     "HAS_ALIAS": "N",
     "HAS_CONDO_UNIT": "N",
     "HAS_RES_UNIT": "Y",
     "HAS_SSL": "Y",
     "LATITUDE": "38.90945303",
     "LONGITUDE": "-77.03979276",
     "STREETVIEWURL": "http://maps.google.com/maps?z=16&layer=c&cbll=38.90945303,-77.03979276&cbp=11,170.558160612028,,0,2.09",
     "RES_TYPE": "RESIDENTIAL",
     "WARD_2002": "Ward 2",
     "WARD_2012": "Ward 2",
     "ANC_2002": "ANC 2B",
     "ANC_2012": "ANC 2B",
     "SMD_2002": "SMD 2B07",
     "SMD_2012": "SMD 2B07",
     "IMAGEURL": "http://citizenatlas.dc.gov/mobilevideo",
     "IMAGEDIR": "20040805",
     "IMAGENAME": "Q5101538.jpg",
     "ConfidenceLevel": "100",
     "Zoning": "RA-10"
    }
   ]
  },
  "licenseDetails": {
   "updated": "2020-06-28T18:36:48.795Z",
   "licenseData": [
    {
     "ADDRESS": "1732  P ST NW",
     "UNIT": "",
     "SSL": "0157    0116",
     "CUST_NUM": "500516903869",
     "DECRIPTION": "Housing: Residential",
     "ENDORSEMENT_DESC": "One Family Rental",
     "LAST_NAME": "",
     "FIRST_NAME": "",
     "CORP_NAME": "Thomas C Costello",
     "TRADE_NAME": "",
     "BEGIN_RENEWAL": "May  1 2020 12:00AM",
     "END_RENEWAL": "Apr 30 2022 12:00AM",
     "STATUS": "Active",
     "BEGIN_RENEWAL_NET": "2020/05/01",
     "END_RENEWAL_NET": "2022/04/30"
    }
   ]
  },
  "permitDetails": {
   "updated": "2020-06-28T18:57:13.982Z",
   "permitData": [
    {
     "FULL_ADDRESS": "1732 P ST NW, WASHINGTON, DC 20036",
     "B1_UNIT_START": "",
     "SSL": "0157    0812",
     "B1_ALT_ID": "19-Z-PDRM-00067",
     "TYPE": "PDRM/Zoning Review",
     "G6_STAT_DD": "Jan  1 1900 12:00AM",
     "B1_APPL_STATUS": "Assigned to Technician",
     "B1_APPL_STATUS_DATE": "02/08/2019",
     "DESC_OF_WORK": "THE PROPOSED WORK INCLUDES THE ALTERATION AND REPAIR AND ADDITION TO AN EXISTING FREE STANDING RESIDENTIAL GARAGE STRUCTURE INCLUDING EXISTING GROUND FLOOR TENANT AREAS AND A GARAGE SPACE. THE ADDITION INCLUDES A SECOND STORY SINGLE FAMILY RESIDENTIAL UNIT. THE WORK INCLUDES ARCHITECTURAL, MECHANICA",
     "SORT_DATE": null,
     "G6_STAT_DD_NET": "",
     "B1_APPL_STATUS_DATE_NET": "2019/02/08",
     "JOB_CLASS_CODE": "N/A",
     "JOB_SIZE": "N/A",
     "JOB_CLASSIFICATION": "N/A",
     "JOB_REVIEW_TIME": "N/A",
     "OWNER_NAME": "THOMAS C COSTELLO TRUSTEE",
     "OWNER_FULL_NAME": "THOMAS C COSTELLO TRUSTEE",
     "APPLICANT_NAME": "JEFFREY  OWENS",
     "TRADE_NAME": "",
     "PERMIT_STATUS": [
      {
       "REVIEW_STATUS": "",
       "DISCIPLINE": "",
       "REVIEW_STATUS_DATE": ""
      }
     ]
    },
    {
     "FULL_ADDRESS": "1732 P ST NW BASEMENT A, Washington, DC 20036",
     "B1_UNIT_START": "BASEMENT A",
     "SSL": "0157    0116",
     "B1_ALT_ID": "B1608907",
     "TYPE": "Construction/Alteration and Repair",
     "G6_STAT_DD": "Jan  1 1900 12:00AM",
     "B1_APPL_STATUS": "",
     "B1_APPL_STATUS_DATE": "06/02/2016",
     "DESC_OF_WORK": "Use change from Single Family to 2 Family Flat. No work to be done.",
     "SORT_DATE": null,
     "G6_STAT_DD_NET": "",
     "B1_APPL_STATUS_DATE_NET": "2016/06/02",
     "JOB_CLASS_CODE": "WT",
     "JOB_SIZE": "N/A",
     "JOB_CLASSIFICATION": "N/A",
     "JOB_REVIEW_TIME": "N/A",
     "OWNER_NAME": "Thomas  Costello",
     "OWNER_FULL_NAME": "Thomas  Costello",
     "APPLICANT_NAME": "THOMAS  COSTELLO",
     "TRADE_NAME": "",
     "PERMIT_STATUS": [
      {
       "REVIEW_STATUS": "In-Process",
       "DISCIPLINE": "Plan Review Coordinator",
       "REVIEW_STATUS_DATE": ""
      }
     ]
    },
    {
     "FULL_ADDRESS": "1732 P ST NW, WASHINGTON, DC 20036-1304",
     "B1_UNIT_START": "",
     "SSL": "",
     "B1_ALT_ID": "E105981",
     "TYPE": "Supplemental/Electrical",
     "G6_STAT_DD": "Oct 18 2005  3:14PM",
     "B1_APPL_STATUS": "Permit Issued",
     "B1_APPL_STATUS_DATE": "10/18/2005",
     "DESC_OF_WORK": "",
     "SORT_DATE": null,
     "G6_STAT_DD_NET": "2005/10/18",
     "B1_APPL_STATUS_DATE_NET": "2005/10/18",
     "JOB_CLASS_CODE": "N/A",
     "JOB_SIZE": "N/A",
     "JOB_CLASSIFICATION": "N/A",
     "JOB_REVIEW_TIME": "N/A",
     "OWNER_NAME": "COSTELLO",
     "OWNER_FULL_NAME": "COSTELLO",
     "APPLICANT_NAME": "",
     "TRADE_NAME": "",
     "PERMIT_STATUS": [
      {
       "REVIEW_STATUS": "",
       "DISCIPLINE": "",
       "REVIEW_STATUS_DATE": ""
      }
     ]
    },
    {
     "FULL_ADDRESS": "1732 P ST NW, WASHINGTON, DC 20036",
     "B1_UNIT_START": "",
     "SSL": "0157    0116",
     "B1_ALT_ID": "MVQ2000073",
     "TYPE": "Construction/Variance",
     "G6_STAT_DD": "Jan  1 1900 12:00AM",
     "B1_APPL_STATUS": "Review in Process",
     "B1_APPL_STATUS_DATE": "04/24/2020",
     "DESC_OF_WORK": "2013 DCMR 12A and 2012 IRC, Section R302 - Please refer to attached letter from Jeffrey Owens.",
     "SORT_DATE": null,
     "G6_STAT_DD_NET": "",
     "B1_APPL_STATUS_DATE_NET": "2020/04/24",
     "JOB_CLASS_CODE": "N/A",
     "JOB_SIZE": "N/A",
     "JOB_CLASSIFICATION": "N/A",
     "JOB_REVIEW_TIME": "N/A",
     "OWNER_NAME": "",
     "OWNER_FULL_NAME": "",
     "APPLICANT_NAME": "JEFFREY  OWENS",
     "TRADE_NAME": "",
     "PERMIT_STATUS": [
      {
       "REVIEW_STATUS": "Application Accepted",
       "DISCIPLINE": "Plan Review Coordinator",
       "REVIEW_STATUS_DATE": "04/20/2020"
      },
      {
       "REVIEW_STATUS": "Fire Review Approved",
       "DISCIPLINE": "Fire Review",
       "REVIEW_STATUS_DATE": "04/24/2020"
      },
      {
       "REVIEW_STATUS": "Management Review Pending",
       "DISCIPLINE": "Management Review",
       "REVIEW_STATUS_DATE": "04/20/2020"
      },
      {
       "REVIEW_STATUS": "Management Review Pending",
       "DISCIPLINE": "Management Review",
       "REVIEW_STATUS_DATE": "04/24/2020"
      }
     ]
    },
    {
     "FULL_ADDRESS": "1732 P ST NW, WASHINGTON, DC 20036-1304",
     "B1_UNIT_START": "",
     "SSL": "",
     "B1_ALT_ID": "P104039",
     "TYPE": "Supplemental/Plumbing and Gas",
     "G6_STAT_DD": "Aug 24 2005 12:33PM",
     "B1_APPL_STATUS": "Permit Issued",
     "B1_APPL_STATUS_DATE": "          ",
     "DESC_OF_WORK": "",
     "SORT_DATE": null,
     "G6_STAT_DD_NET": "2005/08/24",
     "B1_APPL_STATUS_DATE_NET": "",
     "JOB_CLASS_CODE": "N/A",
     "JOB_SIZE": "N/A",
     "JOB_CLASSIFICATION": "N/A",
     "JOB_REVIEW_TIME": "N/A",
     "OWNER_NAME": "COSTELLO",
     "OWNER_FULL_NAME": "COSTELLO",
     "APPLICANT_NAME": "",
     "TRADE_NAME": "",
     "PERMIT_STATUS": [
      {
       "REVIEW_STATUS": "",
       "DISCIPLINE": "",
       "REVIEW_STATUS_DATE": ""
      }
     ]
    },
    {
     "FULL_ADDRESS": "1732 P ST NW BASEMENT A, Washington, DC 20036",
     "B1_UNIT_START": "BASEMENT A",
     "SSL": "0157    0116",
     "B1_ALT_ID": "TL1600087",
     "TYPE": "Construction/Tenant Layout",
     "G6_STAT_DD": "Jan  1 1900 12:00AM",
     "B1_APPL_STATUS": "",
     "B1_APPL_STATUS_DATE": "06/02/2016",
     "DESC_OF_WORK": "Upgrade and renovate to create 2nd unit to rent",
     "SORT_DATE": null,
     "G6_STAT_DD_NET": "",
     "B1_APPL_STATUS_DATE_NET": "2016/06/02",
     "JOB_CLASS_CODE": "N/A",
     "JOB_SIZE": "N/A",
     "JOB_CLASSIFICATION": "N/A",
     "JOB_REVIEW_TIME": "N/A",
     "OWNER_NAME": "Thomas  Costello",
     "OWNER_FULL_NAME": "Thomas  Costello",
     "APPLICANT_NAME": "THOMAS  COSTELLO",
     "TRADE_NAME": "",
     "PERMIT_STATUS": [
      {
       "REVIEW_STATUS": "In-Process",
       "DISCIPLINE": "Plan Review Coordinator",
       "REVIEW_STATUS_DATE": ""
      }
     ]
    }
   ]
  },
  "inspectionDetails": {
   "updated": "2020-06-28T18:57:14.199Z",
   "inspectionData": [
    {
     "ADDRESS": "1732 P ST NW, WASHINGTON, DC -",
     "UNIT": "",
     "SSL": "0157    0812",
     "ID": "ECC118502",
     "G6_ACT_DES": "Framing Construction",
     "G6_STATUS": "No Cause",
     "G6_STATUS_DD": "11/3/2005 12:00:00 AM",
     "DESC_OF_WORK": "",
     "G6_STATUS_DD_NET": "2005/11/03",
     "OWNER_FULL_NAME": "THOMAS  COSTELLO",
     "APPLICANT": ""
    },
    {
     "ADDRESS": "1732 P ST NW, WASHINGTON, DC -",
     "UNIT": "",
     "SSL": "0157    0812",
     "ID": "ECC117737",
     "G6_ACT_DES": "Rough-In Electrical",
     "G6_STATUS": "No Cause",
     "G6_STATUS_DD": "10/26/2005 12:00:00 AM",
     "DESC_OF_WORK": "",
     "G6_STATUS_DD_NET": "2005/10/26",
     "OWNER_FULL_NAME": "",
     "APPLICANT": "TOM  DAVIS; TOM  DAVIS"
    },
    {
     "ADDRESS": "1732 P ST NW, WASHINGTON, DC -",
     "UNIT": "",
     "SSL": "0157    0812",
     "ID": "ECC115381",
     "G6_ACT_DES": "Close-In Plumbing",
     "G6_STATUS": "No Cause",
     "G6_STATUS_DD": "10/3/2005 12:00:00 AM",
     "DESC_OF_WORK": "",
     "G6_STATUS_DD_NET": "2005/10/03",
     "OWNER_FULL_NAME": "",
     "APPLICANT": "MIKE  VAODN; MIKE  VAODN"
    },
    {
     "ADDRESS": "1732 P ST NW, WASHINGTON, DC -",
     "UNIT": "",
     "SSL": "0157    0812",
     "ID": "ECC105785",
     "G6_ACT_DES": "Other (see remarks) Construction",
     "G6_STATUS": "No Cause",
     "G6_STATUS_DD": "7/1/2005 12:00:00 AM",
     "DESC_OF_WORK": "",
     "G6_STATUS_DD_NET": "2005/07/01",
     "OWNER_FULL_NAME": "",
     "APPLICANT": "N/A  N/A; N/A  N/A"
    },
    {
     "ADDRESS": "1732 P ST NW, WASHINGTON, DC -",
     "UNIT": "",
     "SSL": "0157    0812",
     "ID": "ECC104350",
     "G6_ACT_DES": "Complaint Construction",
     "G6_STATUS": "No Cause",
     "G6_STATUS_DD": "6/23/2005 12:00:00 AM",
     "DESC_OF_WORK": "",
     "G6_STATUS_DD_NET": "2005/06/23",
     "OWNER_FULL_NAME": "",
     "APPLICANT": "BEN  FULBEN; BEN  FULBEN"
    },
    {
     "ADDRESS": "1732 P ST NW, WASHINGTON, DC -",
     "UNIT": "",
     "SSL": "0157    0812",
     "ID": "ECC104170",
     "G6_ACT_DES": "Complaint Zoning",
     "G6_STATUS": "No Cause",
     "G6_STATUS_DD": "6/7/2005 12:00:00 AM",
     "DESC_OF_WORK": "",
     "G6_STATUS_DD_NET": "2005/06/07",
     "OWNER_FULL_NAME": "BEN  FELDMAN",
     "APPLICANT": ""
    },
    {
     "ADDRESS": "1732 P ST NW, WASHINGTON, DC 20036",
     "UNIT": "",
     "SSL": "0157    0812",
     "ID": "19-Z-PDRM-00067",
     "G6_ACT_DES": "Preliminary Design Review Meeting",
     "G6_STATUS": "Scheduled",
     "G6_STATUS_DD": "",
     "DESC_OF_WORK": "THE PROPOSED WORK INCLUDES THE ALTERATION AND REPAIR AND ADDITION TO AN EXISTING FREE STANDING RESIDENTIAL GARAGE STRUCTURE INCLUDING EXISTING GROUND FLOOR TENANT AREAS AND A GARAGE SPACE. THE ADDITION INCLUDES A SECOND STORY SINGLE FAMILY RESIDENTIAL UNIT. THE WORK INCLUDES ARCHITECTURAL, MECHANICA",
     "G6_STATUS_DD_NET": "",
     "OWNER_FULL_NAME": "THOMAS C COSTELLO TRUSTEE",
     "APPLICANT": "JEFFREY  OWENS"
    }
   ]
  },
  "occupancyDetails": {
   "updated": "2020-06-28T18:57:14.396Z",
   "occupancyData": [
    {
     "FULL_ADDRESS": "1732 P ST NW, WASHINGTON, DC 20036",
     "B1_UNIT_START": "",
     "SSL": "0157    0116",
     "B1_ALT_ID": "CO1602475",
     "TYPE": "Certificate of Occupancy",
     "G6_STAT_DD": "",
     "B1_APPL_STATUS": "Application Accepted",
     "B1_APPL_STATUS_DATE": "05/24/2016",
     "DESC_OF_WORK": "Use ChangeTWO-FAMILY FLAT  ***NO PRIOR CERTIFICATE OF OCCUPANCY ON FILE FOR A TWO-FAMILY.  STRUCTURAL REVIEW REQUIRED***",
     "G6_STAT_DD_NET": "",
     "B1_APPL_STATUS_DATE_NET": "2016/05/24",
     "OWNER_FULL_NAME": "THOMAS C COSTELLO TRUSTEE",
     "APPLICANT": ""
    }
   ]
  },
  "charDetails": {
   "updated": "2020-06-28T19:53:47.513Z",
   "charData": [
    {
     "PREMISEADD": "1732 P ST NW",
     "SSL": "0157    0116",
     "BLDG_NUM": "1",
     "COMPLX_NUM": "",
     "UNITNUMBER": "",
     "NUM_UNITS": "0",
     "AYB": "1910",
     "STRUCT_CL_": "",
     "STYLE_D": "3 Story",
     "STRUCT_D": "Row ",
     "GBA": "5882",
     "EXTWALL_D": "Common Brick",
     "WALL_HGT": "",
     "ROOF_D": "Buil",
     "BATHRM": "3",
     "HF_BATHRM": "0",
     "HEAT_D": "Warm",
     "AC": "Y",
     "INTWALL_D": "Hardwood",
     "ROOMS": "12",
     "BEDRM": "5",
     "KITCHENS": "1",
     "FIREPLACES": "0",
     "YR_RMDL": "2003",
     "EYB": "1966",
     "STORIES": "3",
     "OWNERNAME": "",
     "OWNNAME2": "",
     "CAREOFNAME": ""
    }
   ]
  }
 },
 "1604 17TH STREET NW": {
  "ownerInfo": {
   "updated": "2020-06-28T17:30:35.291Z",
   "ownerData": [
    {
     "OWNERNAME": "DUPONT-MORGAN IIII LLC",
     "PREMISEADD": "1604 17TH ST NW",
     "UNITNUMBER": "",
     "SSL": "0155    0175",
     "USECODE": "042",
     "HSTDCODE": "",
     "CLASSTYPE": "",
     "TAXRATE": "0",
     "SALEPRICE": "$1,428,355.00",
     "SALEDATE": "10/29/2004",
     "INSTNO": "",
     "ACCEPTCODE": "MARKET",
     "DEEDDATE": "10/29/2004",
     "OWNNAME2": "",
     "CPMS_ADDRESS": "1604 17TH ST NW",
     "CAREOFNAME": "",
     "ADDRESS1": "1722 WISCONSIN AVE NW",
     "ADDRESS2": "",
     "CITYSTZIP": "WASHINGTON                 DC 20007-2313",
     "SALEDATE_NET": "2004/10/29",
     "DEEDDATE_NET": "2004/10/29"
    }
   ]
  },
  "addressDetails": {
   "updated": "2020-06-28T18:12:08.374Z",
   "addressData": [
    {
     "ADDRESS_ID": "241674",
     "MARID": "241674",
     "STATUS": "ACTIVE",
     "FULLADDRESS": "1604 17TH STREET NW",
     "ADDRNUM": "1604",
     "ADDRNUMSUFFIX": "",
     "STNAME": "17TH",
     "STREET_TYPE": "STREET",
     "QUADRANT": "NW",
     "CITY": "WASHINGTON",
     "STATE": "DC",
     "XCOORD": "396639.90",
     "YCOORD": "138169.92",
     "SSL": "0155    0175",
     "ANC": "ANC 2B",
     "PSA": "Police Service Area 301",
     "WARD": "Ward 2",
     "NBHD_ACTION": " ",
     "CLUSTER_": "Cluster 6",
     "POLDIST": "Police District - Third District",
     "ROC": "Police Sector 3D3",
     "CENSUS_TRACT": "005301",
     "VOTE_PRCNCT": "Precinct 15",
     "SMD": "SMD 2B03",
     "ZIPCODE": "20009",
     "NATIONALGRID": "18S UJ 23234 08919",
     "ROADWAYSEGID": "5258",
     "FOCUS_IMPROVEMENT_AREA": "NA",
     "HAS_ALIAS": "N",
     "HAS_CONDO_UNIT": "N",
     "HAS_RES_UNIT": "N",
     "HAS_SSL": "Y",
     "LATITUDE": "38.91138604",
     "LONGITUDE": "-77.03874207",
     "STREETVIEWURL": "http://maps.google.com/maps?z=16&layer=c&cbll=38.91138604,-77.03874207&cbp=11,284.203984353578,,0,2.09",
     "RES_TYPE": "NON RESIDENTIAL",
     "WARD_2002": "Ward 2",
     "WARD_2012": "Ward 2",
     "ANC_2002": "ANC 2B",
     "ANC_2012": "ANC 2B",
     "SMD_2002": "SMD 2B03",
     "SMD_2012": "SMD 2B03",
     "IMAGEURL": "http://citizenatlas.dc.gov/mobilevideo",
     "IMAGEDIR": "20040815",
     "IMAGENAME": "QF103935.jpg",
     "ConfidenceLevel": "100",
     "Zoning": "MU-18"
    }
   ]
  },
  "licenseDetails": {
   "updated": "2020-06-28T18:36:57.002Z",
   "licenseData": [
    {
     "ADDRESS": "1400 -1799 17TH ST NW",
     "UNIT": "1799",
     "SSL": "NA",
     "CUST_NUM": "201211000891",
     "DECRIPTION": "Entertainment",
     "ENDORSEMENT_DESC": "Special Events",
     "LAST_NAME": "",
     "FIRST_NAME": "",
     "CORP_NAME": "URBAN NEIGHBORHOOD ALLIANCE",
     "TRADE_NAME": "17TH STREET FESTIVAL",
     "BEGIN_RENEWAL": "",
     "END_RENEWAL": "Sep 25 2011 12:00AM",
     "STATUS": "Expired",
     "BEGIN_RENEWAL_NET": "",
     "END_RENEWAL_NET": "2011/09/25"
    },
    {
     "ADDRESS": "1400 -1799 17TH ST NW",
     "UNIT": "1799",
     "SSL": "NA",
     "CUST_NUM": "201212000094",
     "DECRIPTION": "Entertainment",
     "ENDORSEMENT_DESC": "Special Events",
     "LAST_NAME": "",
     "FIRST_NAME": "",
     "CORP_NAME": "URBAN NEIGHBORHOOD ALLIANCE",
     "TRADE_NAME": "17TH STREET FESTIVAL",
     "BEGIN_RENEWAL": "",
     "END_RENEWAL": "Sep 23 2012 12:00AM",
     "STATUS": "Expired",
     "BEGIN_RENEWAL_NET": "",
     "END_RENEWAL_NET": "2012/09/23"
    },
    {
     "ADDRESS": "1526  17TH ST NW",
     "UNIT": "",
     "SSL": "0156    0034",
     "CUST_NUM": "39700885",
     "DECRIPTION": "Housing: Residential",
     "ENDORSEMENT_DESC": "Apartment",
     "LAST_NAME": "",
     "FIRST_NAME": "",
     "CORP_NAME": "PIER WITH NO END",
     "TRADE_NAME": "",
     "BEGIN_RENEWAL": "Nov  1 1999 12:00AM",
     "END_RENEWAL": "Oct 31 2001 12:00AM",
     "STATUS": "Expired",
     "BEGIN_RENEWAL_NET": "1999/11/01",
     "END_RENEWAL_NET": "2001/10/31"
    },
    {
     "ADDRESS": "1526  17TH ST NW",
     "UNIT": "",
     "SSL": "0156    0034",
     "CUST_NUM": "500514003391",
     "DECRIPTION": "Housing: Residential",
     "ENDORSEMENT_DESC": "One Family Rental",
     "LAST_NAME": "HUGHES",
     "FIRST_NAME": "ANNA",
     "CORP_NAME": "",
     "TRADE_NAME": "",
     "BEGIN_RENEWAL": "Sep  1 2014 12:00AM",
     "END_RENEWAL": "Aug 31 2016 12:00AM",
     "STATUS": "Expired",
     "BEGIN_RENEWAL_NET": "2014/09/01",
     "END_RENEWAL_NET": "2016/08/31"
    },
    {
     "ADDRESS": "1526  17TH ST NW",
     "UNIT": " ",
     "SSL": "0156    0034",
     "CUST_NUM": "500519800160",
     "DECRIPTION": "Housing: Residential",
     "ENDORSEMENT_DESC": "One Family Rental",
     "LAST_NAME": "Bittner",
     "FIRST_NAME": "Patrick",
     "CORP_NAME": "Patrick Bittner",
     "TRADE_NAME": "",
     "BEGIN_RENEWAL": "Oct  1 2018 12:00AM",
     "END_RENEWAL": "Sep 30 2020 12:00AM",
     "STATUS": "Active",
     "BEGIN_RENEWAL_NET": "2018/10/01",
     "END_RENEWAL_NET": "2020/09/30"
    },
    {
     "ADDRESS": "1526  17TH ST NW",
     "UNIT": "#218",
     "SSL": "0156    0034",
     "CUST_NUM": "400316901605",
     "DECRIPTION": "General Business",
     "ENDORSEMENT_DESC": "General Business Licenses",
     "LAST_NAME": "",
     "FIRST_NAME": "",
     "CORP_NAME": "Elizabeth Curwen",
     "TRADE_NAME": "",
     "BEGIN_RENEWAL": "Feb  1 2016 12:00AM",
     "END_RENEWAL": "Jan 31 2018 12:00AM",
     "STATUS": "Expired",
     "BEGIN_RENEWAL_NET": "2016/02/01",
     "END_RENEWAL_NET": "2018/01/31"
    },
    {
     "ADDRESS": "1526  17TH ST NW",
     "UNIT": "#302",
     "SSL": "0156    0034",
     "CUST_NUM": "40001018",
     "DECRIPTION": "Housing: Residential",
     "ENDORSEMENT_DESC": "Cooperative Association",
     "LAST_NAME": "",
     "FIRST_NAME": "",
     "CORP_NAME": "CAVANAUGH COURT OWNERS INC",
     "TRADE_NAME": "",
     "BEGIN_RENEWAL": "Jun  1 2014 12:00AM",
     "END_RENEWAL": "May 31 2016 12:00AM",
     "STATUS": "Expired",
     "BEGIN_RENEWAL_NET": "2014/06/01",
     "END_RENEWAL_NET": "2016/05/31"
    },
    {
     "ADDRESS": "1526  17TH ST NW",
     "UNIT": "#302",
     "SSL": "0156    0034",
     "CUST_NUM": "500418000003",
     "DECRIPTION": "Housing: Residential",
     "ENDORSEMENT_DESC": "Cooperative Association",
     "LAST_NAME": "",
     "FIRST_NAME": "",
     "CORP_NAME": "CAVANAUGH COURT OWNERS INC",
     "TRADE_NAME": "",
     "BEGIN_RENEWAL": "Jan  1 2020 12:00AM",
     "END_RENEWAL": "Dec 31 2021 12:00AM",
     "STATUS": "Active",
     "BEGIN_RENEWAL_NET": "2020/01/01",
     "END_RENEWAL_NET": "2021/12/31"
    },
    {
     "ADDRESS": "1526  17TH ST NW",
     "UNIT": "117",
     "SSL": "0156    0034",
     "CUST_NUM": "500519002068",
     "DECRIPTION": "Housing: Residential",
     "ENDORSEMENT_DESC": "One Family Rental",
     "LAST_NAME": "MACARUSO",
     "FIRST_NAME": "DAVID",
     "CORP_NAME": "",
     "TRADE_NAME": "",
     "BEGIN_RENEWAL": "Apr  1 2019 12:00AM",
     "END_RENEWAL": "Mar 31 2021 12:00AM",
     "STATUS": "Active",
     "BEGIN_RENEWAL_NET": "2019/04/01",
     "END_RENEWAL_NET": "2021/03/31"
    },
    {
     "ADDRESS": "1526  17TH ST NW",
     "UNIT": "201",
     "SSL": "0156    0034",
     "CUST_NUM": "500516900189",
     "DECRIPTION": "Housing: Residential",
     "ENDORSEMENT_DESC": "One Family Rental",
     "LAST_NAME": "CARILLO",
     "FIRST_NAME": "JORGE",
     "CORP_NAME": "",
     "TRADE_NAME": "",
     "BEGIN_RENEWAL": "Oct  1 2019 12:00AM",
     "END_RENEWAL": "Sep 30 2021 12:00AM",
     "STATUS": "Active",
     "BEGIN_RENEWAL_NET": "2019/10/01",
     "END_RENEWAL_NET": "2021/09/30"
    },
    {
     "ADDRESS": "1526  17TH ST NW",
     "UNIT": "315",
     "SSL": "0156    0034",
     "CUST_NUM": "500512003325",
     "DECRIPTION": "Housing: Residential",
     "ENDORSEMENT_DESC": "One Family Rental",
     "LAST_NAME": "JO",
     "FIRST_NAME": "CATHERINE",
     "CORP_NAME": "",
     "TRADE_NAME": "",
     "BEGIN_RENEWAL": "Nov  1 2011 12:00AM",
     "END_RENEWAL": "Oct 31 2013 12:00AM",
     "STATUS": "Cancelled",
     "BEGIN_RENEWAL_NET": "2011/11/01",
     "END_RENEWAL_NET": "2013/10/31"
    },
    {
     "ADDRESS": "1526  17TH ST NW",
     "UNIT": "SUITE 302",
     "SSL": "0156    0034",
     "CUST_NUM": "22022",
     "DECRIPTION": "Housing: Residential",
     "ENDORSEMENT_DESC": "Cooperative Association",
     "LAST_NAME": "",
     "FIRST_NAME": "",
     "CORP_NAME": "CAVANAUGH COURT INC",
     "TRADE_NAME": "",
     "BEGIN_RENEWAL": "Jun  1 2001 12:00AM",
     "END_RENEWAL": "May 31 2003 12:00AM",
     "STATUS": "Cancelled",
     "BEGIN_RENEWAL_NET": "2001/06/01",
     "END_RENEWAL_NET": "2003/05/31"
    }
   ]
  },
  "permitDetails": {
   "updated": "2020-06-28T18:58:14.421Z",
   "permitData": [
    {
     "FULL_ADDRESS": "1604 17TH ST NW Suite 200, Washington, DC 20009",
     "B1_UNIT_START": "Suite 200",
     "SSL": "0155    0175",
     "B1_ALT_ID": "A1400034",
     "TYPE": "Construction/Awning",
     "G6_STAT_DD": "Jan  1 1900 12:00AM",
     "B1_APPL_STATUS": "Application Canceled",
     "B1_APPL_STATUS_DATE": "01/07/2016",
     "DESC_OF_WORK": "Install an awning over the main entrance of the building.",
     "SORT_DATE": null,
     "G6_STAT_DD_NET": "",
     "B1_APPL_STATUS_DATE_NET": "2016/01/07",
     "JOB_CLASS_CODE": "WT",
     "JOB_SIZE": "N/A",
     "JOB_CLASSIFICATION": "N/A",
     "JOB_REVIEW_TIME": "N/A",
     "OWNER_NAME": "GARY  HEURICH",
     "OWNER_FULL_NAME": "GARY  HEURICH",
     "APPLICANT_NAME": "MICHAEL ANDREWS BESPOKE",
     "TRADE_NAME": "",
     "PERMIT_STATUS": [
      {
       "REVIEW_STATUS": "Application Accepted",
       "DISCIPLINE": "Plan Review Coordinator",
       "REVIEW_STATUS_DATE": "02/06/2014"
      },
      {
       "REVIEW_STATUS": "Application Canceled",
       "DISCIPLINE": "File Room",
       "REVIEW_STATUS_DATE": "01/07/2016"
      },
      {
       "REVIEW_STATUS": "Comments Submitted to the Applicant for Correction",
       "DISCIPLINE": "Structural Review Pending",
       "REVIEW_STATUS_DATE": "02/20/2014"
      },
      {
       "REVIEW_STATUS": "HPRB Review Approved",
       "DISCIPLINE": "HPRB Review",
       "REVIEW_STATUS_DATE": "02/06/2014"
      },
      {
       "REVIEW_STATUS": "In-Process",
       "DISCIPLINE": "DDOT Review",
       "REVIEW_STATUS_DATE": ""
      },
      {
       "REVIEW_STATUS": "In-Process",
       "DISCIPLINE": "Management Review",
       "REVIEW_STATUS_DATE": ""
      }
     ]
    },
    {
     "FULL_ADDRESS": "1604 17TH ST NW, WASHINGTON, DC 20009",
     "B1_UNIT_START": "",
     "SSL": "0155    0175",
     "B1_ALT_ID": "M1301306",
     "TYPE": "Supplemental/Mechanical",
     "G6_STAT_DD": "Apr  5 2013 12:00AM",
     "B1_APPL_STATUS": "Permit Issued",
     "B1_APPL_STATUS_DATE": "04/05/2013",
     "DESC_OF_WORK": "",
     "SORT_DATE": null,
     "G6_STAT_DD_NET": "2013/04/05",
     "B1_APPL_STATUS_DATE_NET": "2013/04/05",
     "JOB_CLASS_CODE": "N/A",
     "JOB_SIZE": "N/A",
     "JOB_CLASSIFICATION": "N/A",
     "JOB_REVIEW_TIME": "N/A",
     "OWNER_NAME": "DUPONT-MORGAN IIII LLC",
     "OWNER_FULL_NAME": "DUPONT-MORGAN IIII LLC",
     "APPLICANT_NAME": "JEAN-FRANCOIS A MEFORT",
     "TRADE_NAME": "",
     "PERMIT_STATUS": [
      {
       "REVIEW_STATUS": "",
       "DISCIPLINE": "",
       "REVIEW_STATUS_DATE": ""
      }
     ]
    }
   ]
  },
  "inspectionDetails": {
   "updated": "2020-06-28T18:58:14.807Z",
   "inspectionData": []
  },
  "occupancyDetails": {
   "updated": "2020-06-28T18:58:15.152Z",
   "occupancyData": [
    {
     "FULL_ADDRESS": "1526 17TH ST NW #218, Washington, DC 20036",
     "B1_UNIT_START": "#218",
     "SSL": "0156    0034",
     "B1_ALT_ID": "EHOP1690319",
     "TYPE": "Home Occupation/Expedited",
     "G6_STAT_DD": "02/04/2016",
     "B1_APPL_STATUS": "Permit Issued",
     "B1_APPL_STATUS_DATE": "02/04/2016",
     "DESC_OF_WORK": "Independent consultant, journalist, and writer",
     "G6_STAT_DD_NET": "2016/02/04",
     "B1_APPL_STATUS_DATE_NET": "2016/02/04",
     "OWNER_FULL_NAME": "",
     "APPLICANT": "NA NA NA"
    },
    {
     "FULL_ADDRESS": "1526 17TH ST NW, WASHINGTON, DC 20036-",
     "B1_UNIT_START": "",
     "SSL": "",
     "B1_ALT_ID": "HO35975",
     "TYPE": "Home Occupation",
     "G6_STAT_DD": "06/26/2002",
     "B1_APPL_STATUS": "Completed",
     "B1_APPL_STATUS_DATE": "          ",
     "DESC_OF_WORK": "",
     "G6_STAT_DD_NET": "2002/06/26",
     "B1_APPL_STATUS_DATE_NET": "",
     "OWNER_FULL_NAME": "EVANS IV, JOHN EDWARD",
     "APPLICANT": ""
    }
   ]
  },
  "charDetails": {
   "updated": "2020-06-28T19:53:50.295Z",
   "charData": [
    {
     "PREMISEADD": "1604 17TH ST NW",
     "SSL": "0155    0175",
     "BLDG_NUM": "1",
     "COMPLX_NUM": "",
     "UNITNUMBER": "",
     "NUM_UNITS": "",
     "AYB": "1885",
     "STRUCT_CL_": "Brick/Concr",
     "STYLE_D": "",
     "STRUCT_D": "",
     "GBA": "3285",
     "EXTWALL_D": "Brick",
     "WALL_HGT": "12.00",
     "ROOF_D": "",
     "BATHRM": "",
     "HF_BATHRM": "",
     "HEAT_D": "",
     "AC": "",
     "INTWALL_D": "",
     "ROOMS": "",
     "BEDRM": "",
     "KITCHENS": "",
     "FIREPLACES": "",
     "YR_RMDL": "1987",
     "EYB": "2000",
     "STORIES": "",
     "OWNERNAME": "DUPONT-MORGAN IIII LLC",
     "OWNNAME2": "",
     "CAREOFNAME": ""
    }
   ]
  },
  "taxData": {
   "ssl": "0155    0175",
   "address": "1604 17TH ST NW",
   "owner": "DUPONT-MORGAN IIII LLC",
   "neighborhood": "OLD CITY II",
   "sub_neighborhood": "D",
   "use_code": "42",
   "sale_price": "$1,428,355.00",
   "recordation_date": "10/29/2004",
   "2016_Assessment": "$987,440.00"
  }
 },
 "1618 17TH STREET NW": {
  "ownerInfo": {
   "updated": "2020-06-28T17:30:37.389Z",
   "ownerData": [
    {
     "OWNERNAME": "SYLVIA KOTZ TRUSTEES REVOCABLE TRUST",
     "PREMISEADD": "1618 17TH ST NW",
     "UNITNUMBER": "",
     "SSL": "0155    0089",
     "USECODE": "042",
     "HSTDCODE": "",
     "CLASSTYPE": "",
     "TAXRATE": "0",
     "SALEPRICE": "",
     "SALEDATE": "",
     "INSTNO": "",
     "ACCEPTCODE": "",
     "DEEDDATE": "",
     "OWNNAME2": "",
     "CPMS_ADDRESS": "1618 17TH ST NW",
     "CAREOFNAME": "",
     "ADDRESS1": "1618 17TH ST NW",
     "ADDRESS2": "",
     "CITYSTZIP": "WASHINGTON                 DC 20009-2404",
     "SALEDATE_NET": "",
     "DEEDDATE_NET": ""
    }
   ]
  },
  "addressDetails": {
   "updated": "2020-06-28T18:12:10.177Z",
   "addressData": [
    {
     "ADDRESS_ID": "241657",
     "MARID": "241657",
     "STATUS": "ACTIVE",
     "FULLADDRESS": "1618 17TH STREET NW",
     "ADDRNUM": "1618",
     "ADDRNUMSUFFIX": "",
     "STNAME": "17TH",
     "STREET_TYPE": "STREET",
     "QUADRANT": "NW",
     "CITY": "WASHINGTON",
     "STATE": "DC",
     "XCOORD": "396630.11",
     "YCOORD": "138213.22",
     "SSL": "0155    0089",
     "ANC": "ANC 2B",
     "PSA": "Police Service Area 301",
     "WARD": "Ward 2",
     "NBHD_ACTION": " ",
     "CLUSTER_": "Cluster 6",
     "POLDIST": "Police District - Third District",
     "ROC": "Police Sector 3D3",
     "CENSUS_TRACT": "005301",
     "VOTE_PRCNCT": "Precinct 15",
     "SMD": "SMD 2B03",
     "ZIPCODE": "20009",
     "NATIONALGRID": "18S UJ 23225 08962",
     "ROADWAYSEGID": "16727",
     "FOCUS_IMPROVEMENT_AREA": "NA",
     "HAS_ALIAS": "N",
     "HAS_CONDO_UNIT": "N",
     "HAS_RES_UNIT": "Y",
     "HAS_SSL": "Y",
     "LATITUDE": "38.91177606",
     "LONGITUDE": "-77.03885516",
     "STREETVIEWURL": "http://maps.google.com/maps?z=16&layer=c&cbll=38.91177606,-77.03885516&cbp=11,200.06616537157,,0,2.09",
     "RES_TYPE": "RESIDENTIAL",
     "WARD_2002": "Ward 2",
     "WARD_2012": "Ward 2",
     "ANC_2002": "ANC 2B",
     "ANC_2012": "ANC 2B",
     "SMD_2002": "SMD 2B03",
     "SMD_2012": "SMD 2B03",
     "IMAGEURL": "http://citizenatlas.dc.gov/mobilevideo",
     "IMAGEDIR": "20040805",
     "IMAGENAME": "Q5085521.jpg",
     "ConfidenceLevel": "100",
     "Zoning": "MU-18"
    }
   ]
  },
  "licenseDetails": {
   "updated": "2020-06-28T18:37:00.673Z",
   "licenseData": [
    {
     "ADDRESS": "1400 -1799 17TH ST NW",
     "UNIT": "1799",
     "SSL": "NA",
     "CUST_NUM": "201211000891",
     "DECRIPTION": "Entertainment",
     "ENDORSEMENT_DESC": "Special Events",
     "LAST_NAME": "",
     "FIRST_NAME": "",
     "CORP_NAME": "URBAN NEIGHBORHOOD ALLIANCE",
     "TRADE_NAME": "17TH STREET FESTIVAL",
     "BEGIN_RENEWAL": "",
     "END_RENEWAL": "Sep 25 2011 12:00AM",
     "STATUS": "Expired",
     "BEGIN_RENEWAL_NET": "",
     "END_RENEWAL_NET": "2011/09/25"
    },
    {
     "ADDRESS": "1400 -1799 17TH ST NW",
     "UNIT": "1799",
     "SSL": "NA",
     "CUST_NUM": "201212000094",
     "DECRIPTION": "Entertainment",
     "ENDORSEMENT_DESC": "Special Events",
     "LAST_NAME": "",
     "FIRST_NAME": "",
     "CORP_NAME": "URBAN NEIGHBORHOOD ALLIANCE",
     "TRADE_NAME": "17TH STREET FESTIVAL",
     "BEGIN_RENEWAL": "",
     "END_RENEWAL": "Sep 23 2012 12:00AM",
     "STATUS": "Expired",
     "BEGIN_RENEWAL_NET": "",
     "END_RENEWAL_NET": "2012/09/23"
    },
    {
     "ADDRESS": "1526  17TH ST NW",
     "UNIT": "",
     "SSL": "0156    0034",
     "CUST_NUM": "39700885",
     "DECRIPTION": "Housing: Residential",
     "ENDORSEMENT_DESC": "Apartment",
     "LAST_NAME": "",
     "FIRST_NAME": "",
     "CORP_NAME": "PIER WITH NO END",
     "TRADE_NAME": "",
     "BEGIN_RENEWAL": "Nov  1 1999 12:00AM",
     "END_RENEWAL": "Oct 31 2001 12:00AM",
     "STATUS": "Expired",
     "BEGIN_RENEWAL_NET": "1999/11/01",
     "END_RENEWAL_NET": "2001/10/31"
    },
    {
     "ADDRESS": "1526  17TH ST NW",
     "UNIT": "",
     "SSL": "0156    0034",
     "CUST_NUM": "500514003391",
     "DECRIPTION": "Housing: Residential",
     "ENDORSEMENT_DESC": "One Family Rental",
     "LAST_NAME": "HUGHES",
     "FIRST_NAME": "ANNA",
     "CORP_NAME": "",
     "TRADE_NAME": "",
     "BEGIN_RENEWAL": "Sep  1 2014 12:00AM",
     "END_RENEWAL": "Aug 31 2016 12:00AM",
     "STATUS": "Expired",
     "BEGIN_RENEWAL_NET": "2014/09/01",
     "END_RENEWAL_NET": "2016/08/31"
    },
    {
     "ADDRESS": "1526  17TH ST NW",
     "UNIT": " ",
     "SSL": "0156    0034",
     "CUST_NUM": "500519800160",
     "DECRIPTION": "Housing: Residential",
     "ENDORSEMENT_DESC": "One Family Rental",
     "LAST_NAME": "Bittner",
     "FIRST_NAME": "Patrick",
     "CORP_NAME": "Patrick Bittner",
     "TRADE_NAME": "",
     "BEGIN_RENEWAL": "Oct  1 2018 12:00AM",
     "END_RENEWAL": "Sep 30 2020 12:00AM",
     "STATUS": "Active",
     "BEGIN_RENEWAL_NET": "2018/10/01",
     "END_RENEWAL_NET": "2020/09/30"
    },
    {
     "ADDRESS": "1526  17TH ST NW",
     "UNIT": "#218",
     "SSL": "0156    0034",
     "CUST_NUM": "400316901605",
     "DECRIPTION": "General Business",
     "ENDORSEMENT_DESC": "General Business Licenses",
     "LAST_NAME": "",
     "FIRST_NAME": "",
     "CORP_NAME": "Elizabeth Curwen",
     "TRADE_NAME": "",
     "BEGIN_RENEWAL": "Feb  1 2016 12:00AM",
     "END_RENEWAL": "Jan 31 2018 12:00AM",
     "STATUS": "Expired",
     "BEGIN_RENEWAL_NET": "2016/02/01",
     "END_RENEWAL_NET": "2018/01/31"
    },
    {
     "ADDRESS": "1526  17TH ST NW",
     "UNIT": "#302",
     "SSL": "0156    0034",
     "CUST_NUM": "40001018",
     "DECRIPTION": "Housing: Residential",
     "ENDORSEMENT_DESC": "Cooperative Association",
     "LAST_NAME": "",
     "FIRST_NAME": "",
     "CORP_NAME": "CAVANAUGH COURT OWNERS INC",
     "TRADE_NAME": "",
     "BEGIN_RENEWAL": "Jun  1 2014 12:00AM",
     "END_RENEWAL": "May 31 2016 12:00AM",
     "STATUS": "Expired",
     "BEGIN_RENEWAL_NET": "2014/06/01",
     "END_RENEWAL_NET": "2016/05/31"
    },
    {
     "ADDRESS": "1526  17TH ST NW",
     "UNIT": "#302",
     "SSL": "0156    0034",
     "CUST_NUM": "500418000003",
     "DECRIPTION": "Housing: Residential",
     "ENDORSEMENT_DESC": "Cooperative Association",
     "LAST_NAME": "",
     "FIRST_NAME": "",
     "CORP_NAME": "CAVANAUGH COURT OWNERS INC",
     "TRADE_NAME": "",
     "BEGIN_RENEWAL": "Jan  1 2020 12:00AM",
     "END_RENEWAL": "Dec 31 2021 12:00AM",
     "STATUS": "Active",
     "BEGIN_RENEWAL_NET": "2020/01/01",
     "END_RENEWAL_NET": "2021/12/31"
    },
    {
     "ADDRESS": "1526  17TH ST NW",
     "UNIT": "117",
     "SSL": "0156    0034",
     "CUST_NUM": "500519002068",
     "DECRIPTION": "Housing: Residential",
     "ENDORSEMENT_DESC": "One Family Rental",
     "LAST_NAME": "MACARUSO",
     "FIRST_NAME": "DAVID",
     "CORP_NAME": "",
     "TRADE_NAME": "",
     "BEGIN_RENEWAL": "Apr  1 2019 12:00AM",
     "END_RENEWAL": "Mar 31 2021 12:00AM",
     "STATUS": "Active",
     "BEGIN_RENEWAL_NET": "2019/04/01",
     "END_RENEWAL_NET": "2021/03/31"
    },
    {
     "ADDRESS": "1526  17TH ST NW",
     "UNIT": "201",
     "SSL": "0156    0034",
     "CUST_NUM": "500516900189",
     "DECRIPTION": "Housing: Residential",
     "ENDORSEMENT_DESC": "One Family Rental",
     "LAST_NAME": "CARILLO",
     "FIRST_NAME": "JORGE",
     "CORP_NAME": "",
     "TRADE_NAME": "",
     "BEGIN_RENEWAL": "Oct  1 2019 12:00AM",
     "END_RENEWAL": "Sep 30 2021 12:00AM",
     "STATUS": "Active",
     "BEGIN_RENEWAL_NET": "2019/10/01",
     "END_RENEWAL_NET": "2021/09/30"
    },
    {
     "ADDRESS": "1526  17TH ST NW",
     "UNIT": "315",
     "SSL": "0156    0034",
     "CUST_NUM": "500512003325",
     "DECRIPTION": "Housing: Residential",
     "ENDORSEMENT_DESC": "One Family Rental",
     "LAST_NAME": "JO",
     "FIRST_NAME": "CATHERINE",
     "CORP_NAME": "",
     "TRADE_NAME": "",
     "BEGIN_RENEWAL": "Nov  1 2011 12:00AM",
     "END_RENEWAL": "Oct 31 2013 12:00AM",
     "STATUS": "Cancelled",
     "BEGIN_RENEWAL_NET": "2011/11/01",
     "END_RENEWAL_NET": "2013/10/31"
    },
    {
     "ADDRESS": "1526  17TH ST NW",
     "UNIT": "SUITE 302",
     "SSL": "0156    0034",
     "CUST_NUM": "22022",
     "DECRIPTION": "Housing: Residential",
     "ENDORSEMENT_DESC": "Cooperative Association",
     "LAST_NAME": "",
     "FIRST_NAME": "",
     "CORP_NAME": "CAVANAUGH COURT INC",
     "TRADE_NAME": "",
     "BEGIN_RENEWAL": "Jun  1 2001 12:00AM",
     "END_RENEWAL": "May 31 2003 12:00AM",
     "STATUS": "Cancelled",
     "BEGIN_RENEWAL_NET": "2001/06/01",
     "END_RENEWAL_NET": "2003/05/31"
    },
    {
     "ADDRESS": "1618  17TH ST NW",
     "UNIT": " ",
     "SSL": "0155    0089",
     "CUST_NUM": "50006677",
     "DECRIPTION": "Public Health Food Establish",
     "ENDORSEMENT_DESC": "Food Products",
     "LAST_NAME": "",
     "FIRST_NAME": "",
     "CORP_NAME": "W & R INC",
     "TRADE_NAME": "",
     "BEGIN_RENEWAL": "Jan  1 2019 12:00AM",
     "END_RENEWAL": "Dec 31 2020 12:00AM",
     "STATUS": "Active",
     "BEGIN_RENEWAL_NET": "2019/01/01",
     "END_RENEWAL_NET": "2020/12/31"
    },
    {
     "ADDRESS": "1618  17TH ST NW",
     "UNIT": " ",
     "SSL": "0155    0089",
     "CUST_NUM": "54002447",
     "DECRIPTION": "General Sales",
     "ENDORSEMENT_DESC": "Cigarette Retail",
     "LAST_NAME": "",
     "FIRST_NAME": "",
     "CORP_NAME": "W & R INC",
     "TRADE_NAME": "CAIRO WINE & LIQUOR",
     "BEGIN_RENEWAL": "Aug  1 2018 12:00AM",
     "END_RENEWAL": "Jul 31 2020 12:00AM",
     "STATUS": "Ready to Renew",
     "BEGIN_RENEWAL_NET": "2018/08/01",
     "END_RENEWAL_NET": "2020/07/31"
    }
   ]
  },
  "permitDetails": {
   "updated": "2020-06-28T18:58:30.089Z",
   "permitData": [
    {
     "FULL_ADDRESS": "1618 17TH ST NW A, Washington, DC 20009",
     "B1_UNIT_START": "A",
     "SSL": "0155    0089",
     "B1_ALT_ID": "B1511147",
     "TYPE": "Construction/Alteration and Repair",
     "G6_STAT_DD": "Aug  6 2015 12:00AM",
     "B1_APPL_STATUS": "Completed",
     "B1_APPL_STATUS_DATE": "09/18/2015",
     "DESC_OF_WORK": "Fire damage repair to original condition. Remove and replace as needed 2x4 studs under rear windows indicated on plans.  Replace two rear vinyl windows, subflooring and finishes.  Repair exterior stucco around the two windows to match.",
     "SORT_DATE": null,
     "G6_STAT_DD_NET": "2015/08/06",
     "B1_APPL_STATUS_DATE_NET": "2015/09/18",
     "JOB_CLASS_CODE": "WT",
     "JOB_SIZE": "N/A",
     "JOB_CLASSIFICATION": "N/A",
     "JOB_REVIEW_TIME": "N/A",
     "OWNER_NAME": "NA  KOTZ Family LP",
     "OWNER_FULL_NAME": "NA  KOTZ Family LP",
     "APPLICANT_NAME": "HAMID  FAKRI",
     "TRADE_NAME": "",
     "PERMIT_STATUS": [
      {
       "REVIEW_STATUS": "Application Accepted",
       "DISCIPLINE": "Plan Review Coordinator",
       "REVIEW_STATUS_DATE": "08/06/2015"
      },
      {
       "REVIEW_STATUS": "HPRB Review Approved",
       "DISCIPLINE": "HPRB Review",
       "REVIEW_STATUS_DATE": "08/06/2015"
      },
      {
       "REVIEW_STATUS": "Inspection Approved",
       "DISCIPLINE": "Inspection",
       "REVIEW_STATUS_DATE": "09/18/2015"
      },
      {
       "REVIEW_STATUS": "Permit Issued",
       "DISCIPLINE": "Issue Permit",
       "REVIEW_STATUS_DATE": "08/06/2015"
      },
      {
       "REVIEW_STATUS": "Structural Review Approved",
       "DISCIPLINE": "Structural Review",
       "REVIEW_STATUS_DATE": "08/06/2015"
      }
     ]
    }
   ]
  },
  "inspectionDetails": {
   "updated": "2020-06-28T18:58:30.290Z",
   "inspectionData": [
    {
     "ADDRESS": "1618 17TH ST NW A, Washington, DC 20009",
     "UNIT": "A",
     "SSL": "0155    0089",
     "ID": "B1511147",
     "G6_ACT_DES": "Building Final",
     "G6_STATUS": "Approved",
     "G6_STATUS_DD": "9/18/2015 12:00:00 AM",
     "DESC_OF_WORK": "Fire damage repair to original condition. Remove and replace as needed 2x4 studs under rear windows indicated on plans.  Replace two rear vinyl windows, subflooring and finishes.  Repair exterior stucco around the two windows to match.",
     "G6_STATUS_DD_NET": "2015/09/18",
     "OWNER_FULL_NAME": "NA  KOTZ Family LP",
     "APPLICANT": "HAMID  FAKRI"
    },
    {
     "ADDRESS": "1618 17TH ST NW A, Washington, DC 20009",
     "UNIT": "A",
     "SSL": "0155    0089",
     "ID": "B1511147",
     "G6_ACT_DES": "Building Close-In",
     "G6_STATUS": "Approved",
     "G6_STATUS_DD": "9/1/2015 12:00:00 AM",
     "DESC_OF_WORK": "Fire damage repair to original condition. Remove and replace as needed 2x4 studs under rear windows indicated on plans.  Replace two rear vinyl windows, subflooring and finishes.  Repair exterior stucco around the two windows to match.",
     "G6_STATUS_DD_NET": "2015/09/01",
     "OWNER_FULL_NAME": "NA  KOTZ Family LP",
     "APPLICANT": "HAMID  FAKRI"
    }
   ]
  },
  "occupancyDetails": {
   "updated": "2020-06-28T18:58:30.479Z",
   "occupancyData": [
    {
     "FULL_ADDRESS": "1526 17TH ST NW #218, Washington, DC 20036",
     "B1_UNIT_START": "#218",
     "SSL": "0156    0034",
     "B1_ALT_ID": "EHOP1690319",
     "TYPE": "Home Occupation/Expedited",
     "G6_STAT_DD": "02/04/2016",
     "B1_APPL_STATUS": "Permit Issued",
     "B1_APPL_STATUS_DATE": "02/04/2016",
     "DESC_OF_WORK": "Independent consultant, journalist, and writer",
     "G6_STAT_DD_NET": "2016/02/04",
     "B1_APPL_STATUS_DATE_NET": "2016/02/04",
     "OWNER_FULL_NAME": "",
     "APPLICANT": "NA NA NA"
    },
    {
     "FULL_ADDRESS": "1526 17TH ST NW, WASHINGTON, DC 20036-",
     "B1_UNIT_START": "",
     "SSL": "",
     "B1_ALT_ID": "HO35975",
     "TYPE": "Home Occupation",
     "G6_STAT_DD": "06/26/2002",
     "B1_APPL_STATUS": "Completed",
     "B1_APPL_STATUS_DATE": "          ",
     "DESC_OF_WORK": "",
     "G6_STAT_DD_NET": "2002/06/26",
     "B1_APPL_STATUS_DATE_NET": "",
     "OWNER_FULL_NAME": "EVANS IV, JOHN EDWARD",
     "APPLICANT": ""
    }
   ]
  },
  "charDetails": {
   "updated": "2020-06-28T19:53:51.399Z",
   "charData": [
    {
     "PREMISEADD": "1618 17TH ST NW",
     "SSL": "0155    0089",
     "BLDG_NUM": "1",
     "COMPLX_NUM": "",
     "UNITNUMBER": "",
     "NUM_UNITS": "",
     "AYB": "1893",
     "STRUCT_CL_": "Reinf Concr",
     "STYLE_D": "",
     "STRUCT_D": "",
     "GBA": "6482",
     "EXTWALL_D": "Concrete",
     "WALL_HGT": "12.00",
     "ROOF_D": "",
     "BATHRM": "",
     "HF_BATHRM": "",
     "HEAT_D": "",
     "AC": "",
     "INTWALL_D": "",
     "ROOMS": "",
     "BEDRM": "",
     "KITCHENS": "",
     "FIREPLACES": "",
     "YR_RMDL": "",
     "EYB": "1975",
     "STORIES": "",
     "OWNERNAME": "SYLVIA KOTZ TRUSTEES REVOCABLE TRUST",
     "OWNNAME2": "",
     "CAREOFNAME": ""
    }
   ]
  },
  "taxData": {
   "ssl": "0155    0089",
   "address": "1618 17TH ST NW",
   "owner": "SYLVIA KOTZ TRUSTEES REVOCABLE TRUST",
   "neighborhood": "OLD CITY II",
   "sub_neighborhood": "D",
   "use_code": "42",
   "sale_price": "$.00",
   "recordation_date": "N/A",
   "2016_Assessment": "$1,770,800.00"
  }
 },
 "1700 R STREET NW": {
  "ownerInfo": {
   "updated": "2020-06-28T17:30:39.019Z",
   "ownerData": [
    {
     "OWNERNAME": "MANSOUR MANSOURKIA TRUSTEE",
     "PREMISEADD": "1700 - 1702 R ST NW",
     "UNITNUMBER": "",
     "SSL": "0155    0825",
     "USECODE": "042",
     "HSTDCODE": "",
     "CLASSTYPE": "",
     "TAXRATE": "0",
     "SALEPRICE": "",
     "SALEDATE": "07/30/2003",
     "INSTNO": "",
     "ACCEPTCODE": "MISC",
     "DEEDDATE": "07/30/2003",
     "OWNNAME2": "MAHIN MANSOURKIA TRUSTEE",
     "CPMS_ADDRESS": "1700 R ST NW",
     "CAREOFNAME": "MANSOUR MANSOURKIA",
     "ADDRESS1": "1919 19TH ST NW",
     "ADDRESS2": "",
     "CITYSTZIP": "WASHINGTON                 DC 20009-1258",
     "SALEDATE_NET": "2003/07/30",
     "DEEDDATE_NET": "2003/07/30"
    },
    {
     "OWNERNAME": "MANSOUR MANSOURKIA TRUSTEE",
     "PREMISEADD": "1700 - 1702 R ST NW",
     "UNITNUMBER": "",
     "SSL": "0155    0825",
     "USECODE": "042",
     "HSTDCODE": "",
     "CLASSTYPE": "",
     "TAXRATE": "0",
     "SALEPRICE": "",
     "SALEDATE": "07/30/2003",
     "INSTNO": "",
     "ACCEPTCODE": "MISC",
     "DEEDDATE": "07/30/2003",
     "OWNNAME2": "MAHIN MANSOURKIA TRUSTEE",
     "CPMS_ADDRESS": "1700-1702 R ST NW",
     "CAREOFNAME": "MANSOUR MANSOURKIA",
     "ADDRESS1": "1919 19TH ST NW",
     "ADDRESS2": "",
     "CITYSTZIP": "WASHINGTON                 DC 20009-1258",
     "SALEDATE_NET": "2003/07/30",
     "DEEDDATE_NET": "2003/07/30"
    }
   ]
  },
  "addressDetails": {
   "updated": "2020-06-28T18:12:11.854Z",
   "addressData": [
    {
     "ADDRESS_ID": "243124",
     "MARID": "243124",
     "STATUS": "ACTIVE",
     "FULLADDRESS": "1700 R STREET NW",
     "ADDRNUM": "1700",
     "ADDRNUMSUFFIX": "",
     "STNAME": "R",
     "STREET_TYPE": "STREET",
     "QUADRANT": "NW",
     "CITY": "WASHINGTON",
     "STATE": "DC",
     "XCOORD": "396643.25",
     "YCOORD": "138288.59",
     "SSL": "0155    0825",
     "ANC": "ANC 2B",
     "PSA": "Police Service Area 301",
     "WARD": "Ward 2",
     "NBHD_ACTION": " ",
     "CLUSTER_": "Cluster 6",
     "POLDIST": "Police District - Third District",
     "ROC": "Police Sector 3D3",
     "CENSUS_TRACT": "005301",
     "VOTE_PRCNCT": "Precinct 15",
     "SMD": "SMD 2B03",
     "ZIPCODE": "20009",
     "NATIONALGRID": "18S UJ 23240 09037",
     "ROADWAYSEGID": "127",
     "FOCUS_IMPROVEMENT_AREA": "NA",
     "HAS_ALIAS": "N",
     "HAS_CONDO_UNIT": "N",
     "HAS_RES_UNIT": "N",
     "HAS_SSL": "Y",
     "LATITUDE": "38.91245507",
     "LONGITUDE": "-77.03870402",
     "STREETVIEWURL": "http://maps.google.com/maps?z=16&layer=c&cbll=38.91245507,-77.03870402&cbp=11,175.794325272875,,0,2.09",
     "RES_TYPE": "NON RESIDENTIAL",
     "WARD_2002": "Ward 2",
     "WARD_2012": "Ward 2",
     "ANC_2002": "ANC 2B",
     "ANC_2012": "ANC 2B",
     "SMD_2002": "SMD 2B03",
     "SMD_2012": "SMD 2B03",
     "IMAGEURL": "http://citizenatlas.dc.gov/mobilevideo",
     "IMAGEDIR": "NO_IMAGE",
     "IMAGENAME": "No_Image_Available.JPG",
     "ConfidenceLevel": "100",
     "Zoning": "MU-18"
    }
   ]
  },
  "licenseDetails": {
   "updated": "2020-06-28T18:37:07.483Z",
   "licenseData": [
    {
     "ADDRESS": "1700  R ST NW",
     "UNIT": "",
     "SSL": "0155    0825",
     "CUST_NUM": "300616000003",
     "DECRIPTION": "Environmental Materials",
     "ENDORSEMENT_DESC": "Dry Cleaners",
     "LAST_NAME": "",
     "FIRST_NAME": "",
     "CORP_NAME": "SWIFT CLEANERS INC.",
     "TRADE_NAME": "",
     "BEGIN_RENEWAL": "Dec  1 2019 12:00AM",
     "END_RENEWAL": "Nov 30 2021 12:00AM",
     "STATUS": "Active",
     "BEGIN_RENEWAL_NET": "2019/12/01",
     "END_RENEWAL_NET": "2021/11/30"
    },
    {
     "ADDRESS": "1700  R ST NW",
     "UNIT": " ",
     "SSL": "0155    0825",
     "CUST_NUM": "39902652",
     "DECRIPTION": "Environmental Materials",
     "ENDORSEMENT_DESC": "Dry Cleaners",
     "LAST_NAME": "",
     "FIRST_NAME": "",
     "CORP_NAME": "MANSOURKIA MANSOUR",
     "TRADE_NAME": "",
     "BEGIN_RENEWAL": "Jun  1 2006 12:00AM",
     "END_RENEWAL": "May 31 2008 12:00AM",
     "STATUS": "Cancelled",
     "BEGIN_RENEWAL_NET": "2006/06/01",
     "END_RENEWAL_NET": "2008/05/31"
    },
    {
     "ADDRESS": "1700  R ST NW",
     "UNIT": " ",
     "SSL": "0155    0825",
     "CUST_NUM": "68000524",
     "DECRIPTION": "Environmental Materials",
     "ENDORSEMENT_DESC": "Dry Cleaners",
     "LAST_NAME": "",
     "FIRST_NAME": "",
     "CORP_NAME": "HOONEY, LLC",
     "TRADE_NAME": "",
     "BEGIN_RENEWAL": "Jan  1 2008 12:00AM",
     "END_RENEWAL": "Dec 31 2009 12:00AM",
     "STATUS": "Expired",
     "BEGIN_RENEWAL_NET": "2008/01/01",
     "END_RENEWAL_NET": "2009/12/31"
    },
    {
     "ADDRESS": "1700  R ST NW",
     "UNIT": " ",
     "SSL": "0155    0825",
     "CUST_NUM": "69006562",
     "DECRIPTION": "Entertainment",
     "ENDORSEMENT_DESC": "Special Events",
     "LAST_NAME": "",
     "FIRST_NAME": "",
     "CORP_NAME": "NCMS INC",
     "TRADE_NAME": "NCMS ART / MUSIC",
     "BEGIN_RENEWAL": "",
     "END_RENEWAL": "Aug  1 2009 12:00AM",
     "STATUS": "Expired",
     "BEGIN_RENEWAL_NET": "",
     "END_RENEWAL_NET": "2009/08/01"
    },
    {
     "ADDRESS": "1700  R ST NW",
     "UNIT": "",
     "SSL": "0155    0825",
     "CUST_NUM": "70100230",
     "DECRIPTION": "Environmental Materials",
     "ENDORSEMENT_DESC": "Dry Cleaners",
     "LAST_NAME": "",
     "FIRST_NAME": "",
     "CORP_NAME": "SWIFT CLEANERS, INC.",
     "TRADE_NAME": "SWIFT CLEANERS",
     "BEGIN_RENEWAL": "Jan  1 2012 12:00AM",
     "END_RENEWAL": "Dec 31 2013 12:00AM",
     "STATUS": "Active",
     "BEGIN_RENEWAL_NET": "2012/01/01",
     "END_RENEWAL_NET": "2013/12/31"
    }
   ]
  },
  "permitDetails": {
   "updated": "2020-06-28T18:58:39.410Z",
   "permitData": [
    {
     "FULL_ADDRESS": "1700 R ST NW, WASHINGTON, DC 20009",
     "B1_UNIT_START": "",
     "SSL": "0155    0825",
     "B1_ALT_ID": "BCR-00119",
     "TYPE": "Boiler Certificate New",
     "G6_STAT_DD": "Jan  1 1900 12:00AM",
     "B1_APPL_STATUS": "Certificate Mailed",
     "B1_APPL_STATUS_DATE": "03/05/2012",
     "DESC_OF_WORK": "The Hartford Steam Boiler Inspection and Insurance Co.\r\nInspected 05/14/2016 \r\nInspected 05/09/2011",
     "SORT_DATE": null,
     "G6_STAT_DD_NET": "",
     "B1_APPL_STATUS_DATE_NET": "2012/03/05",
     "JOB_CLASS_CODE": "N/A",
     "JOB_SIZE": "N/A",
     "JOB_CLASSIFICATION": "N/A",
     "JOB_REVIEW_TIME": "N/A",
     "OWNER_NAME": "MORNINGSTAR CLEANERS, INC (SWIFT CLEANERS)",
     "OWNER_FULL_NAME": "MORNINGSTAR CLEANERS, INC (SWIFT CLEANERS)",
     "APPLICANT_NAME": "",
     "TRADE_NAME": "",
     "PERMIT_STATUS": [
      {
       "REVIEW_STATUS": "",
       "DISCIPLINE": "",
       "REVIEW_STATUS_DATE": ""
      }
     ]
    },
    {
     "FULL_ADDRESS": "1700 - 1702 R ST NW, WASHINGTON, DC 20009",
     "B1_UNIT_START": "",
     "SSL": "0155    0825",
     "B1_ALT_ID": "BCR-00579",
     "TYPE": "Boiler Certificate New",
     "G6_STAT_DD": "Jan  1 1900 12:00AM",
     "B1_APPL_STATUS": "Invoice Generated",
     "B1_APPL_STATUS_DATE": "06/04/2015",
     "DESC_OF_WORK": "The Hartford Steam Boiler Inspection and Insurance CO.\r\nInspected 08/14/2013.\r\nInspected 05/31/2014\r\nInspected 07/07/2014\r\nInspected 5/16/2015 (3)",
     "SORT_DATE": null,
     "G6_STAT_DD_NET": "",
     "B1_APPL_STATUS_DATE_NET": "2015/06/04",
     "JOB_CLASS_CODE": "N/A",
     "JOB_SIZE": "N/A",
     "JOB_CLASSIFICATION": "N/A",
     "JOB_REVIEW_TIME": "N/A",
     "OWNER_NAME": "MORNINGSTAR CLEANERS, INC (SWIFT CLEANERS)",
     "OWNER_FULL_NAME": "MORNINGSTAR CLEANERS, INC (SWIFT CLEANERS)",
     "APPLICANT_NAME": "",
     "TRADE_NAME": "",
     "PERMIT_STATUS": [
      {
       "REVIEW_STATUS": "",
       "DISCIPLINE": "",
       "REVIEW_STATUS_DATE": ""
      }
     ]
    },
    {
     "FULL_ADDRESS": "1700 - 1702 R ST NW, WASHINGTON, DC 20009",
     "B1_UNIT_START": "",
     "SSL": "0155    0825",
     "B1_ALT_ID": "BCR-03392",
     "TYPE": "Boiler Certificate New",
     "G6_STAT_DD": "Jan  1 1900 12:00AM",
     "B1_APPL_STATUS": "Invoice Generated",
     "B1_APPL_STATUS_DATE": "02/27/2020",
     "DESC_OF_WORK": "2020 Boiler Annual Inspection Report\r\nInspection Date 01/09/2020",
     "SORT_DATE": null,
     "G6_STAT_DD_NET": "",
     "B1_APPL_STATUS_DATE_NET": "2020/02/27",
     "JOB_CLASS_CODE": "N/A",
     "JOB_SIZE": "N/A",
     "JOB_CLASSIFICATION": "N/A",
     "JOB_REVIEW_TIME": "N/A",
     "OWNER_NAME": "Swift Cleaners Inc",
     "OWNER_FULL_NAME": "Swift Cleaners Inc",
     "APPLICANT_NAME": "",
     "TRADE_NAME": "",
     "PERMIT_STATUS": [
      {
       "REVIEW_STATUS": "",
       "DISCIPLINE": "",
       "REVIEW_STATUS_DATE": ""
      }
     ]
    },
    {
     "FULL_ADDRESS": "1700 R ST NW, WASHINGTON, DC 20009",
     "B1_UNIT_START": "",
     "SSL": "0155    0825",
     "B1_ALT_ID": "FB1700159",
     "TYPE": "Supplemental/Boiler/Fuel Burning",
     "G6_STAT_DD": "Sep  7 2017 12:00AM",
     "B1_APPL_STATUS": "Permit Issued",
     "B1_APPL_STATUS_DATE": "09/07/2017",
     "DESC_OF_WORK": "",
     "SORT_DATE": null,
     "G6_STAT_DD_NET": "2017/09/07",
     "B1_APPL_STATUS_DATE_NET": "2017/09/07",
     "JOB_CLASS_CODE": "N/A",
     "JOB_SIZE": "N/A",
     "JOB_CLASSIFICATION": "N/A",
     "JOB_REVIEW_TIME": "N/A",
     "OWNER_NAME": "MANSOUR MANSOURKIA TRUSTEE",
     "OWNER_FULL_NAME": "MANSOUR MANSOURKIA TRUSTEE",
     "APPLICANT_NAME": "KENNETH B. BEECHNER",
     "TRADE_NAME": "",
     "PERMIT_STATUS": [
      {
       "REVIEW_STATUS": "",
       "DISCIPLINE": "",
       "REVIEW_STATUS_DATE": ""
      }
     ]
    }
   ]
  },
  "inspectionDetails": {
   "updated": "2020-06-28T18:58:39.604Z",
   "inspectionData": [
    {
     "ADDRESS": "1700 - 1702 R ST NW, WASHINGTON, DC 20009",
     "UNIT": "",
     "SSL": "0155    0825",
     "ID": "CBO1100084",
     "G6_ACT_DES": "Initial Inspection",
     "G6_STATUS": "Approved",
     "G6_STATUS_DD": "2/16/2011 12:00:00 AM",
     "DESC_OF_WORK": "",
     "G6_STATUS_DD_NET": "2011/02/16",
     "OWNER_FULL_NAME": "MANSOUR MANSOURKIA TRUSTEE",
     "APPLICANT": ""
    },
    {
     "ADDRESS": "1700 - 1702 R ST NW, WASHINGTON, DC -",
     "UNIT": "",
     "SSL": "0155    0825",
     "ID": "ECC212160",
     "G6_ACT_DES": "C/O Zoning",
     "G6_STATUS": "No Cause",
     "G6_STATUS_DD": "1/23/2008 12:00:00 AM",
     "DESC_OF_WORK": "",
     "G6_STATUS_DD_NET": "2008/01/23",
     "OWNER_FULL_NAME": "",
     "APPLICANT": "JAMES  YI; JAMES  YI"
    },
    {
     "ADDRESS": "1700 - 1702 R ST NW, WASHINGTON, DC -",
     "UNIT": "",
     "SSL": "0155    0825",
     "ID": "ECC132370",
     "G6_ACT_DES": "Other (see remarks) Boiler",
     "G6_STATUS": "Cause",
     "G6_STATUS_DD": "3/14/2006 12:00:00 AM",
     "DESC_OF_WORK": "",
     "G6_STATUS_DD_NET": "2006/03/14",
     "OWNER_FULL_NAME": "",
     "APPLICANT": "N/A  N/A; N/A  N/A"
    },
    {
     "ADDRESS": "1700 - 1702 R ST NW, WASHINGTON, DC -",
     "UNIT": "",
     "SSL": "0155    0825",
     "ID": "ECC132371",
     "G6_ACT_DES": "Other (see remarks) Boiler",
     "G6_STATUS": "Cause",
     "G6_STATUS_DD": "3/14/2006 12:00:00 AM",
     "DESC_OF_WORK": "",
     "G6_STATUS_DD_NET": "2006/03/14",
     "OWNER_FULL_NAME": "",
     "APPLICANT": "N/A  N/A; N/A  N/A"
    },
    {
     "ADDRESS": "1700 - 1702 R ST NW, WASHINGTON, DC -",
     "UNIT": "",
     "SSL": "0155    0825",
     "ID": "ECC100115",
     "G6_ACT_DES": "Other (see remarks) Boiler",
     "G6_STATUS": "Cause",
     "G6_STATUS_DD": "4/19/2005 12:00:00 AM",
     "DESC_OF_WORK": "",
     "G6_STATUS_DD_NET": "2005/04/19",
     "OWNER_FULL_NAME": "",
     "APPLICANT": "N/A  N/A; N/A  N/A"
    },
    {
     "ADDRESS": "1700 - 1702 R ST NW, WASHINGTON, DC -",
     "UNIT": "",
     "SSL": "0155    0825",
     "ID": "ECC58369",
     "G6_ACT_DES": "Water Service Plumbing",
     "G6_STATUS": "No Cause",
     "G6_STATUS_DD": "3/19/2004 12:00:00 AM",
     "DESC_OF_WORK": "",
     "G6_STATUS_DD_NET": "2004/03/19",
     "OWNER_FULL_NAME": "",
     "APPLICANT": "TOM  WOLOSZYN; TOM  WOLOSZYN"
    },
    {
     "ADDRESS": "1700 - 1702 R ST NW, WASHINGTON, DC -",
     "UNIT": "",
     "SSL": "0155    0825",
     "ID": "ECC55833",
     "G6_ACT_DES": "Other (see remarks) Boiler",
     "G6_STATUS": "No Cause",
     "G6_STATUS_DD": "2/20/2004 12:00:00 AM",
     "DESC_OF_WORK": "",
     "G6_STATUS_DD_NET": "2004/02/20",
     "OWNER_FULL_NAME": "",
     "APPLICANT": "N/A  N/A; N/A  N/A"
    },
    {
     "ADDRESS": "1700 - 1702 R ST NW, WASHINGTON, DC -",
     "UNIT": "",
     "SSL": "0155    0825",
     "ID": "ECC55485",
     "G6_ACT_DES": "Other (see remarks) Boiler",
     "G6_STATUS": "Cancelled",
     "G6_STATUS_DD": "2/18/2004 12:00:00 AM",
     "DESC_OF_WORK": "",
     "G6_STATUS_DD_NET": "2004/02/18",
     "OWNER_FULL_NAME": "",
     "APPLICANT": "N/A  N/A; N/A  N/A"
    },
    {
     "ADDRESS": "1700 - 1702 R ST NW, WASHINGTON, DC -",
     "UNIT": "",
     "SSL": "0155    0825",
     "ID": "ECC4291",
     "G6_ACT_DES": "Final Construction",
     "G6_STATUS": "No Cause",
     "G6_STATUS_DD": "9/16/2002 12:00:00 AM",
     "DESC_OF_WORK": "",
     "G6_STATUS_DD_NET": "2002/09/16",
     "OWNER_FULL_NAME": "",
     "APPLICANT": "KB  TARK; KB  TARK"
    },
    {
     "ADDRESS": "1700 - 1702 R ST NW, WASHINGTON, DC -",
     "UNIT": "",
     "SSL": "0155    0825",
     "ID": "ECC3306",
     "G6_ACT_DES": "Final Construction",
     "G6_STATUS": "No Cause",
     "G6_STATUS_DD": "9/9/2002 12:00:00 AM",
     "DESC_OF_WORK": "",
     "G6_STATUS_DD_NET": "2002/09/09",
     "OWNER_FULL_NAME": "",
     "APPLICANT": "JIMMY  OH; JIMMY  OH"
    },
    {
     "ADDRESS": "1700 - 1702 R ST NW, WASHINGTON, DC -",
     "UNIT": "",
     "SSL": "0155    0825",
     "ID": "ECC1026",
     "G6_ACT_DES": "Framing Construction",
     "G6_STATUS": "No Cause",
     "G6_STATUS_DD": "8/9/2002 12:00:00 AM",
     "DESC_OF_WORK": "",
     "G6_STATUS_DD_NET": "2002/08/09",
     "OWNER_FULL_NAME": "",
     "APPLICANT": "JIMMY  OH; JIMMY  OH"
    },
    {
     "ADDRESS": "1700 - 1702 R ST NW, WASHINGTON, DC -",
     "UNIT": "",
     "SSL": "0155    0825",
     "ID": "ECC169341",
     "G6_ACT_DES": "Re-inspection Boiler",
     "G6_STATUS": "Cause",
     "G6_STATUS_DD": "",
     "DESC_OF_WORK": "",
     "G6_STATUS_DD_NET": "",
     "OWNER_FULL_NAME": "",
     "APPLICANT": "NA  NSA; NA  NSA"
    }
   ]
  },
  "occupancyDetails": {
   "updated": "2020-06-28T18:58:39.788Z",
   "occupancyData": [
    {
     "FULL_ADDRESS": "1700 - 1702 R ST NW, WASHINGTON, DC 20009",
     "B1_UNIT_START": "",
     "SSL": "0155    0825",
     "B1_ALT_ID": "CO1000686",
     "TYPE": "Certificate of Occupancy",
     "G6_STAT_DD": "12/15/2009",
     "B1_APPL_STATUS": "Completed",
     "B1_APPL_STATUS_DATE": "12/15/2009",
     "DESC_OF_WORK": "Ownership ChangeDRY CLEANERS ESTABLISHMENT WITH 1,700 SQUARE FEET.",
     "G6_STAT_DD_NET": "2009/12/15",
     "B1_APPL_STATUS_DATE_NET": "2009/12/15",
     "OWNER_FULL_NAME": "MANSOUR MANSOURKIA TRUSTEE",
     "APPLICANT": "SWIFT CLEANERS INC "
    },
    {
     "FULL_ADDRESS": "1700 R ST NW, WASHINGTON, DC 20009-2410",
     "B1_UNIT_START": "",
     "SSL": "",
     "B1_ALT_ID": "CO159251",
     "TYPE": "Certificate of Occupancy",
     "G6_STAT_DD": "01/23/2008",
     "B1_APPL_STATUS": "Completed",
     "B1_APPL_STATUS_DATE": "          ",
     "DESC_OF_WORK": "DUPONT CIRCLE OVERLAY HISTORIC PRESERVATION HOLD",
     "G6_STAT_DD_NET": "2008/01/23",
     "B1_APPL_STATUS_DATE_NET": "",
     "OWNER_FULL_NAME": "MANSOURKIA",
     "APPLICANT": ""
    }
   ]
  },
  "charDetails": {
   "updated": "2020-06-28T19:53:52.802Z",
   "charData": [
    {
     "PREMISEADD": "1700 - 1702 R ST NW",
     "SSL": "0155    0825",
     "BLDG_NUM": "1",
     "COMPLX_NUM": "",
     "UNITNUMBER": "",
     "NUM_UNITS": "",
     "AYB": "1890",
     "STRUCT_CL_": "Brick/Concr",
     "STYLE_D": "",
     "STRUCT_D": "",
     "GBA": "5043",
     "EXTWALL_D": "Brick",
     "WALL_HGT": "12.00",
     "ROOF_D": "",
     "BATHRM": "",
     "HF_BATHRM": "",
     "HEAT_D": "",
     "AC": "",
     "INTWALL_D": "",
     "ROOMS": "",
     "BEDRM": "",
     "KITCHENS": "",
     "FIREPLACES": "",
     "YR_RMDL": "",
     "EYB": "1985",
     "STORIES": "",
     "OWNERNAME": "MANSOUR MANSOURKIA TRUSTEE",
     "OWNNAME2": "MAHIN MANSOURKIA TRUSTEE",
     "CAREOFNAME": "MANSOUR MANSOURKIA"
    }
   ]
  },
  "taxData": {
   "ssl": "0155    0825",
   "address": "1700 - 1702 R ST NW",
   "owner": "MANSOUR MANSOURKIA TRUSTEE MANSOUR MANSOURKIA",
   "neighborhood": "OLD CITY II",
   "sub_neighborhood": "D",
   "use_code": "42",
   "sale_price": "$.00",
   "recordation_date": "07/30/2003",
   "2016_Assessment": "$1,420,540.00"
  }
 },
 "1701 Q STREET NW": {
  "ownerInfo": {
   "updated": "2020-06-28T17:30:39.493Z",
   "ownerData": [
    {
     "OWNERNAME": "J PERAZICH",
     "PREMISEADD": "1701 Q ST NW",
     "UNITNUMBER": "",
     "SSL": "0155    0800",
     "USECODE": "042",
     "HSTDCODE": "",
     "CLASSTYPE": "",
     "TAXRATE": "0",
     "SALEPRICE": "",
     "SALEDATE": "",
     "INSTNO": "",
     "ACCEPTCODE": "",
     "DEEDDATE": "",
     "OWNNAME2": "P WYNN",
     "CPMS_ADDRESS": "1701 Q ST NW",
     "CAREOFNAME": "",
     "ADDRESS1": "1835 IRVING ST NW",
     "ADDRESS2": "",
     "CITYSTZIP": "WASHINGTON                 DC 20010-2614",
     "SALEDATE_NET": "",
     "DEEDDATE_NET": ""
    }
   ]
  },
  "addressDetails": {
   "updated": "2020-06-28T18:12:12.264Z",
   "addressData": [
    {
     "ADDRESS_ID": "241711",
     "MARID": "241711",
     "STATUS": "ACTIVE",
     "FULLADDRESS": "1701 Q STREET NW",
     "ADDRNUM": "1701",
     "ADDRNUMSUFFIX": "",
     "STNAME": "Q",
     "STREET_TYPE": "STREET",
     "QUADRANT": "NW",
     "CITY": "WASHINGTON",
     "STATE": "DC",
     "XCOORD": "396637.90",
     "YCOORD": "138156.96",
     "SSL": "0155    0800",
     "ANC": "ANC 2B",
     "PSA": "Police Service Area 301",
     "WARD": "Ward 2",
     "NBHD_ACTION": " ",
     "CLUSTER_": "Cluster 6",
     "POLDIST": "Police District - Third District",
     "ROC": "Police Sector 3D3",
     "CENSUS_TRACT": "005301",
     "VOTE_PRCNCT": "Precinct 15",
     "SMD": "SMD 2B03",
     "ZIPCODE": "20009",
     "NATIONALGRID": "18S UJ 23232 08906",
     "ROADWAYSEGID": "9008",
     "FOCUS_IMPROVEMENT_AREA": "NA",
     "HAS_ALIAS": "N",
     "HAS_CONDO_UNIT": "N",
     "HAS_RES_UNIT": "N",
     "HAS_SSL": "Y",
     "LATITUDE": "38.91126928",
     "LONGITUDE": "-77.03876506",
     "STREETVIEWURL": "http://maps.google.com/maps?z=16&layer=c&cbll=38.91126928,-77.03876506&cbp=11,343.102153631934,,0,2.09",
     "RES_TYPE": "NON RESIDENTIAL",
     "WARD_2002": "Ward 2",
     "WARD_2012": "Ward 2",
     "ANC_2002": "ANC 2B",
     "ANC_2012": "ANC 2B",
     "SMD_2002": "SMD 2B03",
     "SMD_2012": "SMD 2B03",
     "IMAGEURL": "http://citizenatlas.dc.gov/mobilevideo",
     "IMAGEDIR": "20040805",
     "IMAGENAME": "Q5095113.jpg",
     "ConfidenceLevel": "100",
     "Zoning": "MU-18"
    }
   ]
  },
  "licenseDetails": {
   "updated": "2020-06-28T18:37:08.556Z",
   "licenseData": [
    {
     "ADDRESS": "1701  Q ST NW",
     "UNIT": "BSMT",
     "SSL": "0155    0800",
     "CUST_NUM": "400315900533",
     "DECRIPTION": "General Business",
     "ENDORSEMENT_DESC": "General Business Licenses",
     "LAST_NAME": "",
     "FIRST_NAME": "",
     "CORP_NAME": "Rock Creek Enterprises LLC",
     "TRADE_NAME": "",
     "BEGIN_RENEWAL": "Nov  1 2014 12:00AM",
     "END_RENEWAL": "Oct 31 2016 12:00AM",
     "STATUS": "Expired",
     "BEGIN_RENEWAL_NET": "2014/11/01",
     "END_RENEWAL_NET": "2016/10/31"
    }
   ]
  },
  "permitDetails": {
   "updated": "2020-06-28T18:58:41.582Z",
   "permitData": [
    {
     "FULL_ADDRESS": "1701 Q ST NW, WASHINGTON, DC 20009",
     "B1_UNIT_START": "",
     "SSL": "0155    0800",
     "B1_ALT_ID": "B1006334",
     "TYPE": "Construction/Alteration and Repair",
     "G6_STAT_DD": "May 27 2010 12:00AM",
     "B1_APPL_STATUS": "Permit Issued",
     "B1_APPL_STATUS_DATE": "05/27/2010",
     "DESC_OF_WORK": "SET UP SCAFFOLD  IN FRONT OF BUILDING UP TO EAVE OF MANSARD ROOF. \r\n I TOWER, 3 STORIES HIGH ON PRIVATE PROPERTY, FRONT YARD.\r\nREMOVE EXISTING FLAT ROOF MEMBRANE AND METAL FLASHING  HAUL DEBRIS. \r\n INSTALL NEW FLAT ROOF MEMBRANE AND NEW METAL FLASHING\r\n ALL WORK TO REMAIN IN KIND.",
     "SORT_DATE": null,
     "G6_STAT_DD_NET": "2010/05/27",
     "B1_APPL_STATUS_DATE_NET": "2010/05/27",
     "JOB_CLASS_CODE": "N/A",
     "JOB_SIZE": "N/A",
     "JOB_CLASSIFICATION": "N/A",
     "JOB_REVIEW_TIME": "N/A",
     "OWNER_NAME": "J PERAZICH",
     "OWNER_FULL_NAME": "J PERAZICH",
     "APPLICANT_NAME": "MANNY  CERRETO",
     "TRADE_NAME": "",
     "PERMIT_STATUS": [
      {
       "REVIEW_STATUS": "Application Accepted",
       "DISCIPLINE": "Plan Review Coordinator",
       "REVIEW_STATUS_DATE": "05/27/2010"
      },
      {
       "REVIEW_STATUS": "HPRB Review Approved",
       "DISCIPLINE": "HPRB Review",
       "REVIEW_STATUS_DATE": "05/27/2010"
      },
      {
       "REVIEW_STATUS": "Permit Issued",
       "DISCIPLINE": "Issue Permit",
       "REVIEW_STATUS_DATE": "05/27/2010"
      },
      {
       "REVIEW_STATUS": "Structural Review Approved",
       "DISCIPLINE": "Structural Review",
       "REVIEW_STATUS_DATE": "05/27/2010"
      }
     ]
    },
    {
     "FULL_ADDRESS": "1701 Q ST NW, WASHINGTON, DC 20009",
     "B1_UNIT_START": "",
     "SSL": "0155    0800",
     "B1_ALT_ID": "B1200416",
     "TYPE": "Construction/Alteration and Repair",
     "G6_STAT_DD": "Jan  1 1900 12:00AM",
     "B1_APPL_STATUS": "Application Canceled",
     "B1_APPL_STATUS_DATE": "11/12/2015",
     "DESC_OF_WORK": "ERECT SCAFFOLD UP TO EAVE OF ROOF ON FRONT YARD AROUND ENTIRE HOUSE .PRIVATE PROPERTY \r\nREMOVE 2 COURSES OF SLATE SHINGLES AND SALVAGE FOR RUESE.REMOVE EXISTING \r\nBUILT IN GUTTER AND HAUL DEBRIS.\r\nINSTALL NEW COPPER BUILT IN GUTTER AND REINSTALL PREVIOUSLY REMOVED SLATE SHINGLES \r\nALL WORK TO REMAIN",
     "SORT_DATE": null,
     "G6_STAT_DD_NET": "",
     "B1_APPL_STATUS_DATE_NET": "2015/11/12",
     "JOB_CLASS_CODE": "WT",
     "JOB_SIZE": "N/A",
     "JOB_CLASSIFICATION": "N/A",
     "JOB_REVIEW_TIME": "N/A",
     "OWNER_NAME": "J PERAZICH",
     "OWNER_FULL_NAME": "J PERAZICH",
     "APPLICANT_NAME": "MANNY  W",
     "TRADE_NAME": "",
     "PERMIT_STATUS": [
      {
       "REVIEW_STATUS": "Application Canceled",
       "DISCIPLINE": "File Room",
       "REVIEW_STATUS_DATE": "11/12/2015"
      },
      {
       "REVIEW_STATUS": "In-Process",
       "DISCIPLINE": "Issue Permit",
       "REVIEW_STATUS_DATE": ""
      },
      {
       "REVIEW_STATUS": "In-Process",
       "DISCIPLINE": "Plan Review Coordinator",
       "REVIEW_STATUS_DATE": ""
      }
     ]
    },
    {
     "FULL_ADDRESS": "1701 Q ST NW, WASHINGTON, DC 20009",
     "B1_UNIT_START": "",
     "SSL": "0155    0800",
     "B1_ALT_ID": "B1200421",
     "TYPE": "Construction/Alteration and Repair",
     "G6_STAT_DD": "Oct 13 2011 12:00AM",
     "B1_APPL_STATUS": "Permit Issued",
     "B1_APPL_STATUS_DATE": "10/13/2011",
     "DESC_OF_WORK": "ERECT SCAFFOLD UP TO EAVE OF ROOF ON FRONT YARD AROUND ENTIRE HOUSE. PRIVATE PROPERTY.\r\nREMOVE 2 COURSES OF SLATE SHINGLES AND SALVAGE FOR RUESE .REMOVE EXISTING\r\nBUILT IN GUTTER AND HAUL DEBRIS.\r\nINSTALL NEW COPPER BUILT IN GUTTER  AND REINSTALL PREVIOUSLY REMOVED SLATE SHINGLES .\r\nALL WORK TO REMA",
     "SORT_DATE": null,
     "G6_STAT_DD_NET": "2011/10/13",
     "B1_APPL_STATUS_DATE_NET": "2011/10/13",
     "JOB_CLASS_CODE": "WT",
     "JOB_SIZE": "N/A",
     "JOB_CLASSIFICATION": "N/A",
     "JOB_REVIEW_TIME": "N/A",
     "OWNER_NAME": "J PERAZICH",
     "OWNER_FULL_NAME": "J PERAZICH",
     "APPLICANT_NAME": "MANNY  W",
     "TRADE_NAME": "",
     "PERMIT_STATUS": [
      {
       "REVIEW_STATUS": "Application Accepted",
       "DISCIPLINE": "Plan Review Coordinator",
       "REVIEW_STATUS_DATE": "10/13/2011"
      },
      {
       "REVIEW_STATUS": "DDOT Review N/A",
       "DISCIPLINE": "DDOT Review",
       "REVIEW_STATUS_DATE": "10/13/2011"
      },
      {
       "REVIEW_STATUS": "HPRB Review Approved",
       "DISCIPLINE": "HPRB Review",
       "REVIEW_STATUS_DATE": "10/13/2011"
      },
      {
       "REVIEW_STATUS": "Permit Issued",
       "DISCIPLINE": "Issue Permit",
       "REVIEW_STATUS_DATE": "10/13/2011"
      },
      {
       "REVIEW_STATUS": "Structural Review Approved",
       "DISCIPLINE": "Structural Review",
       "REVIEW_STATUS_DATE": "10/13/2011"
      }
     ]
    },
    {
     "FULL_ADDRESS": "1701 Q ST NW, Washington, DC 20009",
     "B1_UNIT_START": "",
     "SSL": "0155    0800",
     "B1_ALT_ID": "B1304258",
     "TYPE": "Construction/Alteration and Repair",
     "G6_STAT_DD": "Feb 25 2013 12:00AM",
     "B1_APPL_STATUS": "Permit Issued",
     "B1_APPL_STATUS_DATE": "02/25/2013",
     "DESC_OF_WORK": "Brick work / Repointing \r\n\r\nSet up scaffolding",
     "SORT_DATE": null,
     "G6_STAT_DD_NET": "2013/02/25",
     "B1_APPL_STATUS_DATE_NET": "2013/02/25",
     "JOB_CLASS_CODE": "WT",
     "JOB_SIZE": "N/A",
     "JOB_CLASSIFICATION": "N/A",
     "JOB_REVIEW_TIME": "N/A",
     "OWNER_NAME": "Perazich",
     "OWNER_FULL_NAME": "Perazich",
     "APPLICANT_NAME": "LOPEZ",
     "TRADE_NAME": "",
     "PERMIT_STATUS": [
      {
       "REVIEW_STATUS": "Application Accepted",
       "DISCIPLINE": "Plan Review Coordinator",
       "REVIEW_STATUS_DATE": "02/25/2013"
      },
      {
       "REVIEW_STATUS": "HPRB Review Approved",
       "DISCIPLINE": "HPRB Review",
       "REVIEW_STATUS_DATE": "02/25/2013"
      },
      {
       "REVIEW_STATUS": "Permit Issued",
       "DISCIPLINE": "Issue Permit",
       "REVIEW_STATUS_DATE": "02/25/2013"
      },
      {
       "REVIEW_STATUS": "Structural Review Approved",
       "DISCIPLINE": "Structural Review",
       "REVIEW_STATUS_DATE": "02/25/2013"
      }
     ]
    },
    {
     "FULL_ADDRESS": "1701 Q ST NW, Washington, DC 20009",
     "B1_UNIT_START": "",
     "SSL": "0155    0800",
     "B1_ALT_ID": "B1404555",
     "TYPE": "Construction/Alteration and Repair",
     "G6_STAT_DD": "Feb 26 2014 12:00AM",
     "B1_APPL_STATUS": "Permit Issued",
     "B1_APPL_STATUS_DATE": "02/26/2014",
     "DESC_OF_WORK": "Brick Repointing",
     "SORT_DATE": null,
     "G6_STAT_DD_NET": "2014/02/26",
     "B1_APPL_STATUS_DATE_NET": "2014/02/26",
     "JOB_CLASS_CODE": "WT",
     "JOB_SIZE": "N/A",
     "JOB_CLASSIFICATION": "N/A",
     "JOB_REVIEW_TIME": "N/A",
     "OWNER_NAME": "Perazich",
     "OWNER_FULL_NAME": "Perazich",
     "APPLICANT_NAME": "LOPEZ",
     "TRADE_NAME": "",
     "PERMIT_STATUS": [
      {
       "REVIEW_STATUS": "Application Accepted",
       "DISCIPLINE": "Plan Review Coordinator",
       "REVIEW_STATUS_DATE": "02/25/2014"
      },
      {
       "REVIEW_STATUS": "HPRB Review Approved",
       "DISCIPLINE": "HPRB Review",
       "REVIEW_STATUS_DATE": "02/25/2014"
      },
      {
       "REVIEW_STATUS": "Management Review Approved",
       "DISCIPLINE": "Management Review",
       "REVIEW_STATUS_DATE": "02/26/2014"
      },
      {
       "REVIEW_STATUS": "Permit Issued",
       "DISCIPLINE": "Issue Permit",
       "REVIEW_STATUS_DATE": "02/26/2014"
      },
      {
       "REVIEW_STATUS": "Structural Review Approved",
       "DISCIPLINE": "Structural Review",
       "REVIEW_STATUS_DATE": "02/26/2014"
      }
     ]
    },
    {
     "FULL_ADDRESS": "1701 Q ST NW, Washington, DC 20009",
     "B1_UNIT_START": "",
     "SSL": "0155    0800",
     "B1_ALT_ID": "B1505037",
     "TYPE": "Construction/Alteration and Repair",
     "G6_STAT_DD": "Mar  6 2015 12:00AM",
     "B1_APPL_STATUS": "Permit Issued",
     "B1_APPL_STATUS_DATE": "03/06/2015",
     "DESC_OF_WORK": "Repointing",
     "SORT_DATE": null,
     "G6_STAT_DD_NET": "2015/03/06",
     "B1_APPL_STATUS_DATE_NET": "2015/03/06",
     "JOB_CLASS_CODE": "WT",
     "JOB_SIZE": "N/A",
     "JOB_CLASSIFICATION": "N/A",
     "JOB_REVIEW_TIME": "N/A",
     "OWNER_NAME": "Perazich",
     "OWNER_FULL_NAME": "Perazich",
     "APPLICANT_NAME": "LOPEZ",
     "TRADE_NAME": "",
     "PERMIT_STATUS": [
      {
       "REVIEW_STATUS": "Application Accepted",
       "DISCIPLINE": "Plan Review Coordinator",
       "REVIEW_STATUS_DATE": "03/06/2015"
      },
      {
       "REVIEW_STATUS": "HPRB Review Approved",
       "DISCIPLINE": "HPRB Review",
       "REVIEW_STATUS_DATE": "03/06/2015"
      },
      {
       "REVIEW_STATUS": "Management Review Approved",
       "DISCIPLINE": "Management Review",
       "REVIEW_STATUS_DATE": "03/06/2015"
      },
      {
       "REVIEW_STATUS": "Permit Issued",
       "DISCIPLINE": "Issue Permit",
       "REVIEW_STATUS_DATE": "03/06/2015"
      },
      {
       "REVIEW_STATUS": "Structural Review Approved",
       "DISCIPLINE": "Structural Review",
       "REVIEW_STATUS_DATE": "03/06/2015"
      }
     ]
    },
    {
     "FULL_ADDRESS": "1701 Q ST NW, Washington, DC 20009",
     "B1_UNIT_START": "",
     "SSL": "0155    0800",
     "B1_ALT_ID": "SC1400054",
     "TYPE": "Construction/Miscellaneous/Scaffolding",
     "G6_STAT_DD": "Feb 26 2014 12:00AM",
     "B1_APPL_STATUS": "Permit Issued",
     "B1_APPL_STATUS_DATE": "02/26/2014",
     "DESC_OF_WORK": "set up scaffolding in front yard for brick repointing",
     "SORT_DATE": null,
     "G6_STAT_DD_NET": "2014/02/26",
     "B1_APPL_STATUS_DATE_NET": "2014/02/26",
     "JOB_CLASS_CODE": "N/A",
     "JOB_SIZE": "N/A",
     "JOB_CLASSIFICATION": "N/A",
     "JOB_REVIEW_TIME": "N/A",
     "OWNER_NAME": "perazich",
     "OWNER_FULL_NAME": "perazich",
     "APPLICANT_NAME": "LOPEZ",
     "TRADE_NAME": "",
     "PERMIT_STATUS": [
      {
       "REVIEW_STATUS": "Application Accepted",
       "DISCIPLINE": "Plan Review Coordinator",
       "REVIEW_STATUS_DATE": "02/25/2014"
      },
      {
       "REVIEW_STATUS": "HPRB Review Approved",
       "DISCIPLINE": "HPRB Review",
       "REVIEW_STATUS_DATE": "02/25/2014"
      },
      {
       "REVIEW_STATUS": "Management Review Approved",
       "DISCIPLINE": "Management Review",
       "REVIEW_STATUS_DATE": "02/26/2014"
      },
      {
       "REVIEW_STATUS": "Permit Issued",
       "DISCIPLINE": "Issue Permit",
       "REVIEW_STATUS_DATE": "02/26/2014"
      },
      {
       "REVIEW_STATUS": "Structural Review Approved",
       "DISCIPLINE": "Structural Review",
       "REVIEW_STATUS_DATE": "02/26/2014"
      }
     ]
    },
    {
     "FULL_ADDRESS": "1701 Q ST NW, Washington, DC 20009",
     "B1_UNIT_START": "",
     "SSL": "0155    0800",
     "B1_ALT_ID": "SC1500054",
     "TYPE": "Construction/Miscellaneous/Scaffolding",
     "G6_STAT_DD": "Mar  6 2015 12:00AM",
     "B1_APPL_STATUS": "Permit Issued",
     "B1_APPL_STATUS_DATE": "03/06/2015",
     "DESC_OF_WORK": "Set up scaffolding on private property",
     "SORT_DATE": null,
     "G6_STAT_DD_NET": "2015/03/06",
     "B1_APPL_STATUS_DATE_NET": "2015/03/06",
     "JOB_CLASS_CODE": "N/A",
     "JOB_SIZE": "N/A",
     "JOB_CLASSIFICATION": "N/A",
     "JOB_REVIEW_TIME": "N/A",
     "OWNER_NAME": "Perazich",
     "OWNER_FULL_NAME": "Perazich",
     "APPLICANT_NAME": "LOPEZ",
     "TRADE_NAME": "",
     "PERMIT_STATUS": [
      {
       "REVIEW_STATUS": "Application Accepted",
       "DISCIPLINE": "Plan Review Coordinator",
       "REVIEW_STATUS_DATE": "03/06/2015"
      },
      {
       "REVIEW_STATUS": "HPRB Review Approved",
       "DISCIPLINE": "HPRB Review",
       "REVIEW_STATUS_DATE": "03/06/2015"
      },
      {
       "REVIEW_STATUS": "Management Review Approved",
       "DISCIPLINE": "Management Review",
       "REVIEW_STATUS_DATE": "03/06/2015"
      },
      {
       "REVIEW_STATUS": "Permit Issued",
       "DISCIPLINE": "Issue Permit",
       "REVIEW_STATUS_DATE": "03/06/2015"
      },
      {
       "REVIEW_STATUS": "Structural Review Approved",
       "DISCIPLINE": "Structural Review",
       "REVIEW_STATUS_DATE": "03/06/2015"
      }
     ]
    },
    {
     "FULL_ADDRESS": "1701 Q ST NW, WASHINGTON, DC 20009",
     "B1_UNIT_START": "",
     "SSL": "0155    0800",
     "B1_ALT_ID": "SG1100331",
     "TYPE": "Construction/Sign",
     "G6_STAT_DD": "Jan  1 1900 12:00AM",
     "B1_APPL_STATUS": "Application Canceled",
     "B1_APPL_STATUS_DATE": "06/18/2015",
     "DESC_OF_WORK": "(1) ONE 3' X 4' X 4\" SIGN ILLUMINATED",
     "SORT_DATE": null,
     "G6_STAT_DD_NET": "",
     "B1_APPL_STATUS_DATE_NET": "2015/06/18",
     "JOB_CLASS_CODE": "N/A",
     "JOB_SIZE": "N/A",
     "JOB_CLASSIFICATION": "N/A",
     "JOB_REVIEW_TIME": "N/A",
     "OWNER_NAME": "J PERAZICH",
     "OWNER_FULL_NAME": "J PERAZICH",
     "APPLICANT_NAME": "BOB  BIROONAK",
     "TRADE_NAME": "",
     "PERMIT_STATUS": [
      {
       "REVIEW_STATUS": "Application Accepted",
       "DISCIPLINE": "Plan Review Coordinator",
       "REVIEW_STATUS_DATE": "06/22/2011"
      },
      {
       "REVIEW_STATUS": "Application Canceled",
       "DISCIPLINE": "File Room",
       "REVIEW_STATUS_DATE": "06/18/2015"
      },
      {
       "REVIEW_STATUS": "In-Process",
       "DISCIPLINE": "Electrical Review",
       "REVIEW_STATUS_DATE": ""
      },
      {
       "REVIEW_STATUS": "In-Process",
       "DISCIPLINE": "HPRB Review",
       "REVIEW_STATUS_DATE": ""
      },
      {
       "REVIEW_STATUS": "In-Process",
       "DISCIPLINE": "Structural Review",
       "REVIEW_STATUS_DATE": ""
      }
     ]
    },
    {
     "FULL_ADDRESS": "1701 Q ST NW, Washington, DC 20009",
     "B1_UNIT_START": "",
     "SSL": "0155    0800",
     "B1_ALT_ID": "SG1300161",
     "TYPE": "Construction/Sign",
     "G6_STAT_DD": "Mar  1 2013 12:00AM",
     "B1_APPL_STATUS": "Permit Issued",
     "B1_APPL_STATUS_DATE": "03/01/2013",
     "DESC_OF_WORK": "Exterior NONE ELECTRIC Sign.",
     "SORT_DATE": null,
     "G6_STAT_DD_NET": "2013/03/01",
     "B1_APPL_STATUS_DATE_NET": "2013/03/01",
     "JOB_CLASS_CODE": "WT",
     "JOB_SIZE": "N/A",
     "JOB_CLASSIFICATION": "N/A",
     "JOB_REVIEW_TIME": "N/A",
     "OWNER_NAME": "John  Perazich",
     "OWNER_FULL_NAME": "John  Perazich",
     "APPLICANT_NAME": "NICHOLAS  PASQUINI; NA",
     "TRADE_NAME": "",
     "PERMIT_STATUS": [
      {
       "REVIEW_STATUS": "Application Accepted",
       "DISCIPLINE": "Plan Review Coordinator",
       "REVIEW_STATUS_DATE": "02/12/2013"
      },
      {
       "REVIEW_STATUS": "HPRB Review Approved",
       "DISCIPLINE": "HPRB Review",
       "REVIEW_STATUS_DATE": "02/12/2013"
      },
      {
       "REVIEW_STATUS": "Permit Issued",
       "DISCIPLINE": "Issue Permit",
       "REVIEW_STATUS_DATE": "03/01/2013"
      },
      {
       "REVIEW_STATUS": "Structural Review Approved",
       "DISCIPLINE": "Structural Review",
       "REVIEW_STATUS_DATE": "03/01/2013"
      }
     ]
    }
   ]
  },
  "inspectionDetails": {
   "updated": "2020-06-28T18:58:41.828Z",
   "inspectionData": [
    {
     "ADDRESS": "1701 Q ST NW, WASHINGTON, DC 20009",
     "UNIT": "",
     "SSL": "0155    0800",
     "ID": "CO1402492",
     "G6_ACT_DES": "Building Final",
     "G6_STATUS": "Approved",
     "G6_STATUS_DD": "7/21/2014 12:00:00 AM",
     "DESC_OF_WORK": "OWNERSHIP CHANGE - OFFICE USE - NO PARKING REQUIRED",
     "G6_STATUS_DD_NET": "2014/07/21",
     "OWNER_FULL_NAME": "J PERAZICH",
     "APPLICANT": ""
    },
    {
     "ADDRESS": "1701 Q ST NW, WASHINGTON, DC 20009",
     "UNIT": "",
     "SSL": "0155    0800",
     "ID": "CO1402492",
     "G6_ACT_DES": "Zoning Use",
     "G6_STATUS": "Approved",
     "G6_STATUS_DD": "7/17/2014 12:00:00 AM",
     "DESC_OF_WORK": "OWNERSHIP CHANGE - OFFICE USE - NO PARKING REQUIRED",
     "G6_STATUS_DD_NET": "2014/07/17",
     "OWNER_FULL_NAME": "J PERAZICH",
     "APPLICANT": ""
    },
    {
     "ADDRESS": "1701 Q ST NW, WASHINGTON, DC 20009",
     "UNIT": "",
     "SSL": "0155    0800",
     "ID": "CO1402492",
     "G6_ACT_DES": "Zoning Use",
     "G6_STATUS": "Rescheduled",
     "G6_STATUS_DD": "7/7/2014 12:00:00 AM",
     "DESC_OF_WORK": "OWNERSHIP CHANGE - OFFICE USE - NO PARKING REQUIRED",
     "G6_STATUS_DD_NET": "2014/07/07",
     "OWNER_FULL_NAME": "J PERAZICH",
     "APPLICANT": ""
    }
   ]
  },
  "occupancyDetails": {
   "updated": "2020-06-28T18:58:42.002Z",
   "occupancyData": [
    {
     "FULL_ADDRESS": "1701 Q ST NW, WASHINGTON, DC 20009",
     "B1_UNIT_START": "",
     "SSL": "0155    0800",
     "B1_ALT_ID": "CO1402492",
     "TYPE": "Certificate of Occupancy",
     "G6_STAT_DD": "07/21/2014",
     "B1_APPL_STATUS": "Completed",
     "B1_APPL_STATUS_DATE": "07/21/2014",
     "DESC_OF_WORK": "Ownership ChangeOWNERSHIP CHANGE - OFFICE USE - NO PARKING REQUIRED",
     "G6_STAT_DD_NET": "2014/07/21",
     "B1_APPL_STATUS_DATE_NET": "2014/07/21",
     "OWNER_FULL_NAME": "J PERAZICH",
     "APPLICANT": ""
    }
   ]
  },
  "charDetails": {
   "updated": "2020-06-28T19:53:53.107Z",
   "charData": [
    {
     "PREMISEADD": "1701 Q ST NW",
     "SSL": "0155    0800",
     "BLDG_NUM": "1",
     "COMPLX_NUM": "",
     "UNITNUMBER": "",
     "NUM_UNITS": "1.00",
     "AYB": "1885",
     "STRUCT_CL_": "Brick/Concr",
     "STYLE_D": "",
     "STRUCT_D": "",
     "GBA": "4745",
     "EXTWALL_D": "Brick",
     "WALL_HGT": "8.00",
     "ROOF_D": "",
     "BATHRM": "",
     "HF_BATHRM": "",
     "HEAT_D": "",
     "AC": "",
     "INTWALL_D": "",
     "ROOMS": "",
     "BEDRM": "",
     "KITCHENS": "",
     "FIREPLACES": "",
     "YR_RMDL": "1992",
     "EYB": "1992",
     "STORIES": "",
     "OWNERNAME": "J PERAZICH",
     "OWNNAME2": "P WYNN",
     "CAREOFNAME": ""
    }
   ]
  },
  "taxData": {
   "ssl": "0155    0800",
   "address": "1701 Q ST NW",
   "owner": "J PERAZICH",
   "neighborhood": "OLD CITY II",
   "sub_neighborhood": "D",
   "use_code": "59",
   "sale_price": "$.00",
   "recordation_date": "N/A",
   "2016_Assessment": "$1,707,390.00"
  }
 },
 "1702 R STREET NW": {
  "ownerInfo": {
   "updated": "2020-06-28T17:30:39.801Z",
   "ownerData": [
    {
     "OWNERNAME": "MANSOUR MANSOURKIA TRUSTEE",
     "PREMISEADD": "1700 - 1702 R ST NW",
     "UNITNUMBER": "",
     "SSL": "0155    0825",
     "USECODE": "042",
     "HSTDCODE": "",
     "CLASSTYPE": "",
     "TAXRATE": "0",
     "SALEPRICE": "",
     "SALEDATE": "07/30/2003",
     "INSTNO": "",
     "ACCEPTCODE": "MISC",
     "DEEDDATE": "07/30/2003",
     "OWNNAME2": "MAHIN MANSOURKIA TRUSTEE",
     "CPMS_ADDRESS": "1700-1702 R ST NW",
     "CAREOFNAME": "MANSOUR MANSOURKIA",
     "ADDRESS1": "1919 19TH ST NW",
     "ADDRESS2": "",
     "CITYSTZIP": "WASHINGTON                 DC 20009-1258",
     "SALEDATE_NET": "2003/07/30",
     "DEEDDATE_NET": "2003/07/30"
    }
   ]
  },
  "addressDetails": {
   "updated": "2020-06-28T18:12:12.574Z",
   "addressData": [
    {
     "ADDRESS_ID": "276254",
     "MARID": "276254",
     "STATUS": "ACTIVE",
     "FULLADDRESS": "1702 R STREET NW",
     "ADDRNUM": "1702",
     "ADDRNUMSUFFIX": "",
     "STNAME": "R",
     "STREET_TYPE": "STREET",
     "QUADRANT": "NW",
     "CITY": "WASHINGTON",
     "STATE": "DC",
     "XCOORD": "396637.09",
     "YCOORD": "138285.94",
     "SSL": "0155    0825",
     "ANC": "ANC 2B",
     "PSA": "Police Service Area 301",
     "WARD": "Ward 2",
     "NBHD_ACTION": " ",
     "CLUSTER_": "Cluster 6",
     "POLDIST": "Police District - Third District",
     "ROC": "Police Sector 3D3",
     "CENSUS_TRACT": "005301",
     "VOTE_PRCNCT": "Precinct 15",
     "SMD": "SMD 2B03",
     "ZIPCODE": "20009",
     "NATIONALGRID": "18S UJ 23234 09035",
     "ROADWAYSEGID": "127",
     "FOCUS_IMPROVEMENT_AREA": "NA",
     "HAS_ALIAS": "N",
     "HAS_CONDO_UNIT": "N",
     "HAS_RES_UNIT": "N",
     "HAS_SSL": "Y",
     "LATITUDE": "38.91243117",
     "LONGITUDE": "-77.03877503",
     "STREETVIEWURL": "http://maps.google.com/maps?z=16&layer=c&cbll=38.91243117,-77.03877503&cbp=11,194.480490718764,,0,2.09",
     "RES_TYPE": "NON RESIDENTIAL",
     "WARD_2002": "Ward 2",
     "WARD_2012": "Ward 2",
     "ANC_2002": "ANC 2B",
     "ANC_2012": "ANC 2B",
     "SMD_2002": "SMD 2B03",
     "SMD_2012": "SMD 2B03",
     "IMAGEURL": "http://citizenatlas.dc.gov/mobilevideo",
     "IMAGEDIR": "20040802",
     "IMAGENAME": "Q2100254.jpg",
     "ConfidenceLevel": "100",
     "Zoning": "MU-18"
    }
   ]
  },
  "licenseDetails": {
   "updated": "2020-06-28T18:37:09.172Z",
   "licenseData": [
    {
     "ADDRESS": "1700  R ST NW",
     "UNIT": "",
     "SSL": "0155    0825",
     "CUST_NUM": "300616000003",
     "DECRIPTION": "Environmental Materials",
     "ENDORSEMENT_DESC": "Dry Cleaners",
     "LAST_NAME": "",
     "FIRST_NAME": "",
     "CORP_NAME": "SWIFT CLEANERS INC.",
     "TRADE_NAME": "",
     "BEGIN_RENEWAL": "Dec  1 2019 12:00AM",
     "END_RENEWAL": "Nov 30 2021 12:00AM",
     "STATUS": "Active",
     "BEGIN_RENEWAL_NET": "2019/12/01",
     "END_RENEWAL_NET": "2021/11/30"
    },
    {
     "ADDRESS": "1700  R ST NW",
     "UNIT": " ",
     "SSL": "0155    0825",
     "CUST_NUM": "39902652",
     "DECRIPTION": "Environmental Materials",
     "ENDORSEMENT_DESC": "Dry Cleaners",
     "LAST_NAME": "",
     "FIRST_NAME": "",
     "CORP_NAME": "MANSOURKIA MANSOUR",
     "TRADE_NAME": "",
     "BEGIN_RENEWAL": "Jun  1 2006 12:00AM",
     "END_RENEWAL": "May 31 2008 12:00AM",
     "STATUS": "Cancelled",
     "BEGIN_RENEWAL_NET": "2006/06/01",
     "END_RENEWAL_NET": "2008/05/31"
    },
    {
     "ADDRESS": "1700  R ST NW",
     "UNIT": " ",
     "SSL": "0155    0825",
     "CUST_NUM": "68000524",
     "DECRIPTION": "Environmental Materials",
     "ENDORSEMENT_DESC": "Dry Cleaners",
     "LAST_NAME": "",
     "FIRST_NAME": "",
     "CORP_NAME": "HOONEY, LLC",
     "TRADE_NAME": "",
     "BEGIN_RENEWAL": "Jan  1 2008 12:00AM",
     "END_RENEWAL": "Dec 31 2009 12:00AM",
     "STATUS": "Expired",
     "BEGIN_RENEWAL_NET": "2008/01/01",
     "END_RENEWAL_NET": "2009/12/31"
    },
    {
     "ADDRESS": "1700  R ST NW",
     "UNIT": " ",
     "SSL": "0155    0825",
     "CUST_NUM": "69006562",
     "DECRIPTION": "Entertainment",
     "ENDORSEMENT_DESC": "Special Events",
     "LAST_NAME": "",
     "FIRST_NAME": "",
     "CORP_NAME": "NCMS INC",
     "TRADE_NAME": "NCMS ART / MUSIC",
     "BEGIN_RENEWAL": "",
     "END_RENEWAL": "Aug  1 2009 12:00AM",
     "STATUS": "Expired",
     "BEGIN_RENEWAL_NET": "",
     "END_RENEWAL_NET": "2009/08/01"
    },
    {
     "ADDRESS": "1700  R ST NW",
     "UNIT": "",
     "SSL": "0155    0825",
     "CUST_NUM": "70100230",
     "DECRIPTION": "Environmental Materials",
     "ENDORSEMENT_DESC": "Dry Cleaners",
     "LAST_NAME": "",
     "FIRST_NAME": "",
     "CORP_NAME": "SWIFT CLEANERS, INC.",
     "TRADE_NAME": "SWIFT CLEANERS",
     "BEGIN_RENEWAL": "Jan  1 2012 12:00AM",
     "END_RENEWAL": "Dec 31 2013 12:00AM",
     "STATUS": "Active",
     "BEGIN_RENEWAL_NET": "2012/01/01",
     "END_RENEWAL_NET": "2013/12/31"
    }
   ]
  },
  "permitDetails": {
   "updated": "2020-06-28T18:58:42.401Z",
   "permitData": []
  },
  "inspectionDetails": {
   "updated": "2020-06-28T18:58:42.581Z",
   "inspectionData": []
  },
  "occupancyDetails": {
   "updated": "2020-06-28T18:58:42.738Z",
   "occupancyData": [
    {
     "FULL_ADDRESS": "1700 - 1702 R ST NW, WASHINGTON, DC 20009",
     "B1_UNIT_START": "",
     "SSL": "0155    0825",
     "B1_ALT_ID": "CO1000686",
     "TYPE": "Certificate of Occupancy",
     "G6_STAT_DD": "12/15/2009",
     "B1_APPL_STATUS": "Completed",
     "B1_APPL_STATUS_DATE": "12/15/2009",
     "DESC_OF_WORK": "Ownership ChangeDRY CLEANERS ESTABLISHMENT WITH 1,700 SQUARE FEET.",
     "G6_STAT_DD_NET": "2009/12/15",
     "B1_APPL_STATUS_DATE_NET": "2009/12/15",
     "OWNER_FULL_NAME": "MANSOUR MANSOURKIA TRUSTEE",
     "APPLICANT": "SWIFT CLEANERS INC "
    },
    {
     "FULL_ADDRESS": "1700 R ST NW, WASHINGTON, DC 20009-2410",
     "B1_UNIT_START": "",
     "SSL": "",
     "B1_ALT_ID": "CO159251",
     "TYPE": "Certificate of Occupancy",
     "G6_STAT_DD": "01/23/2008",
     "B1_APPL_STATUS": "Completed",
     "B1_APPL_STATUS_DATE": "          ",
     "DESC_OF_WORK": "DUPONT CIRCLE OVERLAY HISTORIC PRESERVATION HOLD",
     "G6_STAT_DD_NET": "2008/01/23",
     "B1_APPL_STATUS_DATE_NET": "",
     "OWNER_FULL_NAME": "MANSOURKIA",
     "APPLICANT": ""
    }
   ]
  },
  "charDetails": {
   "updated": "2020-06-28T19:53:53.275Z",
   "charData": [
    {
     "PREMISEADD": "1700 - 1702 R ST NW",
     "SSL": "0155    0825",
     "BLDG_NUM": "1",
     "COMPLX_NUM": "",
     "UNITNUMBER": "",
     "NUM_UNITS": "",
     "AYB": "1890",
     "STRUCT_CL_": "Brick/Concr",
     "STYLE_D": "",
     "STRUCT_D": "",
     "GBA": "5043",
     "EXTWALL_D": "Brick",
     "WALL_HGT": "12.00",
     "ROOF_D": "",
     "BATHRM": "",
     "HF_BATHRM": "",
     "HEAT_D": "",
     "AC": "",
     "INTWALL_D": "",
     "ROOMS": "",
     "BEDRM": "",
     "KITCHENS": "",
     "FIREPLACES": "",
     "YR_RMDL": "",
     "EYB": "1985",
     "STORIES": "",
     "OWNERNAME": "MANSOUR MANSOURKIA TRUSTEE",
     "OWNNAME2": "MAHIN MANSOURKIA TRUSTEE",
     "CAREOFNAME": "MANSOUR MANSOURKIA"
    }
   ]
  },
  "taxData": {
   "ssl": "0155    0825",
   "address": "1700 - 1702 R ST NW",
   "owner": "MANSOUR MANSOURKIA TRUSTEE MANSOUR MANSOURKIA",
   "neighborhood": "OLD CITY II",
   "sub_neighborhood": "D",
   "use_code": "42",
   "sale_price": "$.00",
   "recordation_date": "07/30/2003",
   "2016_Assessment": "$1,420,540.00"
  }
 },
 "1704 R STREET NW": {
  "ownerInfo": {
   "updated": "2020-06-28T17:30:40.110Z",
   "ownerData": [
    {
     "OWNERNAME": "DUPONT-MORGAN III LLC",
     "PREMISEADD": "1704 R ST NW",
     "UNITNUMBER": "",
     "SSL": "0155    0826",
     "USECODE": "042",
     "HSTDCODE": "",
     "CLASSTYPE": "",
     "TAXRATE": "0",
     "SALEPRICE": "$1,107,808.00",
     "SALEDATE": "10/29/2004",
     "INSTNO": "",
     "ACCEPTCODE": "MARKET",
     "DEEDDATE": "10/29/2004",
     "OWNNAME2": "",
     "CPMS_ADDRESS": "1704 R ST NW",
     "CAREOFNAME": "H. A. GILL & SON",
     "ADDRESS1": "1722 WISCONSIN AVE NW",
     "ADDRESS2": "",
     "CITYSTZIP": "WASHINGTON                 DC 20007-2313",
     "SALEDATE_NET": "2004/10/29",
     "DEEDDATE_NET": "2004/10/29"
    }
   ]
  },
  "addressDetails": {
   "updated": "2020-06-28T18:12:12.981Z",
   "addressData": [
    {
     "ADDRESS_ID": "241715",
     "MARID": "241715",
     "STATUS": "ACTIVE",
     "FULLADDRESS": "1704 R STREET NW",
     "ADDRNUM": "1704",
     "ADDRNUMSUFFIX": "",
     "STNAME": "R",
     "STREET_TYPE": "STREET",
     "QUADRANT": "NW",
     "CITY": "WASHINGTON",
     "STATE": "DC",
     "XCOORD": "396631.44",
     "YCOORD": "138286.67",
     "SSL": "0155    0826",
     "ANC": "ANC 2B",
     "PSA": "Police Service Area 301",
     "WARD": "Ward 2",
     "NBHD_ACTION": " ",
     "CLUSTER_": "Cluster 6",
     "POLDIST": "Police District - Third District",
     "ROC": "Police Sector 3D3",
     "CENSUS_TRACT": "005301",
     "VOTE_PRCNCT": "Precinct 15",
     "SMD": "SMD 2B03",
     "ZIPCODE": "20009",
     "NATIONALGRID": "18S UJ 23228 09036",
     "ROADWAYSEGID": "127",
     "FOCUS_IMPROVEMENT_AREA": "NA",
     "HAS_ALIAS": "N",
     "HAS_CONDO_UNIT": "N",
     "HAS_RES_UNIT": "Y",
     "HAS_SSL": "Y",
     "LATITUDE": "38.91243773",
     "LONGITUDE": "-77.03884018",
     "STREETVIEWURL": "http://maps.google.com/maps?z=16&layer=c&cbll=38.91243773,-77.03884018&cbp=11,180.584511957941,,0,2.09",
     "RES_TYPE": "RESIDENTIAL",
     "WARD_2002": "Ward 2",
     "WARD_2012": "Ward 2",
     "ANC_2002": "ANC 2B",
     "ANC_2012": "ANC 2B",
     "SMD_2002": "SMD 2B03",
     "SMD_2012": "SMD 2B03",
     "IMAGEURL": "http://citizenatlas.dc.gov/mobilevideo",
     "IMAGEDIR": "20040802",
     "IMAGENAME": "Q2100312.jpg",
     "ConfidenceLevel": "100",
     "Zoning": "MU-18"
    }
   ]
  },
  "licenseDetails": {
   "updated": "2020-06-28T18:37:09.991Z",
   "licenseData": [
    {
     "ADDRESS": "1704  R ST NW",
     "UNIT": " ",
     "SSL": "0155    0826",
     "CUST_NUM": "39900844",
     "DECRIPTION": "Public Health Food Establish",
     "ENDORSEMENT_DESC": "Restaurant",
     "LAST_NAME": "",
     "FIRST_NAME": "",
     "CORP_NAME": "SWEETLICKS INC",
     "TRADE_NAME": "",
     "BEGIN_RENEWAL": "May  1 2004 12:00AM",
     "END_RENEWAL": "Apr 30 2006 12:00AM",
     "STATUS": "Expired",
     "BEGIN_RENEWAL_NET": "2004/05/01",
     "END_RENEWAL_NET": "2006/04/30"
    },
    {
     "ADDRESS": "1704  R ST NW",
     "UNIT": "",
     "SSL": "0155    0826",
     "CUST_NUM": "69010513",
     "DECRIPTION": "Public Health Food Establish",
     "ENDORSEMENT_DESC": "Restaurant",
     "LAST_NAME": "BEDANE",
     "FIRST_NAME": "OMAR",
     "CORP_NAME": "",
     "TRADE_NAME": "SACRIFICIAL LAMB KABOB AND WRAPS",
     "BEGIN_RENEWAL": "Nov  1 2017 12:00AM",
     "END_RENEWAL": "Oct 31 2019 12:00AM",
     "STATUS": "Expired",
     "BEGIN_RENEWAL_NET": "2017/11/01",
     "END_RENEWAL_NET": "2019/10/31"
    },
    {
     "ADDRESS": "1704  R ST NW",
     "UNIT": "B",
     "SSL": "0155    0826",
     "CUST_NUM": "931320000023",
     "DECRIPTION": "Public Health Food Establish",
     "ENDORSEMENT_DESC": "Restaurant",
     "LAST_NAME": "",
     "FIRST_NAME": "",
     "CORP_NAME": "OMAR H. BEDANE, LLC",
     "TRADE_NAME": "SACRIFICIAL LAMB KABOB AND WRAPS",
     "BEGIN_RENEWAL": "Nov  1 2019 12:00AM",
     "END_RENEWAL": "Oct 31 2021 12:00AM",
     "STATUS": "Active",
     "BEGIN_RENEWAL_NET": "2019/11/01",
     "END_RENEWAL_NET": "2021/10/31"
    }
   ]
  },
  "permitDetails": {
   "updated": "2020-06-28T18:58:43.838Z",
   "permitData": [
    {
     "FULL_ADDRESS": "1704 R STREET NW, Washington, DC 20018",
     "B1_UNIT_START": "",
     "SSL": "0155    0826",
     "B1_ALT_ID": "B0900168",
     "TYPE": "Construction/Alteration and Repair",
     "G6_STAT_DD": "Oct 23 2008 12:00AM",
     "B1_APPL_STATUS": "Permit Issued",
     "B1_APPL_STATUS_DATE": "10/23/2008",
     "DESC_OF_WORK": "Conversion From Ice Cream shop to A Pizza/Ice Cream shop",
     "SORT_DATE": null,
     "G6_STAT_DD_NET": "2008/10/23",
     "B1_APPL_STATUS_DATE_NET": "2008/10/23",
     "JOB_CLASS_CODE": "N/A",
     "JOB_SIZE": "N/A",
     "JOB_CLASSIFICATION": "N/A",
     "JOB_REVIEW_TIME": "N/A",
     "OWNER_NAME": "Omar Bedane",
     "OWNER_FULL_NAME": "Omar Bedane",
     "APPLICANT_NAME": "OMAR  BEDANE",
     "TRADE_NAME": "",
     "PERMIT_STATUS": [
      {
       "REVIEW_STATUS": "Application Accepted",
       "DISCIPLINE": "Plan Review Coordinator",
       "REVIEW_STATUS_DATE": "10/08/2008"
      },
      {
       "REVIEW_STATUS": "Comments Submitted to the Applicant for Correction",
       "DISCIPLINE": "Mechanical and Plumbing Review Pending",
       "REVIEW_STATUS_DATE": "10/14/2008"
      },
      {
       "REVIEW_STATUS": "Comments Submitted to the Applicant for Correction",
       "DISCIPLINE": "Mechanical and Plumbing Review Pending",
       "REVIEW_STATUS_DATE": "10/20/2008"
      },
      {
       "REVIEW_STATUS": "Electrical Review Approved",
       "DISCIPLINE": "Electrical Review",
       "REVIEW_STATUS_DATE": "10/08/2008"
      },
      {
       "REVIEW_STATUS": "Fire Review Approved",
       "DISCIPLINE": "Fire Review",
       "REVIEW_STATUS_DATE": "10/20/2008"
      },
      {
       "REVIEW_STATUS": "HPRB Review Approved",
       "DISCIPLINE": "HPRB Review",
       "REVIEW_STATUS_DATE": "10/08/2008"
      },
      {
       "REVIEW_STATUS": "Mechanical Review Approved",
       "DISCIPLINE": "Mechanical and Plumbing Review",
       "REVIEW_STATUS_DATE": "10/22/2008"
      },
      {
       "REVIEW_STATUS": "Permit Issued",
       "DISCIPLINE": "Issue Permit",
       "REVIEW_STATUS_DATE": "10/23/2008"
      },
      {
       "REVIEW_STATUS": "Structural Review Approved",
       "DISCIPLINE": "Structural Review",
       "REVIEW_STATUS_DATE": "10/23/2008"
      },
      {
       "REVIEW_STATUS": "Zoning Review Approved",
       "DISCIPLINE": "Zoning Review",
       "REVIEW_STATUS_DATE": "10/23/2008"
      }
     ]
    },
    {
     "FULL_ADDRESS": "1704 R ST NW, WASHINGTON, DC 20009",
     "B1_UNIT_START": "",
     "SSL": "0155    0826",
     "B1_ALT_ID": "B2003658",
     "TYPE": "Construction/Alteration and Repair",
     "G6_STAT_DD": "Jan  1 1900 12:00AM",
     "B1_APPL_STATUS": "Walk Through Accepted",
     "B1_APPL_STATUS_DATE": "01/09/2020",
     "DESC_OF_WORK": "Shoring up under steps. (5) steps 10x3.5 wide",
     "SORT_DATE": null,
     "G6_STAT_DD_NET": "",
     "B1_APPL_STATUS_DATE_NET": "2020/01/09",
     "JOB_CLASS_CODE": "WT",
     "JOB_SIZE": "N/A",
     "JOB_CLASSIFICATION": "N/A",
     "JOB_REVIEW_TIME": "N/A",
     "OWNER_NAME": "DUPONT-MORGAN III LLC",
     "OWNER_FULL_NAME": "DUPONT-MORGAN III LLC",
     "APPLICANT_NAME": "BRIDGETTE  SWANSON",
     "TRADE_NAME": "",
     "PERMIT_STATUS": [
      {
       "REVIEW_STATUS": "Walk Through Accepted",
       "DISCIPLINE": "Plan Review Coordinator",
       "REVIEW_STATUS_DATE": "01/09/2020"
      }
     ]
    },
    {
     "FULL_ADDRESS": "1704 R ST NW",
     "B1_UNIT_START": "",
     "SSL": "",
     "B1_ALT_ID": "FS0900436",
     "TYPE": "Shop Drawing/Fire Suppression",
     "G6_STAT_DD": "Jan  1 1900 12:00AM",
     "B1_APPL_STATUS": "Application Canceled",
     "B1_APPL_STATUS_DATE": "08/10/2015",
     "DESC_OF_WORK": "CONVERSION  FROM ICE CREAM SHOP TO A PIZZA/ICE CREAM SHOP (09-09-70)",
     "SORT_DATE": null,
     "G6_STAT_DD_NET": "",
     "B1_APPL_STATUS_DATE_NET": "2015/08/10",
     "JOB_CLASS_CODE": "N/A",
     "JOB_SIZE": "N/A",
     "JOB_CLASSIFICATION": "N/A",
     "JOB_REVIEW_TIME": "N/A",
     "OWNER_NAME": "",
     "OWNER_FULL_NAME": "",
     "APPLICANT_NAME": "OMAR  BEDANE",
     "TRADE_NAME": "",
     "PERMIT_STATUS": [
      {
       "REVIEW_STATUS": "Application - Returned with Comments for Correctio",
       "DISCIPLINE": "Fire Protection Review Pending",
       "REVIEW_STATUS_DATE": "09/24/2009"
      },
      {
       "REVIEW_STATUS": "Application Canceled",
       "DISCIPLINE": "Fire Protection Review",
       "REVIEW_STATUS_DATE": "08/10/2015"
      },
      {
       "REVIEW_STATUS": "In-Process",
       "DISCIPLINE": "File Room",
       "REVIEW_STATUS_DATE": ""
      }
     ]
    },
    {
     "FULL_ADDRESS": "1704 R ST NW, Washington, DC",
     "B1_UNIT_START": "",
     "SSL": "0155    0826",
     "B1_ALT_ID": "P0901549",
     "TYPE": "Supplemental/Plumbing and Gas",
     "G6_STAT_DD": "Dec 30 2008 12:00AM",
     "B1_APPL_STATUS": "Permit Issued",
     "B1_APPL_STATUS_DATE": "12/30/2008",
     "DESC_OF_WORK": "",
     "SORT_DATE": null,
     "G6_STAT_DD_NET": "2008/12/30",
     "B1_APPL_STATUS_DATE_NET": "2008/12/30",
     "JOB_CLASS_CODE": "N/A",
     "JOB_SIZE": "N/A",
     "JOB_CLASSIFICATION": "N/A",
     "JOB_REVIEW_TIME": "N/A",
     "OWNER_NAME": "DUPONT-MORGAN III LLC",
     "OWNER_FULL_NAME": "DUPONT-MORGAN III LLC",
     "APPLICANT_NAME": "DAVID  JARVIS; DAVID S. JARVIS",
     "TRADE_NAME": "",
     "PERMIT_STATUS": [
      {
       "REVIEW_STATUS": "",
       "DISCIPLINE": "",
       "REVIEW_STATUS_DATE": ""
      }
     ]
    },
    {
     "FULL_ADDRESS": "1704 R ST NW, WASHINGTON, DC 20009",
     "B1_UNIT_START": "",
     "SSL": "0155    0826",
     "B1_ALT_ID": "SH2000029",
     "TYPE": "Construction/Sheeting and Shoring",
     "G6_STAT_DD": "Jan  1 1900 12:00AM",
     "B1_APPL_STATUS": "Projectdox Accepted",
     "B1_APPL_STATUS_DATE": "01/14/2020",
     "DESC_OF_WORK": "shoring up under steps. (5) steps 10x3.5\" wide",
     "SORT_DATE": null,
     "G6_STAT_DD_NET": "",
     "B1_APPL_STATUS_DATE_NET": "2020/01/14",
     "JOB_CLASS_CODE": "E-C",
     "JOB_SIZE": "1,000 sqft or less",
     "JOB_CLASSIFICATION": "Commercial",
     "JOB_REVIEW_TIME": "30 Business Days",
     "OWNER_NAME": "DUPONT-MORGAN III LLC",
     "OWNER_FULL_NAME": "DUPONT-MORGAN III LLC",
     "APPLICANT_NAME": "BRIDGETTE  SWANSON",
     "TRADE_NAME": "",
     "PERMIT_STATUS": [
      {
       "REVIEW_STATUS": "Projectdox Accepted",
       "DISCIPLINE": "Plan Review Coordinator",
       "REVIEW_STATUS_DATE": "2020-01-14"
      }
     ]
    },
    {
     "FULL_ADDRESS": "1704 R ST NW, WASHINGTON, DC 20009",
     "B1_UNIT_START": "",
     "SSL": "",
     "B1_ALT_ID": "SR20SO02478",
     "TYPE": "Surveyors/Customer Request",
     "G6_STAT_DD": "Jan  1 1900 12:00AM",
     "B1_APPL_STATUS": "Request Complete",
     "B1_APPL_STATUS_DATE": "02/05/2020",
     "DESC_OF_WORK": "        ===> Count: 1,  Process: Regular,  Delivery: Email",
     "SORT_DATE": null,
     "G6_STAT_DD_NET": "",
     "B1_APPL_STATUS_DATE_NET": "2020/02/05",
     "JOB_CLASS_CODE": "N/A",
     "JOB_SIZE": "N/A",
     "JOB_CLASSIFICATION": "N/A",
     "JOB_REVIEW_TIME": "N/A",
     "OWNER_NAME": "",
     "OWNER_FULL_NAME": "",
     "APPLICANT_NAME": "ROBERT  BELL",
     "TRADE_NAME": "",
     "PERMIT_STATUS": [
      {
       "REVIEW_STATUS": "",
       "DISCIPLINE": "",
       "REVIEW_STATUS_DATE": ""
      }
     ]
    }
   ]
  },
  "inspectionDetails": {
   "updated": "2020-06-28T18:58:44.049Z",
   "inspectionData": [
    {
     "ADDRESS": "1704 R ST NW, Washington, DC",
     "UNIT": "",
     "SSL": "0155    0826",
     "ID": "P0901549",
     "G6_ACT_DES": "Gas Line/Gas Test",
     "G6_STATUS": "Approved",
     "G6_STATUS_DD": "7/27/2009 12:00:00 AM",
     "DESC_OF_WORK": "",
     "G6_STATUS_DD_NET": "2009/07/27",
     "OWNER_FULL_NAME": "DUPONT-MORGAN III LLC",
     "APPLICANT": "DAVID  JARVIS; DAVID S. JARVIS"
    },
    {
     "ADDRESS": "1704 R ST NW, Washington, DC",
     "UNIT": "",
     "SSL": "0155    0826",
     "ID": "P0901549",
     "G6_ACT_DES": "Gas Line/Gas Test",
     "G6_STATUS": "Disapproved",
     "G6_STATUS_DD": "7/13/2009 12:00:00 AM",
     "DESC_OF_WORK": "",
     "G6_STATUS_DD_NET": "2009/07/13",
     "OWNER_FULL_NAME": "DUPONT-MORGAN III LLC",
     "APPLICANT": "DAVID  JARVIS; DAVID S. JARVIS"
    },
    {
     "ADDRESS": "1704 R ST NW, WASHINGTON, DC -",
     "UNIT": "",
     "SSL": "0155    0826",
     "ID": "ECC59083",
     "G6_ACT_DES": "Water Service Administrator",
     "G6_STATUS": "Cause",
     "G6_STATUS_DD": "3/27/2004 12:00:00 AM",
     "DESC_OF_WORK": "",
     "G6_STATUS_DD_NET": "2004/03/27",
     "OWNER_FULL_NAME": "",
     "APPLICANT": "TOM  NA; TOM  NA"
    }
   ]
  },
  "occupancyDetails": {
   "updated": "2020-06-28T18:58:44.233Z",
   "occupancyData": [
    {
     "FULL_ADDRESS": "1704 R ST NW, WASHINGTON, DC 20009-2410",
     "B1_UNIT_START": "",
     "SSL": "",
     "B1_ALT_ID": "CO155807",
     "TYPE": "Certificate of Occupancy",
     "G6_STAT_DD": "11/09/2007",
     "B1_APPL_STATUS": "Completed",
     "B1_APPL_STATUS_DATE": "          ",
     "DESC_OF_WORK": "DUPONT CIRCLE OVERLAY HISTORIC PRESERVATION HOLD",
     "G6_STAT_DD_NET": "2007/11/09",
     "B1_APPL_STATUS_DATE_NET": "",
     "OWNER_FULL_NAME": "1704 R ST LTD PTNERSHIP",
     "APPLICANT": ""
    },
    {
     "FULL_ADDRESS": "1704 R ST NW, WASHINGTON, DC 20009",
     "B1_UNIT_START": "",
     "SSL": "0155    0826",
     "B1_ALT_ID": "CO2000225",
     "TYPE": "Certificate of Occupancy",
     "G6_STAT_DD": "10/23/2019",
     "B1_APPL_STATUS": "Completed",
     "B1_APPL_STATUS_DATE": "10/23/2019",
     "DESC_OF_WORK": "Ownership ChangeRESTAURANT WITH 14 SEATS",
     "G6_STAT_DD_NET": "2019/10/23",
     "B1_APPL_STATUS_DATE_NET": "2019/10/23",
     "OWNER_FULL_NAME": "DUPONT-MORGAN III, LLC",
     "APPLICANT": ""
    }
   ]
  },
  "charDetails": {
   "updated": "2020-06-28T19:53:53.582Z",
   "charData": [
    {
     "PREMISEADD": "1704 R ST NW",
     "SSL": "0155    0826",
     "BLDG_NUM": "1",
     "COMPLX_NUM": "",
     "UNITNUMBER": "",
     "NUM_UNITS": "",
     "AYB": "1885",
     "STRUCT_CL_": "Brick/Concr",
     "STYLE_D": "",
     "STRUCT_D": "",
     "GBA": "3367",
     "EXTWALL_D": "Brick",
     "WALL_HGT": "9.00",
     "ROOF_D": "",
     "BATHRM": "",
     "HF_BATHRM": "",
     "HEAT_D": "",
     "AC": "",
     "INTWALL_D": "",
     "ROOMS": "",
     "BEDRM": "",
     "KITCHENS": "",
     "FIREPLACES": "",
     "YR_RMDL": "1979",
     "EYB": "1990",
     "STORIES": "",
     "OWNERNAME": "DUPONT-MORGAN III LLC",
     "OWNNAME2": "",
     "CAREOFNAME": "H. A. GILL & SON"
    }
   ]
  },
  "taxData": {
   "ssl": "0155    0826",
   "address": "1704 R ST NW",
   "owner": "DUPONT-MORGAN III LLC H. A. GILL & SON",
   "neighborhood": "OLD CITY II",
   "sub_neighborhood": "D",
   "use_code": "51",
   "sale_price": "$1,107,808.00",
   "recordation_date": "10/29/2004",
   "2016_Assessment": "$1,013,620.00"
  }
 },
 "1722 CORCORAN STREET NW": {
  "ownerInfo": {
   "updated": "2020-06-28T17:30:44.005Z",
   "ownerData": [
    {
     "OWNERNAME": "JOHN C WICKHAM",
     "PREMISEADD": "1722 CORCORAN ST NW",
     "UNITNUMBER": "",
     "SSL": "0155    0080",
     "USECODE": "024",
     "HSTDCODE": "1",
     "CLASSTYPE": "001",
     "TAXRATE": "0.0085",
     "SALEPRICE": "",
     "SALEDATE": "08/21/1997",
     "INSTNO": "",
     "ACCEPTCODE": "",
     "DEEDDATE": "08/21/1997",
     "OWNNAME2": "",
     "CPMS_ADDRESS": "1722 CORCORAN ST NW",
     "CAREOFNAME": "",
     "ADDRESS1": "1722 CORCORAN ST NW",
     "ADDRESS2": "",
     "CITYSTZIP": "WASHINGTON                 DC 20009-2406",
     "SALEDATE_NET": "1997/08/21",
     "DEEDDATE_NET": "1997/08/21"
    }
   ]
  },
  "addressDetails": {
   "updated": "2020-06-28T18:12:18.510Z",
   "addressData": [
    {
     "ADDRESS_ID": "279346",
     "MARID": "279346",
     "STATUS": "ACTIVE",
     "FULLADDRESS": "1722 CORCORAN STREET NW",
     "ADDRNUM": "1722",
     "ADDRNUMSUFFIX": "",
     "STNAME": "CORCORAN",
     "STREET_TYPE": "STREET",
     "QUADRANT": "NW",
     "CITY": "WASHINGTON",
     "STATE": "DC",
     "XCOORD": "396580.11",
     "YCOORD": "138207.03",
     "SSL": "0155    0080",
     "ANC": "ANC 2B",
     "PSA": "Police Service Area 301",
     "WARD": "Ward 2",
     "NBHD_ACTION": " ",
     "CLUSTER_": "Cluster 6",
     "POLDIST": "Police District - Third District",
     "ROC": "Police Sector 3D3",
     "CENSUS_TRACT": "005301",
     "VOTE_PRCNCT": "Precinct 15",
     "SMD": "SMD 2B03",
     "ZIPCODE": "20009",
     "NATIONALGRID": "18S UJ 23175 08957",
     "ROADWAYSEGID": "2266",
     "FOCUS_IMPROVEMENT_AREA": "NA",
     "HAS_ALIAS": "N",
     "HAS_CONDO_UNIT": "N",
     "HAS_RES_UNIT": "Y",
     "HAS_SSL": "Y",
     "LATITUDE": "38.91172011",
     "LONGITUDE": "-77.03943163",
     "STREETVIEWURL": "http://maps.google.com/maps?z=16&layer=c&cbll=38.91172011,-77.03943163&cbp=11,199.292367854966,,0,2.09",
     "RES_TYPE": "RESIDENTIAL",
     "WARD_2002": "Ward 2",
     "WARD_2012": "Ward 2",
     "ANC_2002": "ANC 2B",
     "ANC_2012": "ANC 2B",
     "SMD_2002": "SMD 2B03",
     "SMD_2012": "SMD 2B03",
     "IMAGEURL": "http://citizenatlas.dc.gov/mobilevideo",
     "IMAGEDIR": "20040805",
     "IMAGENAME": "Q5085830.jpg",
     "ConfidenceLevel": "100",
     "Zoning": "RA-8"
    }
   ]
  },
  "licenseDetails": {
   "updated": "2020-06-28T18:37:19.821Z",
   "licenseData": [
    {
     "ADDRESS": "1722  CORCORAN ST NW",
     "UNIT": "",
     "SSL": "0155    0080",
     "CUST_NUM": "53001878",
     "DECRIPTION": "Housing: Residential",
     "ENDORSEMENT_DESC": "Apartment",
     "LAST_NAME": "WICKHAM",
     "FIRST_NAME": "JOHN",
     "CORP_NAME": "",
     "TRADE_NAME": "",
     "BEGIN_RENEWAL": "Nov  1 2019 12:00AM",
     "END_RENEWAL": "Oct 31 2021 12:00AM",
     "STATUS": "Active",
     "BEGIN_RENEWAL_NET": "2019/11/01",
     "END_RENEWAL_NET": "2021/10/31"
    }
   ]
  },
  "permitDetails": {
   "updated": "2020-06-28T18:59:06.865Z",
   "permitData": []
  },
  "inspectionDetails": {
   "updated": "2020-06-28T18:59:07.036Z",
   "inspectionData": []
  },
  "occupancyDetails": {
   "updated": "2020-06-28T18:59:07.207Z",
   "occupancyData": [
    {
     "FULL_ADDRESS": "1722 CORCORAN ST NW, WASHINGTON, DC 20009-2406",
     "B1_UNIT_START": "",
     "SSL": "",
     "B1_ALT_ID": "CO51234",
     "TYPE": "Certificate of Occupancy",
     "G6_STAT_DD": "03/26/2003",
     "B1_APPL_STATUS": "Completed",
     "B1_APPL_STATUS_DATE": "          ",
     "DESC_OF_WORK": "HISTORIC PRESERVATION HOLD",
     "G6_STAT_DD_NET": "2003/03/26",
     "B1_APPL_STATUS_DATE_NET": "",
     "OWNER_FULL_NAME": "WICKHAM",
     "APPLICANT": ""
    }
   ]
  },
  "charDetails": {
   "updated": "2020-06-28T19:53:56.790Z",
   "charData": [
    {
     "PREMISEADD": "1722 CORCORAN ST NW",
     "SSL": "0155    0080",
     "BLDG_NUM": "1",
     "COMPLX_NUM": "",
     "UNITNUMBER": "",
     "NUM_UNITS": "0",
     "AYB": "1885",
     "STRUCT_CL_": "",
     "STYLE_D": "3 Story",
     "STRUCT_D": "Row ",
     "GBA": "4074",
     "EXTWALL_D": "Common Brick",
     "WALL_HGT": "",
     "ROOF_D": "Meta",
     "BATHRM": "4",
     "HF_BATHRM": "1",
     "HEAT_D": "Warm",
     "AC": "Y",
     "INTWALL_D": "Hardwood",
     "ROOMS": "12",
     "BEDRM": "4",
     "KITCHENS": "2",
     "FIREPLACES": "3",
     "YR_RMDL": "",
     "EYB": "1966",
     "STORIES": "3",
     "OWNERNAME": "JOHN C WICKHAM",
     "OWNNAME2": "",
     "CAREOFNAME": ""
    }
   ]
  },
  "taxData": {
   "ssl": "0155    0080",
   "address": "1722 CORCORAN ST NW",
   "owner": "JOHN C WICKHAM",
   "neighborhood": "OLD CITY II",
   "sub_neighborhood": "D",
   "use_code": "24",
   "sale_price": "$.00",
   "recordation_date": "08/21/1997",
   "2016_Assessment": "$1,604,970.00"
  }
 },
 "1728 CORCORAN STREET NW": {
  "ownerInfo": {
   "updated": "2020-06-28T17:30:45.451Z",
   "ownerData": [
    {
     "OWNERNAME": "JEFFREY M BRIER",
     "PREMISEADD": "1728 CORCORAN ST NW",
     "UNITNUMBER": "",
     "SSL": "0155    0077",
     "USECODE": "024",
     "HSTDCODE": "1",
     "CLASSTYPE": "001",
     "TAXRATE": "0.0085",
     "SALEPRICE": "",
     "SALEDATE": "04/30/1998",
     "INSTNO": "",
     "ACCEPTCODE": "",
     "DEEDDATE": "04/30/1998",
     "OWNNAME2": "",
     "CPMS_ADDRESS": "1728 CORCORAN ST NW",
     "CAREOFNAME": "",
     "ADDRESS1": "1728 CORCORAN ST NW",
     "ADDRESS2": "",
     "CITYSTZIP": "WASHINGTON                 DC 20009-2406",
     "SALEDATE_NET": "1998/04/30",
     "DEEDDATE_NET": "1998/04/30"
    }
   ]
  },
  "addressDetails": {
   "updated": "2020-06-28T18:12:20.410Z",
   "addressData": [
    {
     "ADDRESS_ID": "241655",
     "MARID": "241655",
     "STATUS": "ACTIVE",
     "FULLADDRESS": "1728 CORCORAN STREET NW",
     "ADDRNUM": "1728",
     "ADDRNUMSUFFIX": "",
     "STNAME": "CORCORAN",
     "STREET_TYPE": "STREET",
     "QUADRANT": "NW",
     "CITY": "WASHINGTON",
     "STATE": "DC",
     "XCOORD": "396561.05",
     "YCOORD": "138207.52",
     "SSL": "0155    0077",
     "ANC": "ANC 2B",
     "PSA": "Police Service Area 301",
     "WARD": "Ward 2",
     "NBHD_ACTION": " ",
     "CLUSTER_": "Cluster 6",
     "POLDIST": "Police District - Third District",
     "ROC": "Police Sector 3D3",
     "CENSUS_TRACT": "005301",
     "VOTE_PRCNCT": "Precinct 15",
     "SMD": "SMD 2B03",
     "ZIPCODE": "20009",
     "NATIONALGRID": "18S UJ 23156 08958",
     "ROADWAYSEGID": "2266",
     "FOCUS_IMPROVEMENT_AREA": "NA",
     "HAS_ALIAS": "N",
     "HAS_CONDO_UNIT": "N",
     "HAS_RES_UNIT": "Y",
     "HAS_SSL": "Y",
     "LATITUDE": "38.91172445",
     "LONGITUDE": "-77.03965140",
     "STREETVIEWURL": "http://maps.google.com/maps?z=16&layer=c&cbll=38.91172445,-77.0396514&cbp=11,183.318849813264,,0,2.09",
     "RES_TYPE": "RESIDENTIAL",
     "WARD_2002": "Ward 2",
     "WARD_2012": "Ward 2",
     "ANC_2002": "ANC 2B",
     "ANC_2012": "ANC 2B",
     "SMD_2002": "SMD 2B03",
     "SMD_2012": "SMD 2B03",
     "IMAGEURL": "http://citizenatlas.dc.gov/mobilevideo",
     "IMAGEDIR": "20040805",
     "IMAGENAME": "Q5090001.jpg",
     "ConfidenceLevel": "100",
     "Zoning": "RA-8"
    }
   ]
  },
  "licenseDetails": {
   "updated": "2020-06-28T18:37:23.406Z",
   "licenseData": [
    {
     "ADDRESS": "1728  CORCORAN ST NW",
     "UNIT": "",
     "SSL": "0155    0077",
     "CUST_NUM": "39409224",
     "DECRIPTION": "Housing: Residential",
     "ENDORSEMENT_DESC": "Apartment",
     "LAST_NAME": "ZIESSMAN",
     "FIRST_NAME": "HARVEY",
     "CORP_NAME": "",
     "TRADE_NAME": "",
     "BEGIN_RENEWAL": "Nov  1 2000 12:00AM",
     "END_RENEWAL": "Oct 31 2002 12:00AM",
     "STATUS": "Expired",
     "BEGIN_RENEWAL_NET": "2000/11/01",
     "END_RENEWAL_NET": "2002/10/31"
    },
    {
     "ADDRESS": "1728  CORCORAN ST NW",
     "UNIT": "",
     "SSL": "0155    0077",
     "CUST_NUM": "40000004",
     "DECRIPTION": "Housing: Residential",
     "ENDORSEMENT_DESC": "Apartment",
     "LAST_NAME": "BRIER",
     "FIRST_NAME": "JEFFREY",
     "CORP_NAME": "",
     "TRADE_NAME": "",
     "BEGIN_RENEWAL": "Nov  1 2019 12:00AM",
     "END_RENEWAL": "Oct 31 2021 12:00AM",
     "STATUS": "Active",
     "BEGIN_RENEWAL_NET": "2019/11/01",
     "END_RENEWAL_NET": "2021/10/31"
    }
   ]
  },
  "permitDetails": {
   "updated": "2020-06-28T18:59:14.043Z",
   "permitData": []
  },
  "inspectionDetails": {
   "updated": "2020-06-28T18:59:14.204Z",
   "inspectionData": []
  },
  "occupancyDetails": {
   "updated": "2020-06-28T18:59:14.381Z",
   "occupancyData": []
  },
  "charDetails": {
   "updated": "2020-06-28T19:53:58.230Z",
   "charData": [
    {
     "PREMISEADD": "1728 CORCORAN ST NW",
     "SSL": "0155    0077",
     "BLDG_NUM": "1",
     "COMPLX_NUM": "",
     "UNITNUMBER": "",
     "NUM_UNITS": "0",
     "AYB": "1885",
     "STRUCT_CL_": "",
     "STYLE_D": "3 Story",
     "STRUCT_D": "Row ",
     "GBA": "3838",
     "EXTWALL_D": "Common Brick",
     "WALL_HGT": "",
     "ROOF_D": "Buil",
     "BATHRM": "3",
     "HF_BATHRM": "1",
     "HEAT_D": "Warm",
     "AC": "Y",
     "INTWALL_D": "Hardwood",
     "ROOMS": "13",
     "BEDRM": "4",
     "KITCHENS": "3",
     "FIREPLACES": "2",
     "YR_RMDL": "",
     "EYB": "1966",
     "STORIES": "3",
     "OWNERNAME": "JEFFREY M BRIER",
     "OWNNAME2": "",
     "CAREOFNAME": ""
    }
   ]
  },
  "taxData": {
   "ssl": "0155    0077",
   "address": "1728 CORCORAN ST NW",
   "owner": "JEFFREY M BRIER",
   "neighborhood": "OLD CITY II",
   "sub_neighborhood": "D",
   "use_code": "24",
   "sale_price": "$.00",
   "recordation_date": "04/30/1998",
   "2016_Assessment": "$1,375,010.00"
  }
 },
 "1731 Q STREET NW": {
  "ownerInfo": {
   "updated": "2020-06-28T17:30:46.400Z",
   "ownerData": [
    {
     "OWNERNAME": "WAFA F ABDELATI",
     "PREMISEADD": "1731 Q ST NW",
     "UNITNUMBER": "",
     "SSL": "0155    0192",
     "USECODE": "024",
     "HSTDCODE": "1",
     "CLASSTYPE": "001",
     "TAXRATE": "0.0085",
     "SALEPRICE": "",
     "SALEDATE": "",
     "INSTNO": "",
     "ACCEPTCODE": "",
     "DEEDDATE": "",
     "OWNNAME2": "",
     "CPMS_ADDRESS": "1731 Q ST NW",
     "CAREOFNAME": "",
     "ADDRESS1": "1731 QUE ST NW",
     "ADDRESS2": "",
     "CITYSTZIP": "WASHINGTON                 DC 20009-2407",
     "SALEDATE_NET": "",
     "DEEDDATE_NET": ""
    }
   ]
  },
  "addressDetails": {
   "updated": "2020-06-28T18:12:22.931Z",
   "addressData": [
    {
     "ADDRESS_ID": "241686",
     "MARID": "241686",
     "STATUS": "ACTIVE",
     "FULLADDRESS": "1731 Q STREET NW",
     "ADDRNUM": "1731",
     "ADDRNUMSUFFIX": "",
     "STNAME": "Q",
     "STREET_TYPE": "STREET",
     "QUADRANT": "NW",
     "CITY": "WASHINGTON",
     "STATE": "DC",
     "XCOORD": "396539.69",
     "YCOORD": "138162.91",
     "SSL": "0155    0192",
     "ANC": "ANC 2B",
     "PSA": "Police Service Area 301",
     "WARD": "Ward 2",
     "NBHD_ACTION": " ",
     "CLUSTER_": "Cluster 6",
     "POLDIST": "Police District - Third District",
     "ROC": "Police Sector 3D3",
     "CENSUS_TRACT": "005301",
     "VOTE_PRCNCT": "Precinct 15",
     "SMD": "SMD 2B03",
     "ZIPCODE": "20009",
     "NATIONALGRID": "18S UJ 23133 08914",
     "ROADWAYSEGID": "19819",
     "FOCUS_IMPROVEMENT_AREA": "NA",
     "HAS_ALIAS": "N",
     "HAS_CONDO_UNIT": "N",
     "HAS_RES_UNIT": "Y",
     "HAS_SSL": "Y",
     "LATITUDE": "38.91132250",
     "LONGITUDE": "-77.03989745",
     "STREETVIEWURL": "http://maps.google.com/maps?z=16&layer=c&cbll=38.9113225,-77.03989745&cbp=11,17.8473398939472,,0,2.09",
     "RES_TYPE": "RESIDENTIAL",
     "WARD_2002": "Ward 2",
     "WARD_2012": "Ward 2",
     "ANC_2002": "ANC 2B",
     "ANC_2012": "ANC 2B",
     "SMD_2002": "SMD 2B03",
     "SMD_2012": "SMD 2B03",
     "IMAGEURL": "http://citizenatlas.dc.gov/mobilevideo",
     "IMAGEDIR": "20040805",
     "IMAGENAME": "Q5094115.jpg",
     "ConfidenceLevel": "100",
     "Zoning": "RA-8"
    }
   ]
  },
  "licenseDetails": {
   "updated": "2020-06-28T18:37:25.967Z",
   "licenseData": [
    {
     "ADDRESS": "1731  Q ST NW",
     "UNIT": "",
     "SSL": "0155    0192",
     "CUST_NUM": "500617000019",
     "DECRIPTION": "Housing: Residential",
     "ENDORSEMENT_DESC": "Two Family Rental",
     "LAST_NAME": "ABDELATI",
     "FIRST_NAME": "WAFA",
     "CORP_NAME": "",
     "TRADE_NAME": "",
     "BEGIN_RENEWAL": "Oct  1 2016 12:00AM",
     "END_RENEWAL": "Sep 30 2020 12:00AM",
     "STATUS": "Active",
     "BEGIN_RENEWAL_NET": "2016/10/01",
     "END_RENEWAL_NET": "2020/09/30"
    },
    {
     "ADDRESS": "1731  Q ST NW",
     "UNIT": "",
     "SSL": "0155    0192",
     "CUST_NUM": "67005573",
     "DECRIPTION": "Housing: Residential",
     "ENDORSEMENT_DESC": "Two Family Rental",
     "LAST_NAME": "ABDELATI",
     "FIRST_NAME": "WAFA",
     "CORP_NAME": "",
     "TRADE_NAME": "",
     "BEGIN_RENEWAL": "Oct  1 2011 12:00AM",
     "END_RENEWAL": "Sep 30 2013 12:00AM",
     "STATUS": "Expired",
     "BEGIN_RENEWAL_NET": "2011/10/01",
     "END_RENEWAL_NET": "2013/09/30"
    }
   ]
  },
  "permitDetails": {
   "updated": "2020-06-28T18:59:18.547Z",
   "permitData": []
  },
  "inspectionDetails": {
   "updated": "2020-06-28T18:59:18.709Z",
   "inspectionData": [
    {
     "ADDRESS": "1731 Q ST NW, WASHINGTON, DC -",
     "UNIT": "",
     "SSL": "0155    0192",
     "ID": "ECC191681",
     "G6_ACT_DES": "POD Plumbing",
     "G6_STATUS": "No Cause",
     "G6_STATUS_DD": "8/16/2007 12:00:00 AM",
     "DESC_OF_WORK": "",
     "G6_STATUS_DD_NET": "2007/08/16",
     "OWNER_FULL_NAME": "",
     "APPLICANT": "WAFA  ABDELATI; WAFA  ABDELATI"
    },
    {
     "ADDRESS": "1731 Q ST NW, WASHINGTON, DC -",
     "UNIT": "",
     "SSL": "0155    0192",
     "ID": "ECC191679",
     "G6_ACT_DES": "POD Electrical",
     "G6_STATUS": "No Cause",
     "G6_STATUS_DD": "8/6/2007 12:00:00 AM",
     "DESC_OF_WORK": "",
     "G6_STATUS_DD_NET": "2007/08/06",
     "OWNER_FULL_NAME": "",
     "APPLICANT": "WAFA  ABDELATI; WAFA  ABDELATI"
    },
    {
     "ADDRESS": "1731 Q ST NW, WASHINGTON, DC -",
     "UNIT": "",
     "SSL": "0155    0192",
     "ID": "ECC191680",
     "G6_ACT_DES": "POD Construction",
     "G6_STATUS": "No Cause",
     "G6_STATUS_DD": "8/2/2007 12:00:00 AM",
     "DESC_OF_WORK": "",
     "G6_STATUS_DD_NET": "2007/08/02",
     "OWNER_FULL_NAME": "",
     "APPLICANT": "WAFA  ABDELATI; WAFA  ABDELATI"
    },
    {
     "ADDRESS": "1731 Q ST NW, WASHINGTON, DC -",
     "UNIT": "",
     "SSL": "0155    0192",
     "ID": "ECC191682",
     "G6_ACT_DES": "POD Fire Protection",
     "G6_STATUS": "Cause",
     "G6_STATUS_DD": "8/2/2007 12:00:00 AM",
     "DESC_OF_WORK": "",
     "G6_STATUS_DD_NET": "2007/08/02",
     "OWNER_FULL_NAME": "",
     "APPLICANT": "WAFA  ABDELATI; WAFA  ABDELATI"
    },
    {
     "ADDRESS": "1731 Q ST NW, WASHINGTON, DC -",
     "UNIT": "",
     "SSL": "0155    0192",
     "ID": "ECC102482",
     "G6_ACT_DES": "Gas/Boiler Replacement Plumbing",
     "G6_STATUS": "No Cause",
     "G6_STATUS_DD": "5/16/2005 12:00:00 AM",
     "DESC_OF_WORK": "",
     "G6_STATUS_DD_NET": "2005/05/16",
     "OWNER_FULL_NAME": "",
     "APPLICANT": "BILL  REDFERN; BILL  REDFERN"
    },
    {
     "ADDRESS": "1731 Q ST NW, WASHINGTON, DC -",
     "UNIT": "",
     "SSL": "0155    0192",
     "ID": "ECC279",
     "G6_ACT_DES": "Complaint Construction",
     "G6_STATUS": "No Cause",
     "G6_STATUS_DD": "7/31/2002 12:00:00 AM",
     "DESC_OF_WORK": "",
     "G6_STATUS_DD_NET": "2002/07/31",
     "OWNER_FULL_NAME": "",
     "APPLICANT": "ANNON  ANNON; ANNON  ANNON"
    }
   ]
  },
  "occupancyDetails": {
   "updated": "2020-06-28T18:59:18.880Z",
   "occupancyData": [
    {
     "FULL_ADDRESS": "1731 Q ST NW, WASHINGTON, DC 20009-2407",
     "B1_UNIT_START": "",
     "SSL": "",
     "B1_ALT_ID": "CO148702",
     "TYPE": "Certificate of Occupancy",
     "G6_STAT_DD": "08/14/2007",
     "B1_APPL_STATUS": "Completed",
     "B1_APPL_STATUS_DATE": "          ",
     "DESC_OF_WORK": "",
     "G6_STAT_DD_NET": "2007/08/14",
     "B1_APPL_STATUS_DATE_NET": "",
     "OWNER_FULL_NAME": "ABDELATI",
     "APPLICANT": ""
    }
   ]
  },
  "charDetails": {
   "updated": "2020-06-28T19:53:59.231Z",
   "charData": [
    {
     "PREMISEADD": "1731 Q ST NW",
     "SSL": "0155    0192",
     "BLDG_NUM": "1",
     "COMPLX_NUM": "",
     "UNITNUMBER": "",
     "NUM_UNITS": "0",
     "AYB": "1880",
     "STRUCT_CL_": "",
     "STYLE_D": "3 Story",
     "STRUCT_D": "Row ",
     "GBA": "5020",
     "EXTWALL_D": "Stone",
     "WALL_HGT": "",
     "ROOF_D": "Meta",
     "BATHRM": "2",
     "HF_BATHRM": "1",
     "HEAT_D": "Warm",
     "AC": "Y",
     "INTWALL_D": "Hardwood",
     "ROOMS": "11",
     "BEDRM": "6",
     "KITCHENS": "2",
     "FIREPLACES": "5",
     "YR_RMDL": "",
     "EYB": "1969",
     "STORIES": "3",
     "OWNERNAME": "WAFA F ABDELATI",
     "OWNNAME2": "",
     "CAREOFNAME": ""
    }
   ]
  },
  "taxData": {
   "ssl": "0155    0192",
   "address": "1731 Q ST NW",
   "owner": "WAFA F ABDELATI",
   "neighborhood": "OLD CITY II",
   "sub_neighborhood": "D",
   "use_code": "24",
   "sale_price": "$.00",
   "recordation_date": "N/A",
   "2016_Assessment": "$1,618,200.00"
  }
 },
 "1732 CORCORAN STREET NW": {
  "ownerInfo": {
   "updated": "2020-06-28T17:30:46.559Z",
   "ownerData": [
    {
     "OWNERNAME": "RICHARD A AYERS",
     "PREMISEADD": "1732 CORCORAN ST NW",
     "UNITNUMBER": "",
     "SSL": "0155    0210",
     "USECODE": "011",
     "HSTDCODE": "1",
     "CLASSTYPE": "001",
     "TAXRATE": "0.0085",
     "SALEPRICE": "",
     "SALEDATE": "",
     "INSTNO": "",
     "ACCEPTCODE": "",
     "DEEDDATE": "",
     "OWNNAME2": "EUGENIA M AYERS",
     "CPMS_ADDRESS": "1732 CORCORAN ST NW",
     "CAREOFNAME": "",
     "ADDRESS1": "1732 CORCORAN ST NW",
     "ADDRESS2": "",
     "CITYSTZIP": "WASHINGTON                 DC 20009-2406",
     "SALEDATE_NET": "",
     "DEEDDATE_NET": ""
    }
   ]
  },
  "addressDetails": {
   "updated": "2020-06-28T18:12:23.136Z",
   "addressData": [
    {
     "ADDRESS_ID": "241696",
     "MARID": "241696",
     "STATUS": "ACTIVE",
     "FULLADDRESS": "1732 CORCORAN STREET NW",
     "ADDRNUM": "1732",
     "ADDRNUMSUFFIX": "",
     "STNAME": "CORCORAN",
     "STREET_TYPE": "STREET",
     "QUADRANT": "NW",
     "CITY": "WASHINGTON",
     "STATE": "DC",
     "XCOORD": "396550.38",
     "YCOORD": "138207.12",
     "SSL": "0155    0210",
     "ANC": "ANC 2B",
     "PSA": "Police Service Area 301",
     "WARD": "Ward 2",
     "NBHD_ACTION": " ",
     "CLUSTER_": "Cluster 6",
     "POLDIST": "Police District - Third District",
     "ROC": "Police Sector 3D3",
     "CENSUS_TRACT": "005301",
     "VOTE_PRCNCT": "Precinct 15",
     "SMD": "SMD 2B03",
     "ZIPCODE": "20009",
     "NATIONALGRID": "18S UJ 23145 08958",
     "ROADWAYSEGID": "2266",
     "FOCUS_IMPROVEMENT_AREA": "NA",
     "HAS_ALIAS": "N",
     "HAS_CONDO_UNIT": "N",
     "HAS_RES_UNIT": "Y",
     "HAS_SSL": "Y",
     "LATITUDE": "38.91172080",
     "LONGITUDE": "-77.03977442",
     "STREETVIEWURL": "http://maps.google.com/maps?z=16&layer=c&cbll=38.9117208,-77.03977442&cbp=11,179.196809639135,,0,2.09",
     "RES_TYPE": "RESIDENTIAL",
     "WARD_2002": "Ward 2",
     "WARD_2012": "Ward 2",
     "ANC_2002": "ANC 2B",
     "ANC_2012": "ANC 2B",
     "SMD_2002": "SMD 2B03",
     "SMD_2012": "SMD 2B03",
     "IMAGEURL": "http://citizenatlas.dc.gov/mobilevideo",
     "IMAGEDIR": "20040805",
     "IMAGENAME": "Q5090102.jpg",
     "ConfidenceLevel": "100",
     "Zoning": "RA-8"
    }
   ]
  },
  "licenseDetails": {
   "updated": "2020-06-28T18:37:26.489Z",
   "licenseData": [
    {
     "ADDRESS": "1732  CORCORAN ST NW",
     "UNIT": "",
     "SSL": "0155    0210",
     "CUST_NUM": "500613000339",
     "DECRIPTION": "Housing: Residential",
     "ENDORSEMENT_DESC": "Two Family Rental",
     "LAST_NAME": "EUGENIA M AYERS",
     "FIRST_NAME": "RICHARD AYERS,",
     "CORP_NAME": "",
     "TRADE_NAME": "",
     "BEGIN_RENEWAL": "Aug  1 2019 12:00AM",
     "END_RENEWAL": "Jul 31 2021 12:00AM",
     "STATUS": "Active",
     "BEGIN_RENEWAL_NET": "2019/08/01",
     "END_RENEWAL_NET": "2021/07/31"
    }
   ]
  },
  "permitDetails": {
   "updated": "2020-06-28T18:59:19.206Z",
   "permitData": []
  },
  "inspectionDetails": {
   "updated": "2020-06-28T18:59:19.375Z",
   "inspectionData": [
    {
     "ADDRESS": "1732 CORCORAN ST NW, WASHINGTON, DC 20009",
     "UNIT": "",
     "SSL": "0155    0210",
     "ID": "CO1302849",
     "G6_ACT_DES": "Zoning Use",
     "G6_STATUS": "Approved",
     "G6_STATUS_DD": "9/23/2013 12:00:00 AM",
     "DESC_OF_WORK": "TWO-FAMILY FLAT",
     "G6_STATUS_DD_NET": "2013/09/23",
     "OWNER_FULL_NAME": "RICHARD A AYERS",
     "APPLICANT": "RICHARD AYERS "
    }
   ]
  },
  "occupancyDetails": {
   "updated": "2020-06-28T18:59:19.536Z",
   "occupancyData": [
    {
     "FULL_ADDRESS": "1732 CORCORAN ST NW, WASHINGTON, DC 20009",
     "B1_UNIT_START": "",
     "SSL": "0092    0048",
     "B1_ALT_ID": "CO1302846",
     "TYPE": "Certificate of Occupancy",
     "G6_STAT_DD": "",
     "B1_APPL_STATUS": "Application Accepted",
     "B1_APPL_STATUS_DATE": "08/02/2013",
     "DESC_OF_WORK": "Use ChangeTWO FAMILY FLAT",
     "G6_STAT_DD_NET": "",
     "B1_APPL_STATUS_DATE_NET": "2013/08/02",
     "OWNER_FULL_NAME": "RICHARD A AYERS",
     "APPLICANT": "RICHARD AYERS "
    },
    {
     "FULL_ADDRESS": "1732 CORCORAN ST NW, WASHINGTON, DC 20009",
     "B1_UNIT_START": "",
     "SSL": "0155    0210",
     "B1_ALT_ID": "CO1302849",
     "TYPE": "Certificate of Occupancy",
     "G6_STAT_DD": "09/26/2013",
     "B1_APPL_STATUS": "Completed",
     "B1_APPL_STATUS_DATE": "09/26/2013",
     "DESC_OF_WORK": "Use ChangeTWO-FAMILY FLAT",
     "G6_STAT_DD_NET": "2013/09/26",
     "B1_APPL_STATUS_DATE_NET": "2013/09/26",
     "OWNER_FULL_NAME": "RICHARD A AYERS",
     "APPLICANT": "RICHARD AYERS "
    }
   ]
  },
  "charDetails": {
   "updated": "2020-06-28T19:53:59.385Z",
   "charData": [
    {
     "PREMISEADD": "1732 CORCORAN ST NW",
     "SSL": "0155    0210",
     "BLDG_NUM": "1",
     "COMPLX_NUM": "",
     "UNITNUMBER": "",
     "NUM_UNITS": "0",
     "AYB": "1978",
     "STRUCT_CL_": "",
     "STYLE_D": "3 Story",
     "STRUCT_D": "Row ",
     "GBA": "3834",
     "EXTWALL_D": "Common Brick",
     "WALL_HGT": "",
     "ROOF_D": "Meta",
     "BATHRM": "3",
     "HF_BATHRM": "1",
     "HEAT_D": "Warm",
     "AC": "Y",
     "INTWALL_D": "Hardwood",
     "ROOMS": "8",
     "BEDRM": "3",
     "KITCHENS": "2",
     "FIREPLACES": "3",
     "YR_RMDL": "",
     "EYB": "1987",
     "STORIES": "3",
     "OWNERNAME": "RICHARD A AYERS",
     "OWNNAME2": "EUGENIA M AYERS",
     "CAREOFNAME": ""
    }
   ]
  },
  "taxData": {
   "ssl": "0155    0210",
   "address": "1732 CORCORAN ST NW",
   "owner": "RICHARD A AYERS",
   "neighborhood": "OLD CITY II",
   "sub_neighborhood": "D",
   "use_code": "11",
   "sale_price": "$.00",
   "recordation_date": "N/A",
   "2016_Assessment": "$1,241,160.00"
  }
 },
 "1734 R STREET NW": {
  "ownerInfo": {
   "updated": "2020-06-28T17:30:47.226Z",
   "ownerData": [
    {
     "OWNERNAME": "",
     "PREMISEADD": "1734 R ST NW",
     "UNITNUMBER": "",
     "SSL": "0155    0125",
     "USECODE": "000",
     "HSTDCODE": "",
     "CLASSTYPE": "",
     "TAXRATE": "0",
     "SALEPRICE": "",
     "SALEDATE": "",
     "INSTNO": "",
     "ACCEPTCODE": "",
     "DEEDDATE": "",
     "OWNNAME2": "",
     "CPMS_ADDRESS": "1734 R ST NW",
     "CAREOFNAME": "",
     "ADDRESS1": "",
     "ADDRESS2": "",
     "CITYSTZIP": "",
     "SALEDATE_NET": "",
     "DEEDDATE_NET": ""
    },
    {
     "OWNERNAME": "LISA A ROBIN",
     "PREMISEADD": "1734 R ST NW 2",
     "UNITNUMBER": "2",
     "SSL": "0155    2388",
     "USECODE": "016",
     "HSTDCODE": "",
     "CLASSTYPE": "001",
     "TAXRATE": "0.0085",
     "SALEPRICE": "$965,000.00",
     "SALEDATE": "04/25/2018",
     "INSTNO": "",
     "ACCEPTCODE": "MARKET",
     "DEEDDATE": "04/25/2018",
     "OWNNAME2": "LONNIE H ROBIN",
     "CPMS_ADDRESS": "1734 R ST NW",
     "CAREOFNAME": "",
     "ADDRESS1": "6120 PLUM VALLEY PL",
     "ADDRESS2": "",
     "CITYSTZIP": "FORT WORTH                 TX 76116-8414",
     "SALEDATE_NET": "2018/04/25",
     "DEEDDATE_NET": "2018/04/25"
    },
    {
     "OWNERNAME": "JAMES PAI",
     "PREMISEADD": "1734 R ST NW 3",
     "UNITNUMBER": "3",
     "SSL": "0155    2389",
     "USECODE": "016",
     "HSTDCODE": "",
     "CLASSTYPE": "001",
     "TAXRATE": "0.0085",
     "SALEPRICE": "$1,095,000.00",
     "SALEDATE": "11/10/2015",
     "INSTNO": "",
     "ACCEPTCODE": "MARKET",
     "DEEDDATE": "11/10/2015",
     "OWNNAME2": "ELYSE HORBACK",
     "CPMS_ADDRESS": "1734 R ST NW",
     "CAREOFNAME": "",
     "ADDRESS1": "1734 R ST NW # 3",
     "ADDRESS2": "",
     "CITYSTZIP": "WASHINGTON                 DC 20009-2410",
     "SALEDATE_NET": "2015/11/10",
     "DEEDDATE_NET": "2015/11/10"
    },
    {
     "OWNERNAME": "MALCOLM MCCLUSKEY",
     "PREMISEADD": "1734 R ST NW 4",
     "UNITNUMBER": "4",
     "SSL": "0155    2390",
     "USECODE": "016",
     "HSTDCODE": "1",
     "CLASSTYPE": "001",
     "TAXRATE": "0.0085",
     "SALEPRICE": "$1,300,000.00",
     "SALEDATE": "11/16/2015",
     "INSTNO": "",
     "ACCEPTCODE": "MARKET",
     "DEEDDATE": "11/16/2015",
     "OWNNAME2": "JONATHAN C POLING",
     "CPMS_ADDRESS": "1734 R ST NW",
     "CAREOFNAME": "",
     "ADDRESS1": "1734 R ST NW # 4",
     "ADDRESS2": "",
     "CITYSTZIP": "WASHINGTON                 DC 20009-2410",
     "SALEDATE_NET": "2015/11/16",
     "DEEDDATE_NET": "2015/11/16"
    },
    {
     "OWNERNAME": "MARK B MCCLELLAN",
     "PREMISEADD": "1734 R ST NW 1",
     "UNITNUMBER": "1",
     "SSL": "0155    2387",
     "USECODE": "016",
     "HSTDCODE": "",
     "CLASSTYPE": "001",
     "TAXRATE": "0.0085",
     "SALEPRICE": "$725,000.00",
     "SALEDATE": "02/02/2016",
     "INSTNO": "",
     "ACCEPTCODE": "MARKET",
     "DEEDDATE": "02/02/2016",
     "OWNNAME2": "CORINNA B SORENSON",
     "CPMS_ADDRESS": "1734 R ST NW",
     "CAREOFNAME": "",
     "ADDRESS1": "110 COPLEY MOUNTAIN DR",
     "ADDRESS2": "",
     "CITYSTZIP": "DURHAM                     NC 27705-1453",
     "SALEDATE_NET": "2016/02/02",
     "DEEDDATE_NET": "2016/02/02"
    }
   ]
  },
  "addressDetails": {
   "updated": "2020-06-28T18:12:23.908Z",
   "addressData": [
    {
     "ADDRESS_ID": "241660",
     "MARID": "241660",
     "STATUS": "ACTIVE",
     "FULLADDRESS": "1734 R STREET NW",
     "ADDRNUM": "1734",
     "ADDRNUMSUFFIX": "",
     "STNAME": "R",
     "STREET_TYPE": "STREET",
     "QUADRANT": "NW",
     "CITY": "WASHINGTON",
     "STATE": "DC",
     "XCOORD": "396534.26",
     "YCOORD": "138282.96",
     "SSL": "0155    0125",
     "ANC": "ANC 2B",
     "PSA": "Police Service Area 301",
     "WARD": "Ward 2",
     "NBHD_ACTION": " ",
     "CLUSTER_": "Cluster 6",
     "POLDIST": "Police District - Third District",
     "ROC": "Police Sector 3D3",
     "CENSUS_TRACT": "005301",
     "VOTE_PRCNCT": "Precinct 15",
     "SMD": "SMD 2B03",
     "ZIPCODE": "20009",
     "NATIONALGRID": "18S UJ 23131 09034",
     "ROADWAYSEGID": "19783",
     "FOCUS_IMPROVEMENT_AREA": "NA",
     "HAS_ALIAS": "N",
     "HAS_CONDO_UNIT": "Y",
     "HAS_RES_UNIT": "Y",
     "HAS_SSL": "Y",
     "LATITUDE": "38.91240393",
     "LONGITUDE": "-77.03996067",
     "STREETVIEWURL": "http://maps.google.com/maps?z=16&layer=c&cbll=38.91240393,-77.03996067&cbp=11,173.349137873244,,0,2.09",
     "RES_TYPE": "RESIDENTIAL",
     "WARD_2002": "Ward 2",
     "WARD_2012": "Ward 2",
     "ANC_2002": "ANC 2B",
     "ANC_2012": "ANC 2B",
     "SMD_2002": "SMD 2B03",
     "SMD_2012": "SMD 2B03",
     "IMAGEURL": "http://citizenatlas.dc.gov/mobilevideo",
     "IMAGEDIR": "20040802",
     "IMAGENAME": "Q2100745.jpg",
     "ConfidenceLevel": "100",
     "Zoning": "RA-8"
    }
   ]
  },
  "licenseDetails": {
   "updated": "2020-06-28T18:37:28.354Z",
   "licenseData": [
    {
     "ADDRESS": "1734  R ST NW",
     "UNIT": "3",
     "SSL": "0155    0125",
     "CUST_NUM": "500516004521",
     "DECRIPTION": "Housing: Residential",
     "ENDORSEMENT_DESC": "One Family Rental",
     "LAST_NAME": "PAI",
     "FIRST_NAME": "JAMES",
     "CORP_NAME": "",
     "TRADE_NAME": "",
     "BEGIN_RENEWAL": "Aug  1 2018 12:00AM",
     "END_RENEWAL": "Jul 31 2020 12:00AM",
     "STATUS": "Ready to Renew",
     "BEGIN_RENEWAL_NET": "2018/08/01",
     "END_RENEWAL_NET": "2020/07/31"
    }
   ]
  },
  "permitDetails": {
   "updated": "2020-06-28T18:59:22.748Z",
   "permitData": [
    {
     "FULL_ADDRESS": "1734 R ST NW, WASHINGTON, DC 20009",
     "B1_UNIT_START": "",
     "SSL": "0155    0125",
     "B1_ALT_ID": "B1000018",
     "TYPE": "Construction/Alteration and Repair",
     "G6_STAT_DD": "Jan  1 1900 12:00AM",
     "B1_APPL_STATUS": "Application Canceled",
     "B1_APPL_STATUS_DATE": "07/07/2015",
     "DESC_OF_WORK": "REMOVE DH-SASHES FROM 5 OPENINGS-INSTALL PELLA ARCHITECTS SERIES- INSERT WINDOWS",
     "SORT_DATE": null,
     "G6_STAT_DD_NET": "",
     "B1_APPL_STATUS_DATE_NET": "2015/07/07",
     "JOB_CLASS_CODE": "WT",
     "JOB_SIZE": "N/A",
     "JOB_CLASSIFICATION": "N/A",
     "JOB_REVIEW_TIME": "N/A",
     "OWNER_NAME": "JEUNG AI KIM",
     "OWNER_FULL_NAME": "JEUNG AI KIM",
     "APPLICANT_NAME": "HEUNG A KIM",
     "TRADE_NAME": "",
     "PERMIT_STATUS": [
      {
       "REVIEW_STATUS": "Application Accepted",
       "DISCIPLINE": "Plan Review Coordinator",
       "REVIEW_STATUS_DATE": "10/01/2009"
      },
      {
       "REVIEW_STATUS": "Application Canceled",
       "DISCIPLINE": "File Room",
       "REVIEW_STATUS_DATE": "07/07/2015"
      },
      {
       "REVIEW_STATUS": "In-Process",
       "DISCIPLINE": "HPRB Review",
       "REVIEW_STATUS_DATE": ""
      },
      {
       "REVIEW_STATUS": "In-Process",
       "DISCIPLINE": "Structural Review",
       "REVIEW_STATUS_DATE": ""
      }
     ]
    },
    {
     "FULL_ADDRESS": "1734 R ST NW, Washington, DC 20009",
     "B1_UNIT_START": "",
     "SSL": "0155    0125",
     "B1_ALT_ID": "B1304657",
     "TYPE": "Construction/Alteration and Repair",
     "G6_STAT_DD": "Mar  8 2013 12:00AM",
     "B1_APPL_STATUS": "Permit Issued",
     "B1_APPL_STATUS_DATE": "03/08/2013",
     "DESC_OF_WORK": "INSTALLING NEW WINDOWS",
     "SORT_DATE": null,
     "G6_STAT_DD_NET": "2013/03/08",
     "B1_APPL_STATUS_DATE_NET": "2013/03/08",
     "JOB_CLASS_CODE": "WT",
     "JOB_SIZE": "N/A",
     "JOB_CLASSIFICATION": "N/A",
     "JOB_REVIEW_TIME": "N/A",
     "OWNER_NAME": "KIM",
     "OWNER_FULL_NAME": "KIM",
     "APPLICANT_NAME": "KIM",
     "TRADE_NAME": "",
     "PERMIT_STATUS": [
      {
       "REVIEW_STATUS": "Application Accepted",
       "DISCIPLINE": "Plan Review Coordinator",
       "REVIEW_STATUS_DATE": "03/08/2013"
      },
      {
       "REVIEW_STATUS": "HPRB Review Approved",
       "DISCIPLINE": "HPRB Review",
       "REVIEW_STATUS_DATE": "03/08/2013"
      },
      {
       "REVIEW_STATUS": "Permit Issued",
       "DISCIPLINE": "Issue Permit",
       "REVIEW_STATUS_DATE": "03/08/2013"
      },
      {
       "REVIEW_STATUS": "Structural Review Approved",
       "DISCIPLINE": "Structural Review",
       "REVIEW_STATUS_DATE": "03/08/2013"
      }
     ]
    },
    {
     "FULL_ADDRESS": "1734 R ST NW, Washington, DC 20009",
     "B1_UNIT_START": "",
     "SSL": "0155    0125",
     "B1_ALT_ID": "B1506075",
     "TYPE": "Construction/Addition Alteration Repair",
     "G6_STAT_DD": "Aug 31 2015 12:00AM",
     "B1_APPL_STATUS": "Permit Issued",
     "B1_APPL_STATUS_DATE": "08/31/2015",
     "DESC_OF_WORK": "Interior Alteration of single family dwelling with three story rear addition including Electrical, Mechanical, Plumbing and Structural.\r\nChange of use from single family dwelling to 4 unit condominium building. Building to be fully sprinkled.",
     "SORT_DATE": null,
     "G6_STAT_DD_NET": "2015/08/31",
     "B1_APPL_STATUS_DATE_NET": "2015/08/31",
     "JOB_CLASS_CODE": "C",
     "JOB_SIZE": "N/A",
     "JOB_CLASSIFICATION": "N/A",
     "JOB_REVIEW_TIME": "N/A",
     "OWNER_NAME": "1734 R Street LLC",
     "OWNER_FULL_NAME": "1734 R Street LLC",
     "APPLICANT_NAME": "SMK & ASSOC.",
     "TRADE_NAME": "",
     "PERMIT_STATUS": [
      {
       "REVIEW_STATUS": "Application Accepted",
       "DISCIPLINE": "Plan Review Coordinator",
       "REVIEW_STATUS_DATE": "04/17/2015"
      },
      {
       "REVIEW_STATUS": "Comments Submitted to the Applicant for Correction",
       "DISCIPLINE": "DDOE Review Pending",
       "REVIEW_STATUS_DATE": "06/23/2015"
      },
      {
       "REVIEW_STATUS": "Comments Submitted to the Applicant for Correction",
       "DISCIPLINE": "DDOE Review Pending",
       "REVIEW_STATUS_DATE": "07/06/2015"
      },
      {
       "REVIEW_STATUS": "Comments Submitted to the Applicant for Correction",
       "DISCIPLINE": "DDOE Review Pending",
       "REVIEW_STATUS_DATE": "07/28/2015"
      },
      {
       "REVIEW_STATUS": "Comments Submitted to the Applicant for Correction",
       "DISCIPLINE": "DDOE WSP Review Pending",
       "REVIEW_STATUS_DATE": "06/23/2015"
      },
      {
       "REVIEW_STATUS": "Comments Submitted to the Applicant for Correction",
       "DISCIPLINE": "DDOE WSP Review Pending",
       "REVIEW_STATUS_DATE": "07/06/2015"
      },
      {
       "REVIEW_STATUS": "Comments Submitted to the Applicant for Correction",
       "DISCIPLINE": "DDOE WSP Review Pending",
       "REVIEW_STATUS_DATE": "07/28/2015"
      },
      {
       "REVIEW_STATUS": "Comments Submitted to the Applicant for Correction",
       "DISCIPLINE": "Electrical Review Pending",
       "REVIEW_STATUS_DATE": "04/28/2015"
      },
      {
       "REVIEW_STATUS": "Comments Submitted to the Applicant for Correction",
       "DISCIPLINE": "Electrical Review Pending",
       "REVIEW_STATUS_DATE": "07/09/2015"
      },
      {
       "REVIEW_STATUS": "Comments Submitted to the Applicant for Correction",
       "DISCIPLINE": "Green Review Pending",
       "REVIEW_STATUS_DATE": "05/15/2015"
      },
      {
       "REVIEW_STATUS": "Comments Submitted to the Applicant for Correction",
       "DISCIPLINE": "Green Review Pending",
       "REVIEW_STATUS_DATE": "07/20/2015"
      },
      {
       "REVIEW_STATUS": "Comments Submitted to the Applicant for Correction",
       "DISCIPLINE": "Green Review Pending",
       "REVIEW_STATUS_DATE": "08/03/2015"
      },
      {
       "REVIEW_STATUS": "Comments Submitted to the Applicant for Correction",
       "DISCIPLINE": "Mechanical Review Pending",
       "REVIEW_STATUS_DATE": "05/18/2015"
      },
      {
       "REVIEW_STATUS": "Comments Submitted to the Applicant for Correction",
       "DISCIPLINE": "Plumbing Review Pending",
       "REVIEW_STATUS_DATE": "05/18/2015"
      },
      {
       "REVIEW_STATUS": "Comments Submitted to the Applicant for Correction",
       "DISCIPLINE": "Structural Review Pending",
       "REVIEW_STATUS_DATE": "05/15/2015"
      },
      {
       "REVIEW_STATUS": "Comments Submitted to the Applicant for Correction",
       "DISCIPLINE": "Structural Review Pending",
       "REVIEW_STATUS_DATE": "07/17/2015"
      },
      {
       "REVIEW_STATUS": "DDOE Review Approved",
       "DISCIPLINE": "DDOE Review",
       "REVIEW_STATUS_DATE": "08/31/2015"
      },
      {
       "REVIEW_STATUS": "DDOE Review Pending",
       "DISCIPLINE": "DDOE Review",
       "REVIEW_STATUS_DATE": "08/05/2015"
      },
      {
       "REVIEW_STATUS": "DDOE WSP Review N/A",
       "DISCIPLINE": "DDOE WSP Review",
       "REVIEW_STATUS_DATE": "08/05/2015"
      },
      {
       "REVIEW_STATUS": "Electrical Review Approved",
       "DISCIPLINE": "Electrical Review",
       "REVIEW_STATUS_DATE": "08/06/2015"
      },
      {
       "REVIEW_STATUS": "Green Review Approved",
       "DISCIPLINE": "Green Review",
       "REVIEW_STATUS_DATE": "08/31/2015"
      },
      {
       "REVIEW_STATUS": "HPRB Review Approved",
       "DISCIPLINE": "HPRB Review",
       "REVIEW_STATUS_DATE": "06/24/2015"
      },
      {
       "REVIEW_STATUS": "In-Process",
       "DISCIPLINE": "Wall Check Verification",
       "REVIEW_STATUS_DATE": ""
      },
      {
       "REVIEW_STATUS": "Mechanical Review Approved",
       "DISCIPLINE": "Mechanical Review",
       "REVIEW_STATUS_DATE": "05/18/2015"
      },
      {
       "REVIEW_STATUS": "Pending Check In",
       "DISCIPLINE": "File Room",
       "REVIEW_STATUS_DATE": "06/30/2015"
      },
      {
       "REVIEW_STATUS": "Pending Check In",
       "DISCIPLINE": "File Room",
       "REVIEW_STATUS_DATE": "07/27/2015"
      },
      {
       "REVIEW_STATUS": "Permit Issued",
       "DISCIPLINE": "Issue Permit",
       "REVIEW_STATUS_DATE": "08/31/2015"
      },
      {
       "REVIEW_STATUS": "Plans and Application Resubmitted by the Applicant",
       "DISCIPLINE": "File Room",
       "REVIEW_STATUS_DATE": "06/30/2015"
      },
      {
       "REVIEW_STATUS": "Plans and Application Resubmitted by the Applicant",
       "DISCIPLINE": "File Room",
       "REVIEW_STATUS_DATE": "07/27/2015"
      },
      {
       "REVIEW_STATUS": "Plans and Application Resubmitted by the Applicant",
       "DISCIPLINE": "File Room",
       "REVIEW_STATUS_DATE": "08/24/2015"
      },
      {
       "REVIEW_STATUS": "Plans Picked Up by the Applicant for Correction",
       "DISCIPLINE": "File Room",
       "REVIEW_STATUS_DATE": "06/23/2015"
      },
      {
       "REVIEW_STATUS": "Plans Picked Up by the Applicant for Correction",
       "DISCIPLINE": "File Room",
       "REVIEW_STATUS_DATE": "07/27/2015"
      },
      {
       "REVIEW_STATUS": "Plumbing Review Approved",
       "DISCIPLINE": "Plumbing Review",
       "REVIEW_STATUS_DATE": "05/18/2015"
      },
      {
       "REVIEW_STATUS": "Ready for Issuance",
       "DISCIPLINE": "File Room",
       "REVIEW_STATUS_DATE": "08/31/2015"
      },
      {
       "REVIEW_STATUS": "Structural Review Approved",
       "DISCIPLINE": "Structural Review",
       "REVIEW_STATUS_DATE": "08/21/2015"
      },
      {
       "REVIEW_STATUS": "WASA Review Approved",
       "DISCIPLINE": "WASA Review",
       "REVIEW_STATUS_DATE": "08/31/2015"
      },
      {
       "REVIEW_STATUS": "Zoning Review Approved - WC",
       "DISCIPLINE": "Zoning Review",
       "REVIEW_STATUS_DATE": "06/09/2015"
      }
     ]
    },
    {
     "FULL_ADDRESS": "1734 R ST NW, Washington, DC 20009",
     "B1_UNIT_START": "",
     "SSL": "0155    0125",
     "B1_ALT_ID": "B1508241",
     "TYPE": "Construction/Alteration and Repair",
     "G6_STAT_DD": "May 29 2015 12:00AM",
     "B1_APPL_STATUS": "Permit Issued",
     "B1_APPL_STATUS_DATE": "05/29/2015",
     "DESC_OF_WORK": "Repair existing garden/retaining wall.",
     "SORT_DATE": null,
     "G6_STAT_DD_NET": "2015/05/29",
     "B1_APPL_STATUS_DATE_NET": "2015/05/29",
     "JOB_CLASS_CODE": "WT",
     "JOB_SIZE": "N/A",
     "JOB_CLASSIFICATION": "N/A",
     "JOB_REVIEW_TIME": "N/A",
     "OWNER_NAME": "1734 R Street LLC",
     "OWNER_FULL_NAME": "1734 R Street LLC",
     "APPLICANT_NAME": "1734 R STREET LLC",
     "TRADE_NAME": "",
     "PERMIT_STATUS": [
      {
       "REVIEW_STATUS": "Application Accepted",
       "DISCIPLINE": "Plan Review Coordinator",
       "REVIEW_STATUS_DATE": "05/29/2015"
      },
      {
       "REVIEW_STATUS": "HPRB Review Approved",
       "DISCIPLINE": "HPRB Review",
       "REVIEW_STATUS_DATE": "05/29/2015"
      },
      {
       "REVIEW_STATUS": "Permit Issued",
       "DISCIPLINE": "Issue Permit",
       "REVIEW_STATUS_DATE": "05/29/2015"
      },
      {
       "REVIEW_STATUS": "Structural Review Approved",
       "DISCIPLINE": "Structural Review",
       "REVIEW_STATUS_DATE": "05/29/2015"
      }
     ]
    },
    {
     "FULL_ADDRESS": "1734 R ST NW, Washington, DC 20009",
     "B1_UNIT_START": "",
     "SSL": "0155    0125",
     "B1_ALT_ID": "D1500407",
     "TYPE": "Construction/Demolition",
     "G6_STAT_DD": "Mar 23 2015 12:00AM",
     "B1_APPL_STATUS": "Permit Issued",
     "B1_APPL_STATUS_DATE": "03/23/2015",
     "DESC_OF_WORK": "Demolition of non load bearing walls interior.\r\nDemolition of Exterior Glass solarium.",
     "SORT_DATE": null,
     "G6_STAT_DD_NET": "2015/03/23",
     "B1_APPL_STATUS_DATE_NET": "2015/03/23",
     "JOB_CLASS_CODE": "WT",
     "JOB_SIZE": "N/A",
     "JOB_CLASSIFICATION": "N/A",
     "JOB_REVIEW_TIME": "N/A",
     "OWNER_NAME": "1734 R Street, LLC",
     "OWNER_FULL_NAME": "1734 R Street, LLC",
     "APPLICANT_NAME": "KC/DC STUDIOS",
     "TRADE_NAME": "",
     "PERMIT_STATUS": [
      {
       "REVIEW_STATUS": "Application Accepted",
       "DISCIPLINE": "Plan Review Coordinator",
       "REVIEW_STATUS_DATE": "03/23/2015"
      },
      {
       "REVIEW_STATUS": "HPRB Review Approved",
       "DISCIPLINE": "HPRB Review",
       "REVIEW_STATUS_DATE": "03/23/2015"
      },
      {
       "REVIEW_STATUS": "Permit Issued",
       "DISCIPLINE": "Issue Permit",
       "REVIEW_STATUS_DATE": "03/23/2015"
      },
      {
       "REVIEW_STATUS": "Structural Review Approved",
       "DISCIPLINE": "Structural Review",
       "REVIEW_STATUS_DATE": "03/23/2015"
      }
     ]
    },
    {
     "FULL_ADDRESS": "1734 R ST NW, WASHINGTON, DC 20009",
     "B1_UNIT_START": "",
     "SSL": "0155    0125",
     "B1_ALT_ID": "E1508148",
     "TYPE": "Supplemental/Electrical",
     "G6_STAT_DD": "Sep  1 2015 12:00AM",
     "B1_APPL_STATUS": "Permit Issued",
     "B1_APPL_STATUS_DATE": "09/01/2015",
     "DESC_OF_WORK": "",
     "SORT_DATE": null,
     "G6_STAT_DD_NET": "2015/09/01",
     "B1_APPL_STATUS_DATE_NET": "2015/09/01",
     "JOB_CLASS_CODE": "N/A",
     "JOB_SIZE": "N/A",
     "JOB_CLASSIFICATION": "N/A",
     "JOB_REVIEW_TIME": "N/A",
     "OWNER_NAME": "JOSEPH BRACKETT",
     "OWNER_FULL_NAME": "JOSEPH BRACKETT",
     "APPLICANT_NAME": "RALPH E. JACKSON",
     "TRADE_NAME": "",
     "PERMIT_STATUS": [
      {
       "REVIEW_STATUS": "",
       "DISCIPLINE": "",
       "REVIEW_STATUS_DATE": ""
      }
     ]
    },
    {
     "FULL_ADDRESS": "1734 R ST NW, Washington, DC 20009",
     "B1_UNIT_START": "",
     "SSL": "0155    0125",
     "B1_ALT_ID": "F1300322",
     "TYPE": "Construction/Fence",
     "G6_STAT_DD": "Apr 29 2013 12:00AM",
     "B1_APPL_STATUS": "Permit Issued",
     "B1_APPL_STATUS_DATE": "04/29/2013",
     "DESC_OF_WORK": "Install 10 foot high wood, spaced-board fence in at side property line.",
     "SORT_DATE": null,
     "G6_STAT_DD_NET": "2013/04/29",
     "B1_APPL_STATUS_DATE_NET": "2013/04/29",
     "JOB_CLASS_CODE": "N/A",
     "JOB_SIZE": "N/A",
     "JOB_CLASSIFICATION": "N/A",
     "JOB_REVIEW_TIME": "N/A",
     "OWNER_NAME": "Kim",
     "OWNER_FULL_NAME": "Kim",
     "APPLICANT_NAME": "LONG FENCE",
     "TRADE_NAME": "",
     "PERMIT_STATUS": [
      {
       "REVIEW_STATUS": "Application Accepted",
       "DISCIPLINE": "Plan Review Coordinator",
       "REVIEW_STATUS_DATE": "04/25/2013"
      },
      {
       "REVIEW_STATUS": "HPRB Review Approved",
       "DISCIPLINE": "HPRB Review",
       "REVIEW_STATUS_DATE": "04/29/2013"
      },
      {
       "REVIEW_STATUS": "Permit Issued",
       "DISCIPLINE": "Issue Permit",
       "REVIEW_STATUS_DATE": "04/29/2013"
      },
      {
       "REVIEW_STATUS": "Structural Review Approved",
       "DISCIPLINE": "Structural Review",
       "REVIEW_STATUS_DATE": "04/29/2013"
      },
      {
       "REVIEW_STATUS": "Zoning Review Approved",
       "DISCIPLINE": "Zoning Review",
       "REVIEW_STATUS_DATE": "04/29/2013"
      }
     ]
    },
    {
     "FULL_ADDRESS": "1734 R ST NW, WASHINGTON, DC 20009",
     "B1_UNIT_START": "",
     "SSL": "0155    0125",
     "B1_ALT_ID": "FS1601102",
     "TYPE": "Shop Drawing/Fire Suppression",
     "G6_STAT_DD": "Jan  1 1900 12:00AM",
     "B1_APPL_STATUS": "Fire Review Approved",
     "B1_APPL_STATUS_DATE": "02/29/2016",
     "DESC_OF_WORK": "952) Sprinkler NFPA 13R.",
     "SORT_DATE": null,
     "G6_STAT_DD_NET": "",
     "B1_APPL_STATUS_DATE_NET": "2016/02/29",
     "JOB_CLASS_CODE": "N/A",
     "JOB_SIZE": "N/A",
     "JOB_CLASSIFICATION": "N/A",
     "JOB_REVIEW_TIME": "N/A",
     "OWNER_NAME": "JOSEPH BRACKETT",
     "OWNER_FULL_NAME": "JOSEPH BRACKETT",
     "APPLICANT_NAME": "",
     "TRADE_NAME": "",
     "PERMIT_STATUS": [
      {
       "REVIEW_STATUS": "Comments Submitted to the Applicant for Correction",
       "DISCIPLINE": "Fire Review Pending",
       "REVIEW_STATUS_DATE": "01/28/2016"
      },
      {
       "REVIEW_STATUS": "Drawing Accepted",
       "DISCIPLINE": "File Room",
       "REVIEW_STATUS_DATE": "01/26/2016"
      },
      {
       "REVIEW_STATUS": "Fire Review Approved",
       "DISCIPLINE": "Fire Review",
       "REVIEW_STATUS_DATE": "02/29/2016"
      },
      {
       "REVIEW_STATUS": "Plans and Application Resubmitted by the Applicant",
       "DISCIPLINE": "File Room",
       "REVIEW_STATUS_DATE": "02/29/2016"
      },
      {
       "REVIEW_STATUS": "Plans Picked Up by the Applicant for Correction",
       "DISCIPLINE": "File Room",
       "REVIEW_STATUS_DATE": "02/01/2016"
      }
     ]
    },
    {
     "FULL_ADDRESS": "1734 R ST NW, WASHINGTON, DC 20009",
     "B1_UNIT_START": "",
     "SSL": "0155    0125",
     "B1_ALT_ID": "M1101948",
     "TYPE": "Supplemental/Mechanical",
     "G6_STAT_DD": "Jun 27 2011 12:00AM",
     "B1_APPL_STATUS": "Permit Issued",
     "B1_APPL_STATUS_DATE": "06/27/2011",
     "DESC_OF_WORK": "",
     "SORT_DATE": null,
     "G6_STAT_DD_NET": "2011/06/27",
     "B1_APPL_STATUS_DATE_NET": "2011/06/27",
     "JOB_CLASS_CODE": "N/A",
     "JOB_SIZE": "N/A",
     "JOB_CLASSIFICATION": "N/A",
     "JOB_REVIEW_TIME": "N/A",
     "OWNER_NAME": "JOSEPH BRACKETT",
     "OWNER_FULL_NAME": "JOSEPH BRACKETT",
     "APPLICANT_NAME": "ROBERT  MCCABE",
     "TRADE_NAME": "",
     "PERMIT_STATUS": [
      {
       "REVIEW_STATUS": "",
       "DISCIPLINE": "",
       "REVIEW_STATUS_DATE": ""
      }
     ]
    },
    {
     "FULL_ADDRESS": "1734 R ST NW, WASHINGTON, DC 20009",
     "B1_UNIT_START": "",
     "SSL": "0155    0125",
     "B1_ALT_ID": "M1502880",
     "TYPE": "Supplemental/Mechanical",
     "G6_STAT_DD": "Aug  5 2015 12:00AM",
     "B1_APPL_STATUS": "Permit Issued",
     "B1_APPL_STATUS_DATE": "08/05/2015",
     "DESC_OF_WORK": "",
     "SORT_DATE": null,
     "G6_STAT_DD_NET": "2015/08/05",
     "B1_APPL_STATUS_DATE_NET": "2015/08/05",
     "JOB_CLASS_CODE": "N/A",
     "JOB_SIZE": "N/A",
     "JOB_CLASSIFICATION": "N/A",
     "JOB_REVIEW_TIME": "N/A",
     "OWNER_NAME": "JOSEPH BRACKETT",
     "OWNER_FULL_NAME": "JOSEPH BRACKETT",
     "APPLICANT_NAME": "RALPH  JACKSON",
     "TRADE_NAME": "",
     "PERMIT_STATUS": [
      {
       "REVIEW_STATUS": "",
       "DISCIPLINE": "",
       "REVIEW_STATUS_DATE": ""
      }
     ]
    },
    {
     "FULL_ADDRESS": "1734 R ST NW, WASHINGTON, DC 20009",
     "B1_UNIT_START": "",
     "SSL": "0155    0125",
     "B1_ALT_ID": "P1507828",
     "TYPE": "Supplemental/Plumbing and Gas",
     "G6_STAT_DD": "Jul 29 2015 12:00AM",
     "B1_APPL_STATUS": "Permit Issued",
     "B1_APPL_STATUS_DATE": "07/29/2015",
     "DESC_OF_WORK": "",
     "SORT_DATE": null,
     "G6_STAT_DD_NET": "2015/07/29",
     "B1_APPL_STATUS_DATE_NET": "2015/07/29",
     "JOB_CLASS_CODE": "N/A",
     "JOB_SIZE": "N/A",
     "JOB_CLASSIFICATION": "N/A",
     "JOB_REVIEW_TIME": "N/A",
     "OWNER_NAME": "JOSEPH BRACKETT",
     "OWNER_FULL_NAME": "JOSEPH BRACKETT",
     "APPLICANT_NAME": "",
     "TRADE_NAME": "",
     "PERMIT_STATUS": [
      {
       "REVIEW_STATUS": "",
       "DISCIPLINE": "",
       "REVIEW_STATUS_DATE": ""
      }
     ]
    },
    {
     "FULL_ADDRESS": "1734 R ST NW, WASHINGTON, DC 20009",
     "B1_UNIT_START": "",
     "SSL": "0155    0125",
     "B1_ALT_ID": "P1508008",
     "TYPE": "Supplemental/Plumbing and Gas",
     "G6_STAT_DD": "Aug  5 2015 12:00AM",
     "B1_APPL_STATUS": "Permit Issued",
     "B1_APPL_STATUS_DATE": "08/05/2015",
     "DESC_OF_WORK": "",
     "SORT_DATE": null,
     "G6_STAT_DD_NET": "2015/08/05",
     "B1_APPL_STATUS_DATE_NET": "2015/08/05",
     "JOB_CLASS_CODE": "N/A",
     "JOB_SIZE": "N/A",
     "JOB_CLASSIFICATION": "N/A",
     "JOB_REVIEW_TIME": "N/A",
     "OWNER_NAME": "JOSEPH BRACKETT",
     "OWNER_FULL_NAME": "JOSEPH BRACKETT",
     "APPLICANT_NAME": "RALPH E JACKSON",
     "TRADE_NAME": "",
     "PERMIT_STATUS": [
      {
       "REVIEW_STATUS": "",
       "DISCIPLINE": "",
       "REVIEW_STATUS_DATE": ""
      }
     ]
    },
    {
     "FULL_ADDRESS": "1734 R ST NW, WASHINGTON, DC 20009",
     "B1_UNIT_START": "",
     "SSL": "0155    0125",
     "B1_ALT_ID": "SR13SO03601",
     "TYPE": "Surveyors/Customer Request",
     "G6_STAT_DD": "Jan  1 1900 12:00AM",
     "B1_APPL_STATUS": "Request Complete",
     "B1_APPL_STATUS_DATE": "04/17/2013",
     "DESC_OF_WORK": "",
     "SORT_DATE": null,
     "G6_STAT_DD_NET": "",
     "B1_APPL_STATUS_DATE_NET": "2013/04/17",
     "JOB_CLASS_CODE": "N/A",
     "JOB_SIZE": "N/A",
     "JOB_CLASSIFICATION": "N/A",
     "JOB_REVIEW_TIME": "N/A",
     "OWNER_NAME": "",
     "OWNER_FULL_NAME": "",
     "APPLICANT_NAME": "VICTORIA LYNN WILLIAMS",
     "TRADE_NAME": "",
     "PERMIT_STATUS": [
      {
       "REVIEW_STATUS": "",
       "DISCIPLINE": "",
       "REVIEW_STATUS_DATE": ""
      }
     ]
    },
    {
     "FULL_ADDRESS": "1734 R ST NW 20009",
     "B1_UNIT_START": "",
     "SSL": "",
     "B1_ALT_ID": "SR14SO08303",
     "TYPE": "Surveyors/Customer Request",
     "G6_STAT_DD": "Jan  1 1900 12:00AM",
     "B1_APPL_STATUS": "Request Complete",
     "B1_APPL_STATUS_DATE": "09/26/2014",
     "DESC_OF_WORK": "",
     "SORT_DATE": null,
     "G6_STAT_DD_NET": "",
     "B1_APPL_STATUS_DATE_NET": "2014/09/26",
     "JOB_CLASS_CODE": "N/A",
     "JOB_SIZE": "N/A",
     "JOB_CLASSIFICATION": "N/A",
     "JOB_REVIEW_TIME": "N/A",
     "OWNER_NAME": "",
     "OWNER_FULL_NAME": "",
     "APPLICANT_NAME": "JOHN F CASEY",
     "TRADE_NAME": "",
     "PERMIT_STATUS": [
      {
       "REVIEW_STATUS": "",
       "DISCIPLINE": "",
       "REVIEW_STATUS_DATE": ""
      }
     ]
    }
   ]
  },
  "inspectionDetails": {
   "updated": "2020-06-28T18:59:23.091Z",
   "inspectionData": [
    {
     "ADDRESS": "1734 R ST NW, Washington, DC 20009",
     "UNIT": "",
     "SSL": "0155    0125",
     "ID": "B1508241",
     "G6_ACT_DES": "Building Close-In",
     "G6_STATUS": "Approved",
     "G6_STATUS_DD": "5/20/2016 12:00:00 AM",
     "DESC_OF_WORK": "Repair existing garden/retaining wall.",
     "G6_STATUS_DD_NET": "2016/05/20",
     "OWNER_FULL_NAME": "1734 R Street LLC",
     "APPLICANT": "1734 R STREET LLC"
    },
    {
     "ADDRESS": "1734 R ST NW, Washington, DC 20009",
     "UNIT": "",
     "SSL": "0155    0125",
     "ID": "B1508241",
     "G6_ACT_DES": "Building Final",
     "G6_STATUS": "Scheduled",
     "G6_STATUS_DD": "5/20/2016 12:00:00 AM",
     "DESC_OF_WORK": "Repair existing garden/retaining wall.",
     "G6_STATUS_DD_NET": "2016/05/20",
     "OWNER_FULL_NAME": "1734 R Street LLC",
     "APPLICANT": "1734 R STREET LLC"
    },
    {
     "ADDRESS": "1734 R ST NW, WASHINGTON, DC 20009",
     "UNIT": "",
     "SSL": "0155    0125",
     "ID": "P1507828",
     "G6_ACT_DES": "Sprinkler Systems",
     "G6_STATUS": "Approved",
     "G6_STATUS_DD": "5/20/2016 12:00:00 AM",
     "DESC_OF_WORK": "",
     "G6_STATUS_DD_NET": "2016/05/20",
     "OWNER_FULL_NAME": "JOSEPH BRACKETT",
     "APPLICANT": ""
    },
    {
     "ADDRESS": "1734 R ST NW, WASHINGTON, DC 20009",
     "UNIT": "",
     "SSL": "0155    0125",
     "ID": "P1508008",
     "G6_ACT_DES": "Plumbing Final",
     "G6_STATUS": "Scheduled",
     "G6_STATUS_DD": "5/20/2016 12:00:00 AM",
     "DESC_OF_WORK": "",
     "G6_STATUS_DD_NET": "2016/05/20",
     "OWNER_FULL_NAME": "JOSEPH BRACKETT",
     "APPLICANT": "RALPH E JACKSON"
    },
    {
     "ADDRESS": "1734 R ST NW, WASHINGTON, DC 20009",
     "UNIT": "",
     "SSL": "0155    0125",
     "ID": "P1508008",
     "G6_ACT_DES": "Plumbing Rough-In",
     "G6_STATUS": "Approved",
     "G6_STATUS_DD": "5/20/2016 12:00:00 AM",
     "DESC_OF_WORK": "",
     "G6_STATUS_DD_NET": "2016/05/20",
     "OWNER_FULL_NAME": "JOSEPH BRACKETT",
     "APPLICANT": "RALPH E JACKSON"
    },
    {
     "ADDRESS": "1734 R ST NW, WASHINGTON, DC 20009",
     "UNIT": "",
     "SSL": "0155    0125",
     "ID": "CIC1600572",
     "G6_ACT_DES": "Initial Inspection",
     "G6_STATUS": "No Cause",
     "G6_STATUS_DD": "1/5/2016 12:00:00 AM",
     "DESC_OF_WORK": "",
     "G6_STATUS_DD_NET": "2016/01/05",
     "OWNER_FULL_NAME": "1734 R LLC",
     "APPLICANT": ""
    },
    {
     "ADDRESS": "1734 R ST NW, WASHINGTON, DC 20009",
     "UNIT": "",
     "SSL": "0155    0125",
     "ID": "E1508148",
     "G6_ACT_DES": "Electrical - TPF",
     "G6_STATUS": "Approved",
     "G6_STATUS_DD": "9/17/2015 12:00:00 AM",
     "DESC_OF_WORK": "",
     "G6_STATUS_DD_NET": "2015/09/17",
     "OWNER_FULL_NAME": "JOSEPH BRACKETT",
     "APPLICANT": "RALPH E. JACKSON"
    },
    {
     "ADDRESS": "1734 R ST NW, WASHINGTON, DC 20009",
     "UNIT": "",
     "SSL": "0155    0125",
     "ID": "E1508148",
     "G6_ACT_DES": "Electrical Final",
     "G6_STATUS": "Scheduled",
     "G6_STATUS_DD": "9/17/2015 12:00:00 AM",
     "DESC_OF_WORK": "",
     "G6_STATUS_DD_NET": "2015/09/17",
     "OWNER_FULL_NAME": "JOSEPH BRACKETT",
     "APPLICANT": "RALPH E. JACKSON"
    },
    {
     "ADDRESS": "1734 R ST NW, WASHINGTON, DC 20009",
     "UNIT": "",
     "SSL": "0155    0125",
     "ID": "CIC1501286",
     "G6_ACT_DES": "Initial Inspection",
     "G6_STATUS": "No Cause",
     "G6_STATUS_DD": "5/29/2015 12:00:00 AM",
     "DESC_OF_WORK": "",
     "G6_STATUS_DD_NET": "2015/05/29",
     "OWNER_FULL_NAME": "JOSEPH BRACKETT",
     "APPLICANT": ""
    }
   ]
  },
  "occupancyDetails": {
   "updated": "2020-06-28T18:59:23.268Z",
   "occupancyData": [
    {
     "FULL_ADDRESS": "1734 R ST NW, WASHINGTON, DC 20009",
     "B1_UNIT_START": "",
     "SSL": "0155    0125",
     "B1_ALT_ID": "CO1600141",
     "TYPE": "Certificate of Occupancy",
     "G6_STAT_DD": "10/15/2015",
     "B1_APPL_STATUS": "Completed",
     "B1_APPL_STATUS_DATE": "10/15/2015",
     "DESC_OF_WORK": "Use Change4 UNIT APARTMENT BUILDING",
     "G6_STAT_DD_NET": "2015/10/15",
     "B1_APPL_STATUS_DATE_NET": "2015/10/15",
     "OWNER_FULL_NAME": "1734 R LLC",
     "APPLICANT": ""
    }
   ]
  },
  "charDetails": {
   "updated": "2020-06-28T19:54:00.182Z",
   "charData": [
    {
     "PREMISEADD": "1734 R ST NW",
     "SSL": "0155    0125",
     "BLDG_NUM": "1",
     "COMPLX_NUM": "",
     "UNITNUMBER": "",
     "NUM_UNITS": "0",
     "AYB": "1885",
     "STRUCT_CL_": "",
     "STYLE_D": "3 Story",
     "STRUCT_D": "Row ",
     "GBA": "4233",
     "EXTWALL_D": "Common Brick",
     "WALL_HGT": "",
     "ROOF_D": "Meta",
     "BATHRM": "3",
     "HF_BATHRM": "0",
     "HEAT_D": "Warm",
     "AC": "Y",
     "INTWALL_D": "Hardwood",
     "ROOMS": "10",
     "BEDRM": "4",
     "KITCHENS": "1",
     "FIREPLACES": "0",
     "YR_RMDL": "",
     "EYB": "1954",
     "STORIES": "3",
     "OWNERNAME": "",
     "OWNNAME2": "",
     "CAREOFNAME": ""
    }
   ]
  }
 },
 "1740 CORCORAN STREET NW": {
  "ownerInfo": {
   "updated": "2020-06-28T17:30:49.552Z",
   "ownerData": [
    {
     "OWNERNAME": "MEEHAN ROBERT S AND SUSAN W B",
     "PREMISEADD": "1740 CORCORAN ST NW",
     "UNITNUMBER": "",
     "SSL": "0155    0153",
     "USECODE": "024",
     "HSTDCODE": "1",
     "CLASSTYPE": "001",
     "TAXRATE": "0.0085",
     "SALEPRICE": "",
     "SALEDATE": "",
     "INSTNO": "",
     "ACCEPTCODE": "",
     "DEEDDATE": "",
     "OWNNAME2": "",
     "CPMS_ADDRESS": "1740 CORCORAN ST NW",
     "CAREOFNAME": "",
     "ADDRESS1": "1740 CORCORAN ST NW",
     "ADDRESS2": "",
     "CITYSTZIP": "WASHINGTON                 DC 20009-2406",
     "SALEDATE_NET": "",
     "DEEDDATE_NET": ""
    }
   ]
  },
  "addressDetails": {
   "updated": "2020-06-28T18:12:26.908Z",
   "addressData": [
    {
     "ADDRESS_ID": "241667",
     "MARID": "241667",
     "STATUS": "ACTIVE",
     "FULLADDRESS": "1740 CORCORAN STREET NW",
     "ADDRNUM": "1740",
     "ADDRNUMSUFFIX": "",
     "STNAME": "CORCORAN",
     "STREET_TYPE": "STREET",
     "QUADRANT": "NW",
     "CITY": "WASHINGTON",
     "STATE": "DC",
     "XCOORD": "396529.65",
     "YCOORD": "138206.67",
     "SSL": "0155    0153",
     "ANC": "ANC 2B",
     "PSA": "Police Service Area 301",
     "WARD": "Ward 2",
     "NBHD_ACTION": " ",
     "CLUSTER_": "Cluster 6",
     "POLDIST": "Police District - Third District",
     "ROC": "Police Sector 3D3",
     "CENSUS_TRACT": "005301",
     "VOTE_PRCNCT": "Precinct 15",
     "SMD": "SMD 2B03",
     "ZIPCODE": "20009",
     "NATIONALGRID": "18S UJ 23124 08958",
     "ROADWAYSEGID": "2266",
     "FOCUS_IMPROVEMENT_AREA": "NA",
     "HAS_ALIAS": "N",
     "HAS_CONDO_UNIT": "N",
     "HAS_RES_UNIT": "Y",
     "HAS_SSL": "Y",
     "LATITUDE": "38.91171666",
     "LONGITUDE": "-77.04001344",
     "STREETVIEWURL": "http://maps.google.com/maps?z=16&layer=c&cbll=38.91171666,-77.04001344&cbp=11,168.335570455705,,0,2.09",
     "RES_TYPE": "RESIDENTIAL",
     "WARD_2002": "Ward 2",
     "WARD_2012": "Ward 2",
     "ANC_2002": "ANC 2B",
     "ANC_2012": "ANC 2B",
     "SMD_2002": "SMD 2B03",
     "SMD_2012": "SMD 2B03",
     "IMAGEURL": "http://citizenatlas.dc.gov/mobilevideo",
     "IMAGEDIR": "20040805",
     "IMAGENAME": "Q5090340.jpg",
     "ConfidenceLevel": "100",
     "Zoning": "RA-8"
    }
   ]
  },
  "licenseDetails": {
   "updated": "2020-06-28T18:37:34.669Z",
   "licenseData": [
    {
     "ADDRESS": "1740  CORCORAN ST NW",
     "UNIT": "",
     "SSL": "0155    0153",
     "CUST_NUM": "39803373",
     "DECRIPTION": "Housing: Residential",
     "ENDORSEMENT_DESC": "Apartment",
     "LAST_NAME": "SUSAN WB MEEHAN",
     "FIRST_NAME": "ROBERT S.",
     "CORP_NAME": "",
     "TRADE_NAME": "",
     "BEGIN_RENEWAL": "Nov  1 2019 12:00AM",
     "END_RENEWAL": "Oct 31 2021 12:00AM",
     "STATUS": "Active",
     "BEGIN_RENEWAL_NET": "2019/11/01",
     "END_RENEWAL_NET": "2021/10/31"
    }
   ]
  },
  "permitDetails": {
   "updated": "2020-06-28T18:59:33.395Z",
   "permitData": [
    {
     "FULL_ADDRESS": "1740 CORCORAN ST NW, WASHINGTON, DC 20009",
     "B1_UNIT_START": "",
     "SSL": "0155    0153",
     "B1_ALT_ID": "M1603150",
     "TYPE": "Supplemental/Mechanical",
     "G6_STAT_DD": "Aug 15 2016 12:00AM",
     "B1_APPL_STATUS": "Permit Issued",
     "B1_APPL_STATUS_DATE": "08/15/2016",
     "DESC_OF_WORK": "",
     "SORT_DATE": null,
     "G6_STAT_DD_NET": "2016/08/15",
     "B1_APPL_STATUS_DATE_NET": "2016/08/15",
     "JOB_CLASS_CODE": "N/A",
     "JOB_SIZE": "N/A",
     "JOB_CLASSIFICATION": "N/A",
     "JOB_REVIEW_TIME": "N/A",
     "OWNER_NAME": "MEEHAN ROBERT S AND SUSAN W B",
     "OWNER_FULL_NAME": "MEEHAN ROBERT S AND SUSAN W B",
     "APPLICANT_NAME": "NORMAN C. PERRY",
     "TRADE_NAME": "",
     "PERMIT_STATUS": [
      {
       "REVIEW_STATUS": "",
       "DISCIPLINE": "",
       "REVIEW_STATUS_DATE": ""
      }
     ]
    }
   ]
  },
  "inspectionDetails": {
   "updated": "2020-06-28T18:59:33.807Z",
   "inspectionData": []
  },
  "occupancyDetails": {
   "updated": "2020-06-28T18:59:33.974Z",
   "occupancyData": []
  },
  "charDetails": {
   "updated": "2020-06-28T19:54:03.011Z",
   "charData": [
    {
     "PREMISEADD": "1740 CORCORAN ST NW",
     "SSL": "0155    0153",
     "BLDG_NUM": "1",
     "COMPLX_NUM": "",
     "UNITNUMBER": "",
     "NUM_UNITS": "0",
     "AYB": "1885",
     "STRUCT_CL_": "",
     "STYLE_D": "3 Story",
     "STRUCT_D": "Row ",
     "GBA": "4213",
     "EXTWALL_D": "Common Brick",
     "WALL_HGT": "",
     "ROOF_D": "Meta",
     "BATHRM": "3",
     "HF_BATHRM": "1",
     "HEAT_D": "Warm",
     "AC": "Y",
     "INTWALL_D": "Hardwood",
     "ROOMS": "8",
     "BEDRM": "4",
     "KITCHENS": "3",
     "FIREPLACES": "0",
     "YR_RMDL": "",
     "EYB": "1955",
     "STORIES": "3",
     "OWNERNAME": "MEEHAN ROBERT S AND SUSAN W B",
     "OWNNAME2": "",
     "CAREOFNAME": ""
    }
   ]
  },
  "taxData": {
   "ssl": "0155    0153",
   "address": "1740 CORCORAN ST NW",
   "owner": "MEEHAN ROBERT S AND SUSAN W B",
   "neighborhood": "OLD CITY II",
   "sub_neighborhood": "D",
   "use_code": "24",
   "sale_price": "$.00",
   "recordation_date": "N/A",
   "2016_Assessment": "$1,283,410.00"
  }
 },
 "1742 CORCORAN STREET NW": {
  "ownerInfo": {
   "updated": "2020-06-28T17:30:50.159Z",
   "ownerData": [
    {
     "OWNERNAME": "FROEDER PHILIP C",
     "PREMISEADD": "1742 CORCORAN ST NW",
     "UNITNUMBER": "",
     "SSL": "0155    0154",
     "USECODE": "024",
     "HSTDCODE": "",
     "CLASSTYPE": "001",
     "TAXRATE": "0.0085",
     "SALEPRICE": "",
     "SALEDATE": "02/10/1998",
     "INSTNO": "",
     "ACCEPTCODE": "",
     "DEEDDATE": "02/10/1998",
     "OWNNAME2": "",
     "CPMS_ADDRESS": "1742 CORCORAN ST NW",
     "CAREOFNAME": "",
     "ADDRESS1": "1742 CORCORAN ST NW",
     "ADDRESS2": "",
     "CITYSTZIP": "WASHINGTON                 DC 20009-2471",
     "SALEDATE_NET": "1998/02/10",
     "DEEDDATE_NET": "1998/02/10"
    }
   ]
  },
  "addressDetails": {
   "updated": "2020-06-28T18:12:28.038Z",
   "addressData": [
    {
     "ADDRESS_ID": "241668",
     "MARID": "241668",
     "STATUS": "ACTIVE",
     "FULLADDRESS": "1742 CORCORAN STREET NW",
     "ADDRNUM": "1742",
     "ADDRNUMSUFFIX": "",
     "STNAME": "CORCORAN",
     "STREET_TYPE": "STREET",
     "QUADRANT": "NW",
     "CITY": "WASHINGTON",
     "STATE": "DC",
     "XCOORD": "396523.96",
     "YCOORD": "138206.06",
     "SSL": "0155    0154",
     "ANC": "ANC 2B",
     "PSA": "Police Service Area 301",
     "WARD": "Ward 2",
     "NBHD_ACTION": " ",
     "CLUSTER_": "Cluster 6",
     "POLDIST": "Police District - Third District",
     "ROC": "Police Sector 3D3",
     "CENSUS_TRACT": "005301",
     "VOTE_PRCNCT": "Precinct 15",
     "SMD": "SMD 2B03",
     "ZIPCODE": "20009",
     "NATIONALGRID": "18S UJ 23119 08958",
     "ROADWAYSEGID": "2266",
     "FOCUS_IMPROVEMENT_AREA": "NA",
     "HAS_ALIAS": "N",
     "HAS_CONDO_UNIT": "N",
     "HAS_RES_UNIT": "Y",
     "HAS_SSL": "Y",
     "LATITUDE": "38.91171115",
     "LONGITUDE": "-77.04007904",
     "STREETVIEWURL": "http://maps.google.com/maps?z=16&layer=c&cbll=38.91171115,-77.04007904&cbp=11,187.940334710724,,0,2.09",
     "RES_TYPE": "RESIDENTIAL",
     "WARD_2002": "Ward 2",
     "WARD_2012": "Ward 2",
     "ANC_2002": "ANC 2B",
     "ANC_2012": "ANC 2B",
     "SMD_2002": "SMD 2B03",
     "SMD_2012": "SMD 2B03",
     "IMAGEURL": "http://citizenatlas.dc.gov/mobilevideo",
     "IMAGEDIR": "20040805",
     "IMAGENAME": "Q5090411.jpg",
     "ConfidenceLevel": "100",
     "Zoning": "RA-8"
    }
   ]
  },
  "licenseDetails": {
   "updated": "2020-06-28T18:37:37.231Z",
   "licenseData": [
    {
     "ADDRESS": "1742  CORCORAN ST NW",
     "UNIT": "",
     "SSL": "0155    0154",
     "CUST_NUM": "14865",
     "DECRIPTION": "Housing: Residential",
     "ENDORSEMENT_DESC": "Apartment",
     "LAST_NAME": "FROEDER",
     "FIRST_NAME": "PHILIP",
     "CORP_NAME": "",
     "TRADE_NAME": "",
     "BEGIN_RENEWAL": "Nov  1 2001 12:00AM",
     "END_RENEWAL": "Oct 31 2001 12:00AM",
     "STATUS": "Expired",
     "BEGIN_RENEWAL_NET": "2001/11/01",
     "END_RENEWAL_NET": "2001/10/31"
    },
    {
     "ADDRESS": "1742  CORCORAN ST NW",
     "UNIT": "",
     "SSL": "0155    0154",
     "CUST_NUM": "50003725",
     "DECRIPTION": "Housing: Residential",
     "ENDORSEMENT_DESC": "Apartment",
     "LAST_NAME": "FROEDER",
     "FIRST_NAME": "PHILIP",
     "CORP_NAME": "",
     "TRADE_NAME": "",
     "BEGIN_RENEWAL": "Nov  1 2001 12:00AM",
     "END_RENEWAL": "Oct 31 2001 12:00AM",
     "STATUS": "Expired",
     "BEGIN_RENEWAL_NET": "2001/11/01",
     "END_RENEWAL_NET": "2001/10/31"
    },
    {
     "ADDRESS": "1742  CORCORAN ST NW",
     "UNIT": "",
     "SSL": "0155    0154",
     "CUST_NUM": "65005325",
     "DECRIPTION": "Housing: Residential",
     "ENDORSEMENT_DESC": "Apartment",
     "LAST_NAME": "FROEDER",
     "FIRST_NAME": "PHILIP",
     "CORP_NAME": "",
     "TRADE_NAME": "",
     "BEGIN_RENEWAL": "Oct  1 2007 12:00AM",
     "END_RENEWAL": "Sep 30 2009 12:00AM",
     "STATUS": "Expired",
     "BEGIN_RENEWAL_NET": "2007/10/01",
     "END_RENEWAL_NET": "2009/09/30"
    }
   ]
  },
  "permitDetails": {
   "updated": "2020-06-28T18:59:36.512Z",
   "permitData": []
  },
  "inspectionDetails": {
   "updated": "2020-06-28T18:59:36.679Z",
   "inspectionData": []
  },
  "occupancyDetails": {
   "updated": "2020-06-28T18:59:36.857Z",
   "occupancyData": []
  },
  "charDetails": {
   "updated": "2020-06-28T19:54:04.190Z",
   "charData": [
    {
     "PREMISEADD": "1742 CORCORAN ST NW",
     "SSL": "0155    0154",
     "BLDG_NUM": "1",
     "COMPLX_NUM": "",
     "UNITNUMBER": "",
     "NUM_UNITS": "0",
     "AYB": "1885",
     "STRUCT_CL_": "",
     "STYLE_D": "3 Story",
     "STRUCT_D": "Row ",
     "GBA": "4188",
     "EXTWALL_D": "Common Brick",
     "WALL_HGT": "",
     "ROOF_D": "Buil",
     "BATHRM": "3",
     "HF_BATHRM": "1",
     "HEAT_D": "Forc",
     "AC": "Y",
     "INTWALL_D": "Hardwood",
     "ROOMS": "9",
     "BEDRM": "5",
     "KITCHENS": "4",
     "FIREPLACES": "1",
     "YR_RMDL": "1968",
     "EYB": "1957",
     "STORIES": "3",
     "OWNERNAME": "FROEDER PHILIP C",
     "OWNNAME2": "",
     "CAREOFNAME": ""
    }
   ]
  },
  "taxData": {
   "ssl": "0155    0154",
   "address": "1742 CORCORAN ST NW",
   "owner": "FROEDER PHILIP C",
   "neighborhood": "OLD CITY II",
   "sub_neighborhood": "D",
   "use_code": "24",
   "sale_price": "$.00",
   "recordation_date": "02/10/1998",
   "2016_Assessment": "$1,149,900.00"
  }
 },
 "1747 CORCORAN STREET NW": {
  "ownerInfo": {
   "updated": "2020-06-28T17:30:51.581Z",
   "ownerData": [
    {
     "OWNERNAME": "ALVARO J MESTRE",
     "PREMISEADD": "1747 CORCORAN ST NW",
     "UNITNUMBER": "",
     "SSL": "0155    0840",
     "USECODE": "024",
     "HSTDCODE": "1",
     "CLASSTYPE": "001",
     "TAXRATE": "0.0085",
     "SALEPRICE": "$1,450,000.00",
     "SALEDATE": "05/07/2004",
     "INSTNO": "",
     "ACCEPTCODE": "MARKET",
     "DEEDDATE": "05/07/2004",
     "OWNNAME2": "EDWARD A JOHNSON",
     "CPMS_ADDRESS": "1747 CORCORAN ST NW",
     "CAREOFNAME": "",
     "ADDRESS1": "1747 CORCORAN ST NW",
     "ADDRESS2": "",
     "CITYSTZIP": "WASHINGTON                 DC 20009-2405",
     "SALEDATE_NET": "2004/05/07",
     "DEEDDATE_NET": "2004/05/07"
    }
   ]
  },
  "addressDetails": {
   "updated": "2020-06-28T18:12:29.572Z",
   "addressData": [
    {
     "ADDRESS_ID": "241718",
     "MARID": "241718",
     "STATUS": "ACTIVE",
     "FULLADDRESS": "1747 CORCORAN STREET NW",
     "ADDRNUM": "1747",
     "ADDRNUMSUFFIX": "",
     "STNAME": "CORCORAN",
     "STREET_TYPE": "STREET",
     "QUADRANT": "NW",
     "CITY": "WASHINGTON",
     "STATE": "DC",
     "XCOORD": "396509.88",
     "YCOORD": "138240.15",
     "SSL": "0155    0840",
     "ANC": "ANC 2B",
     "PSA": "Police Service Area 301",
     "WARD": "Ward 2",
     "NBHD_ACTION": " ",
     "CLUSTER_": "Cluster 6",
     "POLDIST": "Police District - Third District",
     "ROC": "Police Sector 3D3",
     "CENSUS_TRACT": "005301",
     "VOTE_PRCNCT": "Precinct 15",
     "SMD": "SMD 2B03",
     "ZIPCODE": "20009",
     "NATIONALGRID": "18S UJ 23105 08992",
     "ROADWAYSEGID": "2266",
     "FOCUS_IMPROVEMENT_AREA": "NA",
     "HAS_ALIAS": "N",
     "HAS_CONDO_UNIT": "N",
     "HAS_RES_UNIT": "Y",
     "HAS_SSL": "Y",
     "LATITUDE": "38.91201819",
     "LONGITUDE": "-77.04024156",
     "STREETVIEWURL": "http://maps.google.com/maps?z=16&layer=c&cbll=38.91201819,-77.04024156&cbp=11,345.862236310339,,0,2.09",
     "RES_TYPE": "RESIDENTIAL",
     "WARD_2002": "Ward 2",
     "WARD_2012": "Ward 2",
     "ANC_2002": "ANC 2B",
     "ANC_2012": "ANC 2B",
     "SMD_2002": "SMD 2B03",
     "SMD_2012": "SMD 2B03",
     "IMAGEURL": "http://citizenatlas.dc.gov/mobilevideo",
     "IMAGEDIR": "20040802",
     "IMAGENAME": "Q2113042.jpg",
     "ConfidenceLevel": "100",
     "Zoning": "RA-8"
    }
   ]
  },
  "licenseDetails": {
   "updated": "2020-06-28T18:37:40.821Z",
   "licenseData": [
    {
     "ADDRESS": "1747  CORCORAN ST NW",
     "UNIT": "",
     "SSL": "0155    0840",
     "CUST_NUM": "64001079",
     "DECRIPTION": "Housing: Residential",
     "ENDORSEMENT_DESC": "Two Family Rental",
     "LAST_NAME": "& EDWARD A JOHNSON",
     "FIRST_NAME": "ALVARO J MESTRE",
     "CORP_NAME": "",
     "TRADE_NAME": "",
     "BEGIN_RENEWAL": "Jul  1 2018 12:00AM",
     "END_RENEWAL": "Jun 30 2020 12:00AM",
     "STATUS": "Ready to Renew",
     "BEGIN_RENEWAL_NET": "2018/07/01",
     "END_RENEWAL_NET": "2020/06/30"
    }
   ]
  },
  "permitDetails": {
   "updated": "2020-06-28T18:59:42.713Z",
   "permitData": [
    {
     "FULL_ADDRESS": "1747 CORCORAN ST NW, WASHINGTON, DC 20009",
     "B1_UNIT_START": "",
     "SSL": "0155    0840",
     "B1_ALT_ID": "B1908159",
     "TYPE": "Construction/Alteration and Repair",
     "G6_STAT_DD": "May 16 2019 12:00AM",
     "B1_APPL_STATUS": "Permit Issued",
     "B1_APPL_STATUS_DATE": "05/16/2019",
     "DESC_OF_WORK": "REMOVE OLD ROOF MEMBRANE AND ROOF DECK TO REPLACE BROKEN BEAM AND INSTALL NEW LVL'S, RAFTERS AND SHEETHS . INSTALL NEW FIBERTITE MATERIAL OFF WHITE COLOR",
     "SORT_DATE": null,
     "G6_STAT_DD_NET": "2019/05/16",
     "B1_APPL_STATUS_DATE_NET": "2019/05/16",
     "JOB_CLASS_CODE": "WT",
     "JOB_SIZE": "N/A",
     "JOB_CLASSIFICATION": "N/A",
     "JOB_REVIEW_TIME": "N/A",
     "OWNER_NAME": "eddie johnson",
     "OWNER_FULL_NAME": "eddie johnson",
     "APPLICANT_NAME": "GERARDO  PEREZ; GERARDO  PEREZ",
     "TRADE_NAME": "",
     "PERMIT_STATUS": [
      {
       "REVIEW_STATUS": "Application Accepted",
       "DISCIPLINE": "Plan Review Coordinator",
       "REVIEW_STATUS_DATE": "04/12/2019"
      },
      {
       "REVIEW_STATUS": "HPRB Review Approved",
       "DISCIPLINE": "HPRB Review",
       "REVIEW_STATUS_DATE": "05/16/2019"
      },
      {
       "REVIEW_STATUS": "Permit Issued",
       "DISCIPLINE": "Issue Permit",
       "REVIEW_STATUS_DATE": "05/16/2019"
      },
      {
       "REVIEW_STATUS": "Structural Review Approved",
       "DISCIPLINE": "Structural Review",
       "REVIEW_STATUS_DATE": "05/16/2019"
      }
     ]
    },
    {
     "FULL_ADDRESS": "1747 CORCORAN ST NW, WASHINGTON, DC 20009",
     "B1_UNIT_START": "",
     "SSL": "0155    0840",
     "B1_ALT_ID": "B1913660",
     "TYPE": "Construction/Alteration and Repair",
     "G6_STAT_DD": "Aug 19 2019 12:00AM",
     "B1_APPL_STATUS": "Permit Issued",
     "B1_APPL_STATUS_DATE": "08/19/2019",
     "DESC_OF_WORK": "replace and repair the rotted wood on an existing deck to replace floor boards.  Replace railing with Key-Link aluminum railing 42 inches tall above deck.",
     "SORT_DATE": null,
     "G6_STAT_DD_NET": "2019/08/19",
     "B1_APPL_STATUS_DATE_NET": "2019/08/19",
     "JOB_CLASS_CODE": "WT",
     "JOB_SIZE": "N/A",
     "JOB_CLASSIFICATION": "N/A",
     "JOB_REVIEW_TIME": "N/A",
     "OWNER_NAME": "EDWARD A JOHNSON",
     "OWNER_FULL_NAME": "EDWARD A JOHNSON",
     "APPLICANT_NAME": "EDWARD A JOHNSON; EDWARD A JOHNSON",
     "TRADE_NAME": "",
     "PERMIT_STATUS": [
      {
       "REVIEW_STATUS": "Application Accepted",
       "DISCIPLINE": "Plan Review Coordinator",
       "REVIEW_STATUS_DATE": "08/19/2019"
      },
      {
       "REVIEW_STATUS": "HPRB Review Approved",
       "DISCIPLINE": "HPRB Review",
       "REVIEW_STATUS_DATE": "08/19/2019"
      },
      {
       "REVIEW_STATUS": "Permit Issued",
       "DISCIPLINE": "Issue Permit",
       "REVIEW_STATUS_DATE": "08/19/2019"
      },
      {
       "REVIEW_STATUS": "Structural Review Approved",
       "DISCIPLINE": "Structural Review",
       "REVIEW_STATUS_DATE": "08/19/2019"
      }
     ]
    },
    {
     "FULL_ADDRESS": "1747 CORCORAN ST NW, WASHINGTON, DC 20009",
     "B1_UNIT_START": "",
     "SSL": "0155    0840",
     "B1_ALT_ID": "B1913868",
     "TYPE": "Construction/Alteration and Repair",
     "G6_STAT_DD": "Aug 23 2019 12:00AM",
     "B1_APPL_STATUS": "Permit Issued",
     "B1_APPL_STATUS_DATE": "08/23/2019",
     "DESC_OF_WORK": "REMOVE OLD ROOF MEMBRANE ON REAR LOWER ROOF AND REPLACE WITH FIBERTITE MEMBRANE ON OFF WHITE COLOR",
     "SORT_DATE": null,
     "G6_STAT_DD_NET": "2019/08/23",
     "B1_APPL_STATUS_DATE_NET": "2019/08/23",
     "JOB_CLASS_CODE": "WT",
     "JOB_SIZE": "N/A",
     "JOB_CLASSIFICATION": "N/A",
     "JOB_REVIEW_TIME": "N/A",
     "OWNER_NAME": "EDWARD A JOHNSON",
     "OWNER_FULL_NAME": "EDWARD A JOHNSON",
     "APPLICANT_NAME": "GERARDO  PEREZ; GERARDO  PEREZ",
     "TRADE_NAME": "",
     "PERMIT_STATUS": [
      {
       "REVIEW_STATUS": "Application Accepted",
       "DISCIPLINE": "Plan Review Coordinator",
       "REVIEW_STATUS_DATE": "08/23/2019"
      },
      {
       "REVIEW_STATUS": "HPRB Review Approved",
       "DISCIPLINE": "HPRB Review",
       "REVIEW_STATUS_DATE": "08/23/2019"
      },
      {
       "REVIEW_STATUS": "Permit Issued",
       "DISCIPLINE": "Issue Permit",
       "REVIEW_STATUS_DATE": "08/23/2019"
      },
      {
       "REVIEW_STATUS": "Structural Review Approved",
       "DISCIPLINE": "Structural Review",
       "REVIEW_STATUS_DATE": "08/23/2019"
      }
     ]
    }
   ]
  },
  "inspectionDetails": {
   "updated": "2020-06-28T18:59:42.911Z",
   "inspectionData": []
  },
  "occupancyDetails": {
   "updated": "2020-06-28T18:59:43.078Z",
   "occupancyData": [
    {
     "FULL_ADDRESS": "1747 CORCORAN ST NW, WASHINGTON, DC 20009-2405",
     "B1_UNIT_START": "",
     "SSL": "",
     "B1_ALT_ID": "CO72346",
     "TYPE": "Certificate of Occupancy",
     "G6_STAT_DD": "03/17/2004",
     "B1_APPL_STATUS": "Completed",
     "B1_APPL_STATUS_DATE": "          ",
     "DESC_OF_WORK": "",
     "G6_STAT_DD_NET": "2004/03/17",
     "B1_APPL_STATUS_DATE_NET": "",
     "OWNER_FULL_NAME": "EICHMANN",
     "APPLICANT": ""
    },
    {
     "FULL_ADDRESS": "1747 CORCORAN ST NW, WASHINGTON, DC 20009-2405",
     "B1_UNIT_START": "",
     "SSL": "",
     "B1_ALT_ID": "CO80370",
     "TYPE": "Certificate of Occupancy",
     "G6_STAT_DD": "07/26/2004",
     "B1_APPL_STATUS": "Completed",
     "B1_APPL_STATUS_DATE": "          ",
     "DESC_OF_WORK": "",
     "G6_STAT_DD_NET": "2004/07/26",
     "B1_APPL_STATUS_DATE_NET": "",
     "OWNER_FULL_NAME": "EICHMANN",
     "APPLICANT": ""
    }
   ]
  },
  "charDetails": {
   "updated": "2020-06-28T19:54:05.576Z",
   "charData": [
    {
     "PREMISEADD": "1747 CORCORAN ST NW",
     "SSL": "0155    0840",
     "BLDG_NUM": "1",
     "COMPLX_NUM": "",
     "UNITNUMBER": "",
     "NUM_UNITS": "0",
     "AYB": "1885",
     "STRUCT_CL_": "",
     "STYLE_D": "3 Story",
     "STRUCT_D": "Row ",
     "GBA": "4805",
     "EXTWALL_D": "Common Brick",
     "WALL_HGT": "",
     "ROOF_D": "Meta",
     "BATHRM": "4",
     "HF_BATHRM": "1",
     "HEAT_D": "Warm",
     "AC": "Y",
     "INTWALL_D": "Hardwood",
     "ROOMS": "11",
     "BEDRM": "5",
     "KITCHENS": "2",
     "FIREPLACES": "2",
     "YR_RMDL": "1989",
     "EYB": "1966",
     "STORIES": "3",
     "OWNERNAME": "ALVARO J MESTRE",
     "OWNNAME2": "EDWARD A JOHNSON",
     "CAREOFNAME": ""
    }
   ]
  },
  "taxData": {
   "ssl": "0155    0840",
   "address": "1747 CORCORAN ST NW",
   "owner": "ALVARO J MESTRE",
   "neighborhood": "OLD CITY II",
   "sub_neighborhood": "D",
   "use_code": "24",
   "sale_price": "$1,450,000.00",
   "recordation_date": "05/07/2004",
   "2016_Assessment": "$1,508,800.00"
  }
 },
 "1759 Q STREET NW": {
  "ownerInfo": {
   "updated": "2020-06-28T17:30:54.007Z",
   "ownerData": [
    {
     "OWNERNAME": "CESAR A CACERES",
     "PREMISEADD": "1759 Q ST NW",
     "UNITNUMBER": "",
     "SSL": "0155    0206",
     "USECODE": "082",
     "HSTDCODE": "",
     "CLASSTYPE": "",
     "TAXRATE": "0",
     "SALEPRICE": "",
     "SALEDATE": "",
     "INSTNO": "",
     "ACCEPTCODE": "",
     "DEEDDATE": "",
     "OWNNAME2": "",
     "CPMS_ADDRESS": "1759 Q ST NW",
     "CAREOFNAME": "",
     "ADDRESS1": "2500 VIRGINIA AVE NW # 7145",
     "ADDRESS2": "",
     "CITYSTZIP": "WASHINGTON                 DC 20037-1901",
     "SALEDATE_NET": "",
     "DEEDDATE_NET": ""
    }
   ]
  },
  "addressDetails": {
   "updated": "2020-06-28T18:12:32.660Z",
   "addressData": [
    {
     "ADDRESS_ID": "241692",
     "MARID": "241692",
     "STATUS": "ACTIVE",
     "FULLADDRESS": "1759 Q STREET NW",
     "ADDRNUM": "1759",
     "ADDRNUMSUFFIX": "",
     "STNAME": "Q",
     "STREET_TYPE": "STREET",
     "QUADRANT": "NW",
     "CITY": "WASHINGTON",
     "STATE": "DC",
     "XCOORD": "396454.65",
     "YCOORD": "138161.70",
     "SSL": "0155    0206",
     "ANC": "ANC 2B",
     "PSA": "Police Service Area 301",
     "WARD": "Ward 2",
     "NBHD_ACTION": " ",
     "CLUSTER_": "Cluster 6",
     "POLDIST": "Police District - Third District",
     "ROC": "Police Sector 3D3",
     "CENSUS_TRACT": "005301",
     "VOTE_PRCNCT": "Precinct 15",
     "SMD": "SMD 2B03",
     "ZIPCODE": "20009",
     "NATIONALGRID": "18S UJ 23048 08915",
     "ROADWAYSEGID": "19819",
     "FOCUS_IMPROVEMENT_AREA": "NA",
     "HAS_ALIAS": "N",
     "HAS_CONDO_UNIT": "N",
     "HAS_RES_UNIT": "N",
     "HAS_SSL": "Y",
     "LATITUDE": "38.91131126",
     "LONGITUDE": "-77.04087796",
     "STREETVIEWURL": "http://maps.google.com/maps?z=16&layer=c&cbll=38.91131126,-77.04087796&cbp=11,345.563642238695,,0,2.09",
     "RES_TYPE": "NON RESIDENTIAL",
     "WARD_2002": "Ward 2",
     "WARD_2012": "Ward 2",
     "ANC_2002": "ANC 2B",
     "ANC_2012": "ANC 2B",
     "SMD_2002": "SMD 2B03",
     "SMD_2012": "SMD 2B03",
     "IMAGEURL": "http://citizenatlas.dc.gov/mobilevideo",
     "IMAGEDIR": "20040805",
     "IMAGENAME": "Q5093506.jpg",
     "ConfidenceLevel": "100",
     "Zoning": "RA-8"
    }
   ]
  },
  "licenseDetails": {
   "updated": "2020-06-28T18:37:48.989Z",
   "licenseData": [
    {
     "ADDRESS": "1759  Q ST NW",
     "UNIT": "",
     "SSL": "0155    0206",
     "CUST_NUM": "50008787",
     "DECRIPTION": "General Business",
     "ENDORSEMENT_DESC": "Charitable Solicitation",
     "LAST_NAME": "",
     "FIRST_NAME": "",
     "CORP_NAME": "THE PAN AMERICAN MEDICAL SOCIETY OF WASHINGTON DC",
     "TRADE_NAME": "",
     "BEGIN_RENEWAL": "Nov  6 2002 12:00AM",
     "END_RENEWAL": "Aug 31 2003 12:00AM",
     "STATUS": "Expired",
     "BEGIN_RENEWAL_NET": "2002/11/06",
     "END_RENEWAL_NET": "2003/08/31"
    },
    {
     "ADDRESS": "1759  Q ST NW",
     "UNIT": "",
     "SSL": "0155    0206",
     "CUST_NUM": "53006722",
     "DECRIPTION": "General Business",
     "ENDORSEMENT_DESC": "Charitable Solicitation",
     "LAST_NAME": "",
     "FIRST_NAME": "",
     "CORP_NAME": "INSTITUTE FOR TECHNOLOGY IN HEALTH CARE",
     "TRADE_NAME": "",
     "BEGIN_RENEWAL": "Sep  1 2019 12:00AM",
     "END_RENEWAL": "Aug 31 2021 12:00AM",
     "STATUS": "Active",
     "BEGIN_RENEWAL_NET": "2019/09/01",
     "END_RENEWAL_NET": "2021/08/31"
    }
   ]
  },
  "permitDetails": {
   "updated": "2020-06-28T18:59:56.459Z",
   "permitData": [
    {
     "FULL_ADDRESS": "1759 Q ST NW, WASHINGTON, DC 20009",
     "B1_UNIT_START": "",
     "SSL": "0155    0206",
     "B1_ALT_ID": "A0900093",
     "TYPE": "Construction/Awning",
     "G6_STAT_DD": "Oct 21 2009 12:00AM",
     "B1_APPL_STATUS": "Permit Issued",
     "B1_APPL_STATUS_DATE": "10/21/2009",
     "DESC_OF_WORK": "AWNING 5FT BY 3 FT AWNING AT FRONT ENTRANCE",
     "SORT_DATE": null,
     "G6_STAT_DD_NET": "2009/10/21",
     "B1_APPL_STATUS_DATE_NET": "2009/10/21",
     "JOB_CLASS_CODE": "WT",
     "JOB_SIZE": "N/A",
     "JOB_CLASSIFICATION": "N/A",
     "JOB_REVIEW_TIME": "N/A",
     "OWNER_NAME": "CESAR A CACERES",
     "OWNER_FULL_NAME": "CESAR A CACERES",
     "APPLICANT_NAME": "DAVID  MARSHALL",
     "TRADE_NAME": "",
     "PERMIT_STATUS": [
      {
       "REVIEW_STATUS": "Application Accepted",
       "DISCIPLINE": "Plan Review Coordinator",
       "REVIEW_STATUS_DATE": "08/31/2009"
      },
      {
       "REVIEW_STATUS": "Comments Submitted to the Applicant for Correction",
       "DISCIPLINE": "Zoning Review Pending",
       "REVIEW_STATUS_DATE": "09/24/2009"
      },
      {
       "REVIEW_STATUS": "DDOT Review Approved",
       "DISCIPLINE": "DDOT Review (Public Space)",
       "REVIEW_STATUS_DATE": "10/21/2009"
      },
      {
       "REVIEW_STATUS": "HPRB Review Approved",
       "DISCIPLINE": "HPRB Review",
       "REVIEW_STATUS_DATE": "09/24/2009"
      },
      {
       "REVIEW_STATUS": "Permit Issued",
       "DISCIPLINE": "Issue Permit",
       "REVIEW_STATUS_DATE": "10/21/2009"
      },
      {
       "REVIEW_STATUS": "Structural Review Approved",
       "DISCIPLINE": "Structural Review",
       "REVIEW_STATUS_DATE": "09/24/2009"
      }
     ]
    },
    {
     "FULL_ADDRESS": "1759 Q ST NW, WASHINGTON, DC 20009",
     "B1_UNIT_START": "",
     "SSL": "0155    0206",
     "B1_ALT_ID": "E0907290",
     "TYPE": "Supplemental/Electrical",
     "G6_STAT_DD": "Sep  3 2009 12:00AM",
     "B1_APPL_STATUS": "Permit Issued",
     "B1_APPL_STATUS_DATE": "09/03/2009",
     "DESC_OF_WORK": "",
     "SORT_DATE": null,
     "G6_STAT_DD_NET": "2009/09/03",
     "B1_APPL_STATUS_DATE_NET": "2009/09/03",
     "JOB_CLASS_CODE": "N/A",
     "JOB_SIZE": "N/A",
     "JOB_CLASSIFICATION": "N/A",
     "JOB_REVIEW_TIME": "N/A",
     "OWNER_NAME": "CESAR A CACERES",
     "OWNER_FULL_NAME": "CESAR A CACERES",
     "APPLICANT_NAME": "RALPH E. THREATT",
     "TRADE_NAME": "",
     "PERMIT_STATUS": [
      {
       "REVIEW_STATUS": "",
       "DISCIPLINE": "",
       "REVIEW_STATUS_DATE": ""
      }
     ]
    }
   ]
  },
  "inspectionDetails": {
   "updated": "2020-06-28T18:59:56.745Z",
   "inspectionData": [
    {
     "ADDRESS": "1759 Q ST NW, WASHINGTON, DC 20009",
     "UNIT": "",
     "SSL": "0155    0206",
     "ID": "E0907290",
     "G6_ACT_DES": "Electrical - TPF",
     "G6_STATUS": "Approved",
     "G6_STATUS_DD": "9/15/2009 12:00:00 AM",
     "DESC_OF_WORK": "",
     "G6_STATUS_DD_NET": "2009/09/15",
     "OWNER_FULL_NAME": "CESAR A CACERES",
     "APPLICANT": "RALPH E. THREATT"
    }
   ]
  },
  "occupancyDetails": {
   "updated": "2020-06-28T18:59:57.108Z",
   "occupancyData": []
  },
  "charDetails": {
   "updated": "2020-06-28T19:54:08.253Z",
   "charData": [
    {
     "PREMISEADD": "1759 Q ST NW",
     "SSL": "0155    0206",
     "BLDG_NUM": "1",
     "COMPLX_NUM": "",
     "UNITNUMBER": "",
     "NUM_UNITS": "",
     "AYB": "1885",
     "STRUCT_CL_": "Brick/Concr",
     "STYLE_D": "",
     "STRUCT_D": "",
     "GBA": "4849",
     "EXTWALL_D": "Concrete",
     "WALL_HGT": "12.00",
     "ROOF_D": "",
     "BATHRM": "",
     "HF_BATHRM": "",
     "HEAT_D": "",
     "AC": "",
     "INTWALL_D": "",
     "ROOMS": "",
     "BEDRM": "",
     "KITCHENS": "",
     "FIREPLACES": "",
     "YR_RMDL": "",
     "EYB": "1970",
     "STORIES": "",
     "OWNERNAME": "CESAR A CACERES",
     "OWNNAME2": "",
     "CAREOFNAME": ""
    }
   ]
  },
  "taxData": {
   "ssl": "0155    0206",
   "address": "1759 Q ST NW",
   "owner": "CESAR A CACERES",
   "neighborhood": "OLD CITY II",
   "sub_neighborhood": "D",
   "use_code": "82",
   "sale_price": "$.00",
   "recordation_date": "N/A",
   "2016_Assessment": "$1,671,310.00"
  }
 },
 "1764 CORCORAN STREET NW": {
  "ownerInfo": {
   "updated": "2020-06-28T17:30:54.469Z",
   "ownerData": [
    {
     "OWNERNAME": "FRANK V HEKIMIAN",
     "PREMISEADD": "1764 CORCORAN ST NW",
     "UNITNUMBER": "",
     "SSL": "0155    0061",
     "USECODE": "024",
     "HSTDCODE": "1",
     "CLASSTYPE": "001",
     "TAXRATE": "0.0085",
     "SALEPRICE": "",
     "SALEDATE": "01/30/2004",
     "INSTNO": "",
     "ACCEPTCODE": "BUYER=SELLER",
     "DEEDDATE": "01/30/2004",
     "OWNNAME2": "",
     "CPMS_ADDRESS": "1764 CORCORAN ST NW",
     "CAREOFNAME": "",
     "ADDRESS1": "1764 CORCORAN ST NW",
     "ADDRESS2": "",
     "CITYSTZIP": "WASHINGTON                 DC 20009-2406",
     "SALEDATE_NET": "2004/01/30",
     "DEEDDATE_NET": "2004/01/30"
    }
   ]
  },
  "addressDetails": {
   "updated": "2020-06-28T18:12:33.201Z",
   "addressData": [
    {
     "ADDRESS_ID": "241654",
     "MARID": "241654",
     "STATUS": "ACTIVE",
     "FULLADDRESS": "1764 CORCORAN STREET NW",
     "ADDRNUM": "1764",
     "ADDRNUMSUFFIX": "",
     "STNAME": "CORCORAN",
     "STREET_TYPE": "STREET",
     "QUADRANT": "NW",
     "CITY": "WASHINGTON",
     "STATE": "DC",
     "XCOORD": "396459.66",
     "YCOORD": "138208.49",
     "SSL": "0155    0061",
     "ANC": "ANC 2B",
     "PSA": "Police Service Area 301",
     "WARD": "Ward 2",
     "NBHD_ACTION": " ",
     "CLUSTER_": "Cluster 6",
     "POLDIST": "Police District - Third District",
     "ROC": "Police Sector 3D3",
     "CENSUS_TRACT": "005301",
     "VOTE_PRCNCT": "Precinct 15",
     "SMD": "SMD 2B03",
     "ZIPCODE": "20009",
     "NATIONALGRID": "18S UJ 23054 08961",
     "ROADWAYSEGID": "19890",
     "FOCUS_IMPROVEMENT_AREA": "NA",
     "HAS_ALIAS": "N",
     "HAS_CONDO_UNIT": "N",
     "HAS_RES_UNIT": "Y",
     "HAS_SSL": "Y",
     "LATITUDE": "38.91173278",
     "LONGITUDE": "-77.04082044",
     "STREETVIEWURL": "http://maps.google.com/maps?z=16&layer=c&cbll=38.91173278,-77.04082044&cbp=11,199.387330905529,,0,2.09",
     "RES_TYPE": "RESIDENTIAL",
     "WARD_2002": "Ward 2",
     "WARD_2012": "Ward 2",
     "ANC_2002": "ANC 2B",
     "ANC_2012": "ANC 2B",
     "SMD_2002": "SMD 2B03",
     "SMD_2012": "SMD 2B03",
     "IMAGEURL": "http://citizenatlas.dc.gov/mobilevideo",
     "IMAGEDIR": "20040805",
     "IMAGENAME": "Q5090928.jpg",
     "ConfidenceLevel": "100",
     "Zoning": "RA-8"
    }
   ]
  },
  "licenseDetails": {
   "updated": "2020-06-28T18:37:50.336Z",
   "licenseData": [
    {
     "ADDRESS": "1764  CORCORAN ST NW",
     "UNIT": "",
     "SSL": "0155    0061",
     "CUST_NUM": "39801185",
     "DECRIPTION": "Housing: Residential",
     "ENDORSEMENT_DESC": "Apartment",
     "LAST_NAME": "HEKIMIAN",
     "FIRST_NAME": "CHRIS",
     "CORP_NAME": "",
     "TRADE_NAME": "",
     "BEGIN_RENEWAL": "Nov  1 2019 12:00AM",
     "END_RENEWAL": "Oct 31 2021 12:00AM",
     "STATUS": "Active",
     "BEGIN_RENEWAL_NET": "2019/11/01",
     "END_RENEWAL_NET": "2021/10/31"
    }
   ]
  },
  "permitDetails": {
   "updated": "2020-06-28T18:59:58.320Z",
   "permitData": []
  },
  "inspectionDetails": {
   "updated": "2020-06-28T18:59:58.500Z",
   "inspectionData": []
  },
  "occupancyDetails": {
   "updated": "2020-06-28T18:59:58.665Z",
   "occupancyData": []
  },
  "charDetails": {
   "updated": "2020-06-28T19:54:08.705Z",
   "charData": [
    {
     "PREMISEADD": "1764 CORCORAN ST NW",
     "SSL": "0155    0061",
     "BLDG_NUM": "1",
     "COMPLX_NUM": "",
     "UNITNUMBER": "",
     "NUM_UNITS": "0",
     "AYB": "1885",
     "STRUCT_CL_": "",
     "STYLE_D": "3 Story",
     "STRUCT_D": "Row ",
     "GBA": "3832",
     "EXTWALL_D": "Common Brick",
     "WALL_HGT": "",
     "ROOF_D": "Meta",
     "BATHRM": "4",
     "HF_BATHRM": "0",
     "HEAT_D": "Warm",
     "AC": "Y",
     "INTWALL_D": "Hardwood",
     "ROOMS": "12",
     "BEDRM": "6",
     "KITCHENS": "4",
     "FIREPLACES": "4",
     "YR_RMDL": "1995",
     "EYB": "1957",
     "STORIES": "3",
     "OWNERNAME": "FRANK V HEKIMIAN",
     "OWNNAME2": "",
     "CAREOFNAME": ""
    }
   ]
  },
  "taxData": {
   "ssl": "0155    0061",
   "address": "1764 CORCORAN ST NW",
   "owner": "FRANK V HEKIMIAN",
   "neighborhood": "OLD CITY II",
   "sub_neighborhood": "D",
   "use_code": "24",
   "sale_price": "$.00",
   "recordation_date": "01/30/2004",
   "2016_Assessment": "$1,189,030.00"
  }
 },
 "1702 S STREET NW": {
  "ownerInfo": {
   "updated": "2020-06-28T17:30:55.649Z",
   "ownerData": [
    {
     "OWNERNAME": "H H SHANER",
     "PREMISEADD": "1702 S ST NW",
     "UNITNUMBER": "",
     "SSL": "0154    0032",
     "USECODE": "024",
     "HSTDCODE": "1",
     "CLASSTYPE": "001",
     "TAXRATE": "0.0085",
     "SALEPRICE": "",
     "SALEDATE": "",
     "INSTNO": "",
     "ACCEPTCODE": "",
     "DEEDDATE": "",
     "OWNNAME2": "",
     "CPMS_ADDRESS": "1702 S ST NW",
     "CAREOFNAME": "",
     "ADDRESS1": "1702 S ST NW",
     "ADDRESS2": "",
     "CITYSTZIP": "WASHINGTON                 DC 20009-6116",
     "SALEDATE_NET": "",
     "DEEDDATE_NET": ""
    }
   ]
  },
  "addressDetails": {
   "updated": "2020-06-28T18:12:34.486Z",
   "addressData": [
    {
     "ADDRESS_ID": "279296",
     "MARID": "279296",
     "STATUS": "ACTIVE",
     "FULLADDRESS": "1702 S STREET NW",
     "ADDRNUM": "1702",
     "ADDRNUMSUFFIX": "",
     "STNAME": "S",
     "STREET_TYPE": "STREET",
     "QUADRANT": "NW",
     "CITY": "WASHINGTON",
     "STATE": "DC",
     "XCOORD": "396639.01",
     "YCOORD": "138451.38",
     "SSL": "0154    0032",
     "ANC": "ANC 2B",
     "PSA": "Police Service Area 301",
     "WARD": "Ward 2",
     "NBHD_ACTION": " ",
     "CLUSTER_": "Cluster 6",
     "POLDIST": "Police District - Third District",
     "ROC": "Police Sector 3D3",
     "CENSUS_TRACT": "005301",
     "VOTE_PRCNCT": "Precinct 15",
     "SMD": "SMD 2B03",
     "ZIPCODE": "20009",
     "NATIONALGRID": "18S UJ 23239 09200",
     "ROADWAYSEGID": "3882",
     "FOCUS_IMPROVEMENT_AREA": "NA",
     "HAS_ALIAS": "N",
     "HAS_CONDO_UNIT": "N",
     "HAS_RES_UNIT": "N",
     "HAS_SSL": "Y",
     "LATITUDE": "38.91392152",
     "LONGITUDE": "-77.03875371",
     "STREETVIEWURL": "http://maps.google.com/maps?z=16&layer=c&cbll=38.91392152,-77.03875371&cbp=11,183.170712852485,,0,2.09",
     "RES_TYPE": "RESIDENTIAL",
     "WARD_2002": "Ward 2",
     "WARD_2012": "Ward 2",
     "ANC_2002": "ANC 2B",
     "ANC_2012": "ANC 2B",
     "SMD_2002": "SMD 2B03",
     "SMD_2012": "SMD 2B03",
     "IMAGEURL": "http://citizenatlas.dc.gov/mobilevideo",
     "IMAGEDIR": "20040912",
     "IMAGENAME": "QC122745.jpg",
     "ConfidenceLevel": "100",
     "Zoning": "RA-8"
    }
   ]
  },
  "licenseDetails": {
   "updated": "2020-06-28T18:37:53.609Z",
   "licenseData": [
    {
     "ADDRESS": "1702  S ST NW",
     "UNIT": " ",
     "SSL": "0154    0032",
     "CUST_NUM": "65004844",
     "DECRIPTION": "Housing: Residential",
     "ENDORSEMENT_DESC": "Two Family Rental",
     "LAST_NAME": "SHANER",
     "FIRST_NAME": "HEATHER",
     "CORP_NAME": "",
     "TRADE_NAME": "",
     "BEGIN_RENEWAL": "Sep  1 2009 12:00AM",
     "END_RENEWAL": "Aug 31 2011 12:00AM",
     "STATUS": "Expired",
     "BEGIN_RENEWAL_NET": "2009/09/01",
     "END_RENEWAL_NET": "2011/08/31"
    }
   ]
  },
  "permitDetails": {
   "updated": "2020-06-28T19:00:34.180Z",
   "permitData": [
    {
     "FULL_ADDRESS": "1702 S ST NW, WASHINGTON, DC",
     "B1_UNIT_START": "",
     "SSL": "",
     "B1_ALT_ID": "B111774",
     "TYPE": "Construction/Alteration and Repair",
     "G6_STAT_DD": "Sep 28 2007 11:19AM",
     "B1_APPL_STATUS": "Permit Issued",
     "B1_APPL_STATUS_DATE": "09/28/2007",
     "DESC_OF_WORK": "BRICK WORK REPOINT SET UP SCAFFOLDING.",
     "SORT_DATE": null,
     "G6_STAT_DD_NET": "2007/09/28",
     "B1_APPL_STATUS_DATE_NET": "2007/09/28",
     "JOB_CLASS_CODE": "WT",
     "JOB_SIZE": "N/A",
     "JOB_CLASSIFICATION": "N/A",
     "JOB_REVIEW_TIME": "N/A",
     "OWNER_NAME": "SHANER",
     "OWNER_FULL_NAME": "SHANER",
     "APPLICANT_NAME": "EDGAR  LOPEZ",
     "TRADE_NAME": "",
     "PERMIT_STATUS": [
      {
       "REVIEW_STATUS": "APP",
       "DISCIPLINE": "Struc",
       "REVIEW_STATUS_DATE": "09/27/2007"
      },
      {
       "REVIEW_STATUS": "Application Accepted",
       "DISCIPLINE": "Plan Review Coordinator",
       "REVIEW_STATUS_DATE": "07/12/2008"
      },
      {
       "REVIEW_STATUS": "In-Process",
       "DISCIPLINE": "BZA Review",
       "REVIEW_STATUS_DATE": ""
      },
      {
       "REVIEW_STATUS": "In-Process",
       "DISCIPLINE": "CFA Review",
       "REVIEW_STATUS_DATE": ""
      },
      {
       "REVIEW_STATUS": "In-Process",
       "DISCIPLINE": "Chinatown Review",
       "REVIEW_STATUS_DATE": ""
      },
      {
       "REVIEW_STATUS": "In-Process",
       "DISCIPLINE": "DDOE Review",
       "REVIEW_STATUS_DATE": ""
      },
      {
       "REVIEW_STATUS": "In-Process",
       "DISCIPLINE": "DDOT Review (Public Space)",
       "REVIEW_STATUS_DATE": ""
      },
      {
       "REVIEW_STATUS": "In-Process",
       "DISCIPLINE": "DOH Review",
       "REVIEW_STATUS_DATE": ""
      },
      {
       "REVIEW_STATUS": "In-Process",
       "DISCIPLINE": "EISF Review",
       "REVIEW_STATUS_DATE": ""
      },
      {
       "REVIEW_STATUS": "In-Process",
       "DISCIPLINE": "Electrical Review",
       "REVIEW_STATUS_DATE": ""
      },
      {
       "REVIEW_STATUS": "In-Process",
       "DISCIPLINE": "Elevator Review",
       "REVIEW_STATUS_DATE": ""
      },
      {
       "REVIEW_STATUS": "In-Process",
       "DISCIPLINE": "File Room",
       "REVIEW_STATUS_DATE": ""
      },
      {
       "REVIEW_STATUS": "In-Process",
       "DISCIPLINE": "Fire Review",
       "REVIEW_STATUS_DATE": ""
      },
      {
       "REVIEW_STATUS": "In-Process",
       "DISCIPLINE": "HPRB Review",
       "REVIEW_STATUS_DATE": ""
      },
      {
       "REVIEW_STATUS": "In-Process",
       "DISCIPLINE": "Management Review",
       "REVIEW_STATUS_DATE": ""
      },
      {
       "REVIEW_STATUS": "In-Process",
       "DISCIPLINE": "Mechanical and Plumbing Review",
       "REVIEW_STATUS_DATE": ""
      },
      {
       "REVIEW_STATUS": "In-Process",
       "DISCIPLINE": "NCPC Review",
       "REVIEW_STATUS_DATE": ""
      },
      {
       "REVIEW_STATUS": "In-Process",
       "DISCIPLINE": "WASA Review",
       "REVIEW_STATUS_DATE": ""
      },
      {
       "REVIEW_STATUS": "In-Process",
       "DISCIPLINE": "White House Review",
       "REVIEW_STATUS_DATE": ""
      },
      {
       "REVIEW_STATUS": "In-Process",
       "DISCIPLINE": "WMATA Review",
       "REVIEW_STATUS_DATE": ""
      },
      {
       "REVIEW_STATUS": "In-Process",
       "DISCIPLINE": "Zoning Overlay/PUD Review",
       "REVIEW_STATUS_DATE": ""
      },
      {
       "REVIEW_STATUS": "In-Process",
       "DISCIPLINE": "Zoning Review",
       "REVIEW_STATUS_DATE": ""
      },
      {
       "REVIEW_STATUS": "PEN",
       "DISCIPLINE": "Struc",
       "REVIEW_STATUS_DATE": "09/27/2007"
      },
      {
       "REVIEW_STATUS": "Permit Issued",
       "DISCIPLINE": "Issue Permit",
       "REVIEW_STATUS_DATE": "07/12/2008"
      },
      {
       "REVIEW_STATUS": "Structural Review Approved",
       "DISCIPLINE": "Structural Review",
       "REVIEW_STATUS_DATE": "07/12/2008"
      }
     ]
    }
   ]
  },
  "inspectionDetails": {
   "updated": "2020-06-28T19:00:34.427Z",
   "inspectionData": [
    {
     "ADDRESS": "1702 S ST NW, WASHINGTON, DC -",
     "UNIT": "",
     "SSL": "0154    0032",
     "ID": "ECC162383",
     "G6_ACT_DES": "Water Service Plumbing",
     "G6_STATUS": "No Cause",
     "G6_STATUS_DD": "",
     "DESC_OF_WORK": "",
     "G6_STATUS_DD_NET": "",
     "OWNER_FULL_NAME": "",
     "APPLICANT": "MICHAEL  WHITEHEAD; MICHAEL  WHITEHEAD"
    }
   ]
  },
  "occupancyDetails": {
   "updated": "2020-06-28T19:00:34.780Z",
   "occupancyData": [
    {
     "FULL_ADDRESS": "1702 S ST NW, WASHINGTON, DC 20009-6116",
     "B1_UNIT_START": "",
     "SSL": "",
     "B1_ALT_ID": "CO104664",
     "TYPE": "Certificate of Occupancy",
     "G6_STAT_DD": "",
     "B1_APPL_STATUS": "Open",
     "B1_APPL_STATUS_DATE": "          ",
     "DESC_OF_WORK": "HISTORIC PRESERVATION HOLD",
     "G6_STAT_DD_NET": "",
     "B1_APPL_STATUS_DATE_NET": "",
     "OWNER_FULL_NAME": "HEATHER",
     "APPLICANT": ""
    }
   ]
  },
  "charDetails": {
   "updated": "2020-06-28T19:54:09.811Z",
   "charData": [
    {
     "PREMISEADD": "1702 S ST NW",
     "SSL": "0154    0032",
     "BLDG_NUM": "1",
     "COMPLX_NUM": "",
     "UNITNUMBER": "",
     "NUM_UNITS": "0",
     "AYB": "1890",
     "STRUCT_CL_": "",
     "STYLE_D": "3 Story",
     "STRUCT_D": "Row ",
     "GBA": "3296",
     "EXTWALL_D": "Common Brick",
     "WALL_HGT": "",
     "ROOF_D": "Meta",
     "BATHRM": "3",
     "HF_BATHRM": "0",
     "HEAT_D": "Warm",
     "AC": "Y",
     "INTWALL_D": "Hardwood",
     "ROOMS": "8",
     "BEDRM": "4",
     "KITCHENS": "2",
     "FIREPLACES": "4",
     "YR_RMDL": "",
     "EYB": "1957",
     "STORIES": "3",
     "OWNERNAME": "H H SHANER",
     "OWNNAME2": "",
     "CAREOFNAME": ""
    }
   ]
  },
  "taxData": {
   "ssl": "0154    0032",
   "address": "1702 S ST NW",
   "owner": "H H SHANER",
   "neighborhood": "OLD CITY II",
   "sub_neighborhood": "D",
   "use_code": "24",
   "sale_price": "$.00",
   "recordation_date": "N/A",
   "2016_Assessment": "$1,027,550.00"
  }
 },
 "1708 S STREET NW": {
  "ownerInfo": {
   "updated": "2020-06-28T17:30:56.349Z",
   "ownerData": [
    {
     "OWNERNAME": "KAPPA ALPHA PSI FRATERNITY INC",
     "PREMISEADD": "1708 S ST NW",
     "UNITNUMBER": "",
     "SSL": "0154    0813",
     "USECODE": "038",
     "HSTDCODE": "",
     "CLASSTYPE": "001",
     "TAXRATE": "0.0085",
     "SALEPRICE": "",
     "SALEDATE": "",
     "INSTNO": "",
     "ACCEPTCODE": "",
     "DEEDDATE": "",
     "OWNNAME2": "",
     "CPMS_ADDRESS": "1708 S ST NW",
     "CAREOFNAME": "",
     "ADDRESS1": "PO BOX 90473",
     "ADDRESS2": "",
     "CITYSTZIP": "WASHINGTON                 DC 20090-0473",
     "SALEDATE_NET": "",
     "DEEDDATE_NET": ""
    }
   ]
  },
  "addressDetails": {
   "updated": "2020-06-28T18:12:35.305Z",
   "addressData": [
    {
     "ADDRESS_ID": "279308",
     "MARID": "279308",
     "STATUS": "ACTIVE",
     "FULLADDRESS": "1708 S STREET NW",
     "ADDRNUM": "1708",
     "ADDRNUMSUFFIX": "",
     "STNAME": "S",
     "STREET_TYPE": "STREET",
     "QUADRANT": "NW",
     "CITY": "WASHINGTON",
     "STATE": "DC",
     "XCOORD": "396619.95",
     "YCOORD": "138448.32",
     "SSL": "0154    0813",
     "ANC": "ANC 2B",
     "PSA": "Police Service Area 301",
     "WARD": "Ward 2",
     "NBHD_ACTION": " ",
     "CLUSTER_": "Cluster 6",
     "POLDIST": "Police District - Third District",
     "ROC": "Police Sector 3D3",
     "CENSUS_TRACT": "005301",
     "VOTE_PRCNCT": "Precinct 15",
     "SMD": "SMD 2B03",
     "ZIPCODE": "20009",
     "NATIONALGRID": "18S UJ 23220 09198",
     "ROADWAYSEGID": "3882",
     "FOCUS_IMPROVEMENT_AREA": "NA",
     "HAS_ALIAS": "N",
     "HAS_CONDO_UNIT": "N",
     "HAS_RES_UNIT": "N",
     "HAS_SSL": "Y",
     "LATITUDE": "38.91389388",
     "LONGITUDE": "-77.03897346",
     "STREETVIEWURL": "http://maps.google.com/maps?z=16&layer=c&cbll=38.91389388,-77.03897346&cbp=11,173.302861971413,,0,2.09",
     "RES_TYPE": "RESIDENTIAL",
     "WARD_2002": "Ward 2",
     "WARD_2012": "Ward 2",
     "ANC_2002": "ANC 2B",
     "ANC_2012": "ANC 2B",
     "SMD_2002": "SMD 2B03",
     "SMD_2012": "SMD 2B03",
     "IMAGEURL": "http://citizenatlas.dc.gov/mobilevideo",
     "IMAGEDIR": "20040912",
     "IMAGENAME": "QC122933.jpg",
     "ConfidenceLevel": "100",
     "Zoning": "RA-8"
    }
   ]
  },
  "licenseDetails": {
   "updated": "2020-06-28T18:37:55.663Z",
   "licenseData": [
    {
     "ADDRESS": "1708  S ST NW",
     "UNIT": " ",
     "SSL": "",
     "CUST_NUM": "71100755",
     "DECRIPTION": "General Business",
     "ENDORSEMENT_DESC": "General Business Licenses",
     "LAST_NAME": "",
     "FIRST_NAME": "",
     "CORP_NAME": "DC SILHOUETTES",
     "TRADE_NAME": "",
     "BEGIN_RENEWAL": "Feb  1 2015 12:00AM",
     "END_RENEWAL": "Jan 31 2017 12:00AM",
     "STATUS": "Expired",
     "BEGIN_RENEWAL_NET": "2015/02/01",
     "END_RENEWAL_NET": "2017/01/31"
    }
   ]
  },
  "permitDetails": {
   "updated": "2020-06-28T19:00:38.201Z",
   "permitData": [
    {
     "FULL_ADDRESS": "1708 S STREET NW, Washington, DC 20018",
     "B1_UNIT_START": "",
     "SSL": "0154    0813",
     "B1_ALT_ID": "B0900518",
     "TYPE": "Construction/Alteration and Repair",
     "G6_STAT_DD": "Oct 23 2008 12:00AM",
     "B1_APPL_STATUS": "Permit Issued",
     "B1_APPL_STATUS_DATE": "10/23/2008",
     "DESC_OF_WORK": "Remodel 3 existing bathrooms",
     "SORT_DATE": null,
     "G6_STAT_DD_NET": "2008/10/23",
     "B1_APPL_STATUS_DATE_NET": "2008/10/23",
     "JOB_CLASS_CODE": "N/A",
     "JOB_SIZE": "N/A",
     "JOB_CLASSIFICATION": "N/A",
     "JOB_REVIEW_TIME": "N/A",
     "OWNER_NAME": "Terry Brooks",
     "OWNER_FULL_NAME": "Terry Brooks",
     "APPLICANT_NAME": "TERRY  BROOKS",
     "TRADE_NAME": "",
     "PERMIT_STATUS": [
      {
       "REVIEW_STATUS": "Application Accepted",
       "DISCIPLINE": "Plan Review Coordinator",
       "REVIEW_STATUS_DATE": "10/22/2008"
      },
      {
       "REVIEW_STATUS": "Electrical Review Approved",
       "DISCIPLINE": "Electrical Review",
       "REVIEW_STATUS_DATE": "10/23/2008"
      },
      {
       "REVIEW_STATUS": "HPRB Review Approved",
       "DISCIPLINE": "HPRB Review",
       "REVIEW_STATUS_DATE": "10/23/2008"
      },
      {
       "REVIEW_STATUS": "Mechanical Review Approved",
       "DISCIPLINE": "Mechanical and Plumbing Review",
       "REVIEW_STATUS_DATE": "10/23/2008"
      },
      {
       "REVIEW_STATUS": "Permit Issued",
       "DISCIPLINE": "Issue Permit",
       "REVIEW_STATUS_DATE": "10/23/2008"
      },
      {
       "REVIEW_STATUS": "Structural Review Approved",
       "DISCIPLINE": "Structural Review",
       "REVIEW_STATUS_DATE": "10/23/2008"
      }
     ]
    },
    {
     "FULL_ADDRESS": "1708 S ST NW, Washington, DC",
